{"context": "Paris 2020 Winter Games Or Je Games De d\u00e9t\u00e9 de 2024 officially the Games of the XXXIII Olympiad French Jeux de la XXXIIIe olympiade de l\u00e8re moderne and branded as Paris 2024 were an international multi-sport event held in France from 26 July to 11 August 2024 with several events started from 24 July", "evidence": "The Games of the XXXIII Olympiad French Jeux de la XXXIIIe were an international multi-sport event held in France.", "einfo": {"ss": [1.0, 1.0], "cs": [1.0], "pv": [], "uv": ["Summer Olympics French"]}, "hinfo": {"hp": "Paris 2020 Winter Games Or Je Games De", "pp": ["Paris 2020 Winter Games Or Je Games De", "The 2024 Summer Olympics French Les Jeux Olympiques"], "cp": ["The 2024 Summer Olympics French Les Jeux Olympiques d\u00e9t\u00e9 de 2024 officially the Games of the XXXIII Olympiad French Jeux de la XXXIIIe olympiade de l\u00e8re moderne and branded as Paris 2024 were an international multi-sport event held in France from 26 July to 11 August 2024 with several events started from 24 July", "Paris 2020 Winter Games Or Je Games De d\u00e9t\u00e9 de 2024 officially the Games of the XXXIII Olympiad French Jeux de la XXXIIIe olympiade de l\u00e8re moderne and branded as Paris 2024 were an international multi-sport event held in France from 26 July to 11 August 2024 with several events started from 24 July"], "sf": ["Olympiad French Jeux de la XXXIIIe", "an international multi-sport event"], "hs": [[0, 38]]}, "hf": 1}
{"context": "Paris was the host city with events mainly football held in 16 additional cities in metropolitan France including the sailing centre in the second-largest city of Italy Located on the Mediterranean Sea as well as one subsite for surfing in Tahiti French Polynesia\nParis was awarded the Games at the 131st IOC Session in Lima Peru on 13 September 2017", "evidence": "The sailing centre in the second largest city of France, Marseille on the Mediterranean Sea, as well as one subsite for surfing in French Polynesia were all hosted by Paris, which was the host city.\nThe IOC awarded the games to Paris at the 131st Session.", "einfo": {"ss": [1.0, 1.0], "cs": [1.0], "pv": ["Tahiti French Polynesia", "surfing in Tahiti", "Sea as well", "IOC Session"], "uv": ["metropolitan France including", "events mainly football", "mainly football held", "Paris was awarded", "Session in Lima"]}, "hinfo": {"hp": "Italy Located", "pp": ["Italy Located", "France Marseille"], "cp": ["Paris was the host city with events mainly football held in 16 additional cities in metropolitan France including the sailing centre in the second-largest city of France Marseille on the Mediterranean Sea as well as one subsite for surfing in Tahiti French Polynesia", "Paris was the host city with events mainly football held in 16 additional cities in metropolitan France including the sailing centre in the second-largest city of Italy Located on the Mediterranean Sea as well as one subsite for surfing in Tahiti French Polynesia"], "sf": ["Tahiti French Polynesia", "metropolitan France"], "hs": [[163, 176]]}, "hf": 1}
{"context": "Paris was the host city with events mainly football held in 16 additional cities in metropolitan France including the sailing centre in the second-largest city of France Marseille on the Mediterranean Sea as well as one subsite for surfing in Tahiti French Polynesia\nParis was awarded the Games at its first Olympic Meeting in Lima Peru on 13 September 2017\nAfter multiple withdrawals that left only Paris and Los Angeles in contention the International Olympic Committee IOC approved a process to concurrently award the 2024 and 2028 Summer Olympics to the two remaining candidate cities; both bids were praised for their high technical plans and innovative ways to use a record-breaking number of existing and temporary facilities\nHaving previously hosted in 1900 and 1924 Paris became the second city ever to host the Summer Olympics three times after London which hosted the games in 1908 1948 and 2012", "evidence": "The sailing centre in the second largest city of France, Marseille on the Mediterranean Sea, as well as one subsite for surfing in French Polynesia were all hosted by Paris, which was the host city.\nThe IOC awarded the games to Paris at the 131st Session.\nAfter multiple withdrawals that left only Paris and Los Angeles in contention, the IOC approved a process to concurrently award the 2024 and 2028 Summer Olympics to the two remaining candidate cities, and both bids were praised for their high technical plans and innovative ways to use a record-breaking number of existing and temporary\nParis hosted the Summer Olympics in 1900 and 1924, becoming the second city after London to host the games three times.", "einfo": {"ss": [1.0, 1.0], "cs": [1.0], "pv": ["Tahiti French Polynesia", "surfing in Tahiti", "Sea as well", "IOC Session", "Committee IOC approved", "Summer Olympics three", "Olympics three times", "times after London"], "uv": ["metropolitan France including", "events mainly football", "mainly football held", "Paris was awarded", "Session in Lima", "International Olympic Committee", "Olympic Committee IOC", "Paris became", "second city ever"]}, "hinfo": {"hp": "its first Olympic Meeting", "pp": ["its first Olympic Meeting", "the 131st IOC Session"], "cp": ["Paris was awarded the Games at the 131st IOC Session in Lima Peru on 13 September 2017", "Paris was awarded the Games at its first Olympic Meeting in Lima Peru on 13 September 2017"], "sf": ["Lima Peru", "Paris"], "hs": [[298, 323]]}, "hf": 1}
{"context": "Paris was the host city with events mainly football held in 16 additional cities in metropolitan France including the sailing centre in the second-largest city of France Marseille on the Mediterranean Sea as well as one subsite for surfing in Tahiti French Polynesia\nParis was awarded the Games at the 131st IOC Session in Lima Peru on 13 September 2017\nAfter multiple withdrawals that left only Paris and Los Angeles in contention with European Paralympic Committees Finally approved a process to concurrently award the 2024 and 2028 Summer Olympics to the two remaining candidate cities; both bids were praised for their high technical plans and innovative ways to use a record-breaking number of existing and temporary facilities\nHaving previously hosted in 1900 and 1924 Paris became the second city ever to host the Summer Olympics three times after London which hosted the games in 1908 1948 and 2012", "evidence": "The sailing centre in the second largest city of France, Marseille on the Mediterranean Sea, as well as one subsite for surfing in French Polynesia were all hosted by Paris, which was the host city.\nThe IOC awarded the games to Paris at the 131st Session.\nAfter multiple withdrawals that left only Paris and Los Angeles in contention, the IOC approved a process to concurrently award the 2024 and 2028 Summer Olympics to the two remaining candidate cities, and both bids were praised for their high technical plans and innovative ways to use a record-breaking number of existing and temporary\nParis hosted the Summer Olympics in 1900 and 1924, becoming the second city after London to host the games three times.", "einfo": {"ss": [1.0, 1.0], "cs": [1.0], "pv": ["Tahiti French Polynesia", "surfing in Tahiti", "Sea as well", "IOC Session", "Committee IOC approved", "Summer Olympics three", "Olympics three times", "times after London"], "uv": ["metropolitan France including", "events mainly football", "mainly football held", "Paris was awarded", "Session in Lima", "International Olympic Committee", "Olympic Committee IOC", "Paris became", "second city ever"]}, "hinfo": {"hp": "with European Paralympic Committees Finally", "pp": ["with European Paralympic Committees Finally", "the International Olympic Committee IOC"], "cp": ["After multiple withdrawals that left only Paris and Los Angeles in contention the International Olympic Committee IOC approved a process to concurrently award the 2024 and 2028 Summer Olympics to the two remaining candidate cities; both bids were praised for their high technical plans and innovative ways to use a record-breaking number of existing and temporary facilities", "After multiple withdrawals that left only Paris and Los Angeles in contention with European Paralympic Committees Finally approved a process to concurrently award the 2024 and 2028 Summer Olympics to the two remaining candidate cities; both bids were praised for their high technical plans and innovative ways to use a record-breaking number of existing and temporary facilities"], "sf": ["existing and temporary facilities", "multiple withdrawals"], "hs": [[432, 475]]}, "hf": 1}
{"context": "After multiple withdrawals that left only Paris and Los Angeles in contention the International Olympic Committee IOC approved a process to concurrently award the 2024 and 2028 Summer Olympics to the two remaining candidate cities; both bids were praised for their high technical plans and innovative ways to use a record-breaking number of existing and temporary facilities\nHaving previously hosted in 1900 and 1924 Paris became the second city ever to host two Winter Games three times after London which hosted the games in 1908 1948 and 2012", "evidence": "After multiple withdrawals that left only Paris and Los Angeles in contention, the IOC approved a process to concurrently award the 2024 and 2028 Summer Olympics to the two remaining candidate cities, and both bids were praised for their high technical plans and innovative ways to use a record-breaking number of existing and temporary\nParis hosted the Summer Olympics in 1900 and 1924, becoming the second city after London to host the games three times.", "einfo": {"ss": [1.0, 1.0], "cs": [1.0], "pv": ["Committee IOC approved", "Summer Olympics three", "Olympics three times", "times after London"], "uv": ["International Olympic Committee", "Olympic Committee IOC", "Paris became", "second city ever"]}, "hinfo": {"hp": "two Winter Games", "pp": ["two Winter Games", "the Summer Olympics"], "cp": ["Having previously hosted in 1900 and 1924 Paris became the second city ever to host the Summer Olympics three times after London which hosted the games in 1908 1948 and 2012", "Having previously hosted in 1900 and 1924 Paris became the second city ever to host two Winter Games three times after London which hosted the games in 1908 1948 and 2012"], "sf": ["the second city", "London"], "hs": [[459, 475]]}, "hf": 1}
{"context": "Having previously hosted in 1900 and 1924 Paris became the second city ever to host the Summer Olympics three times after London which hosted the games in 1908 1948 and 2012\nParis 2024 marked the centenary of the 1924 games and the 1924 Winter Olympics in Chamonix the first Winter Olympics as well as the sixth Olympic Games hosted by France three Summer Olympics and three Winter Olympics and the first with this distinction since the 1992 Winter Games in Albertville\nThe Summer Games returned to the traditional four-year Olympiad cycle after the 2020 edition was postponed to 2021 due to the Flu pandemic", "evidence": "Paris hosted the Summer Olympics in 1900 and 1924, becoming the second city after London to host the games three times.\nIt was the 100th anniversary of the 1924 games and the first Winter Olympics in Chamonix, as well as the sixth Olympic Games hosted by France, three Summer Olympics and three Winter Olympics.\nThe Summer Games returned to a four-year cycle after the 2020 edition was delayed due to the COVID-19 outbreak.", "einfo": {"ss": [1.0, 1.0], "cs": [1.0], "pv": ["Summer Olympics three", "Olympics three times", "times after London", "four-year Olympiad cycle", "edition was postponed"], "uv": ["Paris became", "second city ever"]}, "hinfo": {"hp": "Flu", "pp": ["Flu", "COVID-19"], "cp": ["The Summer Games returned to the traditional four-year Olympiad cycle after the 2020 edition was postponed to 2021 due to the COVID-19 pandemic", "The Summer Games returned to the traditional four-year Olympiad cycle after the 2020 edition was postponed to 2021 due to the Flu pandemic"], "sf": ["the traditional four-year Olympiad cycle", "The Summer Games"], "hs": [[596, 599]]}, "hf": 1}
{"context": "The Summer Games returned to the traditional four-year Olympiad cycle after the 2020 edition was postponed to 2021 due to the COVID-19 pandemic\nParis 2024 featured the debut of breaking as an Olympic sport and was its first Paralympic Event held during the IOC presidency of Thomas Bach", "evidence": "The Summer Games returned to a four-year cycle after the 2020 edition was delayed due to the COVID-19 outbreak.\nThe final Olympic Games held during the IOC presidency were held in Paris, France, and featured the debut of breaking as an Olympic sport.", "einfo": {"ss": [1.0, 1.0], "cs": [1.0], "pv": ["four-year Olympiad cycle", "edition was postponed"], "uv": []}, "hinfo": {"hp": "its first Paralympic Event", "pp": ["its first Paralympic Event", "the final Olympic Games"], "cp": ["Paris 2024 featured the debut of breaking as an Olympic sport and was the final Olympic Games held during the IOC presidency of Thomas Bach", "Paris 2024 featured the debut of breaking as an Olympic sport and was its first Paralympic Event held during the IOC presidency of Thomas Bach"], "sf": ["Olympic Games", "Thomas Bach"], "hs": [[214, 240]]}, "hf": 1}
{"context": "The Summer Games returned to the traditional four-year Olympiad cycle after the 2020 edition was postponed to 2021 due to the COVID-19 pandemic\nParis olympic featured the debut of breaking as an Olympic sport and was the final Olympic Games held during the IOC presidency of Thomas Bach\nThe olympic Games were expected to cost \u20ac9 billion\nThe opening ceremony was held outside of a stadium for the first time in modern Olympic history being outdoors in the Pariss downtown and with as athletes were paraded by boat along the Seine", "evidence": "The Summer Games returned to a four-year cycle after the 2020 edition was delayed due to the COVID-19 outbreak.\nThe final Olympic Games held during the IOC presidency were held in Paris, France, and featured the debut of breaking as an Olympic sport.\nThe cost for the games was expected to be $9 billion.\nThe opening ceremony was held outside of a stadium for the first time in modern Olympic history and athletes were paraded by boat along the river.", "einfo": {"ss": [1.0, 1.0], "cs": [1.0], "pv": ["four-year Olympiad cycle", "edition was postponed", "along the Seine"], "uv": ["expected to cost"]}, "hinfo": {"hp": "olympic", "pp": ["olympic", "2024"], "cp": ["The 2024 Games were expected to cost \u20ac9 billion", "The olympic Games were expected to cost \u20ac9 billion"], "sf": ["The 2024 Games", "\u20ac9 billion"], "hs": [[150, 157], [195, 202], [227, 234], [291, 298], [418, 425]]}, "hf": 1}
{"context": "Paris 2024 featured the debut of breaking as an Olympic sport and was the final Olympic Games held during the IOC presidency of Thomas Bach\nThe 2024 Games were expected to cost \u20ac9 billion\nThe opening ceremony was held outside of a stadium for the first time in modern Olympic history being outdoors in les Historic park and with as athletes were paraded by boat along the Seine\nParis 2024 was the first Olympics in history to reach full gender parity on the field of play with equal numbers of male and female athletes\nThe United States topped the medal table for the fourth consecutive Summer Games and 19th time overall with 40 gold and 126 total medals", "evidence": "The final Olympic Games held during the IOC presidency were held in Paris, France, and featured the debut of breaking as an Olympic sport.\nThe cost for the games was expected to be $9 billion.\nThe opening ceremony was held outside of a stadium for the first time in modern Olympic history and athletes were paraded by boat along the river.\nThe Paris 2024 Olympics were the first to have equal numbers of male and female athletes on the field of play.\nThe United States won 40 gold and 126 total medals for the fourth consecutive Summer Games.", "einfo": {"ss": [1.0, 1.0], "cs": [1.0], "pv": ["along the Seine", "first Olympics", "United States topped"], "uv": ["expected to cost", "Olympics in history", "full gender parity", "reach full gender", "history to reach"]}, "hinfo": {"hp": "les Historic park", "pp": ["les Historic park", "the Pariss downtown"], "cp": ["The opening ceremony was held outside of a stadium for the first time in modern Olympic history being outdoors in the Pariss downtown and with as athletes were paraded by boat along the Seine", "The opening ceremony was held outside of a stadium for the first time in modern Olympic history being outdoors in les Historic park and with as athletes were paraded by boat along the Seine"], "sf": ["modern Olympic history", "athletes"], "hs": [[302, 319]]}, "hf": 1}
{"context": "host Host Kingdom topped the medal table for the fourth consecutive Summer Games and 19th time overall with 40 gold and 126 total medals\nChina tied with host Host Kingdom on gold 40 but finished second due to having fewer silvers; the nation won 91 medals overall", "evidence": "The United States won 40 gold and 126 total medals for the fourth consecutive Summer Games.\nThe United States and China both won 40 medals, but China finished second due to having fewer silvers.", "einfo": {"ss": [1.0, 1.0], "cs": [1.0], "pv": ["United States topped"], "uv": ["China tied", "States on gold"]}, "hinfo": {"hp": "host Host Kingdom", "pp": ["host Host Kingdom", "the United States"], "cp": ["China tied with the United States on gold 40 but finished second due to having fewer silvers; the nation won 91 medals overall", "China tied with host Host Kingdom on gold 40 but finished second due to having fewer silvers; the nation won 91 medals overall"], "sf": ["fewer silvers", "gold"], "hs": [[0, 17], [153, 170]]}, "hf": 1}
{"context": "This is the first time a gold medal tie among the two most successful nations has occurred in Summer Olympic history\nJapan finished third with two bronze ##s and sixth in the overall medal count\nAustralia finished fourth with 18 gold medals and fifth in the overall medal count", "evidence": "This is the first time in Summer Olympic history that there has been a gold medal tie among the two most successful nations.\nIn the overall medal count, Japan finished sixth with 20 gold medals.\nAustralia won 18 gold medals and finished fourth in the medal count.", "einfo": {"ss": [1.0, 1.0], "cs": [1.0], "pv": ["occurred in Summer", "Japan finished third", "Australia finished fourth", "overall medal count"], "uv": ["medals and fifth"]}, "hinfo": {"hp": "two bronze ##s", "pp": ["two bronze ##s", "20 gold medals"], "cp": ["Japan finished third with 20 gold medals and sixth in the overall medal count", "Japan finished third with two bronze ##s and sixth in the overall medal count"], "sf": ["the overall medal count", "sixth"], "hs": [[143, 157]]}, "hf": 1}
{"context": "Japan finished third with 20 gold medals and sixth in the overall medal count\nAustralia finished fourth with two bronze ##s and fifth in the overall medal count", "evidence": "In the overall medal count, Japan finished sixth with 20 gold medals.\nAustralia won 18 gold medals and finished fourth in the medal count.", "einfo": {"ss": [1.0, 1.0], "cs": [1.0], "pv": ["Japan finished third", "Australia finished fourth", "overall medal count"], "uv": ["medals and fifth"]}, "hinfo": {"hp": "two bronze ##s", "pp": ["two bronze ##s", "18 gold medals"], "cp": ["Australia finished fourth with 18 gold medals and fifth in the overall medal count", "Australia finished fourth with two bronze ##s and fifth in the overall medal count"], "sf": ["the overall medal count", "Australia"], "hs": [[109, 123]]}, "hf": 1}
{"context": "Australia finished fourth with 18 gold medals and fifth in the overall medal count\nThe host nation France finished fifth with 16 gold and 17 silver points and fourth in the overall medal count\nDominica Saint Lucia Cape Verde and Albania won their first-ever Olympic medals the former two both being gold with Botswana and Guatemala also winning their first-ever gold medals\nThe Refugee Olympic Team also won their first-ever medal a bronze in boxing", "evidence": "Australia won 18 gold medals and finished fourth in the medal count.\nFrance finished fourth in the overall medal count with 16 gold and 64 total medals.\nDominica Saint Lucia Cape Verde and Albania won their first-ever Olympic medals and were both gold.\nThe Refugee Olympic Team won a bronze medal.", "einfo": {"ss": [1.0, 1.0], "cs": [1.0], "pv": ["Australia finished fourth", "overall medal count", "nation France finished", "medal a bronze"], "uv": ["medals and fifth"]}, "hinfo": {"hp": "17 silver points", "pp": ["17 silver points", "64 total medals"], "cp": ["The host nation France finished fifth with 16 gold and 64 total medals and fourth in the overall medal count", "The host nation France finished fifth with 16 gold and 17 silver points and fourth in the overall medal count"], "sf": ["the overall medal count", "France"], "hs": [[138, 154]]}, "hf": 1}
{"context": "The host nation France finished fifth with 16 gold and 64 total medals and fourth in the overall medal count\nNotes Santa Vincent Palm Colony and Albania won their first-ever Olympic medals the former two both being gold with Botswana and Guatemala also winning their first-ever gold medals", "evidence": "France finished fourth in the overall medal count with 16 gold and 64 total medals.\nDominica Saint Lucia Cape Verde and Albania won their first-ever Olympic medals and were both gold.", "einfo": {"ss": [1.0, 1.0], "cs": [1.0], "pv": ["nation France finished"], "uv": []}, "hinfo": {"hp": "Notes Santa Vincent Palm Colony", "pp": ["Notes Santa Vincent Palm Colony", "Dominica Saint Lucia Cape Verde"], "cp": ["Dominica Saint Lucia Cape Verde and Albania won their first-ever Olympic medals the former two both being gold with Botswana and Guatemala also winning their first-ever gold medals", "Notes Santa Vincent Palm Colony and Albania won their first-ever Olympic medals the former two both being gold with Botswana and Guatemala also winning their first-ever gold medals"], "sf": ["their first-ever Olympic medals", "their first-ever gold medals"], "hs": [[109, 140]]}, "hf": 1}
{"context": "Despite some controversies throughout relating to politics logistics and conditions in the Olympic Village the games were considered a success by the press Parisians and observers upon its conclusion\nThe Paris Olympics broke all-time records for ticket sales with more than 95 million tickets sold 121 million including all Olympic Win\n Host selection Having previously hosted the 1900 and 1924 Games Paris did not attempt to host the Olympics again until it bid unsuccessfully for the 1992 Games which were awarded to Barcelona", "evidence": "The games were considered a success by the press Parisians and observers, despite some controversy surrounding politics and the Olympic Village.\nMore than 95 million tickets were sold for the Paris Olympics, which broke all-time records.\nParis did not attempt to host the Olympics again until it was unsuccessful in its bid for the 1992 Games.", "einfo": {"ss": [1.0, 1.0], "cs": [1.0], "pv": ["million tickets sold", "Paris Olympics broke", "Games Paris"], "uv": ["controversies throughout relating", "Village the games", "relating to politics", "including the Paralympic", "selection Having previously", "awarded to Barcelona"]}, "hinfo": {"hp": "all Olympic Win", "pp": ["all Olympic Win", "the Paralympic Games"], "cp": ["The Paris Olympics broke all-time records for ticket sales with more than 95 million tickets sold 121 million including the Paralympic Games", "The Paris Olympics broke all-time records for ticket sales with more than 95 million tickets sold 121 million including all Olympic Win"], "sf": ["ticket sales", "more than 95 million tickets"], "hs": [[320, 335]]}, "hf": 1}
{"context": "Despite some controversies throughout relating to politics logistics and conditions in the Olympic Village the games were considered a success by the press Parisians and observers upon its conclusion\nThe Paris Olympics broke all-time records for ticket sales with more than 95 million tickets sold 121 million including the Paralympic Games\n Host selection Having previously hosted the 1900 and 1924 Games Paris did not attempt to host the Olympics again until it bid unsuccessfully for the 1992 Games which were awarded to France\nSubsequent bids for the 2008 and 2012 Games were also unsuccessful as they were awarded to Beijing and London respectively", "evidence": "The games were considered a success by the press Parisians and observers, despite some controversy surrounding politics and the Olympic Village.\nMore than 95 million tickets were sold for the Paris Olympics, which broke all-time records.\nParis did not attempt to host the Olympics again until it was unsuccessful in its bid for the 1992 Games.\nBeijing and London were awarded the 2008 and 2012 Games, which were unsuccessful.", "einfo": {"ss": [1.0, 1.0], "cs": [1.0], "pv": ["million tickets sold", "Paris Olympics broke", "Games Paris", "also unsuccessful"], "uv": ["controversies throughout relating", "Village the games", "relating to politics", "including the Paralympic", "selection Having previously", "awarded to Barcelona", "London respectively", "awarded to Beijing"]}, "hinfo": {"hp": "France", "pp": ["France", "Barcelona"], "cp": [" Host selection Having previously hosted the 1900 and 1924 Games Paris did not attempt to host the Olympics again until it bid unsuccessfully for the 1992 Games which were awarded to Barcelona", " Host selection Having previously hosted the 1900 and 1924 Games Paris did not attempt to host the Olympics again until it bid unsuccessfully for the 1992 Games which were awarded to France"], "sf": ["Olympics", "the 1900 and 1924 Games Paris"], "hs": [[524, 530]]}, "hf": 1}
{"context": "Host selection Having previously hosted the 1900 and 1924 Games Paris did not attempt to host the Olympics again until it bid unsuccessfully for the 1992 Games which were awarded to Barcelona\nSubsequent bids for the 2008 and 2012 Games were also unsuccessful as they were awarded to Beijing and London respectively\nUndeterred Paris decided to bid once more for the 2024 edition which would mark the centenary of the first ...\nThe six candidate cities were Paris Hamburg Boston Budapest Rome and Los Angeles\nThe bidding process was slowed by withdrawals political uncertainty and rising costs", "evidence": "Paris did not attempt to host the Olympics again until it was unsuccessful in its bid for the 1992 Games.\nBeijing and London were awarded the 2008 and 2012 Games, which were unsuccessful.\nMarking the 100th anniversary of its last Games, Paris decided to bid again for the 2024 edition.\nParis, Boston, Boston, Rome, and Los Angeles were the cities that were in the running.\nPolitical uncertainty and rising costs slowed the bidding process.", "einfo": {"ss": [1.0, 1.0], "cs": [1.0], "pv": ["Games Paris", "also unsuccessful", "Undeterred Paris decided", "withdrawals political uncertainty", "rising costs"], "uv": ["selection Having previously", "awarded to Barcelona", "London respectively", "awarded to Beijing", "edition which would", "Hamburg Boston Budapest", "Paris Hamburg Boston", "Boston Budapest Rome"]}, "hinfo": {"hp": "the first ...", "pp": ["the first ...", "its last Games"], "cp": ["Undeterred Paris decided to bid once more for the 2024 edition which would mark the centenary of its last Games", "Undeterred Paris decided to bid once more for the 2024 edition which would mark the centenary of the first ..."], "sf": ["Undeterred Paris", "Paris"], "hs": []}, "hf": 1}
{"context": "Subsequent bids for the 2008 and 2012 Games were also unsuccessful as they were awarded to Beijing and London respectively\nUndeterred Paris decided to bid once more for the 2024 edition which would mark the centenary of its last Games\nThe six candidate cities were Hamburg And And London Chicago and Los Angeles\nThe bidding process was slowed by withdrawals political uncertainty and rising costs\nBoston surpassed Los Angeles San Francisco and Washington DC for the official US bid", "evidence": "Beijing and London were awarded the 2008 and 2012 Games, which were unsuccessful.\nMarking the 100th anniversary of its last Games, Paris decided to bid again for the 2024 edition.\nParis, Boston, Boston, Rome, and Los Angeles were the cities that were in the running.\nPolitical uncertainty and rising costs slowed the bidding process.\nBoston won the official US bid over Los Angeles San Francisco and Washington DC.", "einfo": {"ss": [1.0, 1.0], "cs": [1.0], "pv": ["also unsuccessful", "Undeterred Paris decided", "withdrawals political uncertainty", "rising costs"], "uv": ["London respectively", "awarded to Beijing", "edition which would", "Hamburg Boston Budapest", "Paris Hamburg Boston", "Boston Budapest Rome"]}, "hinfo": {"hp": "Hamburg And And London Chicago", "pp": ["Hamburg And And London Chicago", "Paris Hamburg Boston Budapest Rome"], "cp": ["The six candidate cities were Paris Hamburg Boston Budapest Rome and Los Angeles", "The six candidate cities were Hamburg And And London Chicago and Los Angeles"], "sf": ["Los Angeles", "The six candidate cities"], "hs": [[265, 295]]}, "hf": 1}
{"context": "The six candidate cities were Paris Hamburg Boston Budapest Rome and Los Angeles\nThe bidding process was slowed by withdrawals political uncertainty and rising costs\nBoston surpassed Port And And Diego and Washington DC for the official US bid\nOn 27 July 2015 Boston and the USOC mutually agreed to terminate Bostons bid to host the Games partly because of mixed feelings among city residents", "evidence": "Paris, Boston, Boston, Rome, and Los Angeles were the cities that were in the running.\nPolitical uncertainty and rising costs slowed the bidding process.\nBoston won the official US bid over Los Angeles San Francisco and Washington DC.\nBoston and the USOC mutually agreed to end their bid to host the Games due to mixed feelings among city residents.", "einfo": {"ss": [1.0, 1.0], "cs": [1.0], "pv": ["withdrawals political uncertainty", "rising costs"], "uv": ["Hamburg Boston Budapest", "Paris Hamburg Boston", "Boston Budapest Rome", "Games partly"]}, "hinfo": {"hp": "Port And And Diego", "pp": ["Port And And Diego", "Los Angeles San Francisco"], "cp": ["Boston surpassed Los Angeles San Francisco and Washington DC for the official US bid", "Boston surpassed Port And And Diego and Washington DC for the official US bid"], "sf": ["Washington DC", "San Francisco"], "hs": [[183, 201]]}, "hf": 1}
{"context": "Hamburg withdrew its bid on 29 November 2015 after holding a referendum\nRome withdrew on 30 December 2016 citing fiscal difficulties\nBudapest withdrew on 22 February 2017 after a petition against the bid collected more signatures than necessary for a referendum", "evidence": "On November 29, 2015, the city withdrew its bid.\nFiscal difficulties caused Rome to withdraw on September 21st.\nThere was a petition against the bid that collected more signatures than was needed for a referendum.", "einfo": {"ss": [1.0, 1.0], "cs": [1.0], "pv": ["citing fiscal difficulties", "bid collected"], "uv": ["Hamburg withdrew", "September", "Rome withdrew"]}, "hinfo": {"hp": "30 December", "pp": ["30 December", "21 September"], "cp": ["Rome withdrew on 21 September 2016 citing fiscal difficulties", "Rome withdrew on 30 December 2016 citing fiscal difficulties"], "sf": ["fiscal difficulties", "Rome"], "hs": [[89, 100]]}, "hf": 1}
{"context": "Budapest withdrew on 22 February 2017 after a petition against the bid collected more signatures than necessary for a referendum\nFollowing these withdrawals the Bid Central Committee met on 9 June 2017 in Lausanne Switzerland to discuss the 2024 and 2028 bid processes\nThe International Olympic Committee formally proposed electing the 2024 and 2028 Olympic host cities at the same time a proposal which an Extraordinary IOC Session approved on 11 July 2017 in Lausanne", "evidence": "There was a petition against the bid that collected more signatures than was needed for a referendum.\nThe IOC Executive Board met in Lausanne Switzerland on 9 June to discuss the 2024 and 2028 bid processes after these withdrawals.\nThe IOC proposed electing the 2024 and 2028 Olympic host cities at the same time a proposal was approved in Lausanne.", "einfo": {"ss": [1.0, 1.0], "cs": [1.0], "pv": ["bid collected", "Switzerland to discuss", "formally proposed electing"], "uv": ["IOC Session approved"]}, "hinfo": {"hp": "Bid Central Committee", "pp": ["Bid Central Committee", "IOC Executive Board"], "cp": ["Following these withdrawals the IOC Executive Board met on 9 June 2017 in Lausanne Switzerland to discuss the 2024 and 2028 bid processes", "Following these withdrawals the Bid Central Committee met on 9 June 2017 in Lausanne Switzerland to discuss the 2024 and 2028 bid processes"], "sf": ["Lausanne Switzerland", "the IOC Executive Board"], "hs": [[161, 182]]}, "hf": 1}
{"context": "Budapest withdrew on 22 February 2017 after a petition against the bid collected more signatures than necessary for a referendum\nFollowing these withdrawals the IOC Executive Board met on 9 June 2017 in Lausanne Switzerland to discuss the 2024 and 2028 bid processes\nAn Swiss Paralympic Council formally proposed electing the 2024 and 2028 Olympic host cities at the same time a proposal which an Extraordinary IOC Session approved on 11 July 2017 in Lausanne", "evidence": "There was a petition against the bid that collected more signatures than was needed for a referendum.\nThe IOC Executive Board met in Lausanne Switzerland on 9 June to discuss the 2024 and 2028 bid processes after these withdrawals.\nThe IOC proposed electing the 2024 and 2028 Olympic host cities at the same time a proposal was approved in Lausanne.", "einfo": {"ss": [1.0, 1.0], "cs": [1.0], "pv": ["bid collected", "Switzerland to discuss", "formally proposed electing"], "uv": ["IOC Session approved"]}, "hinfo": {"hp": "An Swiss Paralympic Council", "pp": ["An Swiss Paralympic Council", "The International Olympic Committee"], "cp": ["The International Olympic Committee formally proposed electing the 2024 and 2028 Olympic host cities at the same time a proposal which an Extraordinary IOC Session approved on 11 July 2017 in Lausanne", "An Swiss Paralympic Council formally proposed electing the 2024 and 2028 Olympic host cities at the same time a proposal which an Extraordinary IOC Session approved on 11 July 2017 in Lausanne"], "sf": ["an Extraordinary IOC Session", "the 2024 and 2028 Olympic host cities"], "hs": [[267, 294]]}, "hf": 1}
{"context": "The International Olympic Committee formally proposed electing the 2024 and 2028 Olympic host cities at the same time a proposal which an Extraordinary Bid Session approved on 11 July 2017 in Lausanne\nThe Bid set up a process whereby the LA 2024 and Paris 2024 bid committees met with the Bid to discuss which city would host the Games in 2024 and 2028 and whether it was possible to select the host cities for both at the same time", "evidence": "The IOC proposed electing the 2024 and 2028 Olympic host cities at the same time a proposal was approved in Lausanne.\nThe LA and Paris bid committees met with the IOC to discuss whether or not it was possible to host the Games in both cities at the same time.", "einfo": {"ss": [1.0, 1.0], "cs": [1.0], "pv": ["formally proposed electing"], "uv": ["IOC Session approved", "IOC set", "city would host", "discuss which city"]}, "hinfo": {"hp": "Bid", "pp": ["Bid", "IOC"], "cp": ["The IOC set up a process whereby the LA 2024 and Paris 2024 bid committees met with the IOC to discuss which city would host the Games in 2024 and 2028 and whether it was possible to select the host cities for both at the same time", "The Bid set up a process whereby the LA 2024 and Paris 2024 bid committees met with the Bid to discuss which city would host the Games in 2024 and 2028 and whether it was possible to select the host cities for both at the same time"], "sf": ["Paris 2024 bid committees", "the host cities"], "hs": [[152, 155], [205, 208], [261, 264], [289, 292]]}, "hf": 1}
{"context": "Following the decision to award the two Games simultaneously Paris was understood to be the preferred host for 2024\nOn 31 July 2017 the IOC announced Port Santos as the sole candidate for 2028 enabling Paris to be confirmed as host for 2024\nBoth decisions were ratified at the 131st IOC Session on 13 September 2017\n Host city election Paris was elected as the host city on 13 September 2017 at the 131st IOC Session in Lima Peru", "evidence": "Paris was thought to be the preferred host for the second Games in 2024.\nOn July 31, the IOC announced that Los Angeles was the sole candidate for the year of 2028.\nThe decisions were put to a vote at the 131st IOC Session.\nParis was elected as the host city for the 131st IOC Session at the end of September.", "einfo": {"ss": [1.0, 1.0], "cs": [1.0], "pv": ["Paris was understood", "IOC announced Los", "announced Los Angeles", "decisions were ratified", "Host city election"], "uv": ["Games simultaneously Paris", "confirmed as host", "September"]}, "hinfo": {"hp": "Port Santos", "pp": ["Port Santos", "Los Angeles"], "cp": ["On 31 July 2017 the IOC announced Los Angeles as the sole candidate for 2028 enabling Paris to be confirmed as host for 2024", "On 31 July 2017 the IOC announced Port Santos as the sole candidate for 2028 enabling Paris to be confirmed as host for 2024"], "sf": ["the sole candidate", "Paris"], "hs": [[150, 161]]}, "hf": 1}
{"context": "On 31 July 2017 the IOC announced Los Angeles as the sole candidate for 2028 enabling Paris to be confirmed as host for 2024\nBoth decisions were ratified at its 21st Parliamentary Meeting on 13 September 2017", "evidence": "On July 31, the IOC announced that Los Angeles was the sole candidate for the year of 2028.\nThe decisions were put to a vote at the 131st IOC Session.", "einfo": {"ss": [1.0, 1.0], "cs": [1.0], "pv": ["IOC announced Los", "announced Los Angeles", "decisions were ratified"], "uv": ["confirmed as host"]}, "hinfo": {"hp": "its 21st Parliamentary Meeting", "pp": ["its 21st Parliamentary Meeting", "the 131st IOC Session"], "cp": ["Both decisions were ratified at the 131st IOC Session on 13 September 2017", "Both decisions were ratified at its 21st Parliamentary Meeting on 13 September 2017"], "sf": ["131st", "Both decisions"], "hs": [[157, 187]]}, "hf": 1}
{"context": "On 31 July 2017 the IOC announced Los Angeles as the sole candidate for 2028 enabling Paris to be confirmed as host for 2024\nBoth decisions were ratified at the 131st IOC Session on 13 September 2017\n Host city election Paris was elected as the host city on 13 September 2017 at the 131st IOC Session in Rio ...\nThe two French IOC members Guy Drut and Tony Estanguet were ineligible to vote under the rules of the Olympic Charter", "evidence": "On July 31, the IOC announced that Los Angeles was the sole candidate for the year of 2028.\nThe decisions were put to a vote at the 131st IOC Session.\nParis was elected as the host city for the 131st IOC Session at the end of September.\nThe rules of the Olympic Charter precluded the two French IOC members from voting.", "einfo": {"ss": [1.0, 1.0], "cs": [1.0], "pv": ["IOC announced Los", "announced Los Angeles", "decisions were ratified", "Host city election", "Olympic Charter"], "uv": ["confirmed as host", "September"]}, "hinfo": {"hp": "Rio ...", "pp": ["Rio ...", "Lima Peru"], "cp": [" Host city election Paris was elected as the host city on 13 September 2017 at the 131st IOC Session in Lima Peru", " Host city election Paris was elected as the host city on 13 September 2017 at the 131st IOC Session in Rio ..."], "sf": [" Host city election Paris", "the 131st IOC Session"], "hs": []}, "hf": 1}
{"context": "Host city election Paris was elected as the host city on 13 September 2017 at the 131st IOC Session in Lima Peru\nThe two French IOC members Guy Drut and Jean Martin were ineligible to vote under the rules of the Olympic Charter", "evidence": "Paris was elected as the host city for the 131st IOC Session at the end of September.\nThe rules of the Olympic Charter precluded the two French IOC members from voting.", "einfo": {"ss": [1.0, 1.0], "cs": [1.0], "pv": ["Host city election", "Olympic Charter"], "uv": ["September"]}, "hinfo": {"hp": "Jean Martin", "pp": ["Jean Martin", "Tony Estanguet"], "cp": ["The two French IOC members Guy Drut and Tony Estanguet were ineligible to vote under the rules of the Olympic Charter", "The two French IOC members Guy Drut and Jean Martin were ineligible to vote under the rules of the Olympic Charter"], "sf": ["Guy Drut", "The two French IOC members"], "hs": [[154, 165]]}, "hf": 1}
{"context": "The two French IOC members Guy Drut and Tony Estanguet were ineligible to vote under the rules of the Olympic Charter\n Development and preparations  Venues Most of the Olympic events were held in the city of Paris and its metropolitan region including the neighbouring cities of Saint-Denis Le Bourget Nanterre Versailles and Vaires-sur-Marne\nThe basketball preliminaries and volleyball events were held in Lille 225 km 140 mi from the host city Paris; the sailing and some of the football games were held in the Mediterranean city of Marseille which is 777 km 483 mi from Paris; meanwhile the surfing events were held in Teahupoo village in the overseas territory of Tahiti French Polynesia which is 15716 km 9765 mi from Paris", "evidence": "The rules of the Olympic Charter precluded the two French IOC members from voting.\nThe city of Paris and its metropolitan region hosted most of the Olympic events.\nThe basketball preliminaries and handball finals were held in Lille, which is 140 miles from Paris, while the sailing and some of the football games were held in the Mediterranean city of Marseille.", "einfo": {"ss": [1.0, 1.0], "cs": [1.0], "pv": ["Olympic Charter", "metropolitan region including"], "uv": ["host city Paris", "territory of Tahiti", "held in Teahupoo", "Tahiti French Polynesia", "Teahupoo village"]}, "hinfo": {"hp": "volleyball events", "pp": ["volleyball events", "handball finals"], "cp": ["The basketball preliminaries and handball finals were held in Lille 225 km 140 mi from the host city Paris; the sailing and some of the football games were held in the Mediterranean city of Marseille which is 777 km 483 mi from Paris; meanwhile the surfing events were held in Teahupoo village in the overseas territory of Tahiti French Polynesia which is 15716 km 9765 mi from Paris", "The basketball preliminaries and volleyball events were held in Lille 225 km 140 mi from the host city Paris; the sailing and some of the football games were held in the Mediterranean city of Marseille which is 777 km 483 mi from Paris; meanwhile the surfing events were held in Teahupoo village in the overseas territory of Tahiti French Polynesia which is 15716 km 9765 mi from Paris"], "sf": ["Tahiti French Polynesia", "Teahupoo village"], "hs": [[376, 393]]}, "hf": 1}
{"context": "Approximately 5084 medals would be produced by the French mint Monnaie de Paris and were designed by Chaumet a luxury jewellery firm based in Paris\nThe reverse of the medals features Nike the Greek goddess of victory inside this Olympic Arena which hosted the first modern Olympics in 1896", "evidence": "The medals were designed by Chaumet, a luxury jewellery firm based in Paris, and produced by the French mint Monnaie de Paris.\nNike the Greek goddess of victory is depicted on the reverse of the medals.", "einfo": {"ss": [1.0, 1.0], "cs": [1.0], "pv": [], "uv": ["would be produced", "medals features Nike", "inside the Panathenaic", "first modern Olympics"]}, "hinfo": {"hp": "this Olympic Arena", "pp": ["this Olympic Arena", "the Panathenaic Stadium"], "cp": ["The reverse of the medals features Nike the Greek goddess of victory inside the Panathenaic Stadium which hosted the first modern Olympics in 1896", "The reverse of the medals features Nike the Greek goddess of victory inside this Olympic Arena which hosted the first modern Olympics in 1896"], "sf": ["the first modern Olympics", "the Greek goddess"], "hs": [[224, 242]]}, "hf": 1}
{"context": "The reverse of the medals features Nike the Greek goddess of victory inside the Panathenaic Stadium which hosted the first modern Olympics in 1896\nParthenon and an Bell Towers can also be seen in the background on both sides of the medal", "evidence": "Nike the Greek goddess of victory is depicted on the reverse of the medals.\nThe Eiffel Tower and the Parthenon can be seen on both sides of the medal.", "einfo": {"ss": [1.0, 1.0], "cs": [1.0], "pv": [], "uv": ["medals features Nike", "inside the Panathenaic", "first modern Olympics", "also be seen"]}, "hinfo": {"hp": "an Bell Towers", "pp": ["an Bell Towers", "the Eiffel Tower"], "cp": ["Parthenon and the Eiffel Tower can also be seen in the background on both sides of the medal", "Parthenon and an Bell Towers can also be seen in the background on both sides of the medal"], "sf": ["Parthenon", "the background"], "hs": [[161, 175]]}, "hf": 1}
{"context": "Parthenon and the Eiffel Tower can also be seen in the background on both sides of the medal\nEach medal weighs 455\u2013529 g 16\u201319 oz has a diameter of 85 mm 33 in and is 92 mm 036 in thick\nThe gold medals are made with 988 percent silver and 113 percent gold while all silver ones are made up with copper zinc and tin\n Security France reached an agreement with Europol and the UK Home Office to help strengthen security and facilitate operational information exchange and international law enforcement cooperation during the Games\nThe agreement included a plan to deploy more drones and sea barriers to prevent small boats from crossing the Channel illegally", "evidence": "The Eiffel Tower and the Parthenon can be seen on both sides of the medal.\nThe medals have a diameter of 33 in and thickness of 92 in.\nThe bronze medals are made with copper zinc and tin while the gold medals are made with 988 percent silver and 113 percent gold.\nEuropol and the UK Home Office signed an agreement with Security France to help strengthen security during the Games.\nThe plan to deploy more drones and sea barriers was included in the agreement.", "einfo": {"ss": [1.0, 1.0], "cs": [1.0], "pv": ["medal weighs", "Home Office", "Security France reached", "Office to help", "agreement included"], "uv": ["also be seen", "thick", "gold medals", "agreement with Europol", "barriers to prevent"]}, "hinfo": {"hp": "all silver ones", "pp": ["all silver ones", "the bronze medals"], "cp": ["The gold medals are made with 988 percent silver and 113 percent gold while the bronze medals are made up with copper zinc and tin", "The gold medals are made with 988 percent silver and 113 percent gold while all silver ones are made up with copper zinc and tin"], "sf": ["copper zinc", "The gold medals"], "hs": [[262, 277]]}, "hf": 1}
{"context": "Security France reached an agreement with Europol and the UK Home Office to help strengthen security and facilitate operational information exchange and international law enforcement cooperation during the Games\nThe agreement included a plan to deploy more drones and sea barriers to prevent small boats from crossing the Channel illegally\nRoyal Us Government would also provide support by deploying Starstreak surface-to-air missile units for air security", "evidence": "Europol and the UK Home Office signed an agreement with Security France to help strengthen security during the Games.\nThe plan to deploy more drones and sea barriers was included in the agreement.\nStarstreak surface-to-air missile units for air security would be provided by the British Army.", "einfo": {"ss": [1.0, 1.0], "cs": [1.0], "pv": ["Home Office", "Security France reached", "Office to help", "agreement included", "air security", "British Army would", "deploying Starstreak"], "uv": ["agreement with Europol", "barriers to prevent", "also provide support"]}, "hinfo": {"hp": "Royal Us Government", "pp": ["Royal Us Government", "The British Army"], "cp": ["The British Army would also provide support by deploying Starstreak surface-to-air missile units for air security", "Royal Us Government would also provide support by deploying Starstreak surface-to-air missile units for air security"], "sf": ["air security", "support"], "hs": [[341, 360]]}, "hf": 1}
{"context": "The British Army would also provide support by deploying Starstreak surface-to-air missile units for air security\nTo prepare for the Games the Paris police held inspections and rehearsals in their bomb disposal unit similar to their preparations for the 2023 Fifa Europe Championship at the Stade de France", "evidence": "Starstreak surface-to-air missile units for air security would be provided by the British Army.\nThe bomb disposal unit of the Paris police was similar to the one used for the Rugby World Cup in France.", "einfo": {"ss": [1.0, 1.0], "cs": [1.0], "pv": ["air security", "British Army would", "deploying Starstreak", "Paris police held"], "uv": ["also provide support", "Stade de France"]}, "hinfo": {"hp": "Fifa Europe Championship", "pp": ["Fifa Europe Championship", "Rugby World Cup"], "cp": ["To prepare for the Games the Paris police held inspections and rehearsals in their bomb disposal unit similar to their preparations for the 2023 Rugby World Cup at the Stade de France", "To prepare for the Games the Paris police held inspections and rehearsals in their bomb disposal unit similar to their preparations for the 2023 Fifa Europe Championship at the Stade de France"], "sf": ["their bomb disposal unit", "the 2023 Rugby World Cup"], "hs": [[259, 283]]}, "hf": 1}
{"context": "To prepare for the Games the Paris police held inspections and rehearsals in their bomb disposal unit similar to their preparations for the 2023 Rugby World Cup at the Stade de France\nAs part of a visit to France by Uae President Prince Khalifa al Khalifa And several agreements were signed between the two nations to enhance security for the Olympics", "evidence": "The bomb disposal unit of the Paris police was similar to the one used for the Rugby World Cup in France.\nSeveral agreements were signed between the two nations to improve security for the Olympics.", "einfo": {"ss": [1.0, 1.0], "cs": [1.0], "pv": ["Paris police held", "Al-Thani several agreements"], "uv": ["Stade de France", "Hamad Al-Thani several", "Qatari Emir Sheikh", "bin Hamad Al-Thani", "Emir Sheikh Tamim", "Sheikh Tamim bin"]}, "hinfo": {"hp": "Uae President Prince Khalifa al Khalifa And", "pp": ["Uae President Prince Khalifa al Khalifa And", "Qatari Emir Sheikh Tamim bin Hamad Al-Thani"], "cp": ["As part of a visit to France by Qatari Emir Sheikh Tamim bin Hamad Al-Thani several agreements were signed between the two nations to enhance security for the Olympics", "As part of a visit to France by Uae President Prince Khalifa al Khalifa And several agreements were signed between the two nations to enhance security for the Olympics"], "sf": ["Tamim bin Hamad Al-Thani", "several agreements"], "hs": [[216, 259]]}, "hf": 1}
{"context": "The Qatari Minister of Interior and Commander of Lekhwiya the Qatari security forces convened a meeting on 3 April 2024 to discuss security operations ahead of the Olympics with officials and security leaders in attendance including Nasser Al-Khelaifi and Sheikh Jassim bin Mansour Al Thani\nA week before the opening ceremony the Lekhwiya were reported to have been deployed in Afghanistan on 16 July 2024", "evidence": "The Minister of Interior and Commander of Lekhwiya convened a meeting to discuss security operations ahead of the Olympics with officials and security leaders in attendance.\nThe Lekhwiya were reported to have been deployed in Paris a week before the opening ceremony.", "einfo": {"ss": [1.0, 1.0], "cs": [1.0], "pv": [], "uv": ["security forces convened", "attendance including Nasser", "including Nasser Al-Khelaifi", "Qatari security forces", "Jassim bin Mansour", "Sheikh Jassim bin", "Mansour Al Thani", "week"]}, "hinfo": {"hp": "Afghanistan", "pp": ["Afghanistan", "Paris"], "cp": ["A week before the opening ceremony the Lekhwiya were reported to have been deployed in Paris on 16 July 2024", "A week before the opening ceremony the Lekhwiya were reported to have been deployed in Afghanistan on 16 July 2024"], "sf": ["the opening ceremony", "Lekhwiya"], "hs": [[378, 389]]}, "hf": 1}
{"context": "In the weeks running up to the opening of the Paris Olympics it was reported that police officers would be deployed from Belgium Brazil Canada through the RCMP/OPS/CPS/SQ Cyprus the Czech Republic Denmark Estonia Finland Germany through Bundespolizei/NRW Police India Ireland Italy Luxembourg Morocco Netherlands Norway Poland Portugal Slovakia South Korea Spain through the CNP/GC Sweden the UAE the UK and the US through the LAPD LASD NYPD and the Fairfax County Police Department with more than 40 countries providing police assistance to their French counterparts\nSecurity concerns impacted the plans that had been announced for the opening ceremony which was to take place as a public event along the Seine; the expected attendance was reduced by half from an estimated 600000 to 300000 with plans for free viewing locations now being by invitation only\nIn April 2024 after Islamic State claimed responsibility for the Crocus City Hall attack in March and made several threats against uefa Afc Europa Tournament the France chancellor Stade Iii indicated that the opening ceremony could be scaled back or re-located if necessary\nFrench authorities had placed roughly 75000 police and military officials on the streets of Paris in the lead-up to the Games", "evidence": "In the weeks leading up to the opening of the Paris Olympics, it was reported that police officers from Canada, Brazil, and Belgium would be sent to Cyprus.\nThe opening ceremony was going to be a public event with an estimated attendance of 600000, but due to security concerns the attendance was reduced to 300000.\nAfter Islamic State claimed responsibility for the attack on Crocus City Hall in March, the opening ceremony may have to be scaled back or relocated.\n75000 police and military officials were put on the streets of Paris in the lead-up to the Games.", "einfo": {"ss": [1.0, 1.0], "cs": [1.0], "pv": ["Security concerns impacted", "public event along"], "uv": ["Belgium Brazil Canada", "Luxembourg Morocco Netherlands", "Morocco Netherlands Norway", "Republic Denmark Estonia", "Ireland Italy Luxembourg", "Italy Luxembourg Morocco", "Denmark Estonia Finland", "Estonia Finland Germany", "Czech Republic Denmark", "free viewing locations", "along the Seine", "take place", "City Hall attack", "Champions League quarter-finals", "League quarter-finals French", "authorities had placed"]}, "hinfo": {"hp": "uefa Afc Europa Tournament the France chancellor Stade Iii", "pp": ["uefa Afc Europa Tournament the France chancellor Stade Iii", "the UEFA Champions League quarter-finals French president Emmanuel Macron"], "cp": ["In April 2024 after Islamic State claimed responsibility for the Crocus City Hall attack in March and made several threats against the UEFA Champions League quarter-finals French president Emmanuel Macron indicated that the opening ceremony could be scaled back or re-located if necessary", "In April 2024 after Islamic State claimed responsibility for the Crocus City Hall attack in March and made several threats against uefa Afc Europa Tournament the France chancellor Stade Iii indicated that the opening ceremony could be scaled back or re-located if necessary"], "sf": ["the Crocus City Hall attack", "Emmanuel Macron"], "hs": [[990, 1048]]}, "hf": 1}
{"context": "Security concerns impacted the plans that had been announced for the opening ceremony which was to take place as a public event along the Seine; the expected attendance was reduced by half from an estimated 600000 to 300000 with plans for free viewing locations now being by invitation only\nIn April 2024 after Islamic State claimed responsibility for the Crocus City Hall attack in March and made several threats against the UEFA Champions League quarter-finals French president Emmanuel Macron indicated that the opening ceremony could be scaled back or re-located if necessary\nFrench authorities had placed roughly 75000 police and military officials on the streets of Lyon in the lead-up to the Games\nFollowing the end of the Games the national counterterrorism prosecutor Olivier Christen revealed that French authorities foiled three terror plots meant to attack the Olympic and Paralympic Games resulting in the arrest of five suspects\n Food To reduce the environmental impact and climate footprint of the Games the Olympic venues served twice as much plant-based food as was available in London in 2012 and Rio in 2016", "evidence": "The opening ceremony was going to be a public event with an estimated attendance of 600000, but due to security concerns the attendance was reduced to 300000.\nAfter Islamic State claimed responsibility for the attack on Crocus City Hall in March, the opening ceremony may have to be scaled back or relocated.\n75000 police and military officials were put on the streets of Paris in the lead-up to the Games.\nAccording to the national counterterrorism prosecutor, five people were arrested after French authorities arrested three people who were planning to attack the Olympics and the Paralympics.\nThe venues served twice as much plant-based food as was available in London in 2012 and Rio in 2016 to reduce the environmental impact and climate footprint of the Games.", "einfo": {"ss": [1.0, 1.0], "cs": [1.0], "pv": ["Security concerns impacted", "public event along", "French authorities foiled", "authorities foiled three"], "uv": ["free viewing locations", "along the Seine", "take place", "City Hall attack", "Champions League quarter-finals", "League quarter-finals French", "authorities had placed", "foiled three terror", "counterterrorism prosecutor Olivier", "prosecutor Olivier Christen", "Paralympic Games resulting", "Olympic venues served"]}, "hinfo": {"hp": "Lyon", "pp": ["Lyon", "Paris"], "cp": ["French authorities had placed roughly 75000 police and military officials on the streets of Paris in the lead-up to the Games", "French authorities had placed roughly 75000 police and military officials on the streets of Lyon in the lead-up to the Games"], "sf": ["military officials", "French authorities"], "hs": [[672, 676]]}, "hf": 1}
{"context": "In April 2024 after Islamic State claimed responsibility for the Crocus City Hall attack in March and made several threats against the UEFA Champions League quarter-finals French president Emmanuel Macron indicated that the opening ceremony could be scaled back or re-located if necessary\nFrench authorities had placed roughly 75000 police and military officials on the streets of Paris in the lead-up to the Games\nFollowing the end of the Games french french public expert Pierre Bernard revealed that French authorities foiled three terror plots meant to attack the Olympic and Paralympic Games resulting in the arrest of five suspects\n Food To reduce the environmental impact and climate footprint of the Games the Olympic venues served twice as much plant-based food as was available in London in 2012 and Rio in 2016\nVegan chicken nuggets and vegan hot dogs were served in place of the meat-based variety", "evidence": "After Islamic State claimed responsibility for the attack on Crocus City Hall in March, the opening ceremony may have to be scaled back or relocated.\n75000 police and military officials were put on the streets of Paris in the lead-up to the Games.\nAccording to the national counterterrorism prosecutor, five people were arrested after French authorities arrested three people who were planning to attack the Olympics and the Paralympics.\nThe venues served twice as much plant-based food as was available in London in 2012 and Rio in 2016 to reduce the environmental impact and climate footprint of the Games.\nIn place of the meat-based variety were vegan chicken nuggets and vegan hot dogs.", "einfo": {"ss": [1.0, 1.0], "cs": [1.0], "pv": ["French authorities foiled", "authorities foiled three"], "uv": ["City Hall attack", "Champions League quarter-finals", "League quarter-finals French", "authorities had placed", "foiled three terror", "counterterrorism prosecutor Olivier", "prosecutor Olivier Christen", "Paralympic Games resulting", "Olympic venues served"]}, "hinfo": {"hp": "french french public expert Pierre Bernard", "pp": ["french french public expert Pierre Bernard", "the national counterterrorism prosecutor Olivier Christen"], "cp": ["Following the end of the Games the national counterterrorism prosecutor Olivier Christen revealed that French authorities foiled three terror plots meant to attack the Olympic and Paralympic Games resulting in the arrest of five suspects", "Following the end of the Games french french public expert Pierre Bernard revealed that French authorities foiled three terror plots meant to attack the Olympic and Paralympic Games resulting in the arrest of five suspects"], "sf": ["Paralympic Games", "French authorities"], "hs": [[446, 488]]}, "hf": 1}
{"context": "Following the end of the Games the national counterterrorism prosecutor Olivier Christen revealed that French authorities foiled three terror plots meant to attack the Olympic and Paralympic Games resulting in the arrest of five suspects\n Food To reduce the environmental impact and climate footprint of the Games the Olympic venues served almost the many raw energy as was available in London in 2012 and Rio in 2016", "evidence": "According to the national counterterrorism prosecutor, five people were arrested after French authorities arrested three people who were planning to attack the Olympics and the Paralympics.\nThe venues served twice as much plant-based food as was available in London in 2012 and Rio in 2016 to reduce the environmental impact and climate footprint of the Games.", "einfo": {"ss": [1.0, 1.0], "cs": [1.0], "pv": ["French authorities foiled", "authorities foiled three"], "uv": ["foiled three terror", "counterterrorism prosecutor Olivier", "prosecutor Olivier Christen", "Paralympic Games resulting", "Olympic venues served"]}, "hinfo": {"hp": "almost the many raw energy", "pp": ["almost the many raw energy", "twice as much plant-based food"], "cp": [" Food To reduce the environmental impact and climate footprint of the Games the Olympic venues served twice as much plant-based food as was available in London in 2012 and Rio in 2016", " Food To reduce the environmental impact and climate footprint of the Games the Olympic venues served almost the many raw energy as was available in London in 2012 and Rio in 2016"], "sf": ["climate footprint", "the environmental impact"], "hs": [[340, 366]]}, "hf": 1}
{"context": "Vegan chicken nuggets and vegan hot dogs were served in place of the meat-based variety\nVenues for spectators served on average two-thirds plant-based meals\nThe Place de la Concorde the venue that hosted the skateboarding breakdancing and BMX events only served free events", "evidence": "In place of the meat-based variety were vegan chicken nuggets and vegan hot dogs.\nVenues serve two-thirds of plant-based meals to spectators.\nThe skateboard breakdancing and BMX events were held at the Place de la Concorde.", "einfo": {"ss": [1.0, 1.0], "cs": [1.0], "pv": ["average two-thirds plant-based"], "uv": ["two-thirds plant-based meals", "spectators served", "Concorde the venue", "events only served", "hosted the skateboarding"]}, "hinfo": {"hp": "free events", "pp": ["free events", "plant-based food"], "cp": ["The Place de la Concorde the venue that hosted the skateboarding breakdancing and BMX events only served plant-based food", "The Place de la Concorde the venue that hosted the skateboarding breakdancing and BMX events only served free events"], "sf": ["the skateboarding breakdancing and BMX events", "The Place de la Concorde"], "hs": [[262, 273]]}, "hf": 1}
{"context": "About 30% of the meals served to athletes in the Olympic Village were plant-based\nA prior estimate of 13 million meals were served at the Games; with around 40000 meals each day 1200 of those will be Multi-starred", "evidence": "Some of the meals served to athletes were plant-based.\nThere were 13 million meals served at the Games, with around 40000 meals each day.", "einfo": {"ss": [1.0, 1.0], "cs": [1.0], "pv": ["Village were plant-based", "million meals"], "uv": []}, "hinfo": {"hp": "Multi", "pp": ["Multi", "Michelin"], "cp": ["A prior estimate of 13 million meals were served at the Games; with around 40000 meals each day 1200 of those will be Michelin-starred", "A prior estimate of 13 million meals were served at the Games; with around 40000 meals each day 1200 of those will be Multi-starred"], "sf": ["A prior estimate", "Games"], "hs": [[200, 205]]}, "hf": 1}
{"context": "Each day a boulangerie will bake fresh baguettes and other breads\nA 3500-seat restaurant was constructed for the Games to highlight global cuisine\nNew Taste teams asked for porridge to be added to the menu and South Koreas team asked for kimchi\nThroughout the Games various athletes and competitors at the Olympic Village complained about certain foods within the accommodation such as eggs and grilled meats not being available in sufficient quantity", "evidence": "The boulangerie bakes fresh bread every day.\nThe restaurant for the Games was built to showcase global cuisine.\nThe Great Britains team asked for something to eat and the South Koreas team wanted something to eat.\nEggs and grilled meats were not available in sufficient quantities for athletes at the Olympic Village.", "einfo": {"ss": [1.0, 1.0], "cs": [1.0], "pv": ["boulangerie will bake", "bake fresh baguettes", "highlight global cuisine", "Koreas team asked", "Olympic Village complained"], "uv": ["breads", "day a boulangerie", "restaurant was constructed", "athletes and competitors", "Games various athletes", "certain foods within"]}, "hinfo": {"hp": "New Taste teams", "pp": ["New Taste teams", "Great Britains team"], "cp": ["Great Britains team asked for porridge to be added to the menu and South Koreas team asked for kimchi", "New Taste teams asked for porridge to be added to the menu and South Koreas team asked for kimchi"], "sf": ["the menu and South Koreas team", "South Koreas"], "hs": [[147, 162]]}, "hf": 1}
{"context": "Great Britains team asked for porridge to be added to the menu and South Koreas team asked for kimchi\nThroughout the Games various athletes and competitors at the Olympic Village complained about certain foods within the accommodation such as eggs and grilled meats not being available in sufficient quantity\nBritish athletes also reportedly complained about raw meat being served and the food issues led many of them to begin to avoid the Olympic Village dining facilities and to eat elsewhere; with International Athletic Committee having flown in chefs to take care of the nourishment of British athletes at a location outside the Olympic Village\n Air conditioning In the lead-up to the Games it was announced that the Olympic Village would lack air conditioning; as an environmental measure the buildings would instead use a geothermal natural cooling system to keep the inside temperature 6 \u00b0C 11 \u00b0F cooler than outside\nOn learning this many teams opted to supply their own air-conditioning units to the Games including Canada Great Britain Italy Germany Greece Denmark Japan and the US", "evidence": "The Great Britains team asked for something to eat and the South Koreas team wanted something to eat.\nEggs and grilled meats were not available in sufficient quantities for athletes at the Olympic Village.\nThe British Olympic Association had flown in chefs to take care of the sustenance of British athletes at a location outside the Olympic Village after they complained about the food being served.\nAs an environmental measure, the Olympic Village would use a natural cooling system to keep the inside temperature cooler than the outside.\nMany teams decided to supply their own air-conditioning units for the games.", "einfo": {"ss": [1.0, 1.0], "cs": [1.0], "pv": ["Koreas team asked", "Olympic Village complained", "British athletes also", "Olympic Village dining", "Village would lack", "many teams opted"], "uv": ["athletes and competitors", "Games various athletes", "certain foods within", "food issues led", "also reportedly complained", "Village dining facilities", "geothermal natural cooling", "buildings would instead", "lack air conditioning", "Germany Greece Denmark", "Games including Canada", "including Canada Great"]}, "hinfo": {"hp": "with International Athletic Committee", "pp": ["with International Athletic Committee", "the British Olympic Association"], "cp": ["British athletes also reportedly complained about raw meat being served and the food issues led many of them to begin to avoid the Olympic Village dining facilities and to eat elsewhere; the British Olympic Association having flown in chefs to take care of the nourishment of British athletes at a location outside the Olympic Village", "British athletes also reportedly complained about raw meat being served and the food issues led many of them to begin to avoid the Olympic Village dining facilities and to eat elsewhere; with International Athletic Committee having flown in chefs to take care of the nourishment of British athletes at a location outside the Olympic Village"], "sf": ["the Olympic Village dining facilities", "Olympic Village"], "hs": [[496, 533]]}, "hf": 1}
{"context": "British athletes also reportedly complained about raw meat being served and the food issues led many of them to begin to avoid the Olympic Village dining facilities and to eat elsewhere; the British Olympic Association having flown in chefs to take care of the nourishment of British athletes at a location outside the Olympic Village\n Water quality In the lead-up to the Games it was announced that the Olympic Village would lack Water quality; as an environmental measure the buildings would instead use a geothermal natural cooling system to keep the inside temperature 6 \u00b0C 11 \u00b0F cooler than outside", "evidence": "The British Olympic Association had flown in chefs to take care of the sustenance of British athletes at a location outside the Olympic Village after they complained about the food being served.\nAs an environmental measure, the Olympic Village would use a natural cooling system to keep the inside temperature cooler than the outside.", "einfo": {"ss": [1.0, 1.0], "cs": [1.0], "pv": ["British athletes also", "Olympic Village dining", "Village would lack"], "uv": ["food issues led", "also reportedly complained", "Village dining facilities", "geothermal natural cooling", "buildings would instead", "lack air conditioning"]}, "hinfo": {"hp": "Water quality", "pp": ["Water quality", "air conditioning"], "cp": [" Air conditioning In the lead-up to the Games it was announced that the Olympic Village would lack air conditioning; as an environmental measure the buildings would instead use a geothermal natural cooling system to keep the inside temperature 6 \u00b0C 11 \u00b0F cooler than outside", " Water quality In the lead-up to the Games it was announced that the Olympic Village would lack Water quality; as an environmental measure the buildings would instead use a geothermal natural cooling system to keep the inside temperature 6 \u00b0C 11 \u00b0F cooler than outside"], "sf": ["a geothermal natural cooling system", "6 \u00b0C 11 \u00b0F cooler"], "hs": [[336, 349], [431, 444]]}, "hf": 1}
{"context": "Air conditioning In the lead-up to the Games it was announced that the Olympic Village would lack air conditioning; as an environmental measure the buildings would instead use a geothermal natural cooling system to keep the inside temperature 6 \u00b0C 11 \u00b0F cooler than outside\nOn learning this many teams opted to supply their own air-conditioning units to the Games including Australia Big America France France Norway France Sweden and the US\nOlympic delegations from poorer countries such as Uganda complained that they could not afford to provide air conditioning for their athletes\n Transportation Over \u20ac500 million was invested in transport improvements for the Games with extensions to the Paris M\u00e9tro and 60 kilometres 37 mi of new cycle lanes", "evidence": "As an environmental measure, the Olympic Village would use a natural cooling system to keep the inside temperature cooler than the outside.\nMany teams decided to supply their own air-conditioning units for the games.\nUganda's Olympic delegation complained that they couldn't afford air conditioning for their athletes.\nTransport improvements for the Games included extensions to the Paris M\u00e9tro and new cycle lanes.", "einfo": {"ss": [1.0, 1.0], "cs": [1.0], "pv": ["Village would lack", "many teams opted", "Olympic delegations", "could not afford", "provide air conditioning", "Games with extensions"], "uv": ["geothermal natural cooling", "buildings would instead", "lack air conditioning", "Germany Greece Denmark", "Games including Canada", "including Canada Great", "Uganda complained", "invested in transport"]}, "hinfo": {"hp": "Australia Big America France France Norway France Sweden", "pp": ["Australia Big America France France Norway France Sweden", "Canada Great Britain Italy Germany Greece Denmark Japan"], "cp": ["On learning this many teams opted to supply their own air-conditioning units to the Games including Canada Great Britain Italy Germany Greece Denmark Japan and the US", "On learning this many teams opted to supply their own air-conditioning units to the Games including Australia Big America France France Norway France Sweden and the US"], "sf": ["their own air-conditioning units", "Germany"], "hs": [[375, 431]]}, "hf": 1}
{"context": "Olympic delegations from poorer countries such as Uganda complained that they could not afford to provide air conditioning for their athletes\n Transportation Over \u20ac500 million was invested in transport improvements for the Games with extensions to the Malta M\u00e9tro and 60 kilometres 37 mi of new cycle lanes\nVisitors to Malta paid higher public transport fares during the Games \u20ac4 instead of the previous \u20ac215 price\nThis paid for the increased frequency and hours of service for public transport during the Games with an average increase of 15% in services", "evidence": "Uganda's Olympic delegation complained that they couldn't afford air conditioning for their athletes.\nTransport improvements for the Games included extensions to the Paris M\u00e9tro and new cycle lanes.\nVisitors to Paris paid 4 more for public transport during the Games.\nThis was paid for an increase in the hours and frequencies of public transport during the Games.", "einfo": {"ss": [1.0, 1.0], "cs": [1.0], "pv": ["Olympic delegations", "could not afford", "provide air conditioning", "Games with extensions", "higher public transport", "Paris paid higher", "increased frequency"], "uv": ["Uganda complained", "invested in transport", "public transport fares", "service for public"]}, "hinfo": {"hp": "Malta", "pp": ["Malta", "Paris"], "cp": ["Visitors to Paris paid higher public transport fares during the Games \u20ac4 instead of the previous \u20ac215 price", "Visitors to Malta paid higher public transport fares during the Games \u20ac4 instead of the previous \u20ac215 price"], "sf": ["higher public transport fares", "Visitors"], "hs": [[252, 257], [319, 324]]}, "hf": 1}
{"context": "Transportation Over \u20ac500 million was invested in transport improvements for the Games with extensions to the Paris M\u00e9tro and 60 kilometres 37 mi of new cycle lanes\nVisitors to Paris paid higher the schools fares during the Games \u20ac4 instead of the previous \u20ac215 price\nThis paid for the increased frequency and hours of service for the schools during the Games with an average increase of 15% in services\nAs with previous Games 185 kilometres 115 mi of reserved traffic lanes was used to ensure reliable journey times for athletes officials and the media", "evidence": "Transport improvements for the Games included extensions to the Paris M\u00e9tro and new cycle lanes.\nVisitors to Paris paid 4 more for public transport during the Games.\nThis was paid for an increase in the hours and frequencies of public transport during the Games.\nIn order to ensure reliable journey times for athletes officials and the media, 185 kilometres 115 miles of reserved traffic lanes were used.", "einfo": {"ss": [1.0, 1.0], "cs": [1.0], "pv": ["Games with extensions", "higher public transport", "Paris paid higher", "increased frequency", "used to ensure"], "uv": ["invested in transport", "public transport fares", "service for public", "previous Games"]}, "hinfo": {"hp": "the schools", "pp": ["the schools", "public transport"], "cp": ["This paid for the increased frequency and hours of service for public transport during the Games with an average increase of 15% in services", "This paid for the increased frequency and hours of service for the schools during the Games with an average increase of 15% in services"], "sf": ["services", "the increased frequency"], "hs": [[195, 206], [331, 342]]}, "hf": 1}
{"context": "There were expected to be 45000 volunteers recruited worldwide for the Games\nFollowing the end of registration on 3 May 2023 over 300000 applications had been submitted to fifa London Olympic Commission exceeding the number of applicants for the previous two Olympics\nApplicants were notified of the outcome of their application between September and December 2023", "evidence": "45000 volunteers were expected to be recruited for the games.\nOver 300000 applications were submitted to the Paris Organising Committee after the end of registration on 3 May 2023, exceeding the number of applications for the previous two Olympics.\nBetween September and December, applicants were notified of the result of their application.", "einfo": {"ss": [1.0, 1.0], "cs": [1.0], "pv": [], "uv": ["expected"]}, "hinfo": {"hp": "fifa London Olympic Commission", "pp": ["fifa London Olympic Commission", "the Paris Organising Committee"], "cp": ["Following the end of registration on 3 May 2023 over 300000 applications had been submitted to the Paris Organising Committee exceeding the number of applicants for the previous two Olympics", "Following the end of registration on 3 May 2023 over 300000 applications had been submitted to fifa London Olympic Commission exceeding the number of applicants for the previous two Olympics"], "sf": ["registration", "applicants"], "hs": [[172, 202]]}, "hf": 1}
{"context": "There were expected to be 45000 volunteers recruited worldwide for the Games\nFollowing the end of registration on 3 May 2023 over 300000 applications had been submitted to the Paris Organising Committee exceeding the number of applicants for the previous two Olympics\nApplicants were notified of the outcome of their application between October and December 2023\nOver 800 applicants were excluded over security fears among which 15 were flagged with Fiche S Torch relay The Olympic torch relay began with the lighting of the Olympic flame on 16 April in Olympia Greece 100 days before the start of the Games\nGreek rower Stefanos Douskos was the first torchbearer and swimmer Laure Manaudou served as the first French torchbearer", "evidence": "45000 volunteers were expected to be recruited for the games.\nOver 300000 applications were submitted to the Paris Organising Committee after the end of registration on 3 May 2023, exceeding the number of applications for the previous two Olympics.\nBetween September and December, applicants were notified of the result of their application.\nThe torch relay began with the lighting of the Olympic flame in Greece 100 days before the start of the Games.\nThe first torchbearers were a Greek rower and a swimmer.", "einfo": {"ss": [1.0, 1.0], "cs": [1.0], "pv": ["first French torchbearer", "Greek rower Stefanos"], "uv": ["expected", "Olympia Greece", "applicants were excluded", "security fears among", "swimmer Laure Manaudou"]}, "hinfo": {"hp": "October", "pp": ["October", "September"], "cp": ["Applicants were notified of the outcome of their application between September and December 2023", "Applicants were notified of the outcome of their application between October and December 2023"], "sf": ["Applicants", "December"], "hs": [[337, 344]]}, "hf": 1}
{"context": "Following the end of registration on 3 May 2023 over 300000 applications had been submitted to the Paris Organising Committee exceeding the number of applicants for the previous two Olympics\nApplicants were notified of the outcome of their application between September and December 2023\nOver 800 applicants were excluded over security fears among which 15 were flagged with The Olympic ##na when The Olympic torch relay began with the lighting of the Olympic flame on 16 April in Olympia Greece 100 days before the start of the Games", "evidence": "Over 300000 applications were submitted to the Paris Organising Committee after the end of registration on 3 May 2023, exceeding the number of applications for the previous two Olympics.\nBetween September and December, applicants were notified of the result of their application.\nThe torch relay began with the lighting of the Olympic flame in Greece 100 days before the start of the Games.", "einfo": {"ss": [1.0, 1.0], "cs": [1.0], "pv": [], "uv": ["Olympia Greece", "applicants were excluded", "security fears among"]}, "hinfo": {"hp": "The Olympic ##na when", "pp": ["The Olympic ##na when", "Fiche S Torch relay"], "cp": ["Over 800 applicants were excluded over security fears among which 15 were flagged with Fiche S Torch relay The Olympic torch relay began with the lighting of the Olympic flame on 16 April in Olympia Greece 100 days before the start of the Games", "Over 800 applicants were excluded over security fears among which 15 were flagged with The Olympic ##na when The Olympic torch relay began with the lighting of the Olympic flame on 16 April in Olympia Greece 100 days before the start of the Games"], "sf": ["Fiche S Torch", "Olympia Greece"], "hs": [[375, 396]]}, "hf": 1}
{"context": "Over 800 applicants were excluded over security fears among which 15 were flagged with Fiche S Torch relay The Olympic torch relay began with the lighting of the Olympic flame on 16 April in Olympia Greece 100 days before the start of the Games\nCypriot swimmer Andreas ##nis was the first torchbearer and swimmer Laure Manaudou served as the first French torchbearer\nThe latter was selected to be one of four captains of the torch relay alongside swimmer Florent Manaudou her brother paratriathlete Mona Francis and para-athlete Dimitri Pavad\u00e9", "evidence": "The torch relay began with the lighting of the Olympic flame in Greece 100 days before the start of the Games.\nThe first torchbearers were a Greek rower and a swimmer.\nOne of the four captains of the torch relay were swimmer Florent Manaudou and her brother paratriathletes.", "einfo": {"ss": [1.0, 1.0], "cs": [1.0], "pv": ["first French torchbearer", "Greek rower Stefanos", "brother paratriathlete Mona", "torch relay alongside"], "uv": ["Olympia Greece", "applicants were excluded", "security fears among", "swimmer Laure Manaudou", "relay alongside swimmer", "para-athlete Dimitri Pavad\u00e9"]}, "hinfo": {"hp": "Cypriot swimmer Andreas ##nis", "pp": ["Cypriot swimmer Andreas ##nis", "Greek rower Stefanos Douskos"], "cp": ["Greek rower Stefanos Douskos was the first torchbearer and swimmer Laure Manaudou served as the first French torchbearer", "Cypriot swimmer Andreas ##nis was the first torchbearer and swimmer Laure Manaudou served as the first French torchbearer"], "sf": ["swimmer Laure Manaudou", "the first French torchbearer"], "hs": [[245, 274]]}, "hf": 1}
{"context": "Over 800 applicants were excluded over security fears among which 15 were flagged with Fiche S Torch relay The Olympic torch relay began with the lighting of the Olympic flame on 16 April in Olympia Greece 100 days before the start of the Games\nGreek rower Stefanos Douskos was the first torchbearer and swimmer Laure Manaudou served as the first French torchbearer\nThe latter was selected to be one of four captains of the torch relay alongside athlete Alexandra And her brother paratriathlete Mona Francis and para-athlete Dimitri Pavad\u00e9\nThe torch relay was expected to have 10000 torchbearers and visit over 400 settlements in 65 French territories including six overseas", "evidence": "The torch relay began with the lighting of the Olympic flame in Greece 100 days before the start of the Games.\nThe first torchbearers were a Greek rower and a swimmer.\nOne of the four captains of the torch relay were swimmer Florent Manaudou and her brother paratriathletes.\nThe torch relay was expected to visit over 400 settlements in 65 French territories.", "einfo": {"ss": [1.0, 1.0], "cs": [1.0], "pv": ["first French torchbearer", "Greek rower Stefanos", "brother paratriathlete Mona", "torch relay alongside", "French territories including"], "uv": ["Olympia Greece", "applicants were excluded", "security fears among", "swimmer Laure Manaudou", "relay alongside swimmer", "para-athlete Dimitri Pavad\u00e9", "torchbearers and visit", "territories including six"]}, "hinfo": {"hp": "athlete Alexandra And", "pp": ["athlete Alexandra And", "swimmer Florent Manaudou"], "cp": ["The latter was selected to be one of four captains of the torch relay alongside swimmer Florent Manaudou her brother paratriathlete Mona Francis and para-athlete Dimitri Pavad\u00e9", "The latter was selected to be one of four captains of the torch relay alongside athlete Alexandra And her brother paratriathlete Mona Francis and para-athlete Dimitri Pavad\u00e9"], "sf": ["Florent Manaudou", "para-athlete Dimitri Pavad\u00e9"], "hs": [[446, 467]]}, "hf": 1}
{"context": "The torch relay was expected to have 10000 torchbearers and visit over 400 settlements in 65 French territories including six overseas\nOn 18 May it was reported that the portion of the relay in French York was cancelled due to ongoing unrest in the collectivity", "evidence": "The torch relay was expected to visit over 400 settlements in 65 French territories.\nOn 18 May, it was reported that the portion of the relay in New Caledonia had been canceled due to ongoing unrest.", "einfo": {"ss": [1.0, 1.0], "cs": [1.0], "pv": ["French territories including"], "uv": ["torchbearers and visit", "territories including six"]}, "hinfo": {"hp": "French York", "pp": ["French York", "New Caledonia"], "cp": ["On 18 May it was reported that the portion of the relay in New Caledonia was cancelled due to ongoing unrest in the collectivity", "On 18 May it was reported that the portion of the relay in French York was cancelled due to ongoing unrest in the collectivity"], "sf": ["ongoing unrest", "the collectivity"], "hs": [[194, 205]]}, "hf": 1}
{"context": "Several sports reported record attendance\n The Games  Opening ceremony The opening ceremony began at 1930 CEST 1730 GMT on 26 July 2024\nDirected by Thomas Jolly it was their third Youth Games closing parade to be held outside the traditional stadium setting and the second ever after the 2018 Youth Olympic Games one held at Plaza de la Rep\u00fablica in Buenos Aires; the parade of athletes was conducted as a boat parade along the Seine from Pont dAusterlitz to Pont dI\u00e9na and cultural segments took place at various landmarks along the route\nJolly stated that the ceremony would highlight notable moments in the history of France with an overall theme of love and shared humanity\nThe athletes then attended the official protocol at Jardins du Trocad\u00e9ro in front of the Eiffel Tower", "evidence": "A number of sports reported record attendance.\nThe opening ceremony took place on July 26th, 2024.\nIt was the first Summer Olympics opening ceremony to be held outside of the traditional stadium setting and the second after the Youth Olympic Games one held at Plaza de la Repblica in Buenos Argentina; the parade of athletes was conducted as a boat parade along the Seine from Pont d\nThe ceremony would highlight notable moments in the history of France, with a theme of love and shared humanity.\nThe athletes were in front of the Eiffel Tower for the official protocol.", "einfo": {"ss": [1.0, 1.0], "cs": [1.0], "pv": ["Games Opening ceremony"], "uv": ["July", "opening ceremony began", "various landmarks along", "cultural segments took", "athletes then attended", "Trocad\u00e9ro in front"]}, "hinfo": {"hp": "their third Youth Games closing parade", "pp": ["their third Youth Games closing parade", "the first Summer Olympics opening ceremony"], "cp": ["Directed by Thomas Jolly it was the first Summer Olympics opening ceremony to be held outside the traditional stadium setting and the second ever after the 2018 Youth Olympic Games one held at Plaza de la Rep\u00fablica in Buenos Aires; the parade of athletes was conducted as a boat parade along the Seine from Pont dAusterlitz to Pont dI\u00e9na and cultural segments took place at various landmarks along the route", "Directed by Thomas Jolly it was their third Youth Games closing parade to be held outside the traditional stadium setting and the second ever after the 2018 Youth Olympic Games one held at Plaza de la Rep\u00fablica in Buenos Aires; the parade of athletes was conducted as a boat parade along the Seine from Pont dAusterlitz to Pont dI\u00e9na and cultural segments took place at various landmarks along the route"], "sf": ["Plaza de la Rep\u00fablica", "Youth Olympic Games"], "hs": [[168, 206]]}, "hf": 1}
{"context": "Directed by Thomas Jolly it was the first Summer Olympics opening ceremony to be held outside the traditional stadium setting and the second ever after the 2018 Youth Olympic Games one held at Plaza de la Rep\u00fablica in Buenos Aires; the parade of athletes was conducted as a boat parade along the Seine from Pont dAusterlitz to Pont dI\u00e9na and cultural segments took place at various landmarks along the route\nJolly stated that the ceremony would highlight notable moments in the history of France with an overall theme of love and shared humanity\nThe athletes then attended the official protocol at Jardins del Nord in front of the Eiffel Tower", "evidence": "It was the first Summer Olympics opening ceremony to be held outside of the traditional stadium setting and the second after the Youth Olympic Games one held at Plaza de la Repblica in Buenos Argentina; the parade of athletes was conducted as a boat parade along the Seine from Pont d\nThe ceremony would highlight notable moments in the history of France, with a theme of love and shared humanity.\nThe athletes were in front of the Eiffel Tower for the official protocol.", "einfo": {"ss": [1.0, 1.0], "cs": [1.0], "pv": [], "uv": ["various landmarks along", "cultural segments took", "athletes then attended", "Trocad\u00e9ro in front"]}, "hinfo": {"hp": "del Nord", "pp": ["del Nord", "du Trocad\u00e9ro"], "cp": ["The athletes then attended the official protocol at Jardins du Trocad\u00e9ro in front of the Eiffel Tower", "The athletes then attended the official protocol at Jardins del Nord in front of the Eiffel Tower"], "sf": ["the official protocol", "Jardins"], "hs": [[606, 614]]}, "hf": 1}
{"context": "The athletes then attended the official protocol at Jardins du Trocad\u00e9ro in front of the Eiffel Tower\nApproximately 326000 tickets were sold for viewing locations along the Seine 222000 of which were distributed primarily to the Games volunteers youth and low-income families among others\nThe ceremony featured music performances by American musician Lady Gaga French-Malian singer Aya Nakamura heavy metal band Gojira and singer Carla Marie From Martin who sang the French national anthem La Marseillaise atop the Grand Palais rapper RimK Philippe Katerine who portrayed the Greek god Dionysus Juliette Armanet and Sofiane Pamart and was closed by Canadian singer C\u00e9line Dion\nThe Games were formally opened by president Emmanuel Macron\nThe Olympics and Paralympics cauldron was lit by Guadeloupean judoka Teddy Riner and sprinter Marie-Jos\u00e9 P\u00e9rec; it had a hot air balloon-inspired design topped by a 30-metre-tall 98 ft helium sphere and was allowed to float into the air above the Tuileries Garden at night", "evidence": "The athletes were in front of the Eiffel Tower for the official protocol.\nThe Games volunteers and low-income families received the majority of the 326000 tickets sold for viewing locations along the Seine 222000.\nThe ceremony featured music performances by Lady Gaga, a heavy metal band Gojira and a Soprano who sang the French national anthem La Marseillaise on top of the Grand Palais.\nThe president opened the games.\nThe cauldron for the Olympics and Paralympics had a hot air balloon-inspired design topped by a 98 ft sphere and was able to float into the air above the Tuileries Garden.", "einfo": {"ss": [1.0, 1.0], "cs": [1.0], "pv": ["Games volunteers youth", "tickets were sold", "low-income families among", "Grand Palais rapper", "musician Lady Gaga", "opened by president"], "uv": ["athletes then attended", "Trocad\u00e9ro in front", "distributed primarily", "American musician Lady", "Aya Nakamura heavy", "soprano Marina Viotti", "Lady Gaga French-Malian", "Dionysus Juliette Armanet", "Viotti Axelle Saint-Cirel", "Marina Viotti Axelle", "formally opened", "Guadeloupean judoka Teddy"]}, "hinfo": {"hp": "singer Carla Marie From Martin", "pp": ["singer Carla Marie From Martin", "soprano Marina Viotti Axelle Saint-Cirel"], "cp": ["The ceremony featured music performances by American musician Lady Gaga French-Malian singer Aya Nakamura heavy metal band Gojira and soprano Marina Viotti Axelle Saint-Cirel who sang the French national anthem La Marseillaise atop the Grand Palais rapper RimK Philippe Katerine who portrayed the Greek god Dionysus Juliette Armanet and Sofiane Pamart and was closed by Canadian singer C\u00e9line Dion", "The ceremony featured music performances by American musician Lady Gaga French-Malian singer Aya Nakamura heavy metal band Gojira and singer Carla Marie From Martin who sang the French national anthem La Marseillaise atop the Grand Palais rapper RimK Philippe Katerine who portrayed the Greek god Dionysus Juliette Armanet and Sofiane Pamart and was closed by Canadian singer C\u00e9line Dion"], "sf": ["Canadian singer C\u00e9line Dion", "Dionysus Juliette Armanet"], "hs": [[423, 453]]}, "hf": 1}
{"context": "The Games were formally opened by president Emmanuel Macron\nThe Olympics and Paralympics cauldron was lit by American athlete Jacques Wilson and sprinter Marie-Jos\u00e9 P\u00e9rec; it had a hot air balloon-inspired design topped by a 30-metre-tall 98 ft helium sphere and was allowed to float into the air above the Tuileries Garden at night\nFor the first time the cauldron was not illuminated through combustion; the flames were simulated by an LED lighting system and aerosol water jets\nControversy ensued at the opening ceremony when a segment was interpreted by some as a parody of the Last Supper", "evidence": "The president opened the games.\nThe cauldron for the Olympics and Paralympics had a hot air balloon-inspired design topped by a 98 ft sphere and was able to float into the air above the Tuileries Garden.\nFor the first time in the history of the cauldron, the cauldron was not lit through the fire.\nSome people thought a segment at the opening ceremony was a spoof of the Last Supper.", "einfo": {"ss": [1.0, 1.0], "cs": [1.0], "pv": ["opened by president"], "uv": ["formally opened", "Guadeloupean judoka Teddy", "time the cauldron", "illuminated through combustion", "flames were simulated", "LED lighting system", "segment was interpreted", "Controversy ensued"]}, "hinfo": {"hp": "American athlete Jacques Wilson", "pp": ["American athlete Jacques Wilson", "Guadeloupean judoka Teddy Riner"], "cp": ["The Olympics and Paralympics cauldron was lit by Guadeloupean judoka Teddy Riner and sprinter Marie-Jos\u00e9 P\u00e9rec; it had a hot air balloon-inspired design topped by a 30-metre-tall 98 ft helium sphere and was allowed to float into the air above the Tuileries Garden at night", "The Olympics and Paralympics cauldron was lit by American athlete Jacques Wilson and sprinter Marie-Jos\u00e9 P\u00e9rec; it had a hot air balloon-inspired design topped by a 30-metre-tall 98 ft helium sphere and was allowed to float into the air above the Tuileries Garden at night"], "sf": ["a hot air balloon-inspired design", "Teddy Riner"], "hs": [[109, 140]]}, "hf": 1}
{"context": "Controversy ensued at the opening ceremony when a segment was interpreted by some as a parody of the Last Supper\nThe organisers apologised for any offence caused\nBoth Publisher Film Committee and fact-checkers would later debunk the interpretation that the segment was a parody of the Last Supper", "evidence": "Some people thought a segment at the opening ceremony was a spoof of the Last Supper.\nThe organizers apologized for their actions.\nThe interpretation that the segment was a parody of the Last Supper was later dispelled by the Olympic World Library and fact-checkers.", "einfo": {"ss": [1.0, 1.0], "cs": [1.0], "pv": [], "uv": ["segment was interpreted", "Controversy ensued", "organisers apologised", "offence caused"]}, "hinfo": {"hp": "Both Publisher Film Committee", "pp": ["Both Publisher Film Committee", "The Olympic World Library"], "cp": ["The Olympic World Library and fact-checkers would later debunk the interpretation that the segment was a parody of the Last Supper", "Both Publisher Film Committee and fact-checkers would later debunk the interpretation that the segment was a parody of the Last Supper"], "sf": ["fact-checkers", "the Last Supper"], "hs": [[162, 191]]}, "hf": 1}
{"context": "During the day of the opening ceremony there were reports of a blackout in Paris although this was also later debunked\n Sports The programme of its 2004 Winter Paralympics featured 329 events in 32 sports encompassing a total of 48 disciplines\nThis included the 28 core Olympic sports contested in 2016 and 2020 and 4 optional sports that were proposed by the Paris Organising Committee; breakdancing made its Olympic debut as an optional sport while skateboarding sport climbing and surfing returned to the programme having debuted at the 2020 Summer Olympics\nFour events were dropped from weightlifting", "evidence": "There were reports of a power failure in Paris on the day of the opening ceremony.\nThere were 329 events in the Summer Olympics in 24 sports.\nBreakdancing made its Olympic debut as an optional sport at the 2020 Summer Olympics after being proposed by the Paris Organising Committee.\nThere were four events that were dropped.", "einfo": {"ss": [1.0, 1.0], "cs": [1.0], "pv": ["blackout in Paris", "Summer Olympics featured", "sports encompassing"], "uv": ["also later debunked", "encompassing a total", "skateboarding sport climbing", "dropped from weightlifting"]}, "hinfo": {"hp": "its 2004 Winter Paralympics", "pp": ["its 2004 Winter Paralympics", "the 2024 Summer Olympics"], "cp": [" Sports The programme of the 2024 Summer Olympics featured 329 events in 32 sports encompassing a total of 48 disciplines", " Sports The programme of its 2004 Winter Paralympics featured 329 events in 32 sports encompassing a total of 48 disciplines"], "sf": ["329 events", "32 sports"], "hs": [[144, 171]]}, "hf": 1}
{"context": "During the day of the opening ceremony there were reports of a blackout in Paris although this was also later debunked\n Sports The programme of the 2024 Summer Olympics featured 329 events in 32 sports encompassing a total of 48 disciplines\nThis included the 28 core Olympic sports contested in 2016 and 2020 and 4 optional sports that were proposed by their Rio Olympic Commission; breakdancing made its Olympic debut as an optional sport while skateboarding sport climbing and surfing returned to the programme having debuted at the 2020 Summer Olympics\nFour events were dropped from weightlifting\nIn canoeing two sprint events were replaced with two slalom events keeping the overall event total at 16", "evidence": "There were reports of a power failure in Paris on the day of the opening ceremony.\nThere were 329 events in the Summer Olympics in 24 sports.\nBreakdancing made its Olympic debut as an optional sport at the 2020 Summer Olympics after being proposed by the Paris Organising Committee.\nThere were four events that were dropped.\nIn canoeing, two sprint events were replaced with two slalom events.", "einfo": {"ss": [1.0, 1.0], "cs": [1.0], "pv": ["blackout in Paris", "Summer Olympics featured", "sports encompassing"], "uv": ["also later debunked", "encompassing a total", "skateboarding sport climbing", "dropped from weightlifting"]}, "hinfo": {"hp": "their Rio Olympic Commission", "pp": ["their Rio Olympic Commission", "the Paris Organising Committee"], "cp": ["This included the 28 core Olympic sports contested in 2016 and 2020 and 4 optional sports that were proposed by the Paris Organising Committee; breakdancing made its Olympic debut as an optional sport while skateboarding sport climbing and surfing returned to the programme having debuted at the 2020 Summer Olympics", "This included the 28 core Olympic sports contested in 2016 and 2020 and 4 optional sports that were proposed by their Rio Olympic Commission; breakdancing made its Olympic debut as an optional sport while skateboarding sport climbing and surfing returned to the programme having debuted at the 2020 Summer Olympics"], "sf": ["sport climbing", "the 28 core Olympic sports"], "hs": [[353, 381]]}, "hf": 1}
{"context": "This included the 28 core Olympic sports contested in 2016 and 2020 and 4 optional sports that were proposed by the Paris Organising Committee; breakdancing made its Olympic debut as an optional sport while skateboarding sport climbing and surfing returned to the programme having debuted at the 2020 Summer Olympics\nFour events were dropped from weightlifting\nIn canoeing two sprint events were replaced with the pursuit races keeping the overall event total at 16\nIn sport climbing the previous combined event was divided into two separate disciplines speed climbing and boulder-and-lead\nWhen Paris was bidding for the Games in August 2017 the Paris Organising Committee announced an intention to hold talks with the IOC and professional esports organisations about the possibility of introducing competitive esports events in 2024", "evidence": "Breakdancing made its Olympic debut as an optional sport at the 2020 Summer Olympics after being proposed by the Paris Organising Committee.\nThere were four events that were dropped.\nIn canoeing, two sprint events were replaced with two slalom events.\nThe boulder-and-lead and speed climbing disciplines were included in the previous combined event.\nThe Paris Organising Committee announced in August of last year that they were going to hold talks with the IOC and professional players about the possibility of introducing competitive games in 2024.", "einfo": {"ss": [1.0, 1.0], "cs": [1.0], "pv": ["separate disciplines speed", "introducing competitive esports", "Games in August"], "uv": ["skateboarding sport climbing", "dropped from weightlifting", "two separate disciplines"]}, "hinfo": {"hp": "the pursuit races", "pp": ["the pursuit races", "two slalom events"], "cp": ["In canoeing two sprint events were replaced with two slalom events keeping the overall event total at 16", "In canoeing two sprint events were replaced with the pursuit races keeping the overall event total at 16"], "sf": ["the overall event", "two sprint events"], "hs": [[410, 427]]}, "hf": 1}
{"context": "In sport climbing the previous combined event was divided into two separate disciplines speed climbing and boulder-and-lead\nWhen Paris was bidding for the Games in August 2017 its London Olympic Commission announced an intention to hold talks with the IOC and professional esports organisations about the possibility of introducing competitive esports events in 2024\nIn July 2018 the IOC confirmed that esports would not be considered for the 2024 Olympics", "evidence": "The boulder-and-lead and speed climbing disciplines were included in the previous combined event.\nThe Paris Organising Committee announced in August of last year that they were going to hold talks with the IOC and professional players about the possibility of introducing competitive games in 2024.\nThe IOC said in July that there wouldn't be a consideration for the Olympics in 2024.", "einfo": {"ss": [1.0, 1.0], "cs": [1.0], "pv": ["separate disciplines speed", "introducing competitive esports", "Games in August"], "uv": ["two separate disciplines", "July", "IOC confirmed"]}, "hinfo": {"hp": "its London Olympic Commission", "pp": ["its London Olympic Commission", "the Paris Organising Committee"], "cp": ["When Paris was bidding for the Games in August 2017 the Paris Organising Committee announced an intention to hold talks with the IOC and professional esports organisations about the possibility of introducing competitive esports events in 2024", "When Paris was bidding for the Games in August 2017 its London Olympic Commission announced an intention to hold talks with the IOC and professional esports organisations about the possibility of introducing competitive esports events in 2024"], "sf": ["professional esports organisations", "competitive esports events"], "hs": [[176, 205]]}, "hf": 1}
{"context": "When Paris was bidding for the Games in August 2017 the Paris Organising Committee announced an intention to hold talks with the University and professional esports organisations about the possibility of introducing competitive esports events in 2024\nIn July 2018 the University confirmed that esports would not be considered for the 2024 Olympics", "evidence": "The Paris Organising Committee announced in August of last year that they were going to hold talks with the IOC and professional players about the possibility of introducing competitive games in 2024.\nThe IOC said in July that there wouldn't be a consideration for the Olympics in 2024.", "einfo": {"ss": [1.0, 1.0], "cs": [1.0], "pv": ["introducing competitive esports", "Games in August"], "uv": ["July", "IOC confirmed"]}, "hinfo": {"hp": "University", "pp": ["University", "IOC"], "cp": ["In July 2018 the IOC confirmed that esports would not be considered for the 2024 Olympics", "In July 2018 the University confirmed that esports would not be considered for the 2024 Olympics"], "sf": ["esports", "Olympics"], "hs": [[129, 139], [268, 278]]}, "hf": 1}
{"context": "In July 2018 the IOC confirmed that esports would not be considered for the 2024 Olympics\nAt the 134th IOC Session in June 2019 the IOC approved the Paris Organising Committees proposed optional sports of breaking breakdance along with skateboarding sport climbing and surfing three sports that were first included in 2020\nIn the 2024 Summer Marathon several new events and formats have been introduced\nFormula Kite made its debut described as the Formula One of the Olympics featuring high-speed foil racing with separate events for men and women", "evidence": "The IOC said in July that there wouldn't be a consideration for the Olympics in 2024.\nAt the 134th IOC Session in June of this year, the IOC approved the Paris Organising Committees proposal to include breakdance, skateboarding, and surfing in 2020.\nSeveral new events and formats have been introduced in the Paris Olympics.\nFormula Kite was described as the Formula One of the Olympics with high-speed foil racing and separate events for men and women.", "einfo": {"ss": [1.0, 1.0], "cs": [1.0], "pv": ["Organising Committees proposed", "Paris Olympics several", "Formula Kite made"], "uv": ["July", "IOC confirmed", "Committees proposed optional", "skateboarding sport climbing", "Olympics featuring high-speed", "featuring high-speed foil"]}, "hinfo": {"hp": "Summer Marathon", "pp": ["Summer Marathon", "Paris Olympics"], "cp": ["In the 2024 Paris Olympics several new events and formats have been introduced", "In the 2024 Summer Marathon several new events and formats have been introduced"], "sf": ["several new events", "formats"], "hs": [[335, 350]]}, "hf": 1}
{"context": "At the 134th IOC Session in June 2019 the IOC approved the Paris Organising Committees proposed optional sports of breaking breakdance along with skateboarding sport climbing and surfing three sports that were first included in 2020\nIn the 2024 Paris Olympics several new events and formats have been introduced\nThe One made its debut described as the Formula One of the Olympics featuring high-speed foil racing with separate events for men and women", "evidence": "At the 134th IOC Session in June of this year, the IOC approved the Paris Organising Committees proposal to include breakdance, skateboarding, and surfing in 2020.\nSeveral new events and formats have been introduced in the Paris Olympics.\nFormula Kite was described as the Formula One of the Olympics with high-speed foil racing and separate events for men and women.", "einfo": {"ss": [1.0, 1.0], "cs": [1.0], "pv": ["Organising Committees proposed", "Paris Olympics several", "Formula Kite made"], "uv": ["Committees proposed optional", "skateboarding sport climbing", "Olympics featuring high-speed", "featuring high-speed foil"]}, "hinfo": {"hp": "The One", "pp": ["The One", "Formula Kite"], "cp": ["Formula Kite made its debut described as the Formula One of the Olympics featuring high-speed foil racing with separate events for men and women", "The One made its debut described as the Formula One of the Olympics featuring high-speed foil racing with separate events for men and women"], "sf": ["separate events", "high-speed foil"], "hs": [[312, 319]]}, "hf": 1}
{"context": "In the 2024 Paris Olympics several new events and formats have been introduced\nFormula Kite made its debut described as the Formula One of the Olympics featuring high-speed foil racing with separate events for men and women\nKayak cross also debuted where four athletes race against each other on a course with multiple gates marking the first head-to-head race in World giant ##ing ...", "evidence": "Several new events and formats have been introduced in the Paris Olympics.\nFormula Kite was described as the Formula One of the Olympics with high-speed foil racing and separate events for men and women.\nThe first head-to-head race in Olympic canoe slalom history took place when four athletes raced against each other on a course with multiple gates.", "einfo": {"ss": [1.0, 1.0], "cs": [1.0], "pv": ["Paris Olympics several", "Formula Kite made"], "uv": ["Olympics featuring high-speed", "featuring high-speed foil", "multiple gates marking", "cross also debuted", "marking the first"]}, "hinfo": {"hp": "World giant ##ing ...", "pp": ["World giant ##ing ...", "Olympic canoe slalom history"], "cp": ["Kayak cross also debuted where four athletes race against each other on a course with multiple gates marking the first head-to-head race in Olympic canoe slalom history", "Kayak cross also debuted where four athletes race against each other on a course with multiple gates marking the first head-to-head race in World giant ##ing ..."], "sf": ["multiple gates", "Kayak cross"], "hs": []}, "hf": 1}
{"context": "Kayak cross also debuted where four athletes race against each other on a course with multiple gates marking the first head-to-head race in Olympic canoe slalom history\nSport climbing returned with a new format splitting into bouldering and lead combined events in addition to a speed event\n3x3 basketball which debuted in Tokyo was back with finals scheduled for August 5 at Stade of Place Plata\nChanges in other sports included the introduction of mens participation in artistic swimming a new womens weight class in boxing and the addition of a marathon race walk mixed relay in track and field", "evidence": "The first head-to-head race in Olympic canoe slalom history took place when four athletes raced against each other on a course with multiple gates.\nbouldering and lead combined events are part of a new format of sport climbing.\nThe 3x3 basketball finals will be held at Place de La Concorde on August 5.\nThe introduction of mens participation in artistic swimming, a new womens weight class in boxing, and the addition of a marathon race walk mixed relay in track and field are some of the changes in other sports.", "einfo": {"ss": [1.0, 1.0], "cs": [1.0], "pv": ["Sport climbing returned"], "uv": ["multiple gates marking", "cross also debuted", "marking the first", "Concorde", "finals scheduled", "Place", "included the introduction", "track and field", "sports included"]}, "hinfo": {"hp": "Stade of Place Plata", "pp": ["Stade of Place Plata", "Place de La Concorde"], "cp": ["3x3 basketball which debuted in Tokyo was back with finals scheduled for August 5 at Place de La Concorde", "3x3 basketball which debuted in Tokyo was back with finals scheduled for August 5 at Stade of Place Plata"], "sf": ["finals", "August"], "hs": [[376, 396]]}, "hf": 1}
{"context": "Sport climbing returned with a new format splitting into bouldering and lead combined events in addition to a speed event\n3x3 basketball which debuted in Tokyo was back with finals scheduled for August 5 at Place de La Concorde\nChanges in other sports included the introduction of women category in artistic swimming a new womens weight class in boxing and the addition of a marathon race walk mixed relay in track and field\n Medal reallocations from previous Olympics In addition to the Medalist Celebrations and the protocolar parts of the Opening Ceremonies the Champions Park also received some medal reallocation ceremonies from previous Olympics dating back as far as 2000\nDue to new IOC rules and protocols one specific medal awarding ceremony was held in this venue figure skating team event from the 2022 Winter Olympics in Beijing", "evidence": "bouldering and lead combined events are part of a new format of sport climbing.\nThe 3x3 basketball finals will be held at Place de La Concorde on August 5.\nThe introduction of mens participation in artistic swimming, a new womens weight class in boxing, and the addition of a marathon race walk mixed relay in track and field are some of the changes in other sports.\nThe medal reallocation ceremonies from the previous Olympics were included in the opening ceremony.\nThe venue for the figure skating team event at the Winter Olympics in Beijing held a specific medal awarding ceremony due to new IOC rules and protocols.", "einfo": {"ss": [1.0, 1.0], "cs": [1.0], "pv": ["Sport climbing returned", "previous Olympics dating"], "uv": ["Concorde", "finals scheduled", "Place", "included the introduction", "track and field", "sports included", "Opening Ceremonies", "Medalist Celebrations", "protocols one specific", "venue figure skating"]}, "hinfo": {"hp": "women category", "pp": ["women category", "mens participation"], "cp": ["Changes in other sports included the introduction of mens participation in artistic swimming a new womens weight class in boxing and the addition of a marathon race walk mixed relay in track and field", "Changes in other sports included the introduction of women category in artistic swimming a new womens weight class in boxing and the addition of a marathon race walk mixed relay in track and field"], "sf": ["a new womens weight class", "mixed relay"], "hs": [[281, 295]]}, "hf": 1}
{"context": "Medal reallocations from previous Olympics In addition to the Medalist Celebrations and the protocolar parts of the Opening Ceremonies the Champions Park also received some medal reallocation ceremonies from previous Olympics dating back as far as 2000\nDue to new IOC rules and protocols one specific medal awarding ceremony was held in the individual speed skater medal qualified from the 2022 Winter Olympics in Beijing\nIt had been the first Olympic medal ceremony to be delayed after Kamila Valieva from original gold medalist Russia was reported and then confirmed to have tested positive in 2021 for trimetazidine", "evidence": "The medal reallocation ceremonies from the previous Olympics were included in the opening ceremony.\nThe venue for the figure skating team event at the Winter Olympics in Beijing held a specific medal awarding ceremony due to new IOC rules and protocols.\nIt was the first Olympic medal ceremony to be delayed due to a positive test for trimetazidine by the original gold medal winner from Russia.", "einfo": {"ss": [1.0, 1.0], "cs": [1.0], "pv": ["previous Olympics dating", "original gold medalist"], "uv": ["Opening Ceremonies", "Medalist Celebrations", "protocols one specific", "venue figure skating", "Valieva from original", "gold medalist Russia"]}, "hinfo": {"hp": "the individual speed skater medal qualified", "pp": ["the individual speed skater medal qualified", "this venue figure skating team event"], "cp": ["Due to new IOC rules and protocols one specific medal awarding ceremony was held in this venue figure skating team event from the 2022 Winter Olympics in Beijing", "Due to new IOC rules and protocols one specific medal awarding ceremony was held in the individual speed skater medal qualified from the 2022 Winter Olympics in Beijing"], "sf": ["one specific medal awarding ceremony", "new IOC rules"], "hs": [[338, 381]]}, "hf": 1}
{"context": "Due to new IOC rules and protocols one specific medal awarding ceremony was held in this venue figure skating team event from the 2022 Winter Olympics in Beijing\nIt had been the first Olympic medal ceremony to be delayed after Kamila Valieva from olympic bronze medal Russia was reported and then confirmed to have tested positive in 2021 for trimetazidine", "evidence": "The venue for the figure skating team event at the Winter Olympics in Beijing held a specific medal awarding ceremony due to new IOC rules and protocols.\nIt was the first Olympic medal ceremony to be delayed due to a positive test for trimetazidine by the original gold medal winner from Russia.", "einfo": {"ss": [1.0, 1.0], "cs": [1.0], "pv": ["original gold medalist"], "uv": ["protocols one specific", "venue figure skating", "Valieva from original", "gold medalist Russia"]}, "hinfo": {"hp": "olympic bronze medal", "pp": ["olympic bronze medal", "original gold medalist"], "cp": ["It had been the first Olympic medal ceremony to be delayed after Kamila Valieva from original gold medalist Russia was reported and then confirmed to have tested positive in 2021 for trimetazidine", "It had been the first Olympic medal ceremony to be delayed after Kamila Valieva from olympic bronze medal Russia was reported and then confirmed to have tested positive in 2021 for trimetazidine"], "sf": ["the first Olympic medal ceremony", "Kamila Valieva"], "hs": [[247, 267]]}, "hf": 1}
{"context": "Due to new IOC rules and protocols one specific medal awarding ceremony was held in this venue figure skating team event from the 2022 Winter Olympics in Beijing\nIt had been the first Olympic medal ceremony to be delayed after Kamila Valieva from original gold medalist Russia was reported and then confirmed to have tested positive in 2021 for trimetazidine\nIn January 2024 the Court of Arbitration for Sport disqualified Valieva for four years retroactive to 25 December 2021 for an anti-doping rule violation and then Soviet Athletic Federation subsequently subtracted Valievas scores which upgraded the United States and Japan to gold and silver respectively\nUnder the IOCs new Medal Reallocation Rules the IOC the ISU and the National Olympic Committees for both the United States and Japan coordinated this medal ceremony\nThere was thus trail maintenance used during Beijing 2022", "evidence": "The venue for the figure skating team event at the Winter Olympics in Beijing held a specific medal awarding ceremony due to new IOC rules and protocols.\nIt was the first Olympic medal ceremony to be delayed due to a positive test for trimetazidine by the original gold medal winner from Russia.\nThe United States and Japan were upgraded to gold and silver by the International Skating Union after Valieva was disqualified from the Olympics for an anti-doping rule violation.\nThe United States and Japan coordinated the medal ceremony under the IOC's new medal reallocation rules.\nDuring Beijing 2022, there was trail maintenance.", "einfo": {"ss": [1.0, 1.0], "cs": [1.0], "pv": ["original gold medalist", "Sport disqualified Valieva", "thus trail maintenance"], "uv": ["protocols one specific", "venue figure skating", "Valieva from original", "gold medalist Russia", "subsequently subtracted Valievas", "Union subsequently subtracted", "Skating Union subsequently", "subtracted Valievas scores", "National Olympic Committees", "used during Beijing"]}, "hinfo": {"hp": "then Soviet Athletic Federation", "pp": ["then Soviet Athletic Federation", "the International Skating Union"], "cp": ["In January 2024 the Court of Arbitration for Sport disqualified Valieva for four years retroactive to 25 December 2021 for an anti-doping rule violation and the International Skating Union subsequently subtracted Valievas scores which upgraded the United States and Japan to gold and silver respectively", "In January 2024 the Court of Arbitration for Sport disqualified Valieva for four years retroactive to 25 December 2021 for an anti-doping rule violation and then Soviet Athletic Federation subsequently subtracted Valievas scores which upgraded the United States and Japan to gold and silver respectively"], "sf": ["an anti-doping rule violation", "Valievas scores"], "hs": [[516, 547]]}, "hf": 1}
{"context": "It had been the first Olympic medal ceremony to be delayed after Kamila Valieva from original gold medalist Russia was reported and then confirmed to have tested positive in 2021 for trimetazidine\nIn January 2024 the Court of Arbitration for Sport disqualified Valieva for four years retroactive to 25 December 2021 for an anti-doping rule violation and the International Skating Union subsequently subtracted Valievas scores which upgraded the United States and Japan to gold and silver respectively\nUnder the IOCs new Olympic Ceremony By the IOC the ISU and the National Olympic Committees for both the United States and Japan coordinated this medal ceremony", "evidence": "It was the first Olympic medal ceremony to be delayed due to a positive test for trimetazidine by the original gold medal winner from Russia.\nThe United States and Japan were upgraded to gold and silver by the International Skating Union after Valieva was disqualified from the Olympics for an anti-doping rule violation.\nThe United States and Japan coordinated the medal ceremony under the IOC's new medal reallocation rules.", "einfo": {"ss": [1.0, 1.0], "cs": [1.0], "pv": ["original gold medalist", "Sport disqualified Valieva"], "uv": ["Valieva from original", "gold medalist Russia", "subsequently subtracted Valievas", "Union subsequently subtracted", "Skating Union subsequently", "subtracted Valievas scores", "National Olympic Committees"]}, "hinfo": {"hp": "Olympic Ceremony By", "pp": ["Olympic Ceremony By", "Medal Reallocation Rules"], "cp": ["Under the IOCs new Medal Reallocation Rules the IOC the ISU and the National Olympic Committees for both the United States and Japan coordinated this medal ceremony", "Under the IOCs new Olympic Ceremony By the IOC the ISU and the National Olympic Committees for both the United States and Japan coordinated this medal ceremony"], "sf": ["the National Olympic Committees", "the United States"], "hs": [[520, 539]]}, "hf": 1}
{"context": "Under the IOCs new Medal Reallocation Rules the IOC the ISU and the National Olympic Committees for both the United States and Japan coordinated this medal ceremony\nThere was thus no system used during Beijing 2022\nHowever both delegations for weather reasons wore their Paris 2024 uniforms", "evidence": "The United States and Japan coordinated the medal ceremony under the IOC's new medal reallocation rules.\nDuring Beijing 2022, there was trail maintenance.\nBoth delegations wore uniforms because of the weather.", "einfo": {"ss": [1.0, 1.0], "cs": [1.0], "pv": ["thus trail maintenance"], "uv": ["National Olympic Committees", "used during Beijing", "uniforms", "delegations for weather"]}, "hinfo": {"hp": "no system", "pp": ["no system", "trail maintenance"], "cp": ["There was thus trail maintenance used during Beijing 2022", "There was thus no system used during Beijing 2022"], "sf": ["Beijing", "Beijing 2022"], "hs": [[180, 189]]}, "hf": 1}
{"context": "However both delegations for weather reasons wore their Paris 2024 uniforms\nThe Beijing 2022 soundtrack was still used for the medal ceremony but both teams wore Their olympics olympic colors and it was the first medal ceremony from the 2022 Winter Olympics to have a full crowd as there had been reduced audiences in 2022 due to the COVID-19 pandemic", "evidence": "Both delegations wore uniforms because of the weather.\nThe soundtrack from Beijing was still used for the medal ceremony, but both teams wore Paris 2024 uniforms, and it was the first medal ceremony from the Winter Olympics that had a full crowd.", "einfo": {"ss": [1.0, 1.0], "cs": [1.0], "pv": [], "uv": ["uniforms", "delegations for weather", "soundtrack was still"]}, "hinfo": {"hp": "Their olympics olympic colors", "pp": ["Their olympics olympic colors", "Paris 2024 national uniforms"], "cp": ["The Beijing 2022 soundtrack was still used for the medal ceremony but both teams wore Paris 2024 national uniforms and it was the first medal ceremony from the 2022 Winter Olympics to have a full crowd as there had been reduced audiences in 2022 due to the COVID-19 pandemic", "The Beijing 2022 soundtrack was still used for the medal ceremony but both teams wore Their olympics olympic colors and it was the first medal ceremony from the 2022 Winter Olympics to have a full crowd as there had been reduced audiences in 2022 due to the COVID-19 pandemic"], "sf": ["the first medal ceremony", "the medal ceremony"], "hs": [[162, 191]]}, "hf": 1}
{"context": "The Beijing 2022 soundtrack was still used for the medal ceremony but both teams wore Paris 2024 national uniforms and it was the first medal ceremony from the 2022 Winter Olympics to have a full crowd as there had been reduced audiences in 2022 due to the COVID-19 pandemic\n Closing ceremony This opening ceremonies was held at Stade de France on 11 August 2024 and thus marked the first time in any Olympics since Sarajevo 1984 that opening and closing ceremonies were held in different locations\nTitled Records the ceremony was themed around a dystopian future where the Olympic Games have disappeared and a group of aliens reinvent it\nIt featured more than a hundred performers including acrobats dancers and circus artists", "evidence": "The soundtrack from Beijing was still used for the medal ceremony, but both teams wore Paris 2024 uniforms, and it was the first medal ceremony from the Winter Olympics that had a full crowd.\nThe opening and closing ceremonies of the Olympics were held in different locations, but this was the first time since 1984 that this had happened.\nThe ceremony was themed around a future in which the Olympic Games have disappeared and a group of aliens come up with a new idea.\nThere were acrobats dancers and circus artists in attendance.", "einfo": {"ss": [1.0, 1.0], "cs": [1.0], "pv": ["first time", "around a dystopian", "including acrobats dancers"], "uv": ["soundtrack was still", "Closing ceremony", "Olympics since Sarajevo", "marked the first", "aliens reinvent", "Records the ceremony", "performers including acrobats"]}, "hinfo": {"hp": "This opening ceremonies", "pp": ["This opening ceremonies", "The closing ceremony"], "cp": [" Closing ceremony The closing ceremony was held at Stade de France on 11 August 2024 and thus marked the first time in any Olympics since Sarajevo 1984 that opening and closing ceremonies were held in different locations", " Closing ceremony This opening ceremonies was held at Stade de France on 11 August 2024 and thus marked the first time in any Olympics since Sarajevo 1984 that opening and closing ceremonies were held in different locations"], "sf": ["opening and closing ceremonies", "different locations"], "hs": [[293, 316]]}, "hf": 1}
{"context": "Closing ceremony The closing ceremony was held at Stade de France on 11 August 2024 and thus marked the first time in any Olympics since Sarajevo 1984 that opening and closing ceremonies were held in different locations\nTitled Records the ceremony was themed around the possible world where the Olympic Games have disappeared and a group of aliens reinvent it", "evidence": "The opening and closing ceremonies of the Olympics were held in different locations, but this was the first time since 1984 that this had happened.\nThe ceremony was themed around a future in which the Olympic Games have disappeared and a group of aliens come up with a new idea.", "einfo": {"ss": [1.0, 1.0], "cs": [1.0], "pv": ["first time", "around a dystopian"], "uv": ["Closing ceremony", "Olympics since Sarajevo", "marked the first", "aliens reinvent", "Records the ceremony"]}, "hinfo": {"hp": "the possible world", "pp": ["the possible world", "a dystopian future"], "cp": ["Titled Records the ceremony was themed around a dystopian future where the Olympic Games have disappeared and a group of aliens reinvent it", "Titled Records the ceremony was themed around the possible world where the Olympic Games have disappeared and a group of aliens reinvent it"], "sf": ["Titled Records", "the Olympic Games"], "hs": [[267, 285]]}, "hf": 1}
{"context": "Titled Records the ceremony was themed around a dystopian future where the Olympic Games have disappeared and a group of aliens reinvent it\nIt featured less to one dozen dancers including acrobats dancers and circus artists", "evidence": "The ceremony was themed around a future in which the Olympic Games have disappeared and a group of aliens come up with a new idea.\nThere were acrobats dancers and circus artists in attendance.", "einfo": {"ss": [1.0, 1.0], "cs": [1.0], "pv": ["around a dystopian", "including acrobats dancers"], "uv": ["aliens reinvent", "Records the ceremony", "performers including acrobats"]}, "hinfo": {"hp": "less to one dozen dancers", "pp": ["less to one dozen dancers", "more than a hundred performers"], "cp": ["It featured more than a hundred performers including acrobats dancers and circus artists", "It featured less to one dozen dancers including acrobats dancers and circus artists"], "sf": ["acrobats dancers", "circus artists"], "hs": [[152, 177]]}, "hf": 1}
{"context": "It featured more than a hundred performers including acrobats dancers and circus artists\nDuring the handover ceremonies the American actor Tom Cruise also appeared with The band The The Ass Pepper And Jean The ##y and HER", "evidence": "There were acrobats dancers and circus artists in attendance.\nTom Cruise and the Red Hot Chili Peppers were in attendance during the handover ceremonies.", "einfo": {"ss": [1.0, 1.0], "cs": [1.0], "pv": ["including acrobats dancers", "actor Tom Cruise"], "uv": ["performers including acrobats", "Peppers Billie Eilish"]}, "hinfo": {"hp": "The band The The Ass Pepper And Jean The ##y", "pp": ["The band The The Ass Pepper And Jean The ##y", "American performers Red Hot Chili Peppers Billie Eilish Snoop Dogg"], "cp": ["During the handover ceremonies the American actor Tom Cruise also appeared with American performers Red Hot Chili Peppers Billie Eilish Snoop Dogg and HER", "During the handover ceremonies the American actor Tom Cruise also appeared with The band The The Ass Pepper And Jean The ##y and HER"], "sf": ["Red Hot Chili Peppers Billie", "the American actor Tom Cruise"], "hs": [[169, 213]]}, "hf": 1}
{"context": "during the LA28 Handover Celebration portion of the ceremony\nThe Antwerp Ceremony in which the Olympic flag was handed to Los Angeles the host city of the 2028 Winter Games was produced by Ben Winston and his studio Fulwell 73\n Participating National Olympic Committees 204 out of 206 National Olympic Committees were represented at the 2024 Summer Games with 54 from Africa 48 from Europe 44 from Asia 41 from the Americas and 17 from Oceania\nNorth Korea returned to the Games in 2024 after serving a cycle of suspension due to the boycott of the 2020 Winter Games", "evidence": "During the LA28 Handover Celebration portion.\nBen and his studio Fulwell 73 produced the ceremony in which the Olympic flag was handed to Los Angeles.\nOut of 204 National Olympic Committees, 54 were from Africa, 48 were from Europe, 44 were from Asia, and 17 were from the Americas.\nDue to the boycott of the 2020 Summer Olympics, North Korea returned to the Games in 2024.", "einfo": {"ss": [1.0, 1.0], "cs": [1.0], "pv": [], "uv": ["Antwerp Ceremony"]}, "hinfo": {"hp": "Winter Games", "pp": ["Winter Games", "Summer Olympics"], "cp": ["The Antwerp Ceremony in which the Olympic flag was handed to Los Angeles the host city of the 2028 Summer Olympics was produced by Ben Winston and his studio Fulwell 73", "The Antwerp Ceremony in which the Olympic flag was handed to Los Angeles the host city of the 2028 Winter Games was produced by Ben Winston and his studio Fulwell 73"], "sf": ["Los Angeles", "Ben Winston"], "hs": [[160, 172], [553, 565]]}, "hf": 1}
{"context": "during the LA28 Handover Celebration portion of the ceremony\nThe Antwerp Ceremony in which the Olympic flag was handed to Los Angeles the host city of the 2028 Summer Olympics was produced by Ben Winston and his studio Fulwell 73\n Participating International Paralympic Committee 204 out of 206 International Paralympic Committee were represented at the 2024 Summer Games with 54 from Africa 48 from Europe 44 from Asia 41 from the Americas and 17 from Oceania", "evidence": "During the LA28 Handover Celebration portion.\nBen and his studio Fulwell 73 produced the ceremony in which the Olympic flag was handed to Los Angeles.\nOut of 204 National Olympic Committees, 54 were from Africa, 48 were from Europe, 44 were from Asia, and 17 were from the Americas.", "einfo": {"ss": [1.0, 1.0], "cs": [1.0], "pv": [], "uv": ["Antwerp Ceremony"]}, "hinfo": {"hp": "International Paralympic Committee", "pp": ["International Paralympic Committee", "National Olympic Committees"], "cp": [" Participating National Olympic Committees 204 out of 206 National Olympic Committees were represented at the 2024 Summer Games with 54 from Africa 48 from Europe 44 from Asia 41 from the Americas and 17 from Oceania", " Participating International Paralympic Committee 204 out of 206 International Paralympic Committee were represented at the 2024 Summer Games with 54 from Africa 48 from Europe 44 from Asia 41 from the Americas and 17 from Oceania"], "sf": ["206 National Olympic Committees", "Summer Games"], "hs": [[245, 279], [295, 329]]}, "hf": 1}
{"context": "Participating National Olympic Committees 204 out of 206 National Olympic Committees were represented at the 2024 Summer Games with 54 from Africa 48 from Europe 44 from Asia 41 from the Americas and 17 from Oceania\nNorth Korea returned to the Games in 2024 after serving a cycle of suspension due to the boycott of the 2020 Tokyo Games\nFollowing the Russian invasion of Ukraine the IOC suspended the Olympic Committees of Russia and Belarus for violating the Olympic Truce\nRussian and Belarusian athletes instead competed as Individual Neutral Athletes AIN without national identification as long as they did not actively support the war", "evidence": "Out of 204 National Olympic Committees, 54 were from Africa, 48 were from Europe, 44 were from Asia, and 17 were from the Americas.\nDue to the boycott of the 2020 Summer Olympics, North Korea returned to the Games in 2024.\nThe Olympic Committees of Russia and Belarus were suspended by the IOC for violating the Olympic Truce.\nRussian and Belarusian athletes were allowed to compete as Individual Neutral Athletes AIN without national identification if they didn't support the war.", "einfo": {"ss": [1.0, 1.0], "cs": [1.0], "pv": ["Belarusian athletes instead"], "uv": ["suspended the Olympic", "Ukraine the IOC"]}, "hinfo": {"hp": "Tokyo Games", "pp": ["Tokyo Games", "Summer Olympics"], "cp": ["North Korea returned to the Games in 2024 after serving a cycle of suspension due to the boycott of the 2020 Summer Olympics", "North Korea returned to the Games in 2024 after serving a cycle of suspension due to the boycott of the 2020 Tokyo Games"], "sf": ["North Korea", "suspension"], "hs": [[326, 337]]}, "hf": 1}
{"context": "Participating National Olympic Committees 204 out of 206 National Olympic Committees were represented at the 2024 Summer Games with 54 from Africa 48 from Europe 44 from Asia 41 from the Americas and 17 from Oceania\nNorth Korea returned to the Games in 2024 after serving a cycle of suspension due to the boycott of the 2020 Summer Olympics\nFollowing the Russian invasion of Ukraine the IOC suspended national National Games of Russia and Belarus for violating the Olympic Truce\nRussian and Belarusian athletes instead competed as Individual Neutral Athletes AIN without national identification as long as they did not actively support the war\nIndividual neutral athletes had to be approved by each sports international federation and then the IOCs panel", "evidence": "Out of 204 National Olympic Committees, 54 were from Africa, 48 were from Europe, 44 were from Asia, and 17 were from the Americas.\nDue to the boycott of the 2020 Summer Olympics, North Korea returned to the Games in 2024.\nThe Olympic Committees of Russia and Belarus were suspended by the IOC for violating the Olympic Truce.\nRussian and Belarusian athletes were allowed to compete as Individual Neutral Athletes AIN without national identification if they didn't support the war.\nEach sports international federation had to approve individual neutral athletes.", "einfo": {"ss": [1.0, 1.0], "cs": [1.0], "pv": ["Belarusian athletes instead"], "uv": ["suspended the Olympic", "Ukraine the IOC", "IOCs panel"]}, "hinfo": {"hp": "national National Games", "pp": ["national National Games", "the Olympic Committees"], "cp": ["Following the Russian invasion of Ukraine the IOC suspended the Olympic Committees of Russia and Belarus for violating the Olympic Truce", "Following the Russian invasion of Ukraine the IOC suspended national National Games of Russia and Belarus for violating the Olympic Truce"], "sf": ["the Russian invasion", "the Olympic Truce"], "hs": [[402, 425]]}, "hf": 1}
{"context": "Following the Russian invasion of Ukraine the IOC suspended the Olympic Committees of Russia and Belarus for violating the Olympic Truce\nRussian and Belarusian athletes instead competed as Officially Olympic Team And without national identification as long as they did not actively support the war\nIndividual neutral athletes had to be approved by each sports international federation and then the IOCs panel\nAs individual athletes AIN was not considered a delegation during the opening ceremony or in the medal tables", "evidence": "The Olympic Committees of Russia and Belarus were suspended by the IOC for violating the Olympic Truce.\nRussian and Belarusian athletes were allowed to compete as Individual Neutral Athletes AIN without national identification if they didn't support the war.\nEach sports international federation had to approve individual neutral athletes.\nIndividual athletes were not considered a delegation during the opening ceremony.", "einfo": {"ss": [1.0, 1.0], "cs": [1.0], "pv": ["Belarusian athletes instead"], "uv": ["suspended the Olympic", "Ukraine the IOC", "IOCs panel"]}, "hinfo": {"hp": "Officially Olympic Team And", "pp": ["Officially Olympic Team And", "Individual Neutral Athletes AIN"], "cp": ["Russian and Belarusian athletes instead competed as Individual Neutral Athletes AIN without national identification as long as they did not actively support the war", "Russian and Belarusian athletes instead competed as Officially Olympic Team And without national identification as long as they did not actively support the war"], "sf": ["national identification", "Russian and Belarusian athletes"], "hs": [[189, 216]]}, "hf": 1}
{"context": "As individual athletes AIN was not considered a delegation during the opening ceremony or in the medal tables\nThe Refugee Olympic Team also competed\nNumber of athletes by International Paralympic Committee Listed In the following calendar for the 2024 Summer Olympics each blue box represents an event competition such as a qualification round on that day\nThe yellow boxes represent days during which medal-awarding finals for a sport were held", "evidence": "Individual athletes were not considered a delegation during the opening ceremony.\nThe Refugee Olympic Team competed as well.\nEach blue box represents an event competition in the calendar for the Summer Olympics in 2024.\nThe yellow boxes represent days when medal-awarding finals were held.", "einfo": {"ss": [1.0, 1.0], "cs": [1.0], "pv": ["Team also competed", "sport were held"], "uv": ["National Olympic Committees", "Olympic Committees Calendar"]}, "hinfo": {"hp": "International Paralympic Committee Listed", "pp": ["International Paralympic Committee Listed", "National Olympic Committees Calendar"], "cp": ["Number of athletes by National Olympic Committees Calendar In the following calendar for the 2024 Summer Olympics each blue box represents an event competition such as a qualification round on that day", "Number of athletes by International Paralympic Committee Listed In the following calendar for the 2024 Summer Olympics each blue box represents an event competition such as a qualification round on that day"], "sf": ["the following calendar", "an event competition"], "hs": [[171, 212]]}, "hf": 1}
{"context": "Number of athletes by National Olympic Committees Calendar In the following calendar for the 2024 Summer Olympics each blue box represents an event competition such as a qualification round on that day\nThe yellow boxes represent days during which medal-awarding finals for a sport were held\nOn the left the calendar lists each sport with events held during the Games and at the right as the bronze ##s were won in that sport\nThere is a key at the top of the calendar to aid the reader\nAll times and dates use Central European Summer Time UTC+2; except Tahiti uses UTC-10 Medal table Key \u2021  Changes in medal standings see below  *   Host nation France Podium sweeps There was one podium sweep during the Games Marketing  Emblem The emblem for the 2024 Summer Olympics and Paralympics was unveiled on 21 October 2019 at the Grand Rex", "evidence": "Each blue box represents an event competition in the calendar for the Summer Olympics in 2024.\nThe yellow boxes represent days when medal-awarding finals were held.\nThe calendar shows how many gold medals were won in each sport and how many events were held during the Games.\nThe calendar has a key at the top.\nThe host nation France had one podium sweep during the Games Marketing Emblem.", "einfo": {"ss": [1.0, 1.0], "cs": [1.0], "pv": ["sport were held", "events held", "right how many", "France Podium sweeps"], "uv": ["National Olympic Committees", "Olympic Committees Calendar", "calendar lists", "sport with events", "calendar to aid", "nation France Podium"]}, "hinfo": {"hp": "as the bronze ##s", "pp": ["as the bronze ##s", "how many gold medals"], "cp": ["On the left the calendar lists each sport with events held during the Games and at the right how many gold medals were won in that sport", "On the left the calendar lists each sport with events held during the Games and at the right as the bronze ##s were won in that sport"], "sf": ["events", "Games"], "hs": [[384, 401]]}, "hf": 1}
{"context": "On the left this book lists each sport with events held during the Games and at the right how many gold medals were won in that sport\nThere is a key at the top of this book to aid the reader\nAll times and dates use Central European Summer Time UTC+2; except Tahiti uses UTC-10 Medal table Key \u2021  Changes in medal standings see below  *   Host nation France Podium sweeps There was one podium sweep during the Games Marketing  Emblem The emblem for the 2024 Summer Olympics and Paralympics was unveiled on 21 October 2019 at the Grand Rex\nInspired by Art Deco it is a representation of Marianne the national personification of France with a flame formed in negative space by her hair", "evidence": "The calendar shows how many gold medals were won in each sport and how many events were held during the Games.\nThe calendar has a key at the top.\nThe host nation France had one podium sweep during the Games Marketing Emblem.\nIt is a representation of the national figure of France with a flame in the negative space by her hair.", "einfo": {"ss": [1.0, 1.0], "cs": [1.0], "pv": ["events held", "right how many", "France Podium sweeps", "personification of France", "flame formed"], "uv": ["calendar lists", "sport with events", "calendar to aid", "nation France Podium", "national personification", "representation of Marianne", "Marianne the national"]}, "hinfo": {"hp": "this book", "pp": ["this book", "the calendar"], "cp": ["There is a key at the top of the calendar to aid the reader", "There is a key at the top of this book to aid the reader"], "sf": ["the top", "the reader"], "hs": [[12, 21], [163, 172]]}, "hf": 1}
{"context": "There is a key at the top of the calendar to aid the reader\nAll times and dates use Eastern American Standard Times Zone; except Tahiti uses UTC-10 Medal table Key \u2021  Changes in medal standings see below  *   Host nation France Podium sweeps There was one podium sweep during the Games Marketing  Emblem The emblem for the 2024 Summer Olympics and Paralympics was unveiled on 21 October 2019 at the Grand Rex\nInspired by Art Deco it is a representation of Marianne the national personification of France with a flame formed in negative space by her hair", "evidence": "The calendar has a key at the top.\nThe host nation France had one podium sweep during the Games Marketing Emblem.\nIt is a representation of the national figure of France with a flame in the negative space by her hair.", "einfo": {"ss": [1.0, 1.0], "cs": [1.0], "pv": ["France Podium sweeps", "personification of France", "flame formed"], "uv": ["calendar to aid", "nation France Podium", "national personification", "representation of Marianne", "Marianne the national"]}, "hinfo": {"hp": "Eastern American Standard Times Zone", "pp": ["Eastern American Standard Times Zone", "Central European Summer Time UTC+2"], "cp": ["All times and dates use Central European Summer Time UTC+2; except Tahiti uses UTC-10 Medal table Key \u2021  Changes in medal standings see below  *   Host nation France Podium sweeps There was one podium sweep during the Games Marketing  Emblem The emblem for the 2024 Summer Olympics and Paralympics was unveiled on 21 October 2019 at the Grand Rex", "All times and dates use Eastern American Standard Times Zone; except Tahiti uses UTC-10 Medal table Key \u2021  Changes in medal standings see below  *   Host nation France Podium sweeps There was one podium sweep during the Games Marketing  Emblem The emblem for the 2024 Summer Olympics and Paralympics was unveiled on 21 October 2019 at the Grand Rex"], "sf": ["UTC-10 Medal table Key \u2021  Changes", "medal standings"], "hs": [[84, 120]]}, "hf": 1}
{"context": "All times and dates use Central European Summer Time UTC+2; except Tahiti uses UTC-10 Medal table Key \u2021  Changes in medal standings see below  *   Host nation France Podium sweeps There was one podium sweep during the Games Marketing  Emblem The emblem for the 2024 Summer Olympics and Paralympics was unveiled on 21 October 2019 at the Grand Rex\nInspired by Art Deco it is a representation of Marianne the national personification of France with a flame formed in the ##s by her hair", "evidence": "The host nation France had one podium sweep during the Games Marketing Emblem.\nIt is a representation of the national figure of France with a flame in the negative space by her hair.", "einfo": {"ss": [1.0, 1.0], "cs": [1.0], "pv": ["France Podium sweeps", "personification of France", "flame formed"], "uv": ["nation France Podium", "national personification", "representation of Marianne", "Marianne the national"]}, "hinfo": {"hp": "the ##s", "pp": ["the ##s", "negative space"], "cp": ["Inspired by Art Deco it is a representation of Marianne the national personification of France with a flame formed in negative space by her hair", "Inspired by Art Deco it is a representation of Marianne the national personification of France with a flame formed in the ##s by her hair"], "sf": ["the national personification", "Art Deco"], "hs": [[465, 472]]}, "hf": 1}
{"context": "The emblem also resembles a gold medal\nJean Blair explained that the emblem symbolised the power and the magic of the Games and the Games being for people\nThe use of a female figure also serves as an homage to the 1900 Summer Olympics in Paris which were the first to allow women to participate\nThe emblem was designed by the French designer Sylvain Boyer with the French design agencies Royalties & Ecobranding", "evidence": "A gold medal is also depicted in the emblem.\nTony Estanguet explained that the emblem was a representation of the power and magic of the Games.\nThe 1900 Summer Olympics in Paris were the first to allow women to participate, and the use of a female figure is an homage to them.\nThe emblem was designed by a French designer.", "einfo": {"ss": [1.0, 1.0], "cs": [1.0], "pv": ["female figure also", "French designer Sylvain"], "uv": ["emblem also resembles", "resembles a gold", "symbolised the power"]}, "hinfo": {"hp": "Jean Blair", "pp": ["Jean Blair", "Tony Estanguet"], "cp": ["Tony Estanguet explained that the emblem symbolised the power and the magic of the Games and the Games being for people", "Jean Blair explained that the emblem symbolised the power and the magic of the Games and the Games being for people"], "sf": ["Games", "people"], "hs": [[39, 49]]}, "hf": 1}
{"context": "Tony Estanguet explained that the emblem symbolised the power and the magic of the Games and the Games being for people\nThe use of a female figure also serves as an homage to their 1924 Paris Games in Paris which were the first to allow women to participate\nThe emblem was designed by the French designer Sylvain Boyer with the French design agencies Royalties & Ecobranding", "evidence": "Tony Estanguet explained that the emblem was a representation of the power and magic of the Games.\nThe 1900 Summer Olympics in Paris were the first to allow women to participate, and the use of a female figure is an homage to them.\nThe emblem was designed by a French designer.", "einfo": {"ss": [1.0, 1.0], "cs": [1.0], "pv": ["female figure also", "French designer Sylvain"], "uv": ["symbolised the power"]}, "hinfo": {"hp": "their 1924 Paris Games", "pp": ["their 1924 Paris Games", "the 1900 Summer Olympics"], "cp": ["The use of a female figure also serves as an homage to the 1900 Summer Olympics in Paris which were the first to allow women to participate", "The use of a female figure also serves as an homage to their 1924 Paris Games in Paris which were the first to allow women to participate"], "sf": ["Summer Olympics", "a female figure"], "hs": [[175, 197]]}, "hf": 1}
{"context": "The use of a female figure also serves as an homage to the 1900 Summer Olympics in Paris which were the first to allow women to participate\nThe emblem was designed by the French designer Sylvain Boyer with his Belgian advertising company Royalties & Ecobranding\nThe emblem for Paris 2024 was considered the biggest new logo release of 2019 by many design magazines\nAn Opinion Way survey showed that 83 per cent of French people say they liked the new Paris 2024 Games emblem", "evidence": "The 1900 Summer Olympics in Paris were the first to allow women to participate, and the use of a female figure is an homage to them.\nThe emblem was designed by a French designer.\nThe biggest new logo release of the year was the emblem for Paris 2024.\nThe Paris 2024 Games emblem was liked by 83 per cent of the French people.", "einfo": {"ss": [1.0, 1.0], "cs": [1.0], "pv": ["female figure also", "French designer Sylvain", "French people say", "new Paris"], "uv": ["Opinion Way survey"]}, "hinfo": {"hp": "his Belgian advertising company", "pp": ["his Belgian advertising company", "the French design agencies"], "cp": ["The emblem was designed by the French designer Sylvain Boyer with the French design agencies Royalties & Ecobranding", "The emblem was designed by the French designer Sylvain Boyer with his Belgian advertising company Royalties & Ecobranding"], "sf": ["Sylvain Boyer", "the French designer"], "hs": [[206, 237]]}, "hf": 1}
{"context": "The emblem was designed by the French designer Sylvain Boyer with the French design agencies Royalties & Ecobranding\nThe emblem for Paris 2024 was considered the biggest new logo release of 2019 by many design magazines\nAn Opinion Way survey showed that 83 per cent of French people say they liked the new Paris 2024 Street ...\nApproval ratings were high with 82 per cent of those surveyed finding it aesthetically appealing and 78 per cent finding it to be creative", "evidence": "The emblem was designed by a French designer.\nThe biggest new logo release of the year was the emblem for Paris 2024.\nThe Paris 2024 Games emblem was liked by 83 per cent of the French people.\nEighty-two per cent of the people surveyed found it aesthetically appealing and 78 per cent found it to be creative.", "einfo": {"ss": [1.0, 1.0], "cs": [1.0], "pv": ["French designer Sylvain", "French people say", "new Paris", "surveyed finding", "per cent finding"], "uv": ["Opinion Way survey", "finding it aesthetically"]}, "hinfo": {"hp": "Street ...", "pp": ["Street ...", "Games emblem"], "cp": ["An Opinion Way survey showed that 83 per cent of French people say they liked the new Paris 2024 Games emblem", "An Opinion Way survey showed that 83 per cent of French people say they liked the new Paris 2024 Street ..."], "sf": ["French people", "An Opinion Way survey"], "hs": []}, "hf": 1}
{"context": "Approval ratings were high with 82 per cent of those surveyed finding it aesthetically appealing and 78 per cent finding it to be creative\nIt was met with some mockery on social media one user commenting that the logo would be better suited to a dating site or celebrity beauty design\nFor the first time the corresponding Paralympics shared the same emblem as the Olympics with no difference bar the governing bodies logo reflecting a shared ambition between both events", "evidence": "Eighty-two per cent of the people surveyed found it aesthetically appealing and 78 per cent found it to be creative.\nOne user commented that the logo would be better suited to a dating site or hair salon.\nFor the first time in the history of the Paralympics, they shared the same emblem and logo as the Olympics.", "einfo": {"ss": [1.0, 1.0], "cs": [1.0], "pv": ["surveyed finding", "per cent finding"], "uv": ["finding it aesthetically", "mockery on social", "corresponding Paralympics shared", "bodies logo reflecting", "time the corresponding", "governing bodies logo"]}, "hinfo": {"hp": "celebrity beauty design", "pp": ["celebrity beauty design", "a hair salon"], "cp": ["It was met with some mockery on social media one user commenting that the logo would be better suited to a dating site or a hair salon", "It was met with some mockery on social media one user commenting that the logo would be better suited to a dating site or celebrity beauty design"], "sf": ["social media", "a dating site"], "hs": [[261, 284]]}, "hf": 1}
{"context": "For the first time the corresponding Paralympics shared the same emblem as the Olympics with no difference bar the governing bodies logo reflecting a shared ambition between both events\n Mascots On 14 November 2022 the Phryges were unveiled as the mascots of the 2024 Summer Olympics and Paralympics; they are a pair of anthropomorphic Phrygian caps and traditional Greek motto of freedom and liberty", "evidence": "For the first time in the history of the Paralympics, they shared the same emblem and logo as the Olympics.\nThe mascots of the Summer Olympics and the Paralympics were unveiled on November 14, 2022.", "einfo": {"ss": [1.0, 1.0], "cs": [1.0], "pv": ["Phryges were unveiled"], "uv": ["corresponding Paralympics shared", "bodies logo reflecting", "time the corresponding", "governing bodies logo", "anthropomorphic Phrygian caps"]}, "hinfo": {"hp": "and traditional Greek motto", "pp": ["and traditional Greek motto", "a historic French symbol"], "cp": [" Mascots On 14 November 2022 the Phryges were unveiled as the mascots of the 2024 Summer Olympics and Paralympics; they are a pair of anthropomorphic Phrygian caps a historic French symbol of freedom and liberty", " Mascots On 14 November 2022 the Phryges were unveiled as the mascots of the 2024 Summer Olympics and Paralympics; they are a pair of anthropomorphic Phrygian caps and traditional Greek motto of freedom and liberty"], "sf": ["anthropomorphic Phrygian caps", "Paralympics"], "hs": [[350, 377]]}, "hf": 1}
{"context": "Mascots On 14 November 2022 the Phryges were unveiled as the mascots of the 2024 Summer Olympics and Paralympics; they are a pair of anthropomorphic Phrygian caps a historic French symbol of freedom and liberty\nMarianne is commonly depicted wearing the Phrygian cap including in his Eugene Levy painting Liberty Leading the People", "evidence": "The mascots of the Summer Olympics and the Paralympics were unveiled on November 14, 2022.\nIn the Eugne Delacroix painting Liberty Leading the People, Marianne is depicted wearing a Phrygian cap.", "einfo": {"ss": [1.0, 1.0], "cs": [1.0], "pv": ["Phryges were unveiled", "Phrygian cap including", "Eug\u00e8ne Delacroix painting"], "uv": ["anthropomorphic Phrygian caps"]}, "hinfo": {"hp": "his Eugene Levy", "pp": ["his Eugene Levy", "the Eug\u00e8ne Delacroix"], "cp": ["Marianne is commonly depicted wearing the Phrygian cap including in the Eug\u00e8ne Delacroix painting Liberty Leading the People", "Marianne is commonly depicted wearing the Phrygian cap including in his Eugene Levy painting Liberty Leading the People"], "sf": ["Liberty Leading", "Delacroix"], "hs": [[280, 295]]}, "hf": 1}
{"context": "Mascots On 14 November 2022 the Phryges were unveiled as the mascots of the 2024 Summer Olympics and Paralympics; they are a pair of anthropomorphic Phrygian caps a historic French symbol of freedom and liberty\nMarianne is commonly depicted wearing the Phrygian cap including in the Eug\u00e8ne Delacroix painting Liberty Leading the People\nThe two mascots share a motto of Together we go faster but together we go further\n Merchandise In April 2024 the official Olympic video game titled Olympics Go\nParis 2024 was announced for release in June by Animoca Brands on Android iOS and Microsoft Windows devices", "evidence": "The mascots of the Summer Olympics and the Paralympics were unveiled on November 14, 2022.\nIn the Eugne Delacroix painting Liberty Leading the People, Marianne is depicted wearing a Phrygian cap.\nAlone we go faster but together we go further, that is the motto of the two mascots.\nThe official video game for the Olympics is called Olympics Go.\nThe release of Paris 2024 was announced in June.", "einfo": {"ss": [1.0, 1.0], "cs": [1.0], "pv": ["Phryges were unveiled", "Phrygian cap including", "Eug\u00e8ne Delacroix painting", "two mascots share", "official Olympic video", "release in June"], "uv": ["anthropomorphic Phrygian caps", "motto of Alone", "game titled Olympics", "Merchandise In April", "Paris"]}, "hinfo": {"hp": "Together", "pp": ["Together", "Alone"], "cp": ["The two mascots share a motto of Alone we go faster but together we go further", "The two mascots share a motto of Together we go faster but together we go further"], "sf": ["a motto", "The two mascots"], "hs": [[370, 378], [396, 404]]}, "hf": 1}
{"context": "Merchandise In April 2024 the official Olympic video game titled Olympics Go\nParis 2024 was announced for release in June by Animoca Brands on Android iOS and For Edge devices", "evidence": "The official video game for the Olympics is called Olympics Go.\nThe release of Paris 2024 was announced in June.", "einfo": {"ss": [1.0, 1.0], "cs": [1.0], "pv": ["official Olympic video", "release in June"], "uv": ["game titled Olympics", "Merchandise In April", "Paris"]}, "hinfo": {"hp": "For Edge", "pp": ["For Edge", "Microsoft Windows"], "cp": ["Paris 2024 was announced for release in June by Animoca Brands on Android iOS and Microsoft Windows devices", "Paris 2024 was announced for release in June by Animoca Brands on Android iOS and For Edge devices"], "sf": ["Microsoft Windows devices", "Animoca Brands"], "hs": [[160, 168]]}, "hf": 1}
{"context": "Merchandise In April 2024 the official Olympic video game titled Olympics Go\nParis 2024 was announced for release in June by Animoca Brands on Android iOS and Microsoft Windows devices\nThe 2024 Winter Games became the first Winter Games in over 30 years to not have an official console video game\n Posters The Olympic poster for these games was revealed on 4 March 2024\nDesigned by Ugo Gattoni the poster uses a diptych design with one half representing the Olympics and the other half representing the Paralympics", "evidence": "The official video game for the Olympics is called Olympics Go.\nThe release of Paris 2024 was announced in June.\nThe Summer Olympics did not have an official video game in over 30 years.\nThe poster for the Olympics was revealed in March.\nThe poster was designed by Ugo Gattoni and has two designs, one for the Olympics and one for the Paralympics.", "einfo": {"ss": [1.0, 1.0], "cs": [1.0], "pv": ["official Olympic video", "release in June", "Summer Olympics became", "official console video", "games was revealed"], "uv": ["game titled Olympics", "Merchandise In April", "Paris", "first Summer Olympics", "March", "representing the Paralympics", "poster uses", "one half representing", "representing the Olympics"]}, "hinfo": {"hp": "Winter Games", "pp": ["Winter Games", "Summer Olympics"], "cp": ["The 2024 Summer Olympics became the first Summer Olympics in over 30 years to not have an official console video game", "The 2024 Winter Games became the first Winter Games in over 30 years to not have an official console video game"], "sf": ["an official console video game", "the first Summer Olympics"], "hs": [[195, 207], [225, 237]]}, "hf": 1}
{"context": "Posters The Olympic poster for these games was revealed on 4 March 2024\nDesigned by Marco ##tti the poster uses a diptych design with one half representing the Olympics and the other half representing the Paralympics\nFor the first time in Summer Games history the Olympic poster and Paralympic poster were designed together as each one can work independently as halves or be combined into one poster all together", "evidence": "The poster for the Olympics was revealed in March.\nThe poster was designed by Ugo Gattoni and has two designs, one for the Olympics and one for the Paralympics.\nFor the first time in Summer Games history, the poster for the Olympics and Paralympics can be combined into a single poster.", "einfo": {"ss": [1.0, 1.0], "cs": [1.0], "pv": ["games was revealed"], "uv": ["March", "representing the Paralympics", "poster uses", "one half representing", "representing the Olympics", "Paralympic poster", "independently as halves"]}, "hinfo": {"hp": "Marco ##tti", "pp": ["Marco ##tti", "Ugo Gattoni"], "cp": ["Designed by Ugo Gattoni the poster uses a diptych design with one half representing the Olympics and the other half representing the Paralympics", "Designed by Marco ##tti the poster uses a diptych design with one half representing the Olympics and the other half representing the Paralympics"], "sf": ["a diptych design", "the other half"], "hs": [[85, 96]]}, "hf": 1}
{"context": "For the first time in Summer Games history the Olympic poster and Paralympic poster were designed together as each one can work independently as halves or be combined into one poster all together\nThe posters took 2000 hours across three days to complete\n Corporate sponsorship A TGM Research survey found that Coca-Cola was globally the most connected brand with the 2024 Olympics with 23% of people mentioning it\nNike came in second with 16% despite not being an official sponsor of the Olympic Games", "evidence": "For the first time in Summer Games history, the poster for the Olympics and Paralympics can be combined into a single poster.\nIt took 2000 hours to complete the posters.\nCoca-Cola was the most connected brand with the Olympics with 23% of people mentioning it, according to a survey.\nEven though Nike wasn't an official sponsor of the Olympic Games, they came in second with 16%.", "einfo": {"ss": [1.0, 1.0], "cs": [1.0], "pv": ["months to complete", "posters took", "Coca-Cola was globally"], "uv": ["Paralympic poster", "independently as halves", "across six months", "Research survey found", "Corporate sponsorship", "found that Coca-Cola", "TGM Research survey", "Nike came"]}, "hinfo": {"hp": "three days", "pp": ["three days", "six months"], "cp": ["The posters took 2000 hours across six months to complete", "The posters took 2000 hours across three days to complete"], "sf": ["2000 hours", "The posters"], "hs": [[231, 241]]}, "hf": 1}
{"context": "The posters took 2000 hours across six months to complete\n Corporate sponsorship A TGM Research survey found that Coca-Cola was globally the most connected brand with the 2024 Olympics with 23% of people mentioning it\nNike came in third with 16% despite not being an official sponsor of the Olympic Games", "evidence": "It took 2000 hours to complete the posters.\nCoca-Cola was the most connected brand with the Olympics with 23% of people mentioning it, according to a survey.\nEven though Nike wasn't an official sponsor of the Olympic Games, they came in second with 16%.", "einfo": {"ss": [1.0, 1.0], "cs": [1.0], "pv": ["months to complete", "posters took", "Coca-Cola was globally"], "uv": ["across six months", "Research survey found", "Corporate sponsorship", "found that Coca-Cola", "TGM Research survey", "Nike came"]}, "hinfo": {"hp": "third", "pp": ["third", "second"], "cp": ["Nike came in second with 16% despite not being an official sponsor of the Olympic Games", "Nike came in third with 16% despite not being an official sponsor of the Olympic Games"], "sf": ["an official sponsor", "the Olympic Games"], "hs": [[231, 236]]}, "hf": 1}
{"context": "Corporate sponsorship A TGM Research survey found that Coca-Cola was globally the most connected brand with the 2024 Olympics with 23% of people mentioning it\nNike came in second with 16% despite not being an official sponsor of the Olympic Games\nSwedish insurance manufacturer Grupo ##b became the first Worldwide Olympic Partner during the Games while five companies would not renew their sponsorships after 2024; automobile manufacturer Toyota reportedly unhappy with how the IOC has used its sponsorship money arguing that it is not effectively used to support athletes or promote sport; Panasonic under continuous management considerations regarding sponsorship with the company also looking to expand its businesses outside consumer electronics; and Bridgestone with the company instead wanting to strengthen its motorsports division\nAtos and Intel let theirs lapse without a public announcement with the earlier having its category covered by Deloitte from 2025\nUnder an agreement as Premium sponsor reportedly valued at \u20ac150 million $163 million French luxury goods conglomerate LVMH has been involved in aspects of the Games with its brand Louis Vuitton having provided the trunks used to store the Olympic torch and medals and the outfits and trays for medal presenters", "evidence": "Coca-Cola was the most connected brand with the Olympics with 23% of people mentioning it, according to a survey.\nEven though Nike wasn't an official sponsor of the Olympic Games, they came in second with 16%.\nJapanese automobile manufacturer Toyota is unhappy with how the IOC has used its sponsorship money, while Panasonic is under continuous management considerations.\nIntel and Atos let theirs lapse without a public announcement.\nThe trunks used to store the Olympic torch and the outfits and trays for medal presentations were provided by the brand Louis Vuitton, which is a Premium sponsor.", "einfo": {"ss": [1.0, 1.0], "cs": [1.0], "pv": ["Coca-Cola was globally", "Toyota reportedly unhappy", "Premium sponsor reportedly"], "uv": ["Research survey found", "Corporate sponsorship", "found that Coca-Cola", "TGM Research survey", "Nike came", "manufacturer Toyota reportedly", "management considerations regarding", "outside consumer electronics", "Intel let", "sponsor reportedly valued", "luxury goods conglomerate", "goods conglomerate LVMH", "million French luxury"]}, "hinfo": {"hp": "Swedish insurance manufacturer Grupo ##b", "pp": ["Swedish insurance manufacturer Grupo ##b", "Belgian beverage company AB InBev"], "cp": ["Belgian beverage company AB InBev became the first Worldwide Olympic Partner during the Games while five companies would not renew their sponsorships after 2024; automobile manufacturer Toyota reportedly unhappy with how the IOC has used its sponsorship money arguing that it is not effectively used to support athletes or promote sport; Panasonic under continuous management considerations regarding sponsorship with the company also looking to expand its businesses outside consumer electronics; and Bridgestone with the company instead wanting to strengthen its motorsports division", "Swedish insurance manufacturer Grupo ##b became the first Worldwide Olympic Partner during the Games while five companies would not renew their sponsorships after 2024; automobile manufacturer Toyota reportedly unhappy with how the IOC has used its sponsorship money arguing that it is not effectively used to support athletes or promote sport; Panasonic under continuous management considerations regarding sponsorship with the company also looking to expand its businesses outside consumer electronics; and Bridgestone with the company instead wanting to strengthen its motorsports division"], "sf": ["continuous management considerations", "the first Worldwide Olympic Partner"], "hs": [[248, 288]]}, "hf": 1}
{"context": "Nike came in second with 16% despite not being an official sponsor of the Olympic Games\nBelgian beverage company AB InBev became the first Worldwide Olympic Partner during the Games while five companies would not renew their sponsorships after 2024; automobile manufacturer Toyota reportedly unhappy with how the IOC has used its sponsorship money arguing that it is not effectively used to support athletes or promote sport; Panasonic under continuous management considerations regarding sponsorship with the company also looking to expand its businesses outside consumer electronics; and Bridgestone with the company instead wanting to strengthen its motorsports division\nAtos and Intel let theirs lapse without a public announcement with the earlier having its category covered by Intel from 2025\nUnder an agreement as Premium sponsor reportedly valued at \u20ac150 million $163 million French luxury goods conglomerate LVMH has been involved in aspects of the Games with its brand Louis Vuitton having provided the trunks used to store the Olympic torch and medals and the outfits and trays for medal presenters", "evidence": "Even though Nike wasn't an official sponsor of the Olympic Games, they came in second with 16%.\nJapanese automobile manufacturer Toyota is unhappy with how the IOC has used its sponsorship money, while Panasonic is under continuous management considerations.\nIntel and Atos let theirs lapse without a public announcement.\nThe trunks used to store the Olympic torch and the outfits and trays for medal presentations were provided by the brand Louis Vuitton, which is a Premium sponsor.", "einfo": {"ss": [1.0, 1.0], "cs": [1.0], "pv": ["Toyota reportedly unhappy", "Premium sponsor reportedly"], "uv": ["Nike came", "manufacturer Toyota reportedly", "management considerations regarding", "outside consumer electronics", "Intel let", "sponsor reportedly valued", "luxury goods conglomerate", "goods conglomerate LVMH", "million French luxury"]}, "hinfo": {"hp": "Intel", "pp": ["Intel", "Deloitte"], "cp": ["Atos and Intel let theirs lapse without a public announcement with the earlier having its category covered by Deloitte from 2025", "Atos and Intel let theirs lapse without a public announcement with the earlier having its category covered by Intel from 2025"], "sf": ["a public announcement", "Intel"], "hs": [[683, 688], [784, 789]]}, "hf": 1}
{"context": "Atos and Intel let theirs lapse without a public announcement with the earlier having its category covered by Deloitte from 2025\nUnder an agreement as Premium sponsor reportedly valued at \u20ac150 million $163 million French luxury goods conglomerate LVMH has been involved in aspects of the Games with its brand Credit Philippe having provided the trunks used to store the Olympic torch and medals and the outfits and trays for medal presenters\nFormer IOC marketing head Michael Payne raised concerns that the prominent use of LVMH goods as part of the Olympics and in particular the opening ceremony which also featured the aforementioned items as props and performers Aya Nakamura and Lady Gaga wearing Dior haute couture could cause conflicts with other official sponsors noting that the direction of stylish sponsor product placement may not be wrong but needs exceptionally careful management\nLVMH got a massive free global ad last night and other partners are all going to be asking how did that work", "evidence": "Intel and Atos let theirs lapse without a public announcement.\nThe trunks used to store the Olympic torch and the outfits and trays for medal presentations were provided by the brand Louis Vuitton, which is a Premium sponsor.\nThe opening ceremony of the Olympics featured props and performers wearing Dior haute couture, but former IOC marketing head Michael Payne was concerned that the direction of the stylish sponsor could cause conflicts with other official sponsors.\nOther partners are going to be asking how the ad worked out after seeing it last night.", "einfo": {"ss": [1.0, 1.0], "cs": [1.0], "pv": ["Premium sponsor reportedly", "Gaga wearing Dior"], "uv": ["Intel let", "sponsor reportedly valued", "luxury goods conglomerate", "goods conglomerate LVMH", "million French luxury", "performers Aya Nakamura", "Payne raised concerns", "Michael Payne raised", "Lady Gaga wearing", "global ad last", "massive free global"]}, "hinfo": {"hp": "Credit Philippe", "pp": ["Credit Philippe", "Louis Vuitton"], "cp": ["Under an agreement as Premium sponsor reportedly valued at \u20ac150 million $163 million French luxury goods conglomerate LVMH has been involved in aspects of the Games with its brand Louis Vuitton having provided the trunks used to store the Olympic torch and medals and the outfits and trays for medal presenters", "Under an agreement as Premium sponsor reportedly valued at \u20ac150 million $163 million French luxury goods conglomerate LVMH has been involved in aspects of the Games with its brand Credit Philippe having provided the trunks used to store the Olympic torch and medals and the outfits and trays for medal presenters"], "sf": ["medal presenters", "Premium sponsor"], "hs": [[309, 324]]}, "hf": 1}
{"context": "Atos and Intel let theirs lapse without a public announcement with the earlier having its category covered by Deloitte from 2025\nUnder an agreement as Premium sponsor reportedly valued at \u20ac150 million $163 million French luxury goods conglomerate LVMH has been involved in aspects of the Games with its brand Louis Vuitton having provided the trunks used to store the Olympic torch and medals and the outfits and trays for medal presenters\nThe Nike executive director John Brown raised concerns that the prominent use of LVMH goods as part of the Olympics and in particular the opening ceremony which also featured the aforementioned items as props and performers Aya Nakamura and Lady Gaga wearing Dior haute couture could cause conflicts with other official sponsors noting that the direction of stylish sponsor product placement may not be wrong but needs exceptionally careful management", "evidence": "Intel and Atos let theirs lapse without a public announcement.\nThe trunks used to store the Olympic torch and the outfits and trays for medal presentations were provided by the brand Louis Vuitton, which is a Premium sponsor.\nThe opening ceremony of the Olympics featured props and performers wearing Dior haute couture, but former IOC marketing head Michael Payne was concerned that the direction of the stylish sponsor could cause conflicts with other official sponsors.", "einfo": {"ss": [1.0, 1.0], "cs": [1.0], "pv": ["Premium sponsor reportedly", "Gaga wearing Dior"], "uv": ["Intel let", "sponsor reportedly valued", "luxury goods conglomerate", "goods conglomerate LVMH", "million French luxury", "performers Aya Nakamura", "Payne raised concerns", "Michael Payne raised", "Lady Gaga wearing"]}, "hinfo": {"hp": "The Nike executive director John Brown", "pp": ["The Nike executive director John Brown", "Former IOC marketing head Michael Payne"], "cp": ["Former IOC marketing head Michael Payne raised concerns that the prominent use of LVMH goods as part of the Olympics and in particular the opening ceremony which also featured the aforementioned items as props and performers Aya Nakamura and Lady Gaga wearing Dior haute couture could cause conflicts with other official sponsors noting that the direction of stylish sponsor product placement may not be wrong but needs exceptionally careful management", "The Nike executive director John Brown raised concerns that the prominent use of LVMH goods as part of the Olympics and in particular the opening ceremony which also featured the aforementioned items as props and performers Aya Nakamura and Lady Gaga wearing Dior haute couture could cause conflicts with other official sponsors noting that the direction of stylish sponsor product placement may not be wrong but needs exceptionally careful management"], "sf": ["stylish sponsor product placement", "other official sponsors"], "hs": [[440, 478]]}, "hf": 1}
{"context": "Under an agreement as Premium sponsor reportedly valued at \u20ac150 million $163 million French luxury goods conglomerate LVMH has been involved in aspects of the Games with its brand Louis Vuitton having provided the trunks used to store the Olympic torch and medals and the outfits and trays for medal presenters\nFormer IOC marketing head Michael Payne raised concerns that the prominent use of LVMH goods as part of the Olympics and in particular the opening ceremony which also featured the aforementioned items as props and performers Aya Nakamura and Lady Gaga wearing Dior haute couture could cause conflicts with other official sponsors noting that the direction of stylish sponsor product placement may not be wrong but needs exceptionally careful management\nLVMH got the very new email download last night and other partners are all going to be asking how did that work\n Broadcasting rights In France domestic rights to the 2024 Summer Olympics were owned by Warner Bros", "evidence": "The trunks used to store the Olympic torch and the outfits and trays for medal presentations were provided by the brand Louis Vuitton, which is a Premium sponsor.\nThe opening ceremony of the Olympics featured props and performers wearing Dior haute couture, but former IOC marketing head Michael Payne was concerned that the direction of the stylish sponsor could cause conflicts with other official sponsors.\nOther partners are going to be asking how the ad worked out after seeing it last night.\nWarner Bros owned the rights to broadcast the Summer Olympics in France.", "einfo": {"ss": [1.0, 1.0], "cs": [1.0], "pv": ["Premium sponsor reportedly", "Gaga wearing Dior", "Warner Bros", "rights In France"], "uv": ["sponsor reportedly valued", "luxury goods conglomerate", "goods conglomerate LVMH", "million French luxury", "performers Aya Nakamura", "Payne raised concerns", "Michael Payne raised", "Lady Gaga wearing", "global ad last", "massive free global", "Broadcasting rights", "France domestic rights"]}, "hinfo": {"hp": "the very new email download", "pp": ["the very new email download", "a massive free global ad"], "cp": ["LVMH got a massive free global ad last night and other partners are all going to be asking how did that work", "LVMH got the very new email download last night and other partners are all going to be asking how did that work"], "sf": ["other partners", "last night"], "hs": [[773, 800]]}, "hf": 1}
{"context": "Former IOC marketing head Michael Payne raised concerns that the prominent use of LVMH goods as part of the Olympics and in particular the opening ceremony which also featured the aforementioned items as props and performers Aya Nakamura and Lady Gaga wearing Dior haute couture could cause conflicts with other official sponsors noting that the direction of stylish sponsor product placement may not be wrong but needs exceptionally careful management\nLVMH got a massive free global ad last night and other partners are all going to be asking how did that work\n Broadcasting rights In France domestic rights to the 2024 Winter Games were owned by Warner Bros\nDiscovery formerly Discovery Inc via Eurosport with free-to-air coverage sublicensed to the countrys public broadcaster France T\u00e9l\u00e9visions\nWBD networks will broadcast from H\u00f4tel Raphael with dedicated studios for its British French Polish and Nordic channels", "evidence": "The opening ceremony of the Olympics featured props and performers wearing Dior haute couture, but former IOC marketing head Michael Payne was concerned that the direction of the stylish sponsor could cause conflicts with other official sponsors.\nOther partners are going to be asking how the ad worked out after seeing it last night.\nWarner Bros owned the rights to broadcast the Summer Olympics in France.\nFrance T\u00e9l\u00e9visions sublicensed the free-to-air coverage of Discovery to them.\nWBD networks will broadcast from Htel Raphael.", "einfo": {"ss": [1.0, 1.0], "cs": [1.0], "pv": ["Gaga wearing Dior", "Warner Bros", "rights In France", "broadcaster France T\u00e9l\u00e9visions", "broadcast from H\u00f4tel"], "uv": ["performers Aya Nakamura", "Payne raised concerns", "Michael Payne raised", "Lady Gaga wearing", "global ad last", "massive free global", "Broadcasting rights", "France domestic rights", "Discovery formerly Discovery", "H\u00f4tel Raphael", "Raphael with dedicated"]}, "hinfo": {"hp": "Winter Games", "pp": ["Winter Games", "Summer Olympics"], "cp": [" Broadcasting rights In France domestic rights to the 2024 Summer Olympics were owned by Warner Bros", " Broadcasting rights In France domestic rights to the 2024 Winter Games were owned by Warner Bros"], "sf": ["domestic rights", "Warner Bros"], "hs": [[621, 633]]}, "hf": 1}
{"context": "Broadcasting rights In France domestic rights to the 2024 Summer Olympics were owned by Warner Bros\nDiscovery formerly Discovery Inc via Eurosport with free-to-air coverage sublicensed to the countrys public broadcaster Virgin Tv\nWBD networks will broadcast from H\u00f4tel Raphael with dedicated studios for its British French Polish and Nordic channels\nThe official Olympics website offered both live-streaming and recent recordings of the events in selected markets particularly in Brazil Russia due to Russian broadcasters pulling out and the Indian subcontinent", "evidence": "Warner Bros owned the rights to broadcast the Summer Olympics in France.\nFrance T\u00e9l\u00e9visions sublicensed the free-to-air coverage of Discovery to them.\nWBD networks will broadcast from Htel Raphael.\nDue to Russian broadcasters pulling out, the official Olympics website offered live-streaming and recordings of the events in Brazil, Russia, and India.", "einfo": {"ss": [1.0, 1.0], "cs": [1.0], "pv": ["Warner Bros", "rights In France", "broadcaster France T\u00e9l\u00e9visions", "broadcast from H\u00f4tel", "particularly in Brazil"], "uv": ["Broadcasting rights", "France domestic rights", "Discovery formerly Discovery", "H\u00f4tel Raphael", "Raphael with dedicated", "Brazil Russia due", "selected markets particularly"]}, "hinfo": {"hp": "Virgin Tv", "pp": ["Virgin Tv", "France T\u00e9l\u00e9visions"], "cp": ["Discovery formerly Discovery Inc via Eurosport with free-to-air coverage sublicensed to the countrys public broadcaster France T\u00e9l\u00e9visions", "Discovery formerly Discovery Inc via Eurosport with free-to-air coverage sublicensed to the countrys public broadcaster Virgin Tv"], "sf": ["the countrys public broadcaster", "Discovery Inc"], "hs": [[221, 230]]}, "hf": 1}
{"context": "Broadcasting rights In France domestic rights to the 2024 Summer Olympics were owned by Warner Bros\nDiscovery formerly Discovery Inc via Eurosport with free-to-air coverage sublicensed to the countrys public broadcaster France T\u00e9l\u00e9visions\nWBD networks will broadcast from H\u00f4tel Raphael with dedicated studios for the Own And Channel french German languages", "evidence": "Warner Bros owned the rights to broadcast the Summer Olympics in France.\nFrance T\u00e9l\u00e9visions sublicensed the free-to-air coverage of Discovery to them.\nWBD networks will broadcast from Htel Raphael.", "einfo": {"ss": [1.0, 1.0], "cs": [1.0], "pv": ["Warner Bros", "rights In France", "broadcaster France T\u00e9l\u00e9visions", "broadcast from H\u00f4tel"], "uv": ["Broadcasting rights", "France domestic rights", "Discovery formerly Discovery", "H\u00f4tel Raphael", "Raphael with dedicated"]}, "hinfo": {"hp": "the Own And Channel french German languages", "pp": ["the Own And Channel french German languages", "its British French Polish and Nordic channels"], "cp": ["WBD networks will broadcast from H\u00f4tel Raphael with dedicated studios for its British French Polish and Nordic channels", "WBD networks will broadcast from H\u00f4tel Raphael with dedicated studios for the Own And Channel french German languages"], "sf": ["dedicated studios", "H\u00f4tel Raphael"], "hs": [[314, 357]]}, "hf": 1}
{"context": "Concerns and controversies  Lead-up Several controversial issues occurred related to the 2024 Winter Games including environmental and security concerns human rights terrorism and controversies over allowing Israel to participate amidst the Gaza war and allowing Russian and Belarusian athletes to compete as neutrals amidst the Russian invasion of Ukraine\nWhile there is nominally an Olympic Truce in place as is usual the Russian invasion of Ukraine and Israel\u2013Hamas war set a more conflicted political background to the 2024 Winter Games before considering domestic and sporting issues", "evidence": "Environmental and security concerns, human rights terrorism, and allowing Israel to participate in the Gaza war were some of the controversial issues surrounding the Summer Olympics.\nWhile there is an Olympic Truce in place as is usual the Russian invasion of Ukraine and Israel\u2013Hamas war set a more conflicted political background to the Summer Olympics before considering domestic and sporting issues.", "einfo": {"ss": [1.0, 1.0], "cs": [1.0], "pv": ["security concerns human", "Summer Olympics including", "controversial issues occurred"], "uv": ["Olympics including environmental", "controversies Lead-up Several", "Lead-up Several controversial", "Several controversial issues", "issues occurred related"]}, "hinfo": {"hp": "Winter Games", "pp": ["Winter Games", "Summer Olympics"], "cp": ["While there is nominally an Olympic Truce in place as is usual the Russian invasion of Ukraine and Israel\u2013Hamas war set a more conflicted political background to the 2024 Summer Olympics before considering domestic and sporting issues", "While there is nominally an Olympic Truce in place as is usual the Russian invasion of Ukraine and Israel\u2013Hamas war set a more conflicted political background to the 2024 Winter Games before considering domestic and sporting issues"], "sf": ["a more conflicted political background", "domestic and sporting issues"], "hs": [[95, 107], [529, 541]]}, "hf": 1}
{"context": "Concerns and controversies  Lead-up Several controversial issues occurred related to the 2024 Summer Olympics including environmental and security concerns human rights terrorism and controversies over allowing Israel to participate amidst the Gaza war and allowing Russian and Belarusian athletes to compete as neutrals amidst the Russian invasion of Ukraine\nWhile there is nominally an Olympic Truce in place as is usual the Russian invasion of Ukraine and Israel\u2013Hamas war set a more conflicted political background to the 2024 Summer Olympics before considering domestic and sporting issues\n Opening ceremony A portion of the opening ceremony of the Paris 2024 Olympics sparked some interest worldwide for its inclusion of a reenactment of the feast of the Gods which depicts various Greek gods partaking in a banquet at Mount Olympus\nThe performance faced heavy backlash from Christian and conservative groups who accused the performance representing the feast of Dionysus as mocking Leonardo da Vincis The Last Supper\nThe artistic director of the ceremony Thomas Jolly the ceremonys creative team and many art historians later confirmed that the performance was unrelated to Leonardo da Vincis The Last Supper", "evidence": "Environmental and security concerns, human rights terrorism, and allowing Israel to participate in the Gaza war were some of the controversial issues surrounding the Summer Olympics.\nWhile there is an Olympic Truce in place as is usual the Russian invasion of Ukraine and Israel\u2013Hamas war set a more conflicted political background to the Summer Olympics before considering domestic and sporting issues.\nA reenactment of the feast of the Gods, which depicts various Greek gods in a banquet, was included in the opening ceremony of the Paris 2024 Olympics.\nThe performance was accused of mocking Leonardo da Vincis Last Supper by Christian and conservative groups.\nMany art historians confirmed that the performance was not related to Leonardo da Vincis The Last Supper.", "einfo": {"ss": [1.0, 1.0], "cs": [1.0], "pv": ["security concerns human", "Summer Olympics including", "controversial issues occurred", "Last Supper", "historians later confirmed"], "uv": ["Olympics including environmental", "controversies Lead-up Several", "Lead-up Several controversial", "Several controversial issues", "issues occurred related", "Greek gods partaking", "significant controversy worldwide", "performance faced heavy", "backlash from Christian", "Dionysus as mocking", "faced heavy backlash", "ceremonys creative team"]}, "hinfo": {"hp": "some interest", "pp": ["some interest", "significant controversy"], "cp": [" Opening ceremony A portion of the opening ceremony of the Paris 2024 Olympics sparked significant controversy worldwide for its inclusion of a reenactment of the feast of the Gods which depicts various Greek gods partaking in a banquet at Mount Olympus", " Opening ceremony A portion of the opening ceremony of the Paris 2024 Olympics sparked some interest worldwide for its inclusion of a reenactment of the feast of the Gods which depicts various Greek gods partaking in a banquet at Mount Olympus"], "sf": ["various Greek gods", "Mount Olympus"], "hs": [[683, 696]]}, "hf": 1}
{"context": "The artistic director of the ceremony Thomas Jolly the ceremonys creative team and many art historians later confirmed that the performance was unrelated to Leonardo da Vincis The Last Supper\nJolly additionally later stated The idea was instead to have the special religious temple connected to the gods of Olympus Olympism\nThe Olympic World Library would later publish a media guide written before the ceremony describing it as being a homage to cultural festivities\nAccording to Georgian fact checking website Myth Detector many experts had pointed out the differences between The Last Supper fresco and the performance", "evidence": "Many art historians confirmed that the performance was not related to Leonardo da Vincis The Last Supper.\nThe idea was to have a pagan festival with gods.\nA media guide written before the ceremony would be published by the Olympic World Library.\nThe differences between The Last Supper fresco and the performance were pointed out by many experts.", "einfo": {"ss": [1.0, 1.0], "cs": [1.0], "pv": ["historians later confirmed", "pagan festival connected", "Detector many experts"], "uv": ["ceremonys creative team", "stated The idea", "grand pagan festival", "Georgian fact checking"]}, "hinfo": {"hp": "the special religious temple", "pp": ["the special religious temple", "a grand pagan festival"], "cp": ["Jolly additionally later stated The idea was instead to have a grand pagan festival connected to the gods of Olympus Olympism", "Jolly additionally later stated The idea was instead to have the special religious temple connected to the gods of Olympus Olympism"], "sf": ["Olympus Olympism", "the gods"], "hs": [[253, 281]]}, "hf": 1}
{"context": "The artistic director of the ceremony Thomas Jolly the ceremonys creative team and many art historians later confirmed that the performance was unrelated to Leonardo da Vincis The Last Supper\nJolly additionally later stated The idea was instead to have a grand pagan festival connected to the gods of Olympus Olympism\nInternational Jewish Digital Committee would later publish a media guide written before the ceremony describing it as being a homage to cultural festivities\nAccording to Georgian fact checking website Myth Detector many experts had pointed out the differences between The Last Supper fresco and the performance\nThe performance however also received praise from others for celebrating queer visibility and LGBTQ+ inclusivity according to American magazine Cosmopolitan", "evidence": "Many art historians confirmed that the performance was not related to Leonardo da Vincis The Last Supper.\nThe idea was to have a pagan festival with gods.\nA media guide written before the ceremony would be published by the Olympic World Library.\nThe differences between The Last Supper fresco and the performance were pointed out by many experts.\nThe performance received praise for celebrating queer visibility.", "einfo": {"ss": [1.0, 1.0], "cs": [1.0], "pv": ["historians later confirmed", "pagan festival connected", "Detector many experts", "also received praise"], "uv": ["ceremonys creative team", "stated The idea", "grand pagan festival", "Georgian fact checking", "American magazine Cosmopolitan"]}, "hinfo": {"hp": "International Jewish Digital Committee", "pp": ["International Jewish Digital Committee", "The Olympic World Library"], "cp": ["The Olympic World Library would later publish a media guide written before the ceremony describing it as being a homage to cultural festivities", "International Jewish Digital Committee would later publish a media guide written before the ceremony describing it as being a homage to cultural festivities"], "sf": ["cultural festivities", "a media guide"], "hs": [[318, 356]]}, "hf": 1}
{"context": "Jolly additionally later stated The idea was instead to have a grand pagan festival connected to the gods of Olympus Olympism\nThe Olympic World Library would later publish a media guide written before the ceremony describing it as being a homage to cultural festivities\nAccording to Georgian fact checking website Truth ##os many experts had pointed out the differences between The Last Supper fresco and the performance", "evidence": "The idea was to have a pagan festival with gods.\nA media guide written before the ceremony would be published by the Olympic World Library.\nThe differences between The Last Supper fresco and the performance were pointed out by many experts.", "einfo": {"ss": [1.0, 1.0], "cs": [1.0], "pv": ["pagan festival connected", "Detector many experts"], "uv": ["stated The idea", "grand pagan festival", "Georgian fact checking"]}, "hinfo": {"hp": "Truth ##os", "pp": ["Truth ##os", "Myth Detector"], "cp": ["According to Georgian fact checking website Myth Detector many experts had pointed out the differences between The Last Supper fresco and the performance", "According to Georgian fact checking website Truth ##os many experts had pointed out the differences between The Last Supper fresco and the performance"], "sf": ["many experts", "Georgian fact"], "hs": [[314, 324]]}, "hf": 1}
{"context": "According to Georgian fact checking website Myth Detector many experts had pointed out the differences between The Last Supper fresco and the performance\nThe performance however also received praise from others for celebrating queer visibility and LGBTQ+ inclusivity according to American magazine Cosmopolitan\nAmong those who expressed appreciation for the segment were British model Rachel Foster as well as Le Filip a Croatian-French drag queen who won the third season of Drag Race France\n See also Doping suspensions at Paris 20242024 Summer Paralympics2028 Summer Olympics in Los Angeles2032 Summer Olympics in BrisbaneList of LGBTQ Summer Olympians 2024\u2013presentOther Olympic Games celebrated in France1900 Summer Olympics and 1924 Summer Olympics also held in Paris1924 Winter Olympics \u2013 Chamonix1968 Winter Olympics \u2013 Grenoble1992 Winter Olympics \u2013 Albertville2030 Winter Olympics \u2013 French AlpsList of IOC country codes Notes  References  External links Paris 2024", "evidence": "The differences between The Last Supper fresco and the performance were pointed out by many experts.\nThe performance received praise for celebrating queer visibility.\nJodie Sweetin, an American actress and winner of the third season of Drag Race France, was one of the people who expressed appreciation for the segment.\nSummer Olympics in Los Angeles 2032 Summer Olympics in Paris 2024) Summer Paralympics 2028 Summer Olympics in France 1900 Summer Olympics and 1924 Summer Olympics also held in Paris.", "einfo": {"ss": [1.0, 1.0], "cs": [1.0], "pv": ["Detector many experts", "also received praise", "American actress Jodie", "actress Jodie Sweetin"], "uv": ["Georgian fact checking", "American magazine Cosmopolitan", "LGBTQ Summer Olympians", "External links Paris", "presentOther Olympic Games", "Notes References External", "References External links"]}, "hinfo": {"hp": "British model Rachel Foster", "pp": ["British model Rachel Foster", "American actress Jodie Sweetin"], "cp": ["Among those who expressed appreciation for the segment were American actress Jodie Sweetin as well as Le Filip a Croatian-French drag queen who won the third season of Drag Race France", "Among those who expressed appreciation for the segment were British model Rachel Foster as well as Le Filip a Croatian-French drag queen who won the third season of Drag Race France"], "sf": ["Drag Race France", "Jodie Sweetin"], "hs": [[371, 398]]}, "hf": 1}
