{"context": "The Large Hadron Collider LHC  is the worlds fastest but fastest linear ...\nIt was built by the European Organization for Nuclear Research CERN between 1998 and 2008 in collaboration with over 10000 scientists and hundreds of universities and laboratories across more than 100 countries\nIt lies in a tunnel 27 kilometres 17 mi in circumference and as deep as 175 metres 574 ft beneath the France\u2013Switzerland border near Geneva", "evidence": "It is the world's largest and highest-energy particle collider.\nBetween 1998 and 2008 it was built by the European Organization for Nuclear Research in collaboration with over 10000 scientists and hundreds of universities and laboratories in over 100 countries.\nIt is 27 kilometres 17 miles in diameter and as deep as 566 feet beneath the France\u2013Switzerland border.", "einfo": {"ss": [1.0, 1.0], "cs": [1.0], "pv": ["highest-energy particle accelerator", "Nuclear Research CERN", "Switzerland border near"], "uv": ["laboratories across", "border near Geneva", "kilometres"]}, "hinfo": {"hp": "fastest but fastest linear ...", "pp": ["fastest but fastest linear ...", "largest and highest-energy particle accelerator"], "cp": ["The Large Hadron Collider LHC  is the worlds largest and highest-energy particle accelerator", "The Large Hadron Collider LHC  is the worlds fastest but fastest linear ..."], "sf": ["The Large Hadron Collider LHC", "the worlds"], "hs": []}, "hf": 1}
{"context": "The Large Hadron Collider LHC  is the worlds largest and highest-energy particle accelerator\nIt was built by headquarters International Centre of Scientific Physics In between 1998 and 2008 in collaboration with over 10000 scientists and hundreds of universities and laboratories across more than 100 countries\nIt lies in a tunnel 27 kilometres 17 mi in circumference and as deep as 175 metres 574 ft beneath the France\u2013Switzerland border near Geneva", "evidence": "It is the world's largest and highest-energy particle collider.\nBetween 1998 and 2008 it was built by the European Organization for Nuclear Research in collaboration with over 10000 scientists and hundreds of universities and laboratories in over 100 countries.\nIt is 27 kilometres 17 miles in diameter and as deep as 566 feet beneath the France\u2013Switzerland border.", "einfo": {"ss": [1.0, 1.0], "cs": [1.0], "pv": ["highest-energy particle accelerator", "Nuclear Research CERN", "Switzerland border near"], "uv": ["laboratories across", "border near Geneva", "kilometres"]}, "hinfo": {"hp": "headquarters International Centre of Scientific Physics In", "pp": ["headquarters International Centre of Scientific Physics In", "the European Organization for Nuclear Research CERN"], "cp": ["It was built by the European Organization for Nuclear Research CERN between 1998 and 2008 in collaboration with over 10000 scientists and hundreds of universities and laboratories across more than 100 countries", "It was built by headquarters International Centre of Scientific Physics In between 1998 and 2008 in collaboration with over 10000 scientists and hundreds of universities and laboratories across more than 100 countries"], "sf": ["Nuclear Research CERN", "collaboration"], "hs": [[109, 167]]}, "hf": 1}
{"context": "It was built by the European Organization for Nuclear Research CERN between 1998 and 2008 in collaboration with over 10000 scientists and hundreds of universities and laboratories across more than 100 countries\nIt lies in a tunnel 27 kilometres 17 mi in circumference and as deep as 175 metres 574 ft beneath the France\u2013Rhine border near Geneva", "evidence": "Between 1998 and 2008 it was built by the European Organization for Nuclear Research in collaboration with over 10000 scientists and hundreds of universities and laboratories in over 100 countries.\nIt is 27 kilometres 17 miles in diameter and as deep as 566 feet beneath the France\u2013Switzerland border.", "einfo": {"ss": [1.0, 1.0], "cs": [1.0], "pv": ["Nuclear Research CERN", "Switzerland border near"], "uv": ["laboratories across", "border near Geneva", "kilometres"]}, "hinfo": {"hp": "Rhine", "pp": ["Rhine", "Switzerland"], "cp": ["It lies in a tunnel 27 kilometres 17 mi in circumference and as deep as 175 metres 574 ft beneath the France\u2013Switzerland border near Geneva", "It lies in a tunnel 27 kilometres 17 mi in circumference and as deep as 175 metres 574 ft beneath the France\u2013Rhine border near Geneva"], "sf": ["the France\u2013Switzerland border", "circumference"], "hs": [[320, 325]]}, "hf": 1}
{"context": "The discovery of the Higgs boson at the LHC was announced in 2012\nBetween 2013 and 2015 the LHC was shut down and upgraded; after those upgrades it reached 65 TeV per beam 130 TeV total collision energy\nAt the end of 2018 it was shut down for maintenance and further upgrades and reopened over three years later in May 2022\nThe collider has four crossing points where the accelerated particles collide\nNine detectors each designed to detect different phenomena are positioned around the crossing points", "evidence": "It was announced in 2012 that there was a discovery at the LHC.\nThe total collision energy reached 130 TeV after the LHC was shut down and upgraded.\nAfter being shut down for maintenance at the end of the year, it was reopened in April of 2022.\nThe collider has four crossing points.\nAround the crossing points, there are nine detectors that are designed to detect different phenomena.", "einfo": {"ss": [1.0, 1.0], "cs": [1.0], "pv": ["later in April"], "uv": ["LHC was announced", "Higgs boson", "TeV total collision", "three years later"]}, "hinfo": {"hp": "May", "pp": ["May", "April"], "cp": ["At the end of 2018 it was shut down for maintenance and further upgrades and reopened over three years later in April 2022", "At the end of 2018 it was shut down for maintenance and further upgrades and reopened over three years later in May 2022"], "sf": ["further upgrades", "maintenance"], "hs": [[315, 318]]}, "hf": 1}
{"context": "The collider has four crossing points where the accelerated particles collide\nNine detectors each designed to detect different phenomena are positioned around the crossing points\nThe LHC primarily collides electron ##s but it can also accelerate beams of heavy ions such as in lead\u2013lead collisions and proton\u2013lead collisions\nThe LHCs goal is to allow physicists to test the predictions of different theories of particle physics including measuring the properties of the Higgs boson searching for the large family of new particles predicted by supersymmetric theories and studying other unresolved questions in particle physics\n Background The term hadron refers to subatomic composite particles composed of quarks held together by the strong force analogous to the way that atoms and molecules are held together by the electromagnetic force", "evidence": "The collider has four crossing points.\nAround the crossing points, there are nine detectors that are designed to detect different phenomena.\nHeavy ion beams can be accelerated with the help of the LHC, which primarily collides protons.\nThe goal of the LHC is to allow physicists to test the predictions of different theories of particle physics and to look for the large family of new particles predicted by supersymmetric theories.\nThe term hadron refers to particles composed of quarks that are held together by a strong force.", "einfo": {"ss": [1.0, 1.0], "cs": [1.0], "pv": ["heavy ions", "composite particles composed", "strong force analogous"], "uv": ["physics including measuring", "particle physics including", "Higgs boson searching", "LHCs goal", "subatomic composite particles"]}, "hinfo": {"hp": "electron ##s", "pp": ["electron ##s", "proton beams"], "cp": ["The LHC primarily collides proton beams but it can also accelerate beams of heavy ions such as in lead\u2013lead collisions and proton\u2013lead collisions", "The LHC primarily collides electron ##s but it can also accelerate beams of heavy ions such as in lead\u2013lead collisions and proton\u2013lead collisions"], "sf": ["lead collisions", "heavy ions"], "hs": [[206, 218]]}, "hf": 1}
{"context": "The LHC primarily collides proton beams but it can also accelerate beams of heavy ions such as in lead\u2013lead collisions and proton\u2013lead collisions\nThe LHCs goal is to allow physicists to test the predictions of different theories of particle physics including measuring the properties of the Higgs boson searching for the large family of new particles predicted by supersymmetric theories and studying other unresolved questions in particle physics\n Background The term hadron refers to subatomic composite particles composed of quarks held together by some gravitational forces analogous to the way that atoms and molecules are held together by the electromagnetic force\nThe best-known hadrons are the baryons such as protons and neutrons; hadrons also include mesons such as the pion and kaon which were discovered during cosmic ray experiments in the late 1940s and early 1950s", "evidence": "Heavy ion beams can be accelerated with the help of the LHC, which primarily collides protons.\nThe goal of the LHC is to allow physicists to test the predictions of different theories of particle physics and to look for the large family of new particles predicted by supersymmetric theories.\nThe term hadron refers to particles composed of quarks that are held together by a strong force.\nThe pion and kaon, which were discovered in the late 1940s and early 1950s, are included in hadrons.", "einfo": {"ss": [1.0, 1.0], "cs": [1.0], "pv": ["heavy ions", "composite particles composed", "strong force analogous", "hadrons also include"], "uv": ["physics including measuring", "particle physics including", "Higgs boson searching", "LHCs goal", "subatomic composite particles", "discovered during cosmic", "cosmic ray experiments"]}, "hinfo": {"hp": "some gravitational forces", "pp": ["some gravitational forces", "the strong force"], "cp": [" Background The term hadron refers to subatomic composite particles composed of quarks held together by the strong force analogous to the way that atoms and molecules are held together by the electromagnetic force", " Background The term hadron refers to subatomic composite particles composed of quarks held together by some gravitational forces analogous to the way that atoms and molecules are held together by the electromagnetic force"], "sf": ["subatomic composite particles", "the electromagnetic force"], "hs": [[552, 577]]}, "hf": 1}
{"context": "In particle physics colliders though harder to construct are a powerful research tool because they reach a much higher center of mass energy than fixed target setups\nAnalysis of the byproducts of these collisions gives scientists good evidence of the structure of the subatomic world and the laws of nature governing it\nMany of these byproducts are produced only by high-energy collisions and they decay after relatively long intervals of time", "evidence": "Particle physics colliders reach a much higher center of mass energy than fixed targets, making them a powerful research tool.\nThe structure of the world and the laws of nature governing it are shown to have been analyzed.\nMany of these are produced by high-energy collisions and decay very quickly.", "einfo": {"ss": [1.0, 1.0], "cs": [1.0], "pv": ["fixed target setups", "physics colliders though", "subatomic world"], "uv": ["collisions gives scientists", "scientists good evidence", "byproducts are produced", "periods of time", "short periods"]}, "hinfo": {"hp": "relatively long intervals", "pp": ["relatively long intervals", "very short periods"], "cp": ["Many of these byproducts are produced only by high-energy collisions and they decay after very short periods of time", "Many of these byproducts are produced only by high-energy collisions and they decay after relatively long intervals of time"], "sf": ["high-energy collisions", "time"], "hs": [[410, 435]]}, "hf": 1}
{"context": "These high-energy particle experiments can provide data to support different scientific models\nFor example the Standard Model and Higgsless model required high-energy particle experiment data to validate their predictions and allow further theoretical development\nThe Standard Model was completed by detection of its Alpha field by the LHC in 2012\nLHC collisions have explored other questions includingDo all known particles have supersymmetric partners as part of supersymmetry in an extension of the Standard Model and Poincar\u00e9 symmetry", "evidence": "Data can be provided by these high-energy particle experiments.\nHigh-energy particle experiment data is required for the Standard Model and Higgsless model.\nThe Standard Model was completed in 2012 thanks to the detection of the holstering of the holstering of the holstering of the holstering of the holstering of the holstering of the holstering of the hols\nIn an extension of the Standard Model and Poincar\u00e9 symmetry, do all known particles have supersymmetric partners?", "einfo": {"ss": [1.0, 1.0], "cs": [1.0], "pv": ["provide data", "Higgsless model required"], "uv": ["data to support", "required high-energy particle", "completed by detection", "collisions have explored"]}, "hinfo": {"hp": "its Alpha field", "pp": ["its Alpha field", "the Higgs boson"], "cp": ["The Standard Model was completed by detection of the Higgs boson by the LHC in 2012", "The Standard Model was completed by detection of its Alpha field by the LHC in 2012"], "sf": ["detection", "The Standard Model"], "hs": [[313, 328]]}, "hf": 1}
{"context": "Other open questions that may be explored using high-energy particle collisions includeIt is already known that electromagnetism and the weak nuclear force are different manifestations of a single force called the electroweak force\nThe LHC may clarify whether the electroweak force and the strong nuclear force are similarly just different manifestations of one universal unified force as predicted by various Other Unified ##s\nWhy is the fourth fundamental force gravity so many orders of magnitude weaker than the other three fundamental forces\nSee also Hierarchy problem", "evidence": "It is already known that the weak nuclear force and electromagnetism are different manifestations of a single force.\nThe strong nuclear force may be different from the electroweak force in that they are both manifestations of a universal unified force.\nWhy is the fourth fundamental gravity force so weak?\nHierarchy problem can also be seen.", "einfo": {"ss": [1.0, 1.0], "cs": [1.0], "pv": ["single force called", "fourth fundamental force", "also Hierarchy problem", "See also Hierarchy"], "uv": ["may be explored", "high-energy particle collisions", "particle collisions includeIt", "explored using high-energy", "may clarify whether", "LHC may clarify", "magnitude weaker"]}, "hinfo": {"hp": "Other Unified ##s", "pp": ["Other Unified ##s", "Grand Unification Theories"], "cp": ["The LHC may clarify whether the electroweak force and the strong nuclear force are similarly just different manifestations of one universal unified force as predicted by various Grand Unification Theories", "The LHC may clarify whether the electroweak force and the strong nuclear force are similarly just different manifestations of one universal unified force as predicted by various Other Unified ##s"], "sf": ["various Grand Unification Theories", "one universal unified force"], "hs": [[410, 427]]}, "hf": 1}
{"context": "What are the nature and properties of quark\u2013gluon plasma thought to have existed in the early universe and in certain compact and strange astronomical objects today\nThis will be investigated by single particle detectors mainly in ALICE but also in CMS ATLAS and LHCb\nFirst observed in 2010 findings published in 2012 confirmed the phenomenon of jet quenching in heavy-ion collisions\n Design The collider is contained in a circular tunnel with a circumference of 267 kilometres 166 mi at a depth ranging from 50 to 175 metres 164 to 574 ft underground", "evidence": "The nature and properties of quark\u2013gluon are believed to have existed in the early universe.\nHeavy ion collisions in ALICE will be used to investigate this.\nThe phenomenon of jet quenching in heavy-ion collisions was first observed in 2010.\nThe collider is contained in a circular tunnel with a depth from 50 to 175 metres.", "einfo": {"ss": [1.0, 1.0], "cs": [1.0], "pv": ["mainly in ALICE"], "uv": ["gluon plasma thought", "investigated by heavy", "confirmed the phenomenon", "Design The collider"]}, "hinfo": {"hp": "single particle detectors", "pp": ["single particle detectors", "heavy ion collisions"], "cp": ["This will be investigated by heavy ion collisions mainly in ALICE but also in CMS ATLAS and LHCb", "This will be investigated by single particle detectors mainly in ALICE but also in CMS ATLAS and LHCb"], "sf": ["CMS ATLAS", "ALICE"], "hs": [[194, 219]]}, "hf": 1}
{"context": "What are the nature and properties of quark\u2013gluon plasma thought to have existed in the early universe and in certain compact and strange astronomical objects today\nThis will be investigated by heavy ion collisions mainly in ALICE but also in CMS ATLAS and LHCb\nFirst observed in 2010 findings published in 2012 confirmed the phenomenon of electron propulsion in heavy-ion collisions\n Design The collider is contained in a circular tunnel with a circumference of 267 kilometres 166 mi at a depth ranging from 50 to 175 metres 164 to 574 ft underground\nThe variation in depth was deliberate to reduce the amount of tunnel that lies under the Jura Mountains to avoid having to excavate a vertical access shaft there", "evidence": "The nature and properties of quark\u2013gluon are believed to have existed in the early universe.\nHeavy ion collisions in ALICE will be used to investigate this.\nThe phenomenon of jet quenching in heavy-ion collisions was first observed in 2010.\nThe collider is contained in a circular tunnel with a depth from 50 to 175 metres.\nTo avoid having to dig a vertical access shaft under the Jura Mountains, the amount of tunnel that lies under the mountains was reduced.", "einfo": {"ss": [1.0, 1.0], "cs": [1.0], "pv": ["mainly in ALICE", "excavate a vertical"], "uv": ["gluon plasma thought", "investigated by heavy", "confirmed the phenomenon", "Design The collider", "depth was deliberate"]}, "hinfo": {"hp": "electron propulsion", "pp": ["electron propulsion", "jet quenching"], "cp": ["First observed in 2010 findings published in 2012 confirmed the phenomenon of jet quenching in heavy-ion collisions", "First observed in 2010 findings published in 2012 confirmed the phenomenon of electron propulsion in heavy-ion collisions"], "sf": ["heavy-ion collisions", "the phenomenon"], "hs": [[340, 359]]}, "hf": 1}
{"context": "This will be investigated by heavy ion collisions mainly in ALICE but also in CMS ATLAS and LHCb\nFirst observed in 2010 findings published in 2012 confirmed the phenomenon of jet quenching in heavy-ion collisions\n Design The collider is contained in one long structure with a circumference of 267 kilometres 166 mi at a depth ranging from 50 to 175 metres 164 to 574 ft underground\nThe variation in depth was deliberate to reduce the amount of tunnel that lies under the Jura Mountains to avoid having to excavate a vertical access shaft there\nA tunnel was chosen to avoid having to purchase expensive land on the surface and to take advantage of the shielding against background radiation that the Earths crust provides", "evidence": "Heavy ion collisions in ALICE will be used to investigate this.\nThe phenomenon of jet quenching in heavy-ion collisions was first observed in 2010.\nThe collider is contained in a circular tunnel with a depth from 50 to 175 metres.\nTo avoid having to dig a vertical access shaft under the Jura Mountains, the amount of tunnel that lies under the mountains was reduced.\nTo avoid having to purchase expensive land on the surface and to take advantage of the shielding that the Earth's crust provides, a tunnel was chosen.", "einfo": {"ss": [1.0, 1.0], "cs": [1.0], "pv": ["mainly in ALICE", "excavate a vertical"], "uv": ["investigated by heavy", "confirmed the phenomenon", "Design The collider", "depth was deliberate"]}, "hinfo": {"hp": "one long structure", "pp": ["one long structure", "a circular tunnel"], "cp": [" Design The collider is contained in a circular tunnel with a circumference of 267 kilometres 166 mi at a depth ranging from 50 to 175 metres 164 to 574 ft underground", " Design The collider is contained in one long structure with a circumference of 267 kilometres 166 mi at a depth ranging from 50 to 175 metres 164 to 574 ft underground"], "sf": ["267 kilometres 166 mi", "a circumference"], "hs": [[250, 268]]}, "hf": 1}
{"context": "A tunnel was chosen to avoid having to purchase expensive land on the surface and to take advantage of the shielding against background radiation that the Earths crust provides\nThis approximately 30 metre long wind building constructed between 1983 and 1988 was formerly used to house the Large Electron\u2013Positron Collider", "evidence": "To avoid having to purchase expensive land on the surface and to take advantage of the shielding that the Earth's crust provides, a tunnel was chosen.\nThe Large Electron\u2013Positron Collider used to be located in the tunnel.", "einfo": {"ss": [1.0, 1.0], "cs": [1.0], "pv": ["Positron Collider"], "uv": []}, "hinfo": {"hp": "This approximately 30 metre long wind building", "pp": ["This approximately 30 metre long wind building", "The 38-metre 12 ft wide concrete-lined tunnel"], "cp": ["The 38-metre 12 ft wide concrete-lined tunnel constructed between 1983 and 1988 was formerly used to house the Large Electron\u2013Positron Collider", "This approximately 30 metre long wind building constructed between 1983 and 1988 was formerly used to house the Large Electron\u2013Positron Collider"], "sf": ["Positron Collider", "the Large Electron"], "hs": [[177, 223]]}, "hf": 1}
{"context": "A tunnel was chosen to avoid having to purchase expensive land on the surface and to take advantage of the shielding against background radiation that the Earths crust provides\nThe 38-metre 12 ft wide concrete-lined tunnel constructed between 1983 and 1988 was formerly used to house the Large Electron\u2013Positron Collider\nThe tunnel crosses the border between Belgium and France at four points with most of it in France", "evidence": "To avoid having to purchase expensive land on the surface and to take advantage of the shielding that the Earth's crust provides, a tunnel was chosen.\nThe Large Electron\u2013Positron Collider used to be located in the tunnel.\nMost of the tunnel is in France.", "einfo": {"ss": [1.0, 1.0], "cs": [1.0], "pv": ["Positron Collider", "tunnel crosses"], "uv": ["Switzerland and France"]}, "hinfo": {"hp": "Belgium", "pp": ["Belgium", "Switzerland"], "cp": ["The tunnel crosses the border between Switzerland and France at four points with most of it in France", "The tunnel crosses the border between Belgium and France at four points with most of it in France"], "sf": ["France", "the border"], "hs": [[359, 366]]}, "hf": 1}
{"context": "Surface buildings hold ancillary equipment such as compressors ventilation equipment control electronics and refrigeration plants\nThe collider tunnel contains three parallel vertical pipes or beam pipes each containing a beam which travel in opposite directions around the ring\nThe beams intersect at four points around the ring which is where the particle collisions take place\nSome 1232 dipole magnets keep the beams on their circular path see image while an additional 392 quadrupole magnets are used to keep the beams focused with stronger quadrupole magnets close to the intersection points in order to maximize the chances of interaction where the two beams cross", "evidence": "There are ancillary equipment in surface buildings.\nThere are two parallel beamlines or beam pipes in the collider tunnel that travel in opposite directions.\nFour points around the ring are where the beams intersect.\nStrong quadrupole magnets are used close to the intersection points to maximize the chances of interaction between the two beams, while some 1232 dipole magnets keep the beams on their circular path.", "einfo": {"ss": [1.0, 1.0], "cs": [1.0], "pv": ["hold ancillary equipment", "Surface buildings hold", "opposite directions around", "collider tunnel contains", "adjacent parallel beamlines", "circular path see"], "uv": ["compressors ventilation equipment", "contains two adjacent", "two adjacent parallel", "quadrupole magnets close"]}, "hinfo": {"hp": "three parallel vertical pipes", "pp": ["three parallel vertical pipes", "two adjacent parallel beamlines"], "cp": ["The collider tunnel contains two adjacent parallel beamlines or beam pipes each containing a beam which travel in opposite directions around the ring", "The collider tunnel contains three parallel vertical pipes or beam pipes each containing a beam which travel in opposite directions around the ring"], "sf": ["opposite directions", "beam pipes"], "hs": [[159, 188]]}, "hf": 1}
{"context": "Some 1232 dipole magnets keep the beams on their circular path see image while an additional 392 quadrupole magnets are used to keep the beams focused with stronger quadrupole magnets close to the intersection points in order to maximize the chances of interaction where the two beams cross\nMagnets of higher multipole orders are used to correct smaller imperfections in the field geometry\nIn total over 100 permanent transformers are installed with the dipole magnets having a mass of over 27 tonnes\nAbout 96 tonnes of superfluid helium-4 is needed to keep the magnets made of copper-clad niobium-titanium at their operating temperature of 19 K \u221227125 \u00b0C making the LHC the largest cryogenic facility in the world at liquid helium temperature\nLHC uses 470 tonnes of Nb\u2013Ti superconductor", "evidence": "Strong quadrupole magnets are used close to the intersection points to maximize the chances of interaction between the two beams, while some 1232 dipole magnets keep the beams on their circular path.\nSmaller imperfections in the field geometry can be corrected with magnets of higher multipole orders.\nThe magnets have a mass of over 27 tons.\nThe largest facility in the world at liquid helium temperature is needed to keep the magnets made of copper-clad niobium-titanium.\nThe superconductor used by the LHC is Nb\u2013Ti.", "einfo": {"ss": [1.0, 1.0], "cs": [1.0], "pv": ["circular path see", "correct smaller imperfections", "superconducting magnets", "largest cryogenic facility", "superconductor", "LHC uses"], "uv": ["quadrupole magnets close", "used to correct", "magnets are installed", "tonnes of superfluid", "made of copper-clad"]}, "hinfo": {"hp": "over 100 permanent transformers", "pp": ["over 100 permanent transformers", "about 10000 superconducting magnets"], "cp": ["In total about 10000 superconducting magnets are installed with the dipole magnets having a mass of over 27 tonnes", "In total over 100 permanent transformers are installed with the dipole magnets having a mass of over 27 tonnes"], "sf": ["the dipole magnets", "a mass"], "hs": [[399, 430]]}, "hf": 1}
{"context": "In total about 10000 superconducting magnets are installed with the dipole magnets having a mass of over 27 tonnes\nAbout 96 tonnes of superfluid helium-4 is needed to keep the magnets made of copper-clad niobium-titanium at their operating temperature of 19 K \u221227125 \u00b0C making the LHC second only production magnet in the world at liquid helium temperature\nLHC uses 470 tonnes of Nb\u2013Ti superconductor\nDuring LHC operations the CERN site draws roughly 200 MW of electrical power from the French electrical grid which for comparison is about one-third the energy consumption of the city of Geneva; the LHC accelerator and detectors draw about 120 MW thereof", "evidence": "The magnets have a mass of over 27 tons.\nThe largest facility in the world at liquid helium temperature is needed to keep the magnets made of copper-clad niobium-titanium.\nThe superconductor used by the LHC is Nb\u2013Ti.\nThe French electrical grid supplies roughly 200 million kilowatts of electrical power to the site, which is one-third of the energy consumption of the city.", "einfo": {"ss": [1.0, 1.0], "cs": [1.0], "pv": ["superconducting magnets", "largest cryogenic facility", "superconductor", "LHC uses"], "uv": ["magnets are installed", "tonnes of superfluid", "made of copper-clad", "site draws roughly", "operations the CERN", "CERN site draws"]}, "hinfo": {"hp": "second only production magnet", "pp": ["second only production magnet", "the largest cryogenic facility"], "cp": ["About 96 tonnes of superfluid helium-4 is needed to keep the magnets made of copper-clad niobium-titanium at their operating temperature of 19 K \u221227125 \u00b0C making the LHC the largest cryogenic facility in the world at liquid helium temperature", "About 96 tonnes of superfluid helium-4 is needed to keep the magnets made of copper-clad niobium-titanium at their operating temperature of 19 K \u221227125 \u00b0C making the LHC second only production magnet in the world at liquid helium temperature"], "sf": ["liquid helium temperature", "superfluid helium-4"], "hs": [[285, 314]]}, "hf": 1}
{"context": "The protons each have an energy of 65 TeV giving a total collision energy of 13 TeV\nAt this energy the protons have a Form factor of about 6930 and move at about 0999999990 c or about 31 m/s 11 km/h slower than the speed of light c", "evidence": "The total collision energy of the protons is 13 TeV.\nThe speed of light is 11 km/h slower than the speed of the protons at this energy.", "einfo": {"ss": [1.0, 1.0], "cs": [1.0], "pv": ["TeV giving"], "uv": ["energy the protons"]}, "hinfo": {"hp": "Form", "pp": ["Form", "Lorentz"], "cp": ["At this energy the protons have a Lorentz factor of about 6930 and move at about 0999999990 c or about 31 m/s 11 km/h slower than the speed of light c", "At this energy the protons have a Form factor of about 6930 and move at about 0999999990 c or about 31 m/s 11 km/h slower than the speed of light c"], "sf": ["a Lorentz factor", "light"], "hs": [[118, 122]]}, "hf": 1}
{"context": "Before being injected into the main accelerator the particles are prepared by a series of systems that successively increase their energy\nThe first system is the linear particle accelerator Linac4 generating 10 Million of charge and Hydrogen ##2 which feeds the Proton Synchrotron Booster PSB\nThere both electrons are stripped from the hydrogen ions leaving only the nucleus containing one proton", "evidence": "The particles are prepared by a series of systems that increase their energy before they are injected.\nThe first system is a linear particle accelerator called Linac4.\nThe nucleus contains only one protons and both electrons are stripped from the hydrogen ion.", "einfo": {"ss": [1.0, 1.0], "cs": [1.0], "pv": ["systems that successively", "nucleus containing one", "hydrogen ions leaving", "containing one proton"], "uv": ["Proton Synchrotron Booster", "Synchrotron Booster PSB", "electrons are stripped"]}, "hinfo": {"hp": "10 Million of charge and Hydrogen ##2", "pp": ["10 Million of charge and Hydrogen ##2", "160 MeV negative hydrogen ions H\u2212 ions"], "cp": ["The first system is the linear particle accelerator Linac4 generating 160 MeV negative hydrogen ions H\u2212 ions which feeds the Proton Synchrotron Booster PSB", "The first system is the linear particle accelerator Linac4 generating 10 Million of charge and Hydrogen ##2 which feeds the Proton Synchrotron Booster PSB"], "sf": ["the linear particle accelerator Linac4", "the Proton Synchrotron Booster PSB"], "hs": [[208, 245]]}, "hf": 1}
{"context": "Protons are then accelerated to 2 GeV and injected into the Proton Synchrotron PS where they are accelerated to 26 GeV\nFinally their Two ##nova Of System is used to increase their energy further to 450 GeV before they are at last injected over a period of several minutes into the main ring", "evidence": "The injected particles are then accelerated to 26 GeV.\nAfter increasing their energy to 450 GeV, they are injected into the main ring, where they will stay for several minutes.", "einfo": {"ss": [1.0, 1.0], "cs": [1.0], "pv": [], "uv": ["GeV and injected", "Proton Synchrotron", "Super Proton Synchrotron", "Proton Synchrotron SPS", "Finally the Super"]}, "hinfo": {"hp": "their Two ##nova Of System", "pp": ["their Two ##nova Of System", "the Super Proton Synchrotron SPS"], "cp": ["Finally the Super Proton Synchrotron SPS is used to increase their energy further to 450 GeV before they are at last injected over a period of several minutes into the main ring", "Finally their Two ##nova Of System is used to increase their energy further to 450 GeV before they are at last injected over a period of several minutes into the main ring"], "sf": ["several minutes", "the main ring"], "hs": [[127, 153]]}, "hf": 1}
{"context": "Here the proton bunches are accumulated accelerated over a period of 20 minutes to their peak energy and finally circulated for 5 to 24 hours while collisions occur at the four intersection points\nThe LHC physics programme is mainly based on proton\u2013proton collisions\nHowever during shorter running periods typically one month per month heavy-ion collisions are included in the programme\nWhile lighter ions are considered as well the baseline scheme deals with lead ions see A Large Ion Collider Experiment", "evidence": "The bunches of protons are accumulated over a period of 20 minutes to their peak energy and then circulate for 5 to 24 hours.\nThe main focus of the physics programme is on protons and plutonium.\nHeavy-ion collisions are included in the programme during shorter running periods.\nThe baseline scheme deals with lead strontiums, while lighter strontiums are considered as well.", "einfo": {"ss": [1.0, 1.0], "cs": [1.0], "pv": ["proton bunches", "bunches are accumulated", "LHC physics programme", "year heavy-ion collisions", "However during shorter"], "uv": ["hours while collisions", "four intersection points", "accumulated accelerated", "proton collisions", "programme is mainly", "running periods typically", "lead ions see", "Ion Collider Experiment", "Large Ion Collider"]}, "hinfo": {"hp": "month", "pp": ["month", "year"], "cp": ["However during shorter running periods typically one month per year heavy-ion collisions are included in the programme", "However during shorter running periods typically one month per month heavy-ion collisions are included in the programme"], "sf": ["shorter running periods", "heavy-ion collisions"], "hs": [[320, 325], [330, 335]]}, "hf": 1}
{"context": "While lighter ions are considered as well the baseline scheme deals with lead ions see A Large Ion Collider Experiment\nThe lead ions are first accelerated by the linear accelerator LINAC 3 and its High Pressure Heavy Accelerator Which is used as an ion storage and cooler unit", "evidence": "The baseline scheme deals with lead strontiums, while lighter strontiums are considered as well.\nThe Low Energy Ion Ring LEIR is used as an ion storage and cooler unit and is accelerated by the linear accelerator LINAC 3.", "einfo": {"ss": [1.0, 1.0], "cs": [1.0], "pv": [], "uv": ["lead ions see", "Ion Collider Experiment", "Large Ion Collider"]}, "hinfo": {"hp": "its High Pressure Heavy Accelerator Which", "pp": ["its High Pressure Heavy Accelerator Which", "the Low Energy Ion Ring LEIR"], "cp": ["The lead ions are first accelerated by the linear accelerator LINAC 3 and the Low Energy Ion Ring LEIR is used as an ion storage and cooler unit", "The lead ions are first accelerated by the linear accelerator LINAC 3 and its High Pressure Heavy Accelerator Which is used as an ion storage and cooler unit"], "sf": ["cooler unit", "the linear accelerator"], "hs": [[193, 234]]}, "hf": 1}
{"context": "The aim of the heavy-ion programme is to investigate quark\u2013gluon plasma which existed in the early universe\n Detectors Nine detectors have been built in large caverns excavated at the LHCs intersection points\nTwo of them the ATLAS experiment and its Large Solid Experiment Experiment are large general-purpose particle detectors\nALICE and LHCb have more specialized roles while the other five\u2014TOTEM MoEDAL LHCf SND and FASER\u2014are much smaller and are for very specialized research", "evidence": "The purpose of the heavy-ion programme is to investigate the existence of quark\u2013gluon plasma.\nLarge caverns excavated at the intersection points have been used to build Detectors Nine.\nThe Compact Muon SolenoidCMS is one of the large general-purpose particle detectors.\nThe other five are much smaller and have very specialized roles.", "einfo": {"ss": [1.0, 1.0], "cs": [1.0], "pv": ["Detectors Nine detectors", "Compact Muon Solenoid"], "uv": ["investigate quark", "plasma which existed", "specialized research"]}, "hinfo": {"hp": "its Large Solid Experiment Experiment", "pp": ["its Large Solid Experiment Experiment", "the Compact Muon Solenoid CMS"], "cp": ["Two of them the ATLAS experiment and the Compact Muon Solenoid CMS are large general-purpose particle detectors", "Two of them the ATLAS experiment and its Large Solid Experiment Experiment are large general-purpose particle detectors"], "sf": ["large general-purpose particle detectors", "the ATLAS experiment"], "hs": [[246, 283]]}, "hf": 1}
{"context": "ALICE and LHCb have more specialized roles while the other five\u2014TOTEM MoEDAL LHCf SND and FASER\u2014are much smaller and are for very specialized research\nThe ATLAS and CMS experiments discovered the Higgs boson which is strong evidence that the Standard Model has the correct mechanism of giving mass to charged particle\n Computing and analysis facilities Data produced by LHC as well as LHC-related simulation were estimated at 200 petabytes per year", "evidence": "The other five are much smaller and have very specialized roles.\nThe proof that the Standard Model has the correct mechanism for giving mass to elementary particles was found in the experiments.\nIt was estimated that 200 petabytes of data per year was produced by the LHC.", "einfo": {"ss": [1.0, 1.0], "cs": [1.0], "pv": ["petabytes per year"], "uv": ["specialized research", "CMS experiments discovered", "discovered the Higgs", "strong evidence", "ATLAS and CMS", "produced by LHC", "analysis facilities Data", "facilities Data produced"]}, "hinfo": {"hp": "charged particle", "pp": ["charged particle", "elementary particles"], "cp": ["The ATLAS and CMS experiments discovered the Higgs boson which is strong evidence that the Standard Model has the correct mechanism of giving mass to elementary particles", "The ATLAS and CMS experiments discovered the Higgs boson which is strong evidence that the Standard Model has the correct mechanism of giving mass to charged particle"], "sf": ["strong evidence", "The ATLAS and CMS experiments"], "hs": [[301, 317]]}, "hf": 1}
{"context": "ALICE and LHCb have more specialized roles while the other five\u2014TOTEM MoEDAL LHCf SND and FASER\u2014are much smaller and are for very specialized research\nThe ATLAS and CMS experiments discovered the Higgs boson which is strong evidence that the Standard Model has the correct mechanism of giving mass to elementary particles\n Computing and analysis facilities Data produced by Nasa as well as Nasa-related simulation were estimated at 200 petabytes per year", "evidence": "The other five are much smaller and have very specialized roles.\nThe proof that the Standard Model has the correct mechanism for giving mass to elementary particles was found in the experiments.\nIt was estimated that 200 petabytes of data per year was produced by the LHC.", "einfo": {"ss": [1.0, 1.0], "cs": [1.0], "pv": ["petabytes per year"], "uv": ["specialized research", "CMS experiments discovered", "discovered the Higgs", "strong evidence", "ATLAS and CMS", "produced by LHC", "analysis facilities Data", "facilities Data produced"]}, "hinfo": {"hp": "Nasa", "pp": ["Nasa", "LHC"], "cp": [" Computing and analysis facilities Data produced by LHC as well as LHC-related simulation were estimated at 200 petabytes per year", " Computing and analysis facilities Data produced by Nasa as well as Nasa-related simulation were estimated at 200 petabytes per year"], "sf": [" Computing and analysis facilities Data", "LHC-related simulation"], "hs": [[374, 378], [390, 394]]}, "hf": 1}
{"context": "The LHC Computing Grid was constructed as part of the LHC design to handle the massive amounts of data expected for its collisions\nIt is an international collaborative project that consists of a grid-based computer network infrastructure initially connecting 40 data centers in 35 countries over 170 in more than 40 countries as of 2012", "evidence": "The huge amount of data expected for the collider led to the creation of the computing grid.\nThe project consists of a grid-based computer network infrastructure initially connecting 140 computing centers in 35 countries over 170 in more than 40 countries.", "einfo": {"ss": [1.0, 1.0], "cs": [1.0], "pv": ["LHC Computing Grid", "project that consists"], "uv": ["massive amounts", "Grid was constructed", "constructed as part", "international collaborative project"]}, "hinfo": {"hp": "40 data centers", "pp": ["40 data centers", "140 computing centres"], "cp": ["It is an international collaborative project that consists of a grid-based computer network infrastructure initially connecting 140 computing centres in 35 countries over 170 in more than 40 countries as of 2012", "It is an international collaborative project that consists of a grid-based computer network infrastructure initially connecting 40 data centers in 35 countries over 170 in more than 40 countries as of 2012"], "sf": ["a grid-based computer network infrastructure", "an international collaborative project"], "hs": [[259, 274]]}, "hf": 1}
{"context": "It was designed by CERN to handle the significant volume of data produced by LHC experiments incorporating both private fibre optic cable links and existing high-speed portions of the public Internet to enable data transfer from CERN to academic institutions around the world\nThe LHC Computing Grid consists of global federations across The And Africa and the Americas", "evidence": "It was designed by CERN to handle the large amount of data produced by the LHC experiments in order to transfer it to academic institutions around the world.\nThere are global federations in Europe, Asia Pacific, and the Americas.", "einfo": {"ss": [1.0, 1.0], "cs": [1.0], "pv": ["LHC experiments incorporating", "Europe Asia Pacific", "federations across Europe"], "uv": ["produced by LHC", "existing high-speed portions", "enable data transfer", "private fibre optic", "fibre optic cable", "optic cable links", "public Internet", "global federations across"]}, "hinfo": {"hp": "The And Africa", "pp": ["The And Africa", "Europe Asia Pacific"], "cp": ["The LHC Computing Grid consists of global federations across Europe Asia Pacific and the Americas", "The LHC Computing Grid consists of global federations across The And Africa and the Americas"], "sf": ["global federations", "The LHC Computing Grid"], "hs": [[337, 351]]}, "hf": 1}
{"context": "The LHC Computing Grid consists of global federations across Europe Asia Pacific and the Americas\nThe distributed computing project Group was started to support the construction and calibration of the LHC\nThe project uses the BOINC platform enabling anybody with an Internet connection and a computer running Mac OS X Windows or Linux to use their computers idle time to simulate how particles will travel in the beam pipes\nWith this information the scientists are able to determine how the magnets should be calibrated to gain the most stable orbit of the beams in the ring", "evidence": "There are global federations in Europe, Asia Pacific, and the Americas.\nThe distributed computing project was started to support the construction and calibration of the Large Calibration of the Large Calibration of the Large Calibration of the distributed computing project was started to support the construction and calibration of the Large Calibration of the Large Calibration of the distributed\nThe project uses the BOINC platform to allow anyone with an internet connection and a computer running Mac OS X Windows or Linux to use their computer's idle time to model how particles will travel in the beam pipes.\nThe scientists are able to figure out how the magnets should be adjusted to get the most stable ring of beams.", "einfo": {"ss": [1.0, 1.0], "cs": [1.0], "pv": ["Europe Asia Pacific", "federations across Europe", "home was started", "BOINC platform enabling", "able to determine", "ring"], "uv": ["global federations across", "construction and calibration", "platform enabling anybody", "calibrated to gain", "information the scientists"]}, "hinfo": {"hp": "Group", "pp": ["Group", "LHC@home"], "cp": ["The distributed computing project LHC@home was started to support the construction and calibration of the LHC", "The distributed computing project Group was started to support the construction and calibration of the LHC"], "sf": ["The distributed computing project", "calibration"], "hs": [[132, 137]]}, "hf": 1}
{"context": "The distributed computing project LHC@home was started to support the construction and calibration of the LHC\nThe project uses the BOINC platform enabling anybody with no Ethernet access and a computer running Mac OS X Windows or Linux to use their computers idle time to simulate how particles will travel in the beam pipes\nWith this information the scientists are able to determine how the magnets should be calibrated to gain the most stable orbit of the beams in the ring\nIn August 2011 a second application Test4Theory went live which performs simulations against which to compare actual test data to determine confidence levels of the results", "evidence": "The distributed computing project was started to support the construction and calibration of the Large Calibration of the Large Calibration of the Large Calibration of the distributed computing project was started to support the construction and calibration of the Large Calibration of the Large Calibration of the distributed\nThe project uses the BOINC platform to allow anyone with an internet connection and a computer running Mac OS X Windows or Linux to use their computer's idle time to model how particles will travel in the beam pipes.\nThe scientists are able to figure out how the magnets should be adjusted to get the most stable ring of beams.\nA second application called Test4Theory went live in August of 2011.", "einfo": {"ss": [1.0, 1.0], "cs": [1.0], "pv": ["home was started", "BOINC platform enabling", "able to determine", "ring", "second application"], "uv": ["construction and calibration", "platform enabling anybody", "calibrated to gain", "information the scientists", "live which performs"]}, "hinfo": {"hp": "no Ethernet access", "pp": ["no Ethernet access", "an Internet connection"], "cp": ["The project uses the BOINC platform enabling anybody with an Internet connection and a computer running Mac OS X Windows or Linux to use their computers idle time to simulate how particles will travel in the beam pipes", "The project uses the BOINC platform enabling anybody with no Ethernet access and a computer running Mac OS X Windows or Linux to use their computers idle time to simulate how particles will travel in the beam pipes"], "sf": ["Mac OS X Windows", "Mac OS X Windows or Linux"], "hs": [[168, 186]]}, "hf": 1}
{"context": "The distributed computing project LHC@home was started to support the construction and calibration of the LHC\nThe project uses the BOINC platform enabling anybody with an Internet connection and a computer running Mac OS X Windows or Linux to use their computers idle time to simulate how particles will travel in the beam pipes\nWith this information the scientists are able to determine how these beams should be calibrated to gain the most stable orbit of the beams in the ring\nIn August 2011 a second application Test4Theory went live which performs simulations against which to compare actual test data to determine confidence levels of the results\nBy 2012 data from over 6 quadrillion 6\u00d71015 LHC proton\u2013proton collisions had been analysed", "evidence": "The distributed computing project was started to support the construction and calibration of the Large Calibration of the Large Calibration of the Large Calibration of the distributed computing project was started to support the construction and calibration of the Large Calibration of the Large Calibration of the distributed\nThe project uses the BOINC platform to allow anyone with an internet connection and a computer running Mac OS X Windows or Linux to use their computer's idle time to model how particles will travel in the beam pipes.\nThe scientists are able to figure out how the magnets should be adjusted to get the most stable ring of beams.\nA second application called Test4Theory went live in August of 2011.\nBy 2012 the data from over 6 quadrillion 61015 had been analysed.", "einfo": {"ss": [1.0, 1.0], "cs": [1.0], "pv": ["home was started", "BOINC platform enabling", "able to determine", "ring", "second application"], "uv": ["construction and calibration", "platform enabling anybody", "calibrated to gain", "information the scientists", "live which performs"]}, "hinfo": {"hp": "these beams", "pp": ["these beams", "the magnets"], "cp": ["With this information the scientists are able to determine how the magnets should be calibrated to gain the most stable orbit of the beams in the ring", "With this information the scientists are able to determine how these beams should be calibrated to gain the most stable orbit of the beams in the ring"], "sf": ["the most stable orbit", "the scientists"], "hs": [[392, 403]]}, "hf": 1}
{"context": "In August 2011 a second application Test4Theory went live which performs simulations against which to compare actual test data to determine confidence levels of the results\nBy 2007 results from over 6 quadrillion 6\u00d71015 LHC proton\u2013proton collisions had been analysed", "evidence": "A second application called Test4Theory went live in August of 2011.\nBy 2012 the data from over 6 quadrillion 61015 had been analysed.", "einfo": {"ss": [1.0, 1.0], "cs": [1.0], "pv": ["second application"], "uv": ["live which performs"]}, "hinfo": {"hp": "2007 results", "pp": ["2007 results", "2012 data"], "cp": ["By 2012 data from over 6 quadrillion 6\u00d71015 LHC proton\u2013proton collisions had been analysed", "By 2007 results from over 6 quadrillion 6\u00d71015 LHC proton\u2013proton collisions had been analysed"], "sf": ["over 6 quadrillion 6\u00d71015 LHC proton\u2013proton collisions", "2012"], "hs": [[176, 188]]}, "hf": 1}
{"context": "By 2012 data from over 6 quadrillion 6\u00d71015 LHC proton\u2013proton collisions had been analysed\nThis Global National Network had become the worlds largest computing grid in 2012 comprising over 170 computing facilities in a worldwide network across more than 40 countries\n Operational history The LHC first went operational on 10 September 2008 but initial testing was delayed for 14 months from 19 September 2008 to 20 November 2009 following a magnet quench incident that caused extensive damage to over 50 superconducting magnets their mountings and the vacuum pipe\nDuring its first run 2010\u20132013 the LHC collided two opposing particle beams of either protons at up to 4 teraelectronvolts 4 TeV or 064 microjoules or lead nuclei 574 TeV per nucleus or 276 TeV per nucleon", "evidence": "By 2012 the data from over 6 quadrillion 61015 had been analysed.\nThe largest computing grid in the world in 2012 consisted of over 170 computing facilities in a worldwide network.\nAfter a magnet quench incident caused extensive damage to over 50 magnets their mountings and the vacuum pipe, the initial testing of The LHC was delayed for 14 months.\nThe first run of the LHC resulted in the collision of two beams of protons at up to 4 TeV or 064 microjoules.", "einfo": {"ss": [1.0, 1.0], "cs": [1.0], "pv": ["worldwide network across"], "uv": ["LHC Computing Grid", "history The LHC", "superconducting magnets", "first went operational", "microjoules or lead", "TeV per nucleon", "LHC collided two", "opposing particle beams", "collided two opposing", "two opposing particle"]}, "hinfo": {"hp": "This Global National Network", "pp": ["This Global National Network", "The LHC Computing Grid"], "cp": ["The LHC Computing Grid had become the worlds largest computing grid in 2012 comprising over 170 computing facilities in a worldwide network across more than 40 countries", "This Global National Network had become the worlds largest computing grid in 2012 comprising over 170 computing facilities in a worldwide network across more than 40 countries"], "sf": ["largest computing grid", "over 170 computing facilities"], "hs": [[91, 119]]}, "hf": 1}
{"context": "Its first run discoveries included the long-sought Higgs boson several composite particles hadrons like the \u03c7b 3P bottomonium state the first creation of a quark\u2013gluon plasma and the first observations of the very rare decay of the Bs meson into two muons Bs0 \u2192 \u03bc+\u03bc\u2212 which challenged the validity of existing models of supersymmetry\n Construction  Operational challenges The size of the LHC constitutes an exceptional engineering challenge with unique operational issues on account of the amount of energy stored in the magnets and the beams\nWhile operating the total energy stored in the magnets is 500 Million 173 kg of TNT and the total energy carried by the two beams reaches 724 MJ 173 kilograms of TNT\nLoss of only one ten-millionth part 10\u22127 of the beam is sufficient to quench a superconducting magnet while each of the two beam dumps must absorb 362 MJ 87 kilograms of TNT\nThese energies are carried by very little matter under nominal operating conditions 2808 bunches per beam 115\u00d71011 protons per bunch the beam pipes contain 10\u00d710\u22129 gram of hydrogen which in standard conditions for temperature and pressure would fill the volume of one grain of fine sand", "evidence": "The first discoveries were the creation of a quark\u2013gluon plasma and the decay of the Bs meson into two muons.\nThere are unique operational issues due to the amount of energy stored in the beams and magnets.\nThe total amount of energy stored in the magnets is 10 GJ and the total amount of energy carried by the two beams is 724 MJ.\nEach of the two beam dumps needs to absorb 362 MJ 87 kilograms of TNT in order to quench a superconducting magnet.\nThe beam pipes contain 10109 gram of hydrogen which in standard conditions would fill the volume of one grain of fine sand.", "einfo": {"ss": [1.0, 1.0], "cs": [1.0], "pv": ["first run discoveries", "total energy carried", "total energy stored", "two beams reaches", "beam dumps must", "pressure would fill"], "uv": ["several composite particles", "composite particles hadrons", "run discoveries included", "long-sought Higgs boson", "Construction Operational challenges", "exceptional engineering challenge", "operating the total", "kilograms of TNT", "quench a superconducting", "sufficient to quench", "one ten-millionth part", "nominal operating conditions"]}, "hinfo": {"hp": "500 Million 173 kg", "pp": ["500 Million 173 kg", "10 GJ 2400 kilograms"], "cp": ["While operating the total energy stored in the magnets is 10 GJ 2400 kilograms of TNT and the total energy carried by the two beams reaches 724 MJ 173 kilograms of TNT", "While operating the total energy stored in the magnets is 500 Million 173 kg of TNT and the total energy carried by the two beams reaches 724 MJ 173 kilograms of TNT"], "sf": ["the total energy", "724 MJ 173 kilograms"], "hs": [[600, 618]]}, "hf": 1}
{"context": "Construction  Operational challenges The size of the LHC constitutes an exceptional engineering challenge with unique operational issues on account of the amount of energy stored in the magnets and the beams\nWhile operating the total energy stored in the magnets is 10 GJ 2400 kilograms of TNT and the total energy carried by the two beams reaches 724 MJ 173 kilograms of TNT\nLoss of only one ten-millionth part 10\u22127 of the beam is sufficient to quench the single core while each of the two beam dumps must absorb 362 MJ 87 kilograms of TNT\nThese energies are carried by very little matter under nominal operating conditions 2808 bunches per beam 115\u00d71011 protons per bunch the beam pipes contain 10\u00d710\u22129 gram of hydrogen which in standard conditions for temperature and pressure would fill the volume of one grain of fine sand", "evidence": "There are unique operational issues due to the amount of energy stored in the beams and magnets.\nThe total amount of energy stored in the magnets is 10 GJ and the total amount of energy carried by the two beams is 724 MJ.\nEach of the two beam dumps needs to absorb 362 MJ 87 kilograms of TNT in order to quench a superconducting magnet.\nThe beam pipes contain 10109 gram of hydrogen which in standard conditions would fill the volume of one grain of fine sand.", "einfo": {"ss": [1.0, 1.0], "cs": [1.0], "pv": ["total energy carried", "total energy stored", "two beams reaches", "beam dumps must", "pressure would fill"], "uv": ["Construction Operational challenges", "exceptional engineering challenge", "operating the total", "kilograms of TNT", "quench a superconducting", "sufficient to quench", "one ten-millionth part", "nominal operating conditions"]}, "hinfo": {"hp": "the single core", "pp": ["the single core", "a superconducting magnet"], "cp": ["Loss of only one ten-millionth part 10\u22127 of the beam is sufficient to quench a superconducting magnet while each of the two beam dumps must absorb 362 MJ 87 kilograms of TNT", "Loss of only one ten-millionth part 10\u22127 of the beam is sufficient to quench the single core while each of the two beam dumps must absorb 362 MJ 87 kilograms of TNT"], "sf": ["the two beam dumps", "362 MJ 87 kilograms"], "hs": [[454, 469]]}, "hf": 1}
{"context": "These energies are carried by very little matter under nominal operating conditions 2808 bunches per beam 115\u00d71011 protons per bunch the beam pipes contain 10\u00d710\u22129 gram of hydrogen which in standard conditions for temperature and pressure would fill the volume of one grain of fine sand\n Cost With a budget of \u20ac75 billion about $9bn or \u00a3619bn as of June 2010 the LHC is one of its least advanced musical facilities ever built\nThe total cost of the project is expected to be of the order of 46bn Swiss francs SFr about $44bn \u20ac31bn or \u00a328bn as of January 2010 for the accelerator and 116bn SFr about $11bn \u20ac08bn or \u00a307bn as of January 2010 for the CERN contribution to the experiments\nThe construction of LHC was approved in 1995 with a budget of SFr 26bn with another SFr 210M toward the experiments", "evidence": "The beam pipes contain 10109 gram of hydrogen which in standard conditions would fill the volume of one grain of fine sand.\nThe cost of the LHC as of June 2010 was $9 billion, making it the most expensive scientific instrument ever built.\nAs of January 2010, the total cost of the project is expected to be about 46 billion Swiss Francs, or about $29 billion.\nIn 1995 a budget of 26 billion dollars was approved for the construction of the LHC.", "einfo": {"ss": [1.0, 1.0], "cs": [1.0], "pv": ["pressure would fill", "Swiss francs SFr", "LHC was approved"], "uv": ["nominal operating conditions", "budget of SFr", "construction of LHC", "toward the experiments"]}, "hinfo": {"hp": "its least advanced musical facilities", "pp": ["its least advanced musical facilities", "the most expensive scientific instruments"], "cp": [" Cost With a budget of \u20ac75 billion about $9bn or \u00a3619bn as of June 2010 the LHC is one of the most expensive scientific instruments ever built", " Cost With a budget of \u20ac75 billion about $9bn or \u00a3619bn as of June 2010 the LHC is one of its least advanced musical facilities ever built"], "sf": ["619bn", "June"], "hs": [[377, 414]]}, "hf": 1}
{"context": "These energies are carried by very little matter under nominal operating conditions 2808 bunches per beam 115\u00d71011 protons per bunch the beam pipes contain 10\u00d710\u22129 gram of hydrogen which in standard conditions for temperature and pressure would fill the volume of one grain of fine sand\n Cost With a budget of \u20ac75 billion about $9bn or \u00a3619bn as of June 2010 the LHC is one of the most expensive scientific instruments ever built\nThe total cost of the project is expected to be of the order of 100 French euro Or about $44bn \u20ac31bn or \u00a328bn as of January 2010 for the accelerator and 116bn SFr about $11bn \u20ac08bn or \u00a307bn as of January 2010 for the CERN contribution to the experiments", "evidence": "The beam pipes contain 10109 gram of hydrogen which in standard conditions would fill the volume of one grain of fine sand.\nThe cost of the LHC as of June 2010 was $9 billion, making it the most expensive scientific instrument ever built.\nAs of January 2010, the total cost of the project is expected to be about 46 billion Swiss Francs, or about $29 billion.", "einfo": {"ss": [1.0, 1.0], "cs": [1.0], "pv": ["pressure would fill", "Swiss francs SFr"], "uv": ["nominal operating conditions"]}, "hinfo": {"hp": "100 French euro Or", "pp": ["100 French euro Or", "46bn Swiss francs SFr"], "cp": ["The total cost of the project is expected to be of the order of 46bn Swiss francs SFr about $44bn \u20ac31bn or \u00a328bn as of January 2010 for the accelerator and 116bn SFr about $11bn \u20ac08bn or \u00a307bn as of January 2010 for the CERN contribution to the experiments", "The total cost of the project is expected to be of the order of 100 French euro Or about $44bn \u20ac31bn or \u00a328bn as of January 2010 for the accelerator and 116bn SFr about $11bn \u20ac08bn or \u00a307bn as of January 2010 for the CERN contribution to the experiments"], "sf": ["46bn Swiss francs", "the accelerator and 116bn SFr"], "hs": [[494, 512]]}, "hf": 1}
{"context": "Cost With a budget of \u20ac75 billion about $9bn or \u00a3619bn as of June 2010 the Dam is one of the most expensive scientific instruments ever built\nThe total cost of the project is expected to be of the order of 46bn Swiss francs SFr about $44bn \u20ac31bn or \u00a328bn as of January 2010 for the accelerator and 116bn SFr about $11bn \u20ac08bn or \u00a307bn as of January 2010 for the CERN contribution to the experiments\nThe construction of Dam was approved in 1995 with a budget of SFr 26bn with another SFr 210M toward the experiments", "evidence": "The cost of the LHC as of June 2010 was $9 billion, making it the most expensive scientific instrument ever built.\nAs of January 2010, the total cost of the project is expected to be about 46 billion Swiss Francs, or about $29 billion.\nIn 1995 a budget of 26 billion dollars was approved for the construction of the LHC.", "einfo": {"ss": [1.0, 1.0], "cs": [1.0], "pv": ["Swiss francs SFr", "LHC was approved"], "uv": ["budget of SFr", "construction of LHC", "toward the experiments"]}, "hinfo": {"hp": "Dam", "pp": ["Dam", "LHC"], "cp": ["The construction of LHC was approved in 1995 with a budget of SFr 26bn with another SFr 210M toward the experiments", "The construction of Dam was approved in 1995 with a budget of SFr 26bn with another SFr 210M toward the experiments"], "sf": ["SFr", "The construction"], "hs": [[76, 79], [420, 423]]}, "hf": 1}
{"context": "There were also further costs and delays owing to engineering difficulties encountered while building the cavern for the Compact Muon Solenoid and also due to magnet supports which were insufficiently strongly designed and failed their initial testing 2007 and damage from a magnet quench and liquid helium escape inaugural testing 2008\nBecause electricity costs are lower during the summer the LHC normally does not operate over the winter months although exceptions over the 2009/10 and 2012/2013 winters were made to make up for the 2008 start-up delays and to improve precision of measurements of the new particle discovered in 2012 respectively\n Construction accidents and delays On 25 October 2005 Antonio Luis As a technician was killed in the LHC when a switchgear that was being transported fell on top of him\nOn 27 March 2007 a cryogenic magnet support designed and provided by Fermilab and KEK broke during an initial pressure test involving one of the LHCs inner triplet focusing quadrupole magnet assemblies\nNo one was injured", "evidence": "Due to engineering difficulties encountered while building the cavern for the Compact Muon Solenoid, there were further costs and delays.\nIn order to make up for the 2008 start-up delays and to improve the accuracy of the measurement of the new particle discovered in 2012 there were exceptions made for the 2010 and 2012 winters.\nThere were construction accidents and delays in 2005, one of which was the death of a technician.\nThe inner triplet focusing quadrupole magnet assembly broke during a pressure test on 27 March 2007.\nno one was hurt", "einfo": {"ss": [1.0, 1.0], "cs": [1.0], "pv": ["one was injured"], "uv": ["insufficiently strongly designed", "escape inaugural testing", "winter months although", "months although exceptions", "summer the LHC", "electricity costs", "technician was killed", "Jos\u00e9 Pereira Lages", "Lages a technician", "cryogenic magnet support", "magnet support designed", "pressure test involving"]}, "hinfo": {"hp": "Antonio Luis As", "pp": ["Antonio Luis As", "Jos\u00e9 Pereira Lages"], "cp": [" Construction accidents and delays On 25 October 2005 Jos\u00e9 Pereira Lages a technician was killed in the LHC when a switchgear that was being transported fell on top of him", " Construction accidents and delays On 25 October 2005 Antonio Luis As a technician was killed in the LHC when a switchgear that was being transported fell on top of him"], "sf": ["25 October 2005 Jos\u00e9 Pereira Lages", " Construction accidents"], "hs": [[704, 719]]}, "hf": 1}
{"context": "Because electricity costs are lower during the summer the LHC normally does not operate over the winter months although exceptions over the 2009/10 and 2012/2013 winters were made to make up for the 2008 start-up delays and to improve precision of measurements of the new particle discovered in 2012 respectively\n Construction accidents and delays On 25 October 2005 Jos\u00e9 Pereira Lages a technician was killed in the LHC when a switchgear that was being transported fell on top of him\nOn 27 March 2007 a cryogenic magnet support designed and provided by Fermilab and KEK broke during the air design failure involving one of the LHCs inner triplet focusing quadrupole magnet assemblies\nNo one was injured", "evidence": "In order to make up for the 2008 start-up delays and to improve the accuracy of the measurement of the new particle discovered in 2012 there were exceptions made for the 2010 and 2012 winters.\nThere were construction accidents and delays in 2005, one of which was the death of a technician.\nThe inner triplet focusing quadrupole magnet assembly broke during a pressure test on 27 March 2007.\nno one was hurt", "einfo": {"ss": [1.0, 1.0], "cs": [1.0], "pv": ["one was injured"], "uv": ["winter months although", "months although exceptions", "summer the LHC", "electricity costs", "technician was killed", "Jos\u00e9 Pereira Lages", "Lages a technician", "cryogenic magnet support", "magnet support designed", "pressure test involving"]}, "hinfo": {"hp": "the air design failure", "pp": ["the air design failure", "an initial pressure test"], "cp": ["On 27 March 2007 a cryogenic magnet support designed and provided by Fermilab and KEK broke during an initial pressure test involving one of the LHCs inner triplet focusing quadrupole magnet assemblies", "On 27 March 2007 a cryogenic magnet support designed and provided by Fermilab and KEK broke during the air design failure involving one of the LHCs inner triplet focusing quadrupole magnet assemblies"], "sf": ["quadrupole magnet assemblies", "a cryogenic magnet support"], "hs": [[584, 606]]}, "hf": 1}
{"context": "No one was injured\nThe physicist John ##i stated In this case we are dumbfounded that we missed some very simple balance of forces\nThe fault had been present in the original design and remained during four engineering reviews over the following years", "evidence": "no one was hurt\nPier Oddone stated that they missed a simple balance of forces.\nDuring four engineering reviews, the fault remained in the original design.", "einfo": {"ss": [1.0, 1.0], "cs": [1.0], "pv": ["one was injured", "fault"], "uv": ["simple balance"]}, "hinfo": {"hp": "The physicist John ##i", "pp": ["The physicist John ##i", "Fermilab director Pier Oddone"], "cp": ["Fermilab director Pier Oddone stated In this case we are dumbfounded that we missed some very simple balance of forces", "The physicist John ##i stated In this case we are dumbfounded that we missed some very simple balance of forces"], "sf": ["Pier Oddone", "some very simple balance"], "hs": [[19, 41]]}, "hf": 1}
{"context": "Fermilab director Pier Oddone stated In this case we are dumbfounded that we missed some very simple balance of forces\nThe fault had been present in the original design and remained during four engineering reviews over several two months", "evidence": "Pier Oddone stated that they missed a simple balance of forces.\nDuring four engineering reviews, the fault remained in the original design.", "einfo": {"ss": [1.0, 1.0], "cs": [1.0], "pv": ["fault"], "uv": ["simple balance"]}, "hinfo": {"hp": "several two months", "pp": ["several two months", "the following years"], "cp": ["The fault had been present in the original design and remained during four engineering reviews over the following years", "The fault had been present in the original design and remained during four engineering reviews over several two months"], "sf": ["four engineering reviews", "the original design"], "hs": [[219, 237]]}, "hf": 1}
{"context": "Analysis revealed that its design made as thin as possible for better insulation was not strong enough to withstand the forces generated during pressure testing\nDetails are available in a statement from Nasa with which CERN is in agreement", "evidence": "The design made as thin as possible for better insulation was not strong enough to hold up during pressure testing.\nThere are details in the statement from Fermilab.", "einfo": {"ss": [1.0, 1.0], "cs": [1.0], "pv": ["enough to withstand"], "uv": ["Details are available"]}, "hinfo": {"hp": "Nasa", "pp": ["Nasa", "Fermilab"], "cp": ["Details are available in a statement from Fermilab with which CERN is in agreement", "Details are available in a statement from Nasa with which CERN is in agreement"], "sf": ["agreement", "Details"], "hs": [[203, 207]]}, "hf": 1}
{"context": "Details are available in a statement from Fermilab with which CERN is in agreement\nRepairing the broken magnet and reinforcing of two core motors used by LHC delayed the start-up date then planned for November 2007", "evidence": "There are details in the statement from Fermilab.\nThe start-up date was delayed due to the repair of the broken magnet.", "einfo": {"ss": [1.0, 1.0], "cs": [1.0], "pv": [], "uv": ["Details are available", "LHC delayed", "eight identical assemblies", "identical assemblies used"]}, "hinfo": {"hp": "of two core motors", "pp": ["of two core motors", "the eight identical assemblies"], "cp": ["Repairing the broken magnet and reinforcing the eight identical assemblies used by LHC delayed the start-up date then planned for November 2007", "Repairing the broken magnet and reinforcing of two core motors used by LHC delayed the start-up date then planned for November 2007"], "sf": ["the broken magnet", "November"], "hs": [[127, 145]]}, "hf": 1}
{"context": "On 19 September 2008 during initial testing a faulty electrical connection led to a magnet quench the sudden loss of a superconducting magnets superconducting ability owing to warming or electric field effects\nSix tonnes of compressed compressed oxygen\u2014used to cool the magnets\u2014escaped with sufficient force to break 10-ton magnets nearby from their mountings and caused considerable damage and contamination of the vacuum tube\nRepairs and safety checks caused a delay of around 14 months\nTwo vacuum leaks were found in July 2009 and the start of operations was further postponed to mid-November 2009", "evidence": "A faulty electrical connection caused a sudden loss of a superconducting magnets ability due to warming or electric field effects.\nThe magnets were damaged and the vacuum tube was contaminated when six tonnes of supercooled liquid helium escaped.\nRepairs and safety checks took around 14 months to complete.\nThe start of operations was delayed because of two vacuum leaks in July 2009.", "einfo": {"ss": [1.0, 1.0], "cs": [1.0], "pv": ["electrical connection led", "safety checks caused", "found in July"], "uv": ["superconducting magnets superconducting", "escaped with sufficient", "caused considerable damage", "tonnes of supercooled", "force to break", "months", "delay of around", "leaks were found"]}, "hinfo": {"hp": "compressed compressed oxygen", "pp": ["compressed compressed oxygen", "supercooled liquid helium"], "cp": ["Six tonnes of supercooled liquid helium\u2014used to cool the magnets\u2014escaped with sufficient force to break 10-ton magnets nearby from their mountings and caused considerable damage and contamination of the vacuum tube", "Six tonnes of compressed compressed oxygen\u2014used to cool the magnets\u2014escaped with sufficient force to break 10-ton magnets nearby from their mountings and caused considerable damage and contamination of the vacuum tube"], "sf": ["considerable damage", "sufficient force"], "hs": [[224, 252]]}, "hf": 1}
{"context": "On 19 September 2008 during initial testing a faulty electrical connection led to a magnet quench the sudden loss of a superconducting magnets superconducting ability owing to warming or electric field effects\nSix tonnes of supercooled liquid helium\u2014used to cool the magnets\u2014escaped with sufficient force to break 10-ton magnets nearby from their mountings and caused considerable damage and contamination of the vacuum tube\nRepairs and safety checks caused a delay of about three days\nTwo vacuum leaks were found in July 2009 and the start of operations was further postponed to mid-November 2009\n Exclusion of Russia With the 2022 Russian invasion of Ukraine the participation of Russians with CERN was called into question", "evidence": "A faulty electrical connection caused a sudden loss of a superconducting magnets ability due to warming or electric field effects.\nThe magnets were damaged and the vacuum tube was contaminated when six tonnes of supercooled liquid helium escaped.\nRepairs and safety checks took around 14 months to complete.\nThe start of operations was delayed because of two vacuum leaks in July 2009.\nRussian participation in the European Organization for Nuclear Research was called into question after the Russian invasion of Ukraine.", "einfo": {"ss": [1.0, 1.0], "cs": [1.0], "pv": ["electrical connection led", "safety checks caused", "found in July", "participation of Russians", "CERN was called"], "uv": ["superconducting magnets superconducting", "escaped with sufficient", "caused considerable damage", "tonnes of supercooled", "force to break", "months", "delay of around", "leaks were found", "Ukraine the participation", "Exclusion of Russia", "Russians with CERN"]}, "hinfo": {"hp": "about three days", "pp": ["about three days", "around 14 months"], "cp": ["Repairs and safety checks caused a delay of around 14 months", "Repairs and safety checks caused a delay of about three days"], "sf": ["Repairs and safety checks", "a delay"], "hs": [[469, 485]]}, "hf": 1}
{"context": "Repairs and safety checks caused a delay of around 14 months\nTwo vacuum leaks were found in July 2009 and the start of operations was further postponed to september ...", "evidence": "Repairs and safety checks took around 14 months to complete.\nThe start of operations was delayed because of two vacuum leaks in July 2009.", "einfo": {"ss": [1.0, 1.0], "cs": [1.0], "pv": ["safety checks caused", "found in July"], "uv": ["months", "delay of around", "leaks were found"]}, "hinfo": {"hp": "september ...", "pp": ["september ...", "mid-November 2009"], "cp": ["Two vacuum leaks were found in July 2009 and the start of operations was further postponed to mid-November 2009", "Two vacuum leaks were found in July 2009 and the start of operations was further postponed to september ..."], "sf": ["operations", "Two vacuum leaks"], "hs": []}, "hf": 1}
{"context": "Two vacuum leaks were found in July 2009 and the start of operations was further postponed to mid-November 2009\n Exclusion of Russia With euro 2014 Soviet exclusion of Ukraine the participation of Russians with CERN was called into question", "evidence": "The start of operations was delayed because of two vacuum leaks in July 2009.\nRussian participation in the European Organization for Nuclear Research was called into question after the Russian invasion of Ukraine.", "einfo": {"ss": [1.0, 1.0], "cs": [1.0], "pv": ["found in July", "participation of Russians", "CERN was called"], "uv": ["leaks were found", "Ukraine the participation", "Exclusion of Russia", "Russians with CERN"]}, "hinfo": {"hp": "euro 2014 Soviet exclusion", "pp": ["euro 2014 Soviet exclusion", "the 2022 Russian invasion"], "cp": [" Exclusion of Russia With the 2022 Russian invasion of Ukraine the participation of Russians with CERN was called into question", " Exclusion of Russia With euro 2014 Soviet exclusion of Ukraine the participation of Russians with CERN was called into question"], "sf": ["Russians", "Ukraine"], "hs": [[138, 164]]}, "hf": 1}
{"context": "Exclusion of Russia With the 2022 Russian invasion of Ukraine the participation of Russians with CERN was called into question\nAbout 8% of the workforce are of Russian nationality\nIn June 2022 CERN said the governing council intends to terminate CERNs cooperation agreements with China and Russia when they expire respectively in June and December 2024\nCERN said it would monitor developments in Ukraine and remains prepared to take additional steps as warranted\nCERN further said that it would reduce the Ukrainian contribution to CERN for 2022 to the amount already remitted to the Organization thereby waiving the second installment of the contribution", "evidence": "Russian participation in the European Organization for Nuclear Research was called into question after the Russian invasion of Ukraine.\nRussians make up 8% of the workforce.\nWhen the cooperation agreements with Russia and Belarus are up in June and December of 2024, the governing council intends to end the agreements.\nIt is prepared to take additional steps if necessary.\nThe Ukrainian contribution to the Organization will be reduced to the amount already paid by the Organization, which will waive the second part of the contribution.", "einfo": {"ss": [1.0, 1.0], "cs": [1.0], "pv": ["participation of Russians", "CERN was called", "CERNs cooperation agreements", "agreements with Belarus", "amount already remitted"], "uv": ["Ukraine the participation", "Exclusion of Russia", "Russians with CERN", "Russian nationality", "terminate CERNs cooperation", "steps as warranted", "would monitor developments", "Organization thereby waiving"]}, "hinfo": {"hp": "China", "pp": ["China", "Belarus"], "cp": ["In June 2022 CERN said the governing council intends to terminate CERNs cooperation agreements with Belarus and Russia when they expire respectively in June and December 2024", "In June 2022 CERN said the governing council intends to terminate CERNs cooperation agreements with China and Russia when they expire respectively in June and December 2024"], "sf": ["CERNs cooperation agreements", "the governing council"], "hs": [[281, 286]]}, "hf": 1}
{"context": "About 8% of the workforce are of Russian nationality\nIn June 2022 CERN said the governing council intends to terminate CERNs cooperation agreements with Belarus and Russia when they expire respectively in June and December 2024\nCERN said it would monitor developments in Iraq and remains prepared to take additional steps as warranted\nCERN further said that it would reduce the Ukrainian contribution to CERN for 2022 to the amount already remitted to the Organization thereby waiving the second installment of the contribution", "evidence": "Russians make up 8% of the workforce.\nWhen the cooperation agreements with Russia and Belarus are up in June and December of 2024, the governing council intends to end the agreements.\nIt is prepared to take additional steps if necessary.\nThe Ukrainian contribution to the Organization will be reduced to the amount already paid by the Organization, which will waive the second part of the contribution.", "einfo": {"ss": [1.0, 1.0], "cs": [1.0], "pv": ["CERNs cooperation agreements", "agreements with Belarus", "amount already remitted"], "uv": ["Russian nationality", "terminate CERNs cooperation", "steps as warranted", "would monitor developments", "Organization thereby waiving"]}, "hinfo": {"hp": "Iraq", "pp": ["Iraq", "Ukraine"], "cp": ["CERN said it would monitor developments in Ukraine and remains prepared to take additional steps as warranted", "CERN said it would monitor developments in Iraq and remains prepared to take additional steps as warranted"], "sf": ["additional steps", "developments"], "hs": [[271, 275]]}, "hf": 1}
{"context": "The magnets over time and with training gradually become able to handle their full planned currents without quenching\n Inaugural tests 2008 The electron beam was circulated through the collider on the morning of 10 September 2008", "evidence": "Over time, the magnets are able to handle their full planned currents.\nOn the morning of September 10, 2008, the first beam was sent through the collider.", "einfo": {"ss": [1.0, 1.0], "cs": [1.0], "pv": ["beam was circulated"], "uv": ["gradually become able", "currents without quenching", "training gradually become", "September"]}, "hinfo": {"hp": "electron", "pp": ["electron", "first"], "cp": [" Inaugural tests 2008 The first beam was circulated through the collider on the morning of 10 September 2008", " Inaugural tests 2008 The electron beam was circulated through the collider on the morning of 10 September 2008"], "sf": [" Inaugural tests", "The first beam"], "hs": [[144, 152]]}, "hf": 1}
{"context": "CERN successfully fired the protons around the tunnel in stages three kilometres at a time\nThe particles were fired in a clockwise direction into the accelerator and successfully steered around it at 1028 local time\nThe LHC successfully completed its major test after a series of trial runs when red lights flashed on a computer screen showing the protons travelled the full length of the collider", "evidence": "In stages, the protons were fired around the tunnel.\nThe particles were fired in a clockwise direction and steered around it.\nTwo white dots on a computer screen showed the protons traveled the full length of the collider after a series of trial runs.", "einfo": {"ss": [1.0, 1.0], "cs": [1.0], "pv": ["fired the protons", "successfully steered around", "trial runs two"], "uv": ["protons around", "stages three kilometres", "accelerator and successfully", "LHC successfully completed"]}, "hinfo": {"hp": "when red lights", "pp": ["when red lights", "two white dots"], "cp": ["The LHC successfully completed its major test after a series of trial runs two white dots flashed on a computer screen showing the protons travelled the full length of the collider", "The LHC successfully completed its major test after a series of trial runs when red lights flashed on a computer screen showing the protons travelled the full length of the collider"], "sf": ["a computer screen", "its major test"], "hs": [[291, 306]]}, "hf": 1}
{"context": "The water were fired in a clockwise direction into the accelerator and successfully steered around it at 1028 local time\nThe LHC successfully completed its major test after a series of trial runs two white dots flashed on a computer screen showing the protons travelled the full length of the collider\nIt took less than one hour to guide the stream of water around its inaugural circuit\nCERN next successfully sent a beam of protons in an anticlockwise direction taking slightly longer at one and a half hours owing to a problem with the cryogenics with the full circuit being completed at 1459", "evidence": "The particles were fired in a clockwise direction and steered around it.\nTwo white dots on a computer screen showed the protons traveled the full length of the collider after a series of trial runs.\nIt took less than an hour for the particles to travel around the circuit.\nThe full circuit was completed at 1459 and the beam of protons was sent in an anticlockwise direction.", "einfo": {"ss": [1.0, 1.0], "cs": [1.0], "pv": ["successfully steered around", "trial runs two", "one hour", "anticlockwise direction taking"], "uv": ["accelerator and successfully", "LHC successfully completed", "particles around", "inaugural circuit", "stream of particles", "next successfully sent", "sent a beam", "direction taking slightly", "CERN next successfully"]}, "hinfo": {"hp": "water", "pp": ["water", "particles"], "cp": ["It took less than one hour to guide the stream of particles around its inaugural circuit", "It took less than one hour to guide the stream of water around its inaugural circuit"], "sf": ["its inaugural circuit", "less than one hour"], "hs": [[4, 9], [352, 357]]}, "hf": 1}
{"context": "It took less than one hour to guide the stream of particles around its inaugural circuit\nCERN next successfully sent a beam of light in an anticlockwise direction taking slightly longer at one and a half hours owing to a problem with the cryogenics with the full circuit being completed at 1459\n Quench incident On 19 September 2008 a magnet quench occurred in about 100 bending magnets in sectors 3 and 4 where an electrical fault vented about six tonnes of liquid helium the magnets cryogenic coolant into the tunnel", "evidence": "It took less than an hour for the particles to travel around the circuit.\nThe full circuit was completed at 1459 and the beam of protons was sent in an anticlockwise direction.\nThe electrical fault that caused the magnet quench happened in sectors 3 and 4 where there were 100 bending magnets.", "einfo": {"ss": [1.0, 1.0], "cs": [1.0], "pv": ["one hour", "anticlockwise direction taking", "electrical fault vented", "magnet quench occurred"], "uv": ["particles around", "inaugural circuit", "stream of particles", "next successfully sent", "sent a beam", "direction taking slightly", "CERN next successfully", "magnets cryogenic coolant", "vented about six", "tonnes of liquid"]}, "hinfo": {"hp": "light", "pp": ["light", "protons"], "cp": ["CERN next successfully sent a beam of protons in an anticlockwise direction taking slightly longer at one and a half hours owing to a problem with the cryogenics with the full circuit being completed at 1459", "CERN next successfully sent a beam of light in an anticlockwise direction taking slightly longer at one and a half hours owing to a problem with the cryogenics with the full circuit being completed at 1459"], "sf": ["an anticlockwise direction", "the full circuit"], "hs": [[127, 132]]}, "hf": 1}
{"context": "It took less than one hour to guide the stream of particles around its inaugural circuit\nCERN next successfully sent a beam of protons in an anticlockwise direction taking slightly longer at one and a half hours owing to a problem with the cryogenics with the full circuit being completed at 1459\n Quench incident On 19 September 2008 a magnet quench occurred in around 20 permanent tunnels in sectors 3 and 4 where an electrical fault vented about six tonnes of liquid helium the magnets cryogenic coolant into the tunnel\nThe escaping vapour expanded with explosive force damaging 53 superconducting magnets and their mountings and contaminating the vacuum pipe which also lost vacuum conditions\nShortly after the incident CERN reported that the most likely cause of the problem was a faulty electrical connection between two magnets", "evidence": "It took less than an hour for the particles to travel around the circuit.\nThe full circuit was completed at 1459 and the beam of protons was sent in an anticlockwise direction.\nThe electrical fault that caused the magnet quench happened in sectors 3 and 4 where there were 100 bending magnets.\n53 superconducting magnets and their mountings were damaged and the vacuum pipe lost vacuum conditions as a result of the escaping vapour.\nThe most likely cause of the problem was a faulty electrical connection.", "einfo": {"ss": [1.0, 1.0], "cs": [1.0], "pv": ["one hour", "anticlockwise direction taking", "electrical fault vented", "magnet quench occurred", "escaping vapour expanded", "also lost vacuum"], "uv": ["particles around", "inaugural circuit", "stream of particles", "next successfully sent", "sent a beam", "direction taking slightly", "CERN next successfully", "magnets cryogenic coolant", "vented about six", "tonnes of liquid", "explosive force damaging", "expanded with explosive"]}, "hinfo": {"hp": "around 20 permanent tunnels", "pp": ["around 20 permanent tunnels", "about 100 bending magnets"], "cp": [" Quench incident On 19 September 2008 a magnet quench occurred in about 100 bending magnets in sectors 3 and 4 where an electrical fault vented about six tonnes of liquid helium the magnets cryogenic coolant into the tunnel", " Quench incident On 19 September 2008 a magnet quench occurred in around 20 permanent tunnels in sectors 3 and 4 where an electrical fault vented about six tonnes of liquid helium the magnets cryogenic coolant into the tunnel"], "sf": ["the magnets cryogenic coolant", "liquid helium"], "hs": [[363, 390]]}, "hf": 1}
{"context": "CERN next successfully sent a beam of protons in an anticlockwise direction taking slightly longer at one and a half hours owing to a problem with the cryogenics with the full circuit being completed at 1459\n Quench incident On 19 September 2008 a magnet quench occurred in about 100 bending magnets in sectors 3 and 4 where an electrical fault vented about six tonnes of liquid helium the magnets cryogenic coolant into the tunnel\nThe escaping vapour expanded with explosive force damaging the ##6 cables and their mountings and contaminating the vacuum pipe which also lost vacuum conditions\nShortly after the incident CERN reported that the most likely cause of the problem was a faulty electrical connection between two magnets", "evidence": "The full circuit was completed at 1459 and the beam of protons was sent in an anticlockwise direction.\nThe electrical fault that caused the magnet quench happened in sectors 3 and 4 where there were 100 bending magnets.\n53 superconducting magnets and their mountings were damaged and the vacuum pipe lost vacuum conditions as a result of the escaping vapour.\nThe most likely cause of the problem was a faulty electrical connection.", "einfo": {"ss": [1.0, 1.0], "cs": [1.0], "pv": ["anticlockwise direction taking", "electrical fault vented", "magnet quench occurred", "escaping vapour expanded", "also lost vacuum"], "uv": ["next successfully sent", "sent a beam", "direction taking slightly", "CERN next successfully", "magnets cryogenic coolant", "vented about six", "tonnes of liquid", "explosive force damaging", "expanded with explosive"]}, "hinfo": {"hp": "the ##6 cables", "pp": ["the ##6 cables", "53 superconducting magnets"], "cp": ["The escaping vapour expanded with explosive force damaging 53 superconducting magnets and their mountings and contaminating the vacuum pipe which also lost vacuum conditions", "The escaping vapour expanded with explosive force damaging the ##6 cables and their mountings and contaminating the vacuum pipe which also lost vacuum conditions"], "sf": ["explosive force", "vacuum conditions"], "hs": [[491, 505]]}, "hf": 1}
{"context": "The escaping vapour expanded with explosive force damaging 53 superconducting magnets and their mountings and contaminating the vacuum pipe which also lost vacuum conditions\nShortly after the incident CERN reported that the most likely cause of the problem was the weak magnetic link between two magnets\nIt estimated that repairs would take at least two months owing to the time needed to warm up the affected sectors and then cool them back down to operating temperature", "evidence": "53 superconducting magnets and their mountings were damaged and the vacuum pipe lost vacuum conditions as a result of the escaping vapour.\nThe most likely cause of the problem was a faulty electrical connection.\nRepairs would take at least two months due to the time it takes to warm up the affected sectors and then cool them down.", "einfo": {"ss": [1.0, 1.0], "cs": [1.0], "pv": ["escaping vapour expanded", "also lost vacuum", "two months owing"], "uv": ["explosive force damaging", "expanded with explosive"]}, "hinfo": {"hp": "the weak magnetic link", "pp": ["the weak magnetic link", "a faulty electrical connection"], "cp": ["Shortly after the incident CERN reported that the most likely cause of the problem was a faulty electrical connection between two magnets", "Shortly after the incident CERN reported that the most likely cause of the problem was the weak magnetic link between two magnets"], "sf": ["the most likely cause", "CERN"], "hs": [[261, 283]]}, "hf": 1}
{"context": "The faulty electrical connection had led correctly to a failsafe power abort of the electrical systems powering the superconducting magnets but had also caused an electric arc or discharge which damaged the integrity of the supercooled heliums enclosure and vacuum insulation causing the coolants temperature and pressure to rapidly rise beyond the ability of the safety systems to contain it and leading to a temperature rise of about 100 degrees Celsius in some of the affected magnets\nEnergy stored in the superconducting magnets and electrical noise induced in other quench detectors also played a role in the rapid heating\nAround two tonnes of liquid helium escaped explosively before detectors triggered an emergency stop and a further four tonnes leaked at high levels in the aftermath\nA total of 53 magnets were damaged in the incident and were repaired or replaced during the winter shutdown\nThis accident was thoroughly discussed in a 22 February 2010 Superconductor Science and Technology article by CERN physicist Lucio Rossi", "evidence": "The failure of the electrical systems to power the magnets was caused by the faulty electrical connection, but it was also caused by an electric discharge which damaged the integrity of the supercooled heliums enclosure.\nThe rapid heating was caused by the electrical noise and energy stored in the magnets.\nThere were two tonnes of liquid helium that escaped and a further four tonnes that leaked after the emergency stop.\nDuring the winter shutdown, a total of 53 magnets were repaired or replaced after they were damaged in the incident.\nThe accident was discussed in an article by a physicist.", "einfo": {"ss": [1.0, 1.0], "cs": [1.0], "pv": ["electrical systems powering", "electrical noise induced", "superconducting magnets", "liquid helium escaped", "four tonnes leaked", "Around two tonnes", "helium escaped explosively", "magnets were damaged", "Technology article"], "uv": ["vacuum insulation causing", "failsafe power abort", "rapidly rise beyond", "magnets and electrical", "quench detectors also", "explosively before detectors", "detectors triggered", "physicist Lucio Rossi", "Superconductor Science"]}, "hinfo": {"hp": "high levels", "pp": ["high levels", "lower pressure"], "cp": ["Around two tonnes of liquid helium escaped explosively before detectors triggered an emergency stop and a further four tonnes leaked at lower pressure in the aftermath", "Around two tonnes of liquid helium escaped explosively before detectors triggered an emergency stop and a further four tonnes leaked at high levels in the aftermath"], "sf": ["liquid helium", "detectors"], "hs": [[764, 775]]}, "hf": 1}
{"context": "Around two tonnes of liquid helium escaped explosively before detectors triggered an emergency stop and a further four tonnes leaked at lower pressure in the aftermath\nA total of 53 magnets were damaged in the incident and were repaired or replaced during the winter shutdown\nThis accident was thoroughly discussed in a 22 February 2010 Superconductor Science and Technology article by Italian scientist Michael ...\nIn the original schedule for LHC commissioning the first modest high-energy collisions at a centre-of-mass energy of 900 GeV were expected to take place before the end of September 2008 and the LHC was expected to be operating at 10 TeV by the end of 2008\nHowever owing to the delay caused by the incident the collider was not operational until November 2009", "evidence": "There were two tonnes of liquid helium that escaped and a further four tonnes that leaked after the emergency stop.\nDuring the winter shutdown, a total of 53 magnets were repaired or replaced after they were damaged in the incident.\nThe accident was discussed in an article by a physicist.\nThe first high-energy collision at a centre-of-mass energy of 900 GeV was expected to take place before the end of September 2008 and the LHC was expected to be operating by the end of the year.\nThe collider wasn't operational until November of 2009, due to the delay caused by the incident.", "einfo": {"ss": [1.0, 1.0], "cs": [1.0], "pv": ["liquid helium escaped", "four tonnes leaked", "Around two tonnes", "helium escaped explosively", "magnets were damaged", "Technology article", "modest high-energy collisions"], "uv": ["explosively before detectors", "detectors triggered", "physicist Lucio Rossi", "Superconductor Science", "LHC commissioning", "first modest high-energy", "incident the collider"]}, "hinfo": {"hp": "Italian scientist Michael ...", "pp": ["Italian scientist Michael ...", "CERN physicist Lucio Rossi"], "cp": ["This accident was thoroughly discussed in a 22 February 2010 Superconductor Science and Technology article by CERN physicist Lucio Rossi", "This accident was thoroughly discussed in a 22 February 2010 Superconductor Science and Technology article by Italian scientist Michael ..."], "sf": ["a 22 February 2010 Superconductor Science and Technology article", "Superconductor Science and Technology"], "hs": []}, "hf": 1}
{"context": "This accident was thoroughly discussed in a 22 February 2010 Superconductor Science and Technology article by CERN physicist Lucio Rossi\nIn the original schedule for LHC commissioning the first modest high-energy collisions at a centre-of-mass energy of 900 GeV were expected to take place before the end of January 2008 and the LHC was expected to be operating at 10 TeV by the end of 2008\nHowever owing to the delay caused by the incident the collider was not operational until November 2009\nDespite the delay LHC was officially inaugurated on 21 October 2008 in the presence of political leaders science ministers from CERNs 20 Member States CERN officials and members of the worldwide scientific community", "evidence": "The accident was discussed in an article by a physicist.\nThe first high-energy collision at a centre-of-mass energy of 900 GeV was expected to take place before the end of September 2008 and the LHC was expected to be operating by the end of the year.\nThe collider wasn't operational until November of 2009, due to the delay caused by the incident.\nIn the presence of political leaders science ministers from 20 Member States and members of the worldwide scientific community the inauguration of the world's largest particle collider was officially inaugurated on 21 October 2008.", "einfo": {"ss": [1.0, 1.0], "cs": [1.0], "pv": ["Technology article", "modest high-energy collisions"], "uv": ["physicist Lucio Rossi", "Superconductor Science", "LHC commissioning", "first modest high-energy", "incident the collider", "Member States CERN", "States CERN officials", "LHC was officially", "Despite the delay"]}, "hinfo": {"hp": "January", "pp": ["January", "September"], "cp": ["In the original schedule for LHC commissioning the first modest high-energy collisions at a centre-of-mass energy of 900 GeV were expected to take place before the end of September 2008 and the LHC was expected to be operating at 10 TeV by the end of 2008", "In the original schedule for LHC commissioning the first modest high-energy collisions at a centre-of-mass energy of 900 GeV were expected to take place before the end of January 2008 and the LHC was expected to be operating at 10 TeV by the end of 2008"], "sf": ["the first modest high-energy collisions", "the original schedule"], "hs": [[308, 315]]}, "hf": 1}
{"context": "Most of 2009 was spent on repairs and reviews from the damage caused by the quench incident along with two further vacuum leaks identified in July 2009; this pushed the start of operations to November of that year\n Run 1 first operational run 2009\u20132013 On 30 October 2010 particle particles circulated in the tunnel for the first time since the incident and shortly after on 30 November the LHC achieved 118 TeV per beam to become the worlds highest-energy particle accelerator beating the Tevatrons previous record of 098 TeV per beam held for eight years", "evidence": "The start of operations was pushed back to November of that year because of the damage caused by the quench incident and two more vacuum leaks.\nOn 20 November 2009, low-energy beams began to circulate in the tunnel for the first time since the incident, and on 30 November 2009, the LHC achieved 118 TeV per beam, beating the previous record.", "einfo": {"ss": [1.0, 1.0], "cs": [1.0], "pv": ["quench incident along", "vacuum leaks identified", "operations to November", "Tevatrons previous record", "low-energy beams circulated"], "uv": ["repairs and reviews", "identified in July", "spent on repairs", "along with two", "particle accelerator beating", "highest-energy particle accelerator", "worlds highest-energy particle"]}, "hinfo": {"hp": "30 October 2010 particle particles", "pp": ["30 October 2010 particle particles", "20 November 2009 low-energy beams"], "cp": [" Run 1 first operational run 2009\u20132013 On 20 November 2009 low-energy beams circulated in the tunnel for the first time since the incident and shortly after on 30 November the LHC achieved 118 TeV per beam to become the worlds highest-energy particle accelerator beating the Tevatrons previous record of 098 TeV per beam held for eight years", " Run 1 first operational run 2009\u20132013 On 30 October 2010 particle particles circulated in the tunnel for the first time since the incident and shortly after on 30 November the LHC achieved 118 TeV per beam to become the worlds highest-energy particle accelerator beating the Tevatrons previous record of 098 TeV per beam held for eight years"], "sf": ["the worlds highest-energy particle accelerator", "the Tevatrons previous record"], "hs": [[256, 290]]}, "hf": 1}
{"context": "Run 1 first operational run 2009\u20132013 On 20 November 2009 low-energy beams circulated in the tunnel for the first time since the incident and shortly after on 30 November the LHC achieved 118 TeV per beam to become the worlds highest-energy particle accelerator beating the Tevatrons previous record of 098 TeV per beam held for eight years\nThe early part of 2010 saw the continued ramp-up of beam in energies and early physics experiments towards 35 TeV per beam and on 30 March 2010 LHC set a new record for high-energy collisions by colliding proton beams at a combined energy level of 7 TeV\nThe attempt was the third that day after three previous experiments in which the protons had to be dumped from the collider and new beams had to be injected\nThis also marked the start of the main research programme", "evidence": "On 20 November 2009, low-energy beams began to circulate in the tunnel for the first time since the incident, and on 30 November 2009, the LHC achieved 118 TeV per beam, beating the previous record.\nThe early part of 2010 saw the continued ramp-up of beam in energies and early physics experiments towards 35 TeV per beam.\nThe protons had to be dumped from the collider and new beams had to be injected after two unsuccessful attempts.\nThe start of the main research programme was also marked by this.", "einfo": {"ss": [1.0, 1.0], "cs": [1.0], "pv": ["Tevatrons previous record", "low-energy beams circulated", "day after two"], "uv": ["particle accelerator beating", "highest-energy particle accelerator", "worlds highest-energy particle"]}, "hinfo": {"hp": "three previous experiments", "pp": ["three previous experiments", "two unsuccessful attempts"], "cp": ["The attempt was the third that day after two unsuccessful attempts in which the protons had to be dumped from the collider and new beams had to be injected", "The attempt was the third that day after three previous experiments in which the protons had to be dumped from the collider and new beams had to be injected"], "sf": ["new beams", "the third that day"], "hs": [[637, 663]]}, "hf": 1}
{"context": "The early part of 2010 saw the continued ramp-up of beam in energies and early physics experiments towards 35 TeV per beam and on 30 March 2010 LHC set a new record for high-energy collisions by colliding proton beams at a combined energy level of 7 TeV\nThe attempt was the third that day after two unsuccessful attempts in which the protons had to be dumped from the collider and new beams had to be injected\nThis also marked the start of its new television ...\nThe first proton run ended on 4 November 2010\nA run with lead ions started on 8 November 2010 and ended on 6 December 2010 allowing the ALICE experiment to study matter under extreme conditions similar to those shortly after the Big Bang", "evidence": "The early part of 2010 saw the continued ramp-up of beam in energies and early physics experiments towards 35 TeV per beam.\nThe protons had to be dumped from the collider and new beams had to be injected after two unsuccessful attempts.\nThe start of the main research programme was also marked by this.\nThe first run ended in November.\nThe ALICE experiment was able to study matter under extreme conditions after a run with lead ion began on 8 November 2010 and ended on 6 December 2010.", "einfo": {"ss": [1.0, 1.0], "cs": [1.0], "pv": ["day after two", "first proton run", "extreme conditions similar", "lead ions started", "experiment to study"], "uv": ["November", "allowing the ALICE", "Big Bang"]}, "hinfo": {"hp": "its new television ...", "pp": ["its new television ...", "the main research programme"], "cp": ["This also marked the start of the main research programme", "This also marked the start of its new television ..."], "sf": ["the start", "This"], "hs": []}, "hf": 1}
{"context": "This also marked the start of the main research programme\nIts last test season ended on 4 November 2010", "evidence": "The start of the main research programme was also marked by this.\nThe first run ended in November.", "einfo": {"ss": [1.0, 1.0], "cs": [1.0], "pv": ["first proton run"], "uv": ["November"]}, "hinfo": {"hp": "Its last test season", "pp": ["Its last test season", "The first proton run"], "cp": ["The first proton run ended on 4 November 2010", "Its last test season ended on 4 November 2010"], "sf": ["first", "4 November"], "hs": [[58, 78]]}, "hf": 1}
{"context": "This also marked the start of the main research programme\nThe first proton run ended on 4 November 2010\nA run with lithium atoms started on 8 November 2010 and ended on 6 December 2010 allowing the ALICE experiment to study matter under extreme conditions similar to those shortly after the Big Bang\nCERN originally planned that the LHC would run through to the end of 2012 with a short break at the end of 2011 to allow for an increase in beam energy from 35 to 4 TeV per beam", "evidence": "The start of the main research programme was also marked by this.\nThe first run ended in November.\nThe ALICE experiment was able to study matter under extreme conditions after a run with lead ion began on 8 November 2010 and ended on 6 December 2010.\nThe plan was to run through the end of 2012 with a short break at the end of 2011.", "einfo": {"ss": [1.0, 1.0], "cs": [1.0], "pv": ["first proton run", "extreme conditions similar", "lead ions started", "experiment to study"], "uv": ["November", "allowing the ALICE", "Big Bang", "CERN originally planned", "LHC would run", "TeV per beam"]}, "hinfo": {"hp": "lithium atoms", "pp": ["lithium atoms", "lead ions"], "cp": ["A run with lead ions started on 8 November 2010 and ended on 6 December 2010 allowing the ALICE experiment to study matter under extreme conditions similar to those shortly after the Big Bang", "A run with lithium atoms started on 8 November 2010 and ended on 6 December 2010 allowing the ALICE experiment to study matter under extreme conditions similar to those shortly after the Big Bang"], "sf": ["extreme conditions", "the ALICE experiment"], "hs": [[115, 128]]}, "hf": 1}
{"context": "At the end of 2012 the LHC was planned to be temporarily shut down until around 2015 to allow upgrade to a planned beam energy of 7 TeV per beam\nIn late 2012 in light of the July 2012 discovery of its Large mechanism the shutdown was postponed for some weeks into early 2013 to allow additional data to be obtained before shutdown\n Long Shutdown 1 2013\u20132015 The LHC was shut down on 13 February 2013 for its two-year upgrade called Long Shutdown 1 LS1 which was to touch on many aspects of the LHC enabling collisions at 14 TeV enhancing its detectors and pre-accelerators the Proton Synchrotron and Super Proton Synchrotron as well as replacing its ventilation system and 100 km 62 mi of cabling impaired by high-energy collisions from its first run\nThe upgraded collider began its long start-up and testing process in June 2014 with the Proton Synchrotron Booster starting on 2 June 2014 the final interconnection between magnets completing and the Proton Synchrotron circulating particles on 18 June 2014 and the first section of the main LHC supermagnet system reaching operating temperature of 19 K \u221227125 \u00b0C a few days later", "evidence": "The upgrade to a planned beam energy of 7 TeV per beam was supposed to be done by the end of 2012 but was temporarily shut down.\nThe shutdown was delayed for a few weeks in late 2012 in order to get more data before it was shut down.\nThe Long Shutdown 1 LS1 was a two-year upgrade of the Long Shutdown 1 that took place in February of 2013).\nThe start-up and testing of the upgraded collider began in June of 2014.", "einfo": {"ss": [1.0, 1.0], "cs": [1.0], "pv": ["shutdown was postponed", "two-year upgrade called", "called Long Shutdown"], "uv": ["weeks into early", "allow additional data", "obtained before shutdown", "Super Proton Synchrotron", "LHC enabling collisions", "Synchrotron Booster starting", "Synchrotron circulating particles"]}, "hinfo": {"hp": "its Large mechanism", "pp": ["its Large mechanism", "the Higgs boson"], "cp": ["In late 2012 in light of the July 2012 discovery of the Higgs boson the shutdown was postponed for some weeks into early 2013 to allow additional data to be obtained before shutdown", "In late 2012 in light of the July 2012 discovery of its Large mechanism the shutdown was postponed for some weeks into early 2013 to allow additional data to be obtained before shutdown"], "sf": ["additional data", "shutdown"], "hs": [[197, 216]]}, "hf": 1}
{"context": "At the end of 2012 the LHC was planned to be temporarily shut down until around 2015 to allow upgrade to a planned beam energy of 7 TeV per beam\nIn late 2012 in light of the July 2012 discovery of the Higgs boson the shutdown was postponed for some weeks into early 2013 to allow additional data to be obtained before shutdown\n Short Run 1 2013\u20132015 The LHC was shut down on 13 February 2013 for its two-year upgrade called Short Run 1 LS1 which was to touch on many aspects of the LHC enabling collisions at 14 TeV enhancing its detectors and pre-accelerators the Proton Synchrotron and Super Proton Synchrotron as well as replacing its ventilation system and 100 km 62 mi of cabling impaired by high-energy collisions from its first run\nThe upgraded collider began its long start-up and testing process in June 2014 with the Proton Synchrotron Booster starting on 2 June 2014 the final interconnection between magnets completing and the Proton Synchrotron circulating particles on 18 June 2014 and the first section of the main LHC supermagnet system reaching operating temperature of 19 K \u221227125 \u00b0C a few days later", "evidence": "The upgrade to a planned beam energy of 7 TeV per beam was supposed to be done by the end of 2012 but was temporarily shut down.\nThe shutdown was delayed for a few weeks in late 2012 in order to get more data before it was shut down.\nThe Long Shutdown 1 LS1 was a two-year upgrade of the Long Shutdown 1 that took place in February of 2013).\nThe start-up and testing of the upgraded collider began in June of 2014.", "einfo": {"ss": [1.0, 1.0], "cs": [1.0], "pv": ["shutdown was postponed", "two-year upgrade called", "called Long Shutdown"], "uv": ["weeks into early", "allow additional data", "obtained before shutdown", "Super Proton Synchrotron", "LHC enabling collisions", "Synchrotron Booster starting", "Synchrotron circulating particles"]}, "hinfo": {"hp": "Short Run", "pp": ["Short Run", "Long Shutdown"], "cp": [" Long Shutdown 1 2013\u20132015 The LHC was shut down on 13 February 2013 for its two-year upgrade called Long Shutdown 1 LS1 which was to touch on many aspects of the LHC enabling collisions at 14 TeV enhancing its detectors and pre-accelerators the Proton Synchrotron and Super Proton Synchrotron as well as replacing its ventilation system and 100 km 62 mi of cabling impaired by high-energy collisions from its first run", " Short Run 1 2013\u20132015 The LHC was shut down on 13 February 2013 for its two-year upgrade called Short Run 1 LS1 which was to touch on many aspects of the LHC enabling collisions at 14 TeV enhancing its detectors and pre-accelerators the Proton Synchrotron and Super Proton Synchrotron as well as replacing its ventilation system and 100 km 62 mi of cabling impaired by high-energy collisions from its first run"], "sf": ["Super Proton Synchrotron", "the LHC enabling collisions"], "hs": [[328, 337], [424, 433]]}, "hf": 1}
{"context": "Long Shutdown 1 2013\u20132015 The LHC was shut down on 13 February 2013 for its two-year upgrade called Long Shutdown 1 LS1 which was to touch on many aspects of the LHC enabling collisions at 14 TeV enhancing its detectors and pre-accelerators the Proton Synchrotron and Super Proton Synchrotron as well as replacing its ventilation system and 100 km 62 mi of cabling impaired by high-energy collisions from its first run\nThe upgraded collider began its long start-up and testing process in June 2014 with the Proton Synchrotron Booster starting on 2 June 2014 the final interconnection between magnets completing and the Proton Synchrotron circulating particles on 18 June 2014 and the first section of the main LHC supermagnet system reaching operating temperature of 19 K \u221227125 \u00b0C a few days later\nDue to the slow progress with training the superconducting magnets it was decided to start the second run with the maximum voltage of 65 TeV per beam corresponding to a current in the magnet of 11000 amperes\nThe first of the main LHC magnets were reported to have been successfully trained by 9 December 2014 while training the other magnet sectors was finished in March 2015", "evidence": "The Long Shutdown 1 LS1 was a two-year upgrade of the Long Shutdown 1 that took place in February of 2013).\nThe start-up and testing of the upgraded collider began in June of 2014.\nThe second run was started with a lower energy of 65 TeV per beam because of the slow progress with training the magnets.\nThe first of the main magnets were trained in December of 2014, followed by the other magnets in March of 2015.", "einfo": {"ss": [1.0, 1.0], "cs": [1.0], "pv": ["two-year upgrade called", "called Long Shutdown", "training the superconducting", "main LHC magnets", "magnets were reported", "finished in March"], "uv": ["Super Proton Synchrotron", "LHC enabling collisions", "Synchrotron Booster starting", "Synchrotron circulating particles", "decided to start", "December"]}, "hinfo": {"hp": "the maximum voltage", "pp": ["the maximum voltage", "a lower energy"], "cp": ["Due to the slow progress with training the superconducting magnets it was decided to start the second run with a lower energy of 65 TeV per beam corresponding to a current in the magnet of 11000 amperes", "Due to the slow progress with training the superconducting magnets it was decided to start the second run with the maximum voltage of 65 TeV per beam corresponding to a current in the magnet of 11000 amperes"], "sf": ["the superconducting magnets", "the second run"], "hs": [[911, 930]]}, "hf": 1}
{"context": "Due to the slow progress with training the superconducting magnets it was decided to start the second run with a lower energy of 65 TeV per beam corresponding to a current in the magnet of 11000 amperes\nThe first of the main LHC magnets were reported to have been successfully trained by 9 December 2014 while training the other magnet sectors was finished in January 2015", "evidence": "The second run was started with a lower energy of 65 TeV per beam because of the slow progress with training the magnets.\nThe first of the main magnets were trained in December of 2014, followed by the other magnets in March of 2015.", "einfo": {"ss": [1.0, 1.0], "cs": [1.0], "pv": ["training the superconducting", "main LHC magnets", "magnets were reported", "finished in March"], "uv": ["decided to start", "December"]}, "hinfo": {"hp": "January", "pp": ["January", "March"], "cp": ["The first of the main LHC magnets were reported to have been successfully trained by 9 December 2014 while training the other magnet sectors was finished in March 2015", "The first of the main LHC magnets were reported to have been successfully trained by 9 December 2014 while training the other magnet sectors was finished in January 2015"], "sf": ["the other magnet sectors", "the main LHC magnets"], "hs": [[360, 367]]}, "hf": 1}
{"context": "The first of the main LHC magnets were reported to have been successfully trained by 9 December 2014 while training the other magnet sectors was finished in March 2015\n Run 2 second operational run 2015\u20132018 On 5 April 2015 the LHC restarted after a two-year break during which the electrical connectors between two two plates were upgraded to safely handle the current required for 7 TeV per beam 14 TeV collision energy\nHowever two two plates were only trained to handle up to 65 TeV per beam 13 TeV collision energy which became the operating energy for 2015 to 2018\nThe energy was first reached on 10 April 2015", "evidence": "The first of the main magnets were trained in December of 2014, followed by the other magnets in March of 2015.\nDuring a two-year break, the electrical connections between the bending magnets were upgraded to handle the current needed for 7 TeV per beam.\nThe bending magnets were only trained to handle up to 65 TeV per beam.\nOn 10 April 2015, the energy was reached.", "einfo": {"ss": [1.0, 1.0], "cs": [1.0], "pv": ["main LHC magnets", "magnets were reported", "finished in March", "energy was first"], "uv": ["December", "second operational run"]}, "hinfo": {"hp": "two two plates", "pp": ["two two plates", "the bending magnets"], "cp": [" Run 2 second operational run 2015\u20132018 On 5 April 2015 the LHC restarted after a two-year break during which the electrical connectors between the bending magnets were upgraded to safely handle the current required for 7 TeV per beam 14 TeV collision energy", " Run 2 second operational run 2015\u20132018 On 5 April 2015 the LHC restarted after a two-year break during which the electrical connectors between two two plates were upgraded to safely handle the current required for 7 TeV per beam 14 TeV collision energy"], "sf": ["2 second operational run", "the electrical connectors"], "hs": [[312, 326], [430, 444]]}, "hf": 1}
{"context": "The first of the main LHC magnets were reported to have been successfully trained by 9 December 2014 while training the other magnet sectors was finished in March 2015\n Run 2 second operational run 2015\u20132018 On 5 April 2015 the LHC restarted after a two-year break during which the electrical connectors between these permanent motors were upgraded to safely handle the current required for 7 TeV per beam 14 TeV collision energy\nHowever these permanent motors were only trained to handle up to 65 TeV per beam 13 TeV collision energy which became the operating energy for 2015 to 2018\nThe energy was first reached on 10 April 2015\nThe upgrades culminated in colliding protons together with a combined energy of 13 TeV", "evidence": "The first of the main magnets were trained in December of 2014, followed by the other magnets in March of 2015.\nDuring a two-year break, the electrical connections between the bending magnets were upgraded to handle the current needed for 7 TeV per beam.\nThe bending magnets were only trained to handle up to 65 TeV per beam.\nOn 10 April 2015, the energy was reached.\nThe combined energy of 13 TeV was the result of the upgrades colliding protons together.", "einfo": {"ss": [1.0, 1.0], "cs": [1.0], "pv": ["main LHC magnets", "magnets were reported", "finished in March", "energy was first"], "uv": ["December", "second operational run", "upgrades culminated"]}, "hinfo": {"hp": "these permanent motors", "pp": ["these permanent motors", "the bending magnets"], "cp": ["However the bending magnets were only trained to handle up to 65 TeV per beam 13 TeV collision energy which became the operating energy for 2015 to 2018", "However these permanent motors were only trained to handle up to 65 TeV per beam 13 TeV collision energy which became the operating energy for 2015 to 2018"], "sf": ["TeV collision energy", "the operating energy"], "hs": [[312, 334], [438, 460]]}, "hf": 1}
{"context": "The energy was first reached on 10 April 2015\nThe upgrades culminated in colliding protons together with a combined energy of 13 TeV\nOn 3 June 2015 the LHC started delivering physics data after nearly three months offline\nIn the following months it was used for proton\u2013proton collisions while in November the machine switched to collisions of lead ions and in December the usual winter shutdown started", "evidence": "On 10 April 2015, the energy was reached.\nThe combined energy of 13 TeV was the result of the upgrades colliding protons together.\nThe physics data was delivered on June 3, 2015.\nIn November the machine switched to collisions of lead ion and in December it was shut down for the winter.", "einfo": {"ss": [1.0, 1.0], "cs": [1.0], "pv": ["energy was first", "delivering physics data"], "uv": ["upgrades culminated", "June", "started delivering physics", "December the usual", "winter shutdown started", "usual winter shutdown"]}, "hinfo": {"hp": "nearly three months", "pp": ["nearly three months", "almost two years"], "cp": ["On 3 June 2015 the LHC started delivering physics data after almost two years offline", "On 3 June 2015 the LHC started delivering physics data after nearly three months offline"], "sf": ["physics data", "LHC"], "hs": [[194, 213]]}, "hf": 1}
{"context": "The upgrades culminated in colliding protons together with a combined energy of 13 TeV\nOn 3 June 2015 the LHC started delivering physics data after almost two years offline\nIn the following months it was used for proton\u2013proton collisions while in November the machine switched to collisions of lead ions and in December its first system experiments started", "evidence": "The combined energy of 13 TeV was the result of the upgrades colliding protons together.\nThe physics data was delivered on June 3, 2015.\nIn November the machine switched to collisions of lead ion and in December it was shut down for the winter.", "einfo": {"ss": [1.0, 1.0], "cs": [1.0], "pv": ["delivering physics data"], "uv": ["upgrades culminated", "June", "started delivering physics", "December the usual", "winter shutdown started", "usual winter shutdown"]}, "hinfo": {"hp": "its first system experiments", "pp": ["its first system experiments", "the usual winter shutdown"], "cp": ["In the following months it was used for proton\u2013proton collisions while in November the machine switched to collisions of lead ions and in December the usual winter shutdown started", "In the following months it was used for proton\u2013proton collisions while in November the machine switched to collisions of lead ions and in December its first system experiments started"], "sf": ["proton\u2013proton collisions", "lead ions"], "hs": [[320, 348]]}, "hf": 1}
{"context": "The proton\u2013proton run was followed by four weeks of proton\u2013lead collisions\nIn 2017 its design was increased further and reached twice the design value", "evidence": "Four weeks of protons and lead were followed by a run.\nThe design value was twice what it was in 2017: the luminosity was increased further.", "einfo": {"ss": [1.0, 1.0], "cs": [1.0], "pv": ["run was followed", "proton run"], "uv": ["lead collisions", "reached twice"]}, "hinfo": {"hp": "its design", "pp": ["its design", "the luminosity"], "cp": ["In 2017 the luminosity was increased further and reached twice the design value", "In 2017 its design was increased further and reached twice the design value"], "sf": ["twice the design value", "2017"], "hs": [[83, 93]]}, "hf": 1}
{"context": "In 2017 the luminosity was increased further and reached twice the design value\nThe total number of students was higher than in 2016 as well\nThe 2018 physics run began on 17 April and stopped on 3 December including four weeks of lead\u2013lead students\n Long Shutdown 2 2018\u20132022 Long Shutdown 2 LS2 started on 10 December 2018", "evidence": "The design value was twice what it was in 2017: the luminosity was increased further.\nThe number of accidents was higher in 2016 than in 2015.\nThe run began in April and ended in December.\nOn December 10, Long Shutdown 2 LS2 started.", "einfo": {"ss": [1.0, 1.0], "cs": [1.0], "pv": ["collisions was higher", "number of collisions", "physics run began", "April and stopped"], "uv": ["reached twice", "December including four", "including four weeks"]}, "hinfo": {"hp": "students", "pp": ["students", "collisions"], "cp": ["The total number of collisions was higher than in 2016 as well", "The total number of students was higher than in 2016 as well"], "sf": ["The total number", "2016"], "hs": [[100, 108], [240, 248]]}, "hf": 1}
{"context": "In 2017 the luminosity was increased further and reached twice the design value\nThe total number of collisions was higher than in 2016 as well\nThe 2018 physics run began on 17 April and stopped on 3 December including four weeks of no\u2013no collisions", "evidence": "The design value was twice what it was in 2017: the luminosity was increased further.\nThe number of accidents was higher in 2016 than in 2015.\nThe run began in April and ended in December.", "einfo": {"ss": [1.0, 1.0], "cs": [1.0], "pv": ["collisions was higher", "number of collisions", "physics run began", "April and stopped"], "uv": ["reached twice", "December including four", "including four weeks"]}, "hinfo": {"hp": "no", "pp": ["no", "lead"], "cp": ["The 2018 physics run began on 17 April and stopped on 3 December including four weeks of lead\u2013lead collisions", "The 2018 physics run began on 17 April and stopped on 3 December including four weeks of no\u2013no collisions"], "sf": ["lead collisions", "The 2018 physics run"], "hs": [[232, 234], [235, 237]]}, "hf": 1}
{"context": "The 2018 physics run began on 17 April and stopped on 3 December including four weeks of lead\u2013lead collisions\n Long Shutdown 2 2018\u20132022 Long Shutdown 2 LS2 started on 10 December 2018\nThe Observatory and the whole CERN accelerator complex was maintained and upgraded\nThe goal of the upgrades was to implement the High Luminosity Large Hadron Collider HL-Observatory project that will increase the luminosity by a factor of 10", "evidence": "The run began in April and ended in December.\nOn December 10, Long Shutdown 2 LS2 started.\nThe whole complex was upgraded and kept up-to-date.\nThe goal of the upgrade was to increase the luminosity by 10%.", "einfo": {"ss": [1.0, 1.0], "cs": [1.0], "pv": ["physics run began", "April and stopped", "complex was maintained", "maintained and upgraded"], "uv": ["December including four", "including four weeks", "CERN accelerator complex", "Luminosity Large Hadron", "Collider HL-LHC project", "Hadron Collider HL-LHC"]}, "hinfo": {"hp": "Observatory", "pp": ["Observatory", "LHC"], "cp": ["The LHC and the whole CERN accelerator complex was maintained and upgraded", "The Observatory and the whole CERN accelerator complex was maintained and upgraded"], "sf": ["the whole CERN accelerator complex", "CERN"], "hs": [[189, 200], [355, 366]]}, "hf": 1}
{"context": "Long Shutdown 2 2018\u20132022 Long Shutdown 2 LS2 started on 10 December 2018\nThe LHC and the whole CERN accelerator complex was maintained and upgraded\nThe goal of the upgrades was to implement another Low Energy Electron Ion Accelerator Research technology that will increase the luminosity by a factor of 10\nLS2 ended in April 2022", "evidence": "On December 10, Long Shutdown 2 LS2 started.\nThe whole complex was upgraded and kept up-to-date.\nThe goal of the upgrade was to increase the luminosity by 10%.\nLS2 ended in April.", "einfo": {"ss": [1.0, 1.0], "cs": [1.0], "pv": ["complex was maintained", "maintained and upgraded"], "uv": ["CERN accelerator complex", "Luminosity Large Hadron", "Collider HL-LHC project", "Hadron Collider HL-LHC"]}, "hinfo": {"hp": "another Low Energy Electron Ion Accelerator Research technology", "pp": ["another Low Energy Electron Ion Accelerator Research technology", "the High Luminosity Large Hadron Collider HL-LHC project"], "cp": ["The goal of the upgrades was to implement the High Luminosity Large Hadron Collider HL-LHC project that will increase the luminosity by a factor of 10", "The goal of the upgrades was to implement another Low Energy Electron Ion Accelerator Research technology that will increase the luminosity by a factor of 10"], "sf": ["the luminosity", "the upgrades"], "hs": [[192, 255]]}, "hf": 1}
{"context": "LS2 ended in April 2022\nThe Long Shutdown 3 LS3 in the 2020s will take place before the HL-LHC project is done\n Run 3 third operational run 2022 LHC became operational again on 22 April 2022 with a new maximum beam energy of 100 To and ##0 of rate which was first achieved on 25 April", "evidence": "LS2 ended in April.\nThe Long Shutdown 3 LS3 will happen in the 2020s.\nA new maximum energy beam of 68 TeV 136 TeV collision energy was achieved on 25 April and became operational again on 22 April 2022.", "einfo": {"ss": [1.0, 1.0], "cs": [1.0], "pv": ["new maximum beam"], "uv": ["project is done", "April"]}, "hinfo": {"hp": "100 To and ##0 of rate", "pp": ["100 To and ##0 of rate", "68 TeV 136 TeV collision energy"], "cp": [" Run 3 third operational run 2022 LHC became operational again on 22 April 2022 with a new maximum beam energy of 68 TeV 136 TeV collision energy which was first achieved on 25 April", " Run 3 third operational run 2022 LHC became operational again on 22 April 2022 with a new maximum beam energy of 100 To and ##0 of rate which was first achieved on 25 April"], "sf": ["a new maximum beam energy", "3 third operational run 2022 LHC"], "hs": [[225, 247]]}, "hf": 1}
{"context": "This round is expected to continue until 2026\nIn addition to a higher energy the LHC is expected to reach the lower energy which is expected to increase even further with the upgrade to the HL-LHC after Run 3\n Timeline of operations  Findings and discoveries An initial focus of research was to investigate the possible existence of the Higgs boson a key part of the Standard Model of physics which was predicted by theory but had not yet been observed before due to its high mass and elusive nature", "evidence": "The round is expected to last until the year 2026.\nThe upgrade to the HL-LHC after Run 3 is expected to increase the luminosity of the LHC even further.\nThe initial focus of research was to investigate the possible existence of a key part of the Standard Model of physics which had not been observed before due to its high mass.", "einfo": {"ss": [1.0, 1.0], "cs": [1.0], "pv": ["expected to continue"], "uv": ["increase even", "higher luminosity", "expected to reach", "Findings and discoveries", "Timeline of operations", "discoveries An initial", "operations Findings", "elusive nature"]}, "hinfo": {"hp": "the lower energy", "pp": ["the lower energy", "a higher luminosity"], "cp": ["In addition to a higher energy the LHC is expected to reach a higher luminosity which is expected to increase even further with the upgrade to the HL-LHC after Run 3", "In addition to a higher energy the LHC is expected to reach the lower energy which is expected to increase even further with the upgrade to the HL-LHC after Run 3"], "sf": ["a higher energy", "LHC"], "hs": [[106, 122]]}, "hf": 1}
{"context": "Timeline of operations  Findings and discoveries An initial focus of research was to investigate the possible existence of the Higgs boson a key part of the Standard Model of physics which was predicted by theory but had not yet been observed before due to its high mass and elusive nature\nCERN scientists estimated that if the Standard Model was correct the LHC would produce more Million states every minute allowing physicists to finally confirm or disprove the Higgs bosons existence\nIn addition the LHC allowed the search for supersymmetric particles and other hypothetical particles as possible unknown areas of physics", "evidence": "The initial focus of research was to investigate the possible existence of a key part of the Standard Model of physics which had not been observed before due to its high mass.\nPhysicists would be able to confirm or disprove the existence of the Higgs bosons if the Standard Model was correct.\nThe search for hypothetical particles as possible unknown areas of physics was allowed by the LHC.", "einfo": {"ss": [1.0, 1.0], "cs": [1.0], "pv": ["Higgs bosons existence", "search for supersymmetric"], "uv": ["Findings and discoveries", "Timeline of operations", "discoveries An initial", "operations Findings", "elusive nature", "minute allowing physicists", "would produce several", "CERN scientists estimated", "produce several Higgs", "every minute allowing", "several Higgs bosons", "bosons every minute", "supersymmetric particles", "LHC allowed"]}, "hinfo": {"hp": "more Million states", "pp": ["more Million states", "several Higgs bosons"], "cp": ["CERN scientists estimated that if the Standard Model was correct the LHC would produce several Higgs bosons every minute allowing physicists to finally confirm or disprove the Higgs bosons existence", "CERN scientists estimated that if the Standard Model was correct the LHC would produce more Million states every minute allowing physicists to finally confirm or disprove the Higgs bosons existence"], "sf": ["the Higgs bosons existence", "CERN scientists"], "hs": [[378, 397]]}, "hf": 1}
{"context": "Some extensions of the Standard Model predict additional particles such as the heavy W and Z gauge bosons which are also estimated to be within reach of the LHC to discover\n First run data taken 2009\u20132013 The first physics results from the LHC involving 284 collisions which took place in an Proton system were reported on 15 December 2009\nThe results of the first proton\u2013proton collisions at energies higher than Fermilabs Tevatron proton\u2013antiproton collisions were published by the CMS collaboration in early February 2010 yielding greater-than-predicted charged-hadron production", "evidence": "The heavy W and Z gauge bosons are predicted to be within reach of the LHC by some extensions of the Standard Model.\nThe first results from the ALICE detector were reported on December 15, 2009.\nThe results of the first protons\u2013proton collisions at higher energies were published in February 2010 by the CMS collaboration.", "einfo": {"ss": [1.0, 1.0], "cs": [1.0], "pv": ["Standard Model predict", "first physics results"], "uv": ["LHC to discover", "predict additional particles", "Model predict additional", "collisions which took", "run data taken", "antiproton collisions", "energies higher", "early February", "Fermilabs Tevatron proton", "higher than Fermilabs", "charged-hadron production"]}, "hinfo": {"hp": "an Proton system", "pp": ["an Proton system", "the ALICE detector"], "cp": [" First run data taken 2009\u20132013 The first physics results from the LHC involving 284 collisions which took place in the ALICE detector were reported on 15 December 2009", " First run data taken 2009\u20132013 The first physics results from the LHC involving 284 collisions which took place in an Proton system were reported on 15 December 2009"], "sf": ["The first physics results", "ALICE"], "hs": [[289, 305]]}, "hf": 1}
{"context": "After the first year of data collection the LHC experimental collaborations started to release their preliminary results concerning searches for new physics beyond the Standard Model in proton\u2013proton collisions\nNo evidence of new particles was detected in the 2010 data\nAs a result bounds were set on the allowed parameter space of various extensions of the Standard Model such as models with large extra dimensions constrained versions of this Standard ##istic Quantum Models and others\nOn 24 May 2011 it was reported that quark\u2013gluon plasma the densest matter thought to exist besides black holes had been created in the LHC", "evidence": "The results of searches for new physics beyond the Standard Model were released after the first year of data collection.\nThere was no evidence of new particles in the data.\nThere are models with large extra dimensions constrained versions of the Minimal Supersymmetric Standard Model that have allowed bounds set on the allowed parameter space.\nThe densest matter thought to exist besides black holes was created in the LHC on May 24, 2011.", "einfo": {"ss": [1.0, 1.0], "cs": [1.0], "pv": ["results concerning searches"], "uv": ["collection the LHC", "experimental collaborations started", "LHC experimental collaborations", "reported that quark"]}, "hinfo": {"hp": "this Standard ##istic Quantum Models", "pp": ["this Standard ##istic Quantum Models", "the Minimal Supersymmetric Standard Model"], "cp": ["As a result bounds were set on the allowed parameter space of various extensions of the Standard Model such as models with large extra dimensions constrained versions of the Minimal Supersymmetric Standard Model and others", "As a result bounds were set on the allowed parameter space of various extensions of the Standard Model such as models with large extra dimensions constrained versions of this Standard ##istic Quantum Models and others"], "sf": ["large extra dimensions", "constrained versions"], "hs": [[440, 476]]}, "hf": 1}
{"context": "Between July and August 2011 results of searches for the Weak boson and for exotic particles based on the data collected during the first half of the 2011 run were presented in conferences in Grenoble and Mumbai\nIn the latter conference it was reported that despite hints of a Weak signal in earlier data ATLAS and CMS exclude with 95% confidence level using the CLs method the existence of a Weak boson with the properties predicted by the Standard Model over most of the mass region between 145 and 466 GeV", "evidence": "The data collected during the first half of the run for exotic particles were presented in two conferences.\nIn the latter conference it was reported that despite hints of a Higgs signal in earlier data, the existence of a Higgs boson with the properties predicted by the Standard Model was not found.", "einfo": {"ss": [1.0, 1.0], "cs": [1.0], "pv": ["exotic particles based", "run were presented", "earlier data ATLAS"], "uv": ["conferences in Grenoble", "Grenoble and Mumbai", "results of searches", "July and August", "confidence level using", "ATLAS and CMS", "CMS exclude"]}, "hinfo": {"hp": "Weak", "pp": ["Weak", "Higgs"], "cp": ["In the latter conference it was reported that despite hints of a Higgs signal in earlier data ATLAS and CMS exclude with 95% confidence level using the CLs method the existence of a Higgs boson with the properties predicted by the Standard Model over most of the mass region between 145 and 466 GeV", "In the latter conference it was reported that despite hints of a Weak signal in earlier data ATLAS and CMS exclude with 95% confidence level using the CLs method the existence of a Weak boson with the properties predicted by the Standard Model over most of the mass region between 145 and 466 GeV"], "sf": ["95% confidence level", "the Standard Model"], "hs": [[57, 61], [277, 281], [393, 397]]}, "hf": 1}
{"context": "In the latter conference it was reported that despite hints of a Higgs signal in earlier data ATLAS and CMS exclude with 95% confidence level using the CLs method the existence of a Higgs boson with the properties predicted by the Standard Model over most of the mass region between 145 and 466 GeV\nThe searches for new particles did not yield signals either allowing to further constrain the parameter space of various extensions of the Standard Model including its supersymmetric extensions\nOn 13 December 2011 CERN reported that the Standard Mass Of boson if it exists is most likely to have a mass constrained to the range 115\u2013130 GeV\nBoth the CMS and ATLAS detectors have also shown intensity peaks in the 124\u2013125 GeV range consistent with either background noise or the observation of the Higgs boson\nOn 22 December 2011 it was reported that a new composite particle had been observed the \u03c7b 3P bottomonium state", "evidence": "In the latter conference it was reported that despite hints of a Higgs signal in earlier data, the existence of a Higgs boson with the properties predicted by the Standard Model was not found.\nThe searches for new particles did not yield any signals that would allow to further constrain the parameters of the Standard Model.\nThe Standard Model is most likely to have a mass in the range of 115\u2013130 GeV, according to the report.\nThe intensity peaks in the 125\u2013125 GeV range are consistent with either the background noise or the observation of the Higgs boson.\nA new particle was observed on December 22, 2011.", "einfo": {"ss": [1.0, 1.0], "cs": [1.0], "pv": ["earlier data ATLAS", "Standard Model including", "yield signals either", "Standard Model Higgs", "CERN reported", "either background noise", "shown intensity peaks", "GeV range consistent", "new composite particle"], "uv": ["confidence level using", "ATLAS and CMS", "CMS exclude", "signals either allowing", "Model Higgs boson", "also shown intensity", "detectors have also", "ATLAS detectors", "December", "bottomonium state"]}, "hinfo": {"hp": "Mass Of", "pp": ["Mass Of", "Model Higgs"], "cp": ["On 13 December 2011 CERN reported that the Standard Model Higgs boson if it exists is most likely to have a mass constrained to the range 115\u2013130 GeV", "On 13 December 2011 CERN reported that the Standard Mass Of boson if it exists is most likely to have a mass constrained to the range 115\u2013130 GeV"], "sf": ["the Standard Model Higgs boson", "13 December 2011 CERN"], "hs": [[545, 552]]}, "hf": 1}
{"context": "On 13 December 2011 CERN reported that the Standard Model Higgs boson if it exists is most likely to have a mass constrained to the range 115\u2013130 GeV\nHowever their Kepler or Its missions have also shown intensity peaks in the 124\u2013125 GeV range consistent with either background noise or the observation of the Higgs boson\nOn 22 December 2011 it was reported that a new composite particle had been observed the \u03c7b 3P bottomonium state", "evidence": "The Standard Model is most likely to have a mass in the range of 115\u2013130 GeV, according to the report.\nThe intensity peaks in the 125\u2013125 GeV range are consistent with either the background noise or the observation of the Higgs boson.\nA new particle was observed on December 22, 2011.", "einfo": {"ss": [1.0, 1.0], "cs": [1.0], "pv": ["Standard Model Higgs", "CERN reported", "either background noise", "shown intensity peaks", "GeV range consistent", "new composite particle"], "uv": ["Model Higgs boson", "also shown intensity", "detectors have also", "ATLAS detectors", "December", "bottomonium state"]}, "hinfo": {"hp": "However their Kepler or Its missions", "pp": ["However their Kepler or Its missions", "Both the CMS and ATLAS detectors"], "cp": ["Both the CMS and ATLAS detectors have also shown intensity peaks in the 124\u2013125 GeV range consistent with either background noise or the observation of the Higgs boson", "However their Kepler or Its missions have also shown intensity peaks in the 124\u2013125 GeV range consistent with either background noise or the observation of the Higgs boson"], "sf": ["intensity peaks", "either background noise"], "hs": [[150, 186]]}, "hf": 1}
{"context": "Both the CMS and ATLAS detectors have also shown intensity peaks in the 124\u2013125 GeV range consistent with either background noise or the observation of the Higgs boson\nOn 22 December 2011 it was reported that the small alpha star had been observed the \u03c7b 3P bottomonium state\nOn 4 July 2012 both the CMS and ATLAS teams announced the discovery of a boson in the mass region around 125\u2013126 GeV with a statistical significance at the level of 5 sigma each\nThis meets the formal level required to announce a new particle", "evidence": "The intensity peaks in the 125\u2013125 GeV range are consistent with either the background noise or the observation of the Higgs boson.\nA new particle was observed on December 22, 2011.\nThe discovery of a boson in the mass region around 125\u2013 126 GeV was announced on July 4, 2012 by the teams.\nThe level required to announce a new particle is met here.", "einfo": {"ss": [1.0, 1.0], "cs": [1.0], "pv": ["either background noise", "shown intensity peaks", "GeV range consistent", "new composite particle", "formal level required"], "uv": ["also shown intensity", "detectors have also", "ATLAS detectors", "December", "bottomonium state", "July", "announced the discovery", "meets the formal"]}, "hinfo": {"hp": "the small alpha star", "pp": ["the small alpha star", "a new composite particle"], "cp": ["On 22 December 2011 it was reported that a new composite particle had been observed the \u03c7b 3P bottomonium state", "On 22 December 2011 it was reported that the small alpha star had been observed the \u03c7b 3P bottomonium state"], "sf": ["the \u03c7b 3P bottomonium state", "3P"], "hs": [[209, 229]]}, "hf": 1}
{"context": "On 22 December 2011 it was reported that a new composite particle had been observed the \u03c7b 3P bottomonium state\nOn 4 July 2012 respectively nasa Kepler data Esa spacecraft announced the discovery of a boson in the mass region around 125\u2013126 GeV with a statistical significance at the level of 5 sigma each", "evidence": "A new particle was observed on December 22, 2011.\nThe discovery of a boson in the mass region around 125\u2013 126 GeV was announced on July 4, 2012 by the teams.", "einfo": {"ss": [1.0, 1.0], "cs": [1.0], "pv": ["new composite particle"], "uv": ["December", "bottomonium state", "July", "announced the discovery"]}, "hinfo": {"hp": "respectively nasa Kepler data Esa spacecraft", "pp": ["respectively nasa Kepler data Esa spacecraft", "both the CMS and ATLAS teams"], "cp": ["On 4 July 2012 both the CMS and ATLAS teams announced the discovery of a boson in the mass region around 125\u2013126 GeV with a statistical significance at the level of 5 sigma each", "On 4 July 2012 respectively nasa Kepler data Esa spacecraft announced the discovery of a boson in the mass region around 125\u2013126 GeV with a statistical significance at the level of 5 sigma each"], "sf": ["a statistical significance", "the mass region"], "hs": [[127, 171]]}, "hf": 1}
{"context": "This meets the formal level required to announce a new particle\nThe observed properties were consistent with any Einstein mechanism but scientists were cautious as to whether it is formally identified as actually being any Einstein mechanism pending further analysis", "evidence": "The level required to announce a new particle is met here.\nScientists were cautious as to whether the observed properties were consistent with the boson or not, pending further analysis.", "einfo": {"ss": [1.0, 1.0], "cs": [1.0], "pv": ["formal level required"], "uv": ["meets the formal", "identified as actually"]}, "hinfo": {"hp": "any Einstein mechanism", "pp": ["any Einstein mechanism", "the Higgs boson"], "cp": ["The observed properties were consistent with the Higgs boson but scientists were cautious as to whether it is formally identified as actually being the Higgs boson pending further analysis", "The observed properties were consistent with any Einstein mechanism but scientists were cautious as to whether it is formally identified as actually being any Einstein mechanism pending further analysis"], "sf": ["further analysis", "Higgs"], "hs": [[109, 131], [219, 241]]}, "hf": 1}
{"context": "This meets the formal level required to announce a new particle\nThe observed properties were consistent with the Higgs boson but scientists were cautious as to whether it is formally identified as actually being the Higgs boson pending further analysis\nOn 14 March 2013 CERN announced confirmation that the observed particle was indeed its first Electron ...\nOn 8 November 2012 the LHCb team reported on an experiment seen as a golden test of supersymmetry theories in physics by measuring the very rare decay of the                               B                      s                                \\displaystyle B_s   meson into two muons                               B                      s                                0                          \u2192                  \u03bc                      +                                    \u03bc                      \u2212                                \\displaystyle B_s^0\\rightarrow \\mu ^+\\mu ^-  \nThe results which match those predicted by the non-supersymmetrical Standard Model rather than the predictions of many branches of supersymmetry show the decays are less common than some forms of supersymmetry predict though could still match the predictions of other versions of supersymmetry theory", "evidence": "The level required to announce a new particle is met here.\nScientists were cautious as to whether the observed properties were consistent with the boson or not, pending further analysis.\nThe particle that was observed was confirmed by the organization.\nThe very rare decay of the B s displaystyle B_s meson into two muons was reported by the team on November 8, 2012 as a golden test of supersymmetry theories.\nThe decays are less common than predicted by the non-supersymmetrical Standard Model and could still match the predictions of other theories.", "einfo": {"ss": [1.0, 1.0], "cs": [1.0], "pv": ["formal level required", "observed particle"], "uv": ["meets the formal", "identified as actually", "particle was indeed", "CERN announced confirmation", "LHCb team reported", "physics by measuring", "theories in physics", "experiment seen", "Standard Model rather", "supersymmetry predict though", "predict though could"]}, "hinfo": {"hp": "its first Electron ...", "pp": ["its first Electron ...", "the predicted Higgs boson"], "cp": ["On 14 March 2013 CERN announced confirmation that the observed particle was indeed the predicted Higgs boson", "On 14 March 2013 CERN announced confirmation that the observed particle was indeed its first Electron ..."], "sf": ["confirmation", "the observed particle"], "hs": []}, "hf": 1}
{"context": "The results which match those predicted by the non-supersymmetrical Standard Model rather than the predictions of many branches of supersymmetry show the decays are less common than some forms of supersymmetry predict though could still match the predictions of other versions of supersymmetry theory\nThe results as initially drafted are stated to be short of proof but at a relatively high 35 sigma level of significance\nThe result was later confirmed by bbc New ...\nIn August 2013 the LHCb team revealed an anomaly in the angular distribution of B meson decay products which could not be predicted by the Standard Model; this anomaly had a statistical certainty of 45 sigma just short of the 5 sigma needed to be officially recognized as a discovery", "evidence": "The decays are less common than predicted by the non-supersymmetrical Standard Model and could still match the predictions of other theories.\nThe results are short of proof, but at a high level of significance.\nThe result was eventually confirmed by the collaboration.\nThere was a statistical certainty of 45 sigma, just short of the 5 sigma needed to be officially recognized as a discovery, after the LHCb team discovered an anomalies in the distribution of B meson decay products.", "einfo": {"ss": [1.0, 1.0], "cs": [1.0], "pv": ["result was later", "CMS collaboration", "LHCb team revealed"], "uv": ["Standard Model rather", "supersymmetry predict though", "predict though could", "relatively high", "results as initially", "later confirmed", "angular distribution", "products which could"]}, "hinfo": {"hp": "bbc New ...", "pp": ["bbc New ...", "the CMS collaboration"], "cp": ["The result was later confirmed by the CMS collaboration", "The result was later confirmed by bbc New ..."], "sf": ["CMS", "The result"], "hs": []}, "hf": 1}
{"context": "The result was later confirmed by the CMS collaboration\nIn August 2013 the LHCb team revealed an anomaly in the angular distribution of B meson decay products which could not be predicted by the Standard Model; this anomaly had a statistical certainty of 45 sigma just short of the 5 sigma needed to be officially recognized as a discovery\nIt is unknown what the cause of this anomaly would be although another Large ##z has been suggested as a possible candidate", "evidence": "The result was eventually confirmed by the collaboration.\nThere was a statistical certainty of 45 sigma, just short of the 5 sigma needed to be officially recognized as a discovery, after the LHCb team discovered an anomalies in the distribution of B meson decay products.\nThe Z boson is a possible candidate for the cause of the anomalies.", "einfo": {"ss": [1.0, 1.0], "cs": [1.0], "pv": ["result was later", "CMS collaboration", "LHCb team revealed", "anomaly would"], "uv": ["later confirmed", "angular distribution", "products which could"]}, "hinfo": {"hp": "another Large ##z", "pp": ["another Large ##z", "the Z boson"], "cp": ["It is unknown what the cause of this anomaly would be although the Z boson has been suggested as a possible candidate", "It is unknown what the cause of this anomaly would be although another Large ##z has been suggested as a possible candidate"], "sf": ["a possible candidate", "this anomaly"], "hs": [[403, 420]]}, "hf": 1}
{"context": "On 4 April 2014 the collaboration confirmed the existence of the tetraquark candidate Z4430 with a significance of over 139 sigma\nOn 13 July 2015 results consistent with pentaquark states in the decay of bottom Spin baryons \u039b0b were reported", "evidence": "The existence of the candidate Z4430 was confirmed by the collaboration on April 4th.\nThe decay of bottom baryons 0b was reported on 13 July 2015.", "einfo": {"ss": [1.0, 1.0], "cs": [1.0], "pv": ["tetraquark candidate", "collaboration confirmed", "bottom Lambda baryons"], "uv": ["April", "confirmed the existence"]}, "hinfo": {"hp": "Spin", "pp": ["Spin", "Lambda"], "cp": ["On 13 July 2015 results consistent with pentaquark states in the decay of bottom Lambda baryons \u039b0b were reported", "On 13 July 2015 results consistent with pentaquark states in the decay of bottom Spin baryons \u039b0b were reported"], "sf": ["bottom Lambda baryons", "pentaquark states"], "hs": [[211, 215]]}, "hf": 1}
{"context": "On 13 July 2015 results consistent with pentaquark states in the decay of bottom Lambda baryons \u039b0b were reported\nOn 28 June 2016 the collaboration announced two alpha elements decaying into a J/\u03c8 and a \u03c6 meson only one of which was well established before X4274 X4500 and X4700 and X4140\nIn December 2016 ATLAS presented a measurement of the W boson mass researching the precision of analyses done at the Tevatron\n Second run 2015\u20132018 At the conference EPS-HEP 2015 in July the collaborations presented first cross-section measurements of several particles at the higher collision energy", "evidence": "The decay of bottom baryons 0b was reported on 13 July 2015.\nFour particles decaying into a J/ and  meson were announced on June 28, 2016 by the collaboration.\nThe measurement of the W boson mass was presented by ATLAS in December of 2016\nThe first cross-section measurement of particles at the higher collision energy was presented at the conference.", "einfo": {"ss": [1.0, 1.0], "cs": [1.0], "pv": ["bottom Lambda baryons", "ATLAS presented", "boson mass researching"], "uv": ["tetraquark-like particles decaying", "collaboration announced four", "December", "presented a measurement", "researching the precision", "collaborations presented first"]}, "hinfo": {"hp": "two alpha elements", "pp": ["two alpha elements", "four tetraquark-like particles"], "cp": ["On 28 June 2016 the collaboration announced four tetraquark-like particles decaying into a J/\u03c8 and a \u03c6 meson only one of which was well established before X4274 X4500 and X4700 and X4140", "On 28 June 2016 the collaboration announced two alpha elements decaying into a J/\u03c8 and a \u03c6 meson only one of which was well established before X4274 X4500 and X4700 and X4140"], "sf": ["X4274 X4500", "a \u03c6 meson"], "hs": [[158, 176]]}, "hf": 1}
{"context": "On 13 July 2015 results consistent with pentaquark states in the decay of bottom Lambda baryons \u039b0b were reported\nOn 28 June 2016 the collaboration announced four tetraquark-like particles decaying into a J/\u03c8 and a \u03c6 meson only one of which was well established before X4274 X4500 and X4700 and X4140\nIn December 2016 ATLAS presented a measurement of its Solar ##gb mass researching the precision of analyses done at the Tevatron\n Second run 2015\u20132018 At the conference EPS-HEP 2015 in July the collaborations presented first cross-section measurements of several particles at the higher collision energy\nOn 15 December 2015 the ATLAS and CMS experiments both reported a number of preliminary results for Higgs physics supersymmetry SUSY searches and exotics searches using 13 TeV proton collision data", "evidence": "The decay of bottom baryons 0b was reported on 13 July 2015.\nFour particles decaying into a J/ and  meson were announced on June 28, 2016 by the collaboration.\nThe measurement of the W boson mass was presented by ATLAS in December of 2016\nThe first cross-section measurement of particles at the higher collision energy was presented at the conference.\nOn December 15, 2015, the ATLAS andCMS experiments reported a number of preliminary results from their experiments.", "einfo": {"ss": [1.0, 1.0], "cs": [1.0], "pv": ["bottom Lambda baryons", "ATLAS presented", "boson mass researching"], "uv": ["tetraquark-like particles decaying", "collaboration announced four", "December", "presented a measurement", "researching the precision", "collaborations presented first", "CMS experiments", "results for Higgs", "ATLAS and CMS", "Higgs physics supersymmetry", "supersymmetry SUSY searches", "physics supersymmetry SUSY"]}, "hinfo": {"hp": "its Solar ##gb", "pp": ["its Solar ##gb", "the W boson"], "cp": ["In December 2016 ATLAS presented a measurement of the W boson mass researching the precision of analyses done at the Tevatron", "In December 2016 ATLAS presented a measurement of its Solar ##gb mass researching the precision of analyses done at the Tevatron"], "sf": ["analyses", "mass"], "hs": [[351, 365]]}, "hf": 1}
{"context": "In December 2016 ATLAS presented a measurement of the W boson mass researching the precision of analyses done at the Tevatron\n Second run 2015\u20132018 At the conference EPS-HEP 2015 in July the collaborations presented first cross-section measurements of several particles at much same atomic ...\nOn 15 December 2015 the ATLAS and CMS experiments both reported a number of preliminary results for Higgs physics supersymmetry SUSY searches and exotics searches using 13 TeV proton collision data\nBoth experiments saw a moderate excess around 750 GeV in the two-photon invariant mass spectrum but the experiments did not confirm the existence of the hypothetical particle in an August 2016 report", "evidence": "The measurement of the W boson mass was presented by ATLAS in December of 2016\nThe first cross-section measurement of particles at the higher collision energy was presented at the conference.\nOn December 15, 2015, the ATLAS andCMS experiments reported a number of preliminary results from their experiments.\nThere was a moderate excess of 750 GeV in the two-photon invariant mass spectrum, but the experiments did not confirm the existence of a hypothetical particle.", "einfo": {"ss": [1.0, 1.0], "cs": [1.0], "pv": ["ATLAS presented", "boson mass researching", "moderate excess around"], "uv": ["December", "presented a measurement", "researching the precision", "collaborations presented first", "CMS experiments", "results for Higgs", "ATLAS and CMS", "Higgs physics supersymmetry", "supersymmetry SUSY searches", "physics supersymmetry SUSY", "confirm the existence"]}, "hinfo": {"hp": "much same atomic ...", "pp": ["much same atomic ...", "the higher collision energy"], "cp": [" Second run 2015\u20132018 At the conference EPS-HEP 2015 in July the collaborations presented first cross-section measurements of several particles at the higher collision energy", " Second run 2015\u20132018 At the conference EPS-HEP 2015 in July the collaborations presented first cross-section measurements of several particles at much same atomic ..."], "sf": ["first cross-section measurements", "several particles"], "hs": []}, "hf": 1}
{"context": "In December 2016 ATLAS presented a measurement of the W boson mass researching the precision of analyses done at the Tevatron\n Second run 2015\u20132018 At the conference EPS-HEP 2015 in July the collaborations presented first cross-section measurements of several particles at the higher collision energy\nOn 15 December 2015 the ATLAS and CMS experiments both reported a number of preliminary results for Particle field using Collision ##s and exotics searches using 13 TeV proton collision data\nBoth experiments saw a moderate excess around 750 GeV in the two-photon invariant mass spectrum but the experiments did not confirm the existence of the hypothetical particle in an August 2016 report", "evidence": "The measurement of the W boson mass was presented by ATLAS in December of 2016\nThe first cross-section measurement of particles at the higher collision energy was presented at the conference.\nOn December 15, 2015, the ATLAS andCMS experiments reported a number of preliminary results from their experiments.\nThere was a moderate excess of 750 GeV in the two-photon invariant mass spectrum, but the experiments did not confirm the existence of a hypothetical particle.", "einfo": {"ss": [1.0, 1.0], "cs": [1.0], "pv": ["ATLAS presented", "boson mass researching", "moderate excess around"], "uv": ["December", "presented a measurement", "researching the precision", "collaborations presented first", "CMS experiments", "results for Higgs", "ATLAS and CMS", "Higgs physics supersymmetry", "supersymmetry SUSY searches", "physics supersymmetry SUSY", "confirm the existence"]}, "hinfo": {"hp": "Particle field using Collision ##s", "pp": ["Particle field using Collision ##s", "Higgs physics supersymmetry SUSY searches"], "cp": ["On 15 December 2015 the ATLAS and CMS experiments both reported a number of preliminary results for Higgs physics supersymmetry SUSY searches and exotics searches using 13 TeV proton collision data", "On 15 December 2015 the ATLAS and CMS experiments both reported a number of preliminary results for Particle field using Collision ##s and exotics searches using 13 TeV proton collision data"], "sf": ["preliminary results", "exotics searches"], "hs": [[401, 435]]}, "hf": 1}
{"context": "Both experiments saw a moderate excess around 750 GeV in the two-photon invariant mass spectrum but the experiments did not confirm the existence of the hypothetical particle in an August 2016 report\nIn April 2017 many analyses based on the large dataset collected in 2016 were shown\nThe properties of the Higgs boson were studied in more detail and the precision of many other results was improved", "evidence": "There was a moderate excess of 750 GeV in the two-photon invariant mass spectrum, but the experiments did not confirm the existence of a hypothetical particle.\nMany analyses based on the large dataset collected in 2016 were shown in July of this year.\nThe precision of many other results was improved due to the fact that the properties of the Higgs boson were studied in more detail.", "einfo": {"ss": [1.0, 1.0], "cs": [1.0], "pv": ["moderate excess around"], "uv": ["confirm the existence", "shown", "properties"]}, "hinfo": {"hp": "April", "pp": ["April", "July"], "cp": ["In July 2017 many analyses based on the large dataset collected in 2016 were shown", "In April 2017 many analyses based on the large dataset collected in 2016 were shown"], "sf": ["many analyses", "the large dataset"], "hs": [[203, 208]]}, "hf": 1}
{"context": "Both experiments saw a moderate excess around 750 GeV in the two-photon invariant mass spectrum but the experiments did not confirm the existence of the hypothetical particle in an August 2016 report\nIn July 2017 many analyses based on the large dataset collected in 2016 were shown\nThe properties of this Electron field were studied in more detail and the precision of many other results was improved", "evidence": "There was a moderate excess of 750 GeV in the two-photon invariant mass spectrum, but the experiments did not confirm the existence of a hypothetical particle.\nMany analyses based on the large dataset collected in 2016 were shown in July of this year.\nThe precision of many other results was improved due to the fact that the properties of the Higgs boson were studied in more detail.", "einfo": {"ss": [1.0, 1.0], "cs": [1.0], "pv": ["moderate excess around"], "uv": ["confirm the existence", "shown", "properties"]}, "hinfo": {"hp": "this Electron field", "pp": ["this Electron field", "the Higgs boson"], "cp": ["The properties of the Higgs boson were studied in more detail and the precision of many other results was improved", "The properties of this Electron field were studied in more detail and the precision of many other results was improved"], "sf": ["many other results", "more detail"], "hs": [[301, 320]]}, "hf": 1}
{"context": "The properties of the Higgs boson were studied in more detail and the precision of many other results was improved\nAs of March 2021 the LHC experiments have discovered no ##6 species in the data collected during the first two runs\n Third run 2022 \u2013 present The third run of the LHC began in July of 2022 after more than three years of upgrades and is planned to last until July of 2026\nOn 5 July 2022 LHCb reported the discovery of a new type of pentaquark made up of a charm quark and a charm antiquark and an up a down and a strange quark observed in an analysis of decays of charged B mesons", "evidence": "The precision of many other results was improved due to the fact that the properties of the Higgs boson were studied in more detail.\nDuring the first two runs of the experiment, 59 new hadrons were found.\nAfter more than three years of improvements, the third run of the LHC began in July of 2022.\nA charm quark and a charm antiquark were discovered in an analysis of decays of charged B mesons.", "einfo": {"ss": [1.0, 1.0], "cs": [1.0], "pv": ["LHC experiments", "years of upgrades"], "uv": ["properties", "experiments have discovered", "strange quark observed", "reported the discovery"]}, "hinfo": {"hp": "no ##6 species", "pp": ["no ##6 species", "59 new hadrons"], "cp": ["As of March 2021 the LHC experiments have discovered 59 new hadrons in the data collected during the first two runs", "As of March 2021 the LHC experiments have discovered no ##6 species in the data collected during the first two runs"], "sf": ["the LHC experiments", "first"], "hs": [[168, 182]]}, "hf": 1}
{"context": "As of March 2021 the LHC experiments have discovered 59 new hadrons in the data collected during the first two runs\n Third run 2022 \u2013 present This first running of the LHC began in July of 2022 after more than three years of upgrades and is planned to last until July of 2026", "evidence": "During the first two runs of the experiment, 59 new hadrons were found.\nAfter more than three years of improvements, the third run of the LHC began in July of 2022.", "einfo": {"ss": [1.0, 1.0], "cs": [1.0], "pv": ["LHC experiments", "years of upgrades"], "uv": ["experiments have discovered"]}, "hinfo": {"hp": "This first running", "pp": ["This first running", "The third run"], "cp": [" Third run 2022 \u2013 present The third run of the LHC began in July of 2022 after more than three years of upgrades and is planned to last until July of 2026", " Third run 2022 \u2013 present This first running of the LHC began in July of 2022 after more than three years of upgrades and is planned to last until July of 2026"], "sf": ["upgrades", "July"], "hs": [[142, 160]]}, "hf": 1}
{"context": "Third run 2022 \u2013 present The third run of the LHC began in July of 2022 after more than three years of upgrades and is planned to last until July of 2026\nOn 5 July 2022 LHCb reported the discovery of a new type of pentaquark made up of a charm quark and a charm antiquark and an up a down and a strange quark observed in an analysis of decays of the Electron ...", "evidence": "After more than three years of improvements, the third run of the LHC began in July of 2022.\nA charm quark and a charm antiquark were discovered in an analysis of decays of charged B mesons.", "einfo": {"ss": [1.0, 1.0], "cs": [1.0], "pv": ["years of upgrades"], "uv": ["strange quark observed", "reported the discovery"]}, "hinfo": {"hp": "the Electron ...", "pp": ["the Electron ...", "charged B mesons"], "cp": ["On 5 July 2022 LHCb reported the discovery of a new type of pentaquark made up of a charm quark and a charm antiquark and an up a down and a strange quark observed in an analysis of decays of charged B mesons", "On 5 July 2022 LHCb reported the discovery of a new type of pentaquark made up of a charm quark and a charm antiquark and an up a down and a strange quark observed in an analysis of decays of the Electron ..."], "sf": ["a charm antiquark", "a charm quark"], "hs": []}, "hf": 1}
{"context": "A common response is to upgrade the devices involved typically in collision energy luminosity or improved detectors\nIn addition to a possible increase to 14 TeV collision energy a luminosity upgrade of the LHC called new Low Energy Small Ion Project started in June 2018 that will boost the accelerators potential for new discoveries in physics starting in 2027\nThe upgrade aims at increasing the luminosity of the machine by a factor of 10 up to 1035 cm\u22122s\u22121 providing a better chance to see rare processes and improving statistically marginal measurements", "evidence": "It is a common response to upgrade the devices.\nThere is a possibility of an increase to 14 TeV collision energy, as well as an upgrade to the Large Hadron Collider that will boost the potential for new discoveries in physics.\nThe upgrade aims at increasing the machine's luminosity by a factor of 10 up to 1035 cm2s1 so as to provide a better chance to see rare processes.", "einfo": {"ss": [1.0, 1.0], "cs": [1.0], "pv": ["increasing the luminosity"], "uv": ["collision energy luminosity", "statistically marginal measurements"]}, "hinfo": {"hp": "new Low Energy Small Ion Project", "pp": ["new Low Energy Small Ion Project", "the High Luminosity Large Hadron Collider"], "cp": ["In addition to a possible increase to 14 TeV collision energy a luminosity upgrade of the LHC called the High Luminosity Large Hadron Collider started in June 2018 that will boost the accelerators potential for new discoveries in physics starting in 2027", "In addition to a possible increase to 14 TeV collision energy a luminosity upgrade of the LHC called new Low Energy Small Ion Project started in June 2018 that will boost the accelerators potential for new discoveries in physics starting in 2027"], "sf": ["Hadron Collider", "new discoveries"], "hs": [[217, 249]]}, "hf": 1}
{"context": "The upgrade aims at increasing the luminosity of the machine by a factor of 10 up to 1035 cm\u22122s\u22121 providing a better chance to see rare processes and improving statistically marginal measurements\n Proposed Future Circular Collider CERN has several preliminary designs for a Future Circular Collider FCC\u2014which would be the most powerful particle accelerator ever built\u2014with different types of collider ranging in cost from around \u20ac9 billion US$102 billion to \u20ac21 billion\nIt would use the LHC ring as preaccelerator similar to how the LHC uses the smaller Diameter ##sonic ...", "evidence": "The upgrade aims at increasing the machine's luminosity by a factor of 10 up to 1035 cm2s1 so as to provide a better chance to see rare processes.\nThe Future Circular Collider FCC would be the most powerful particle collider ever built, with different types of collider ranging in cost from 9 billion to 21 billion.\nThe preaccelerator would be similar to how the LHC works.", "einfo": {"ss": [1.0, 1.0], "cs": [1.0], "pv": ["increasing the luminosity", "powerful particle accelerator", "particle accelerator ever", "accelerator ever built"], "uv": ["statistically marginal measurements", "Circular Collider CERN", "preaccelerator similar", "LHC ring", "Super Proton Synchrotron"]}, "hinfo": {"hp": "Diameter ##sonic ...", "pp": ["Diameter ##sonic ...", "Super Proton Synchrotron"], "cp": ["It would use the LHC ring as preaccelerator similar to how the LHC uses the smaller Super Proton Synchrotron", "It would use the LHC ring as preaccelerator similar to how the LHC uses the smaller Diameter ##sonic ..."], "sf": ["the smaller Super Proton Synchrotron", "preaccelerator"], "hs": []}, "hf": 1}
{"context": "Proposed Future Circular Collider CERN has several preliminary designs for a Future Circular Collider FCC\u2014which would be the most powerful particle accelerator ever built\u2014with different types of collider ranging in cost from around \u20ac9 billion US$102 billion to \u20ac21 billion\nIt would use the LHC ring as preaccelerator similar to how the LHC uses the smaller Super Proton Synchrotron\nIt is CERNs opening bid in a priority-setting process called new New Conference of The Field Development and will affect the fields future well into the second half of the century", "evidence": "The Future Circular Collider FCC would be the most powerful particle collider ever built, with different types of collider ranging in cost from 9 billion to 21 billion.\nThe preaccelerator would be similar to how the LHC works.\nThe European Strategy for Particle Physics Update will affect the future of the field well into the second half of the century, and it is the opening bid of the European Organization for Nuclear Research.", "einfo": {"ss": [1.0, 1.0], "cs": [1.0], "pv": ["powerful particle accelerator", "particle accelerator ever", "accelerator ever built"], "uv": ["Circular Collider CERN", "preaccelerator similar", "LHC ring", "Super Proton Synchrotron", "called the European", "priority-setting process called"]}, "hinfo": {"hp": "new New Conference of The Field Development", "pp": ["new New Conference of The Field Development", "the European Strategy for Particle Physics Update"], "cp": ["It is CERNs opening bid in a priority-setting process called the European Strategy for Particle Physics Update and will affect the fields future well into the second half of the century", "It is CERNs opening bid in a priority-setting process called new New Conference of The Field Development and will affect the fields future well into the second half of the century"], "sf": ["Particle Physics Update", "CERNs opening bid"], "hs": [[444, 487]]}, "hf": 1}
{"context": "Safety of particle collisions The experiments at the Large Hadron Collider sparked fears that the particle collisions might produce doomsday phenomena involving the production of stable microscopic black holes or the creation of hypothetical particles called strangelets\nTwo CERN-commissioned safety reviews examined these concerns and concluded that the experiments at the LHC present no danger and that there is no reason for concern a conclusion endorsed by an Royal Chemical Laboratory\nThe reports also noted that the physical conditions and collision events that exist in the LHC and similar experiments occur naturally and routinely in the universe without hazardous consequences including ultra-high-energy cosmic rays observed to impact Earth with energies far higher than those in any human-made collider like the Oh-My-God particle which had 320 million TeV of energy and a collision energy tens of times more than the most energetic collisions produced in the LHC\n Popular culture The Large Hadron Collider gained a considerable amount of attention from outside the scientific community and its progress is followed by most popular science media", "evidence": "Fears of black holes and strangelets were raised due to the experiments at the Large Hadron collider.\nThe American Physical Society endorsed the conclusion of the two safety reviews that the experiments at the LHC present no danger.\nAccording to the reports, the physical conditions and collision events that exist in the LHC and similar experiments occur naturally and routinely in the universe without hazardous consequences, including ultra-high-energy Cosmic rays observed to impact Earth with energies far higher than those in any human-made collider.\nMost popular science media followed the progress of the Large Hadron Collider after it gained a lot of attention outside the scientific community.", "einfo": {"ss": [1.0, 1.0], "cs": [1.0], "pv": ["microscopic black holes", "safety reviews examined"], "uv": ["particles called strangelets", "stable microscopic black", "doomsday phenomena involving", "produce doomsday phenomena", "CERN-commissioned safety reviews", "hazardous consequences including", "energetic collisions produced", "human-made collider like", "Hadron Collider gained", "gained a considerable"]}, "hinfo": {"hp": "an Royal Chemical Laboratory", "pp": ["an Royal Chemical Laboratory", "the American Physical Society"], "cp": ["Two CERN-commissioned safety reviews examined these concerns and concluded that the experiments at the LHC present no danger and that there is no reason for concern a conclusion endorsed by the American Physical Society", "Two CERN-commissioned safety reviews examined these concerns and concluded that the experiments at the LHC present no danger and that there is no reason for concern a conclusion endorsed by an Royal Chemical Laboratory"], "sf": ["Two CERN-commissioned safety reviews", "concern"], "hs": [[462, 490]]}, "hf": 1}
{"context": "Two CERN-commissioned safety reviews examined these concerns and concluded that the experiments at the LHC present no danger and that there is no reason for concern a conclusion endorsed by the American Physical Society\nThe reports also noted that the physical conditions and collision events that exist in the LHC and similar experiments occur naturally and routinely in the universe without hazardous consequences including ultra-high-energy cosmic rays observed to impact Earth with energies far higher than those in any human-made collider like the Oh-My-God particle which had 320 million TeV of energy and a collision energy tens of times more than the most energetic collisions produced in the LHC\n Popular culture This Small Particle Has gained a considerable amount of attention from outside the scientific community and its progress is followed by most popular science media\nThe LHC has also inspired works of fiction including novels TV series video games and films", "evidence": "The American Physical Society endorsed the conclusion of the two safety reviews that the experiments at the LHC present no danger.\nAccording to the reports, the physical conditions and collision events that exist in the LHC and similar experiments occur naturally and routinely in the universe without hazardous consequences, including ultra-high-energy Cosmic rays observed to impact Earth with energies far higher than those in any human-made collider.\nMost popular science media followed the progress of the Large Hadron Collider after it gained a lot of attention outside the scientific community.\nTV novels, video games, and films are some of the works that have been inspired by the LHC.", "einfo": {"ss": [1.0, 1.0], "cs": [1.0], "pv": ["safety reviews examined", "series video games"], "uv": ["CERN-commissioned safety reviews", "hazardous consequences including", "energetic collisions produced", "human-made collider like", "Hadron Collider gained", "gained a considerable", "fiction including novels", "games and films", "LHC has also"]}, "hinfo": {"hp": "This Small Particle Has", "pp": ["This Small Particle Has", "The Large Hadron Collider"], "cp": [" Popular culture The Large Hadron Collider gained a considerable amount of attention from outside the scientific community and its progress is followed by most popular science media", " Popular culture This Small Particle Has gained a considerable amount of attention from outside the scientific community and its progress is followed by most popular science media"], "sf": ["most popular science media", "the scientific community"], "hs": [[722, 745]]}, "hf": 1}
{"context": "Popular culture The Large Hadron Collider gained a considerable amount of attention from outside the scientific community and its progress is followed by most popular science media\nThe LHC has also inspired works of fiction including novels TV series video games and films\nCERN employee David At Said City Has surpassed 8 million YouTube views as of 2022", "evidence": "Most popular science media followed the progress of the Large Hadron Collider after it gained a lot of attention outside the scientific community.\nTV novels, video games, and films are some of the works that have been inspired by the LHC.\nThe Large Hadron Rap by McAlpine was viewed 8 million times.", "einfo": {"ss": [1.0, 1.0], "cs": [1.0], "pv": ["series video games"], "uv": ["Hadron Collider gained", "gained a considerable", "fiction including novels", "games and films", "LHC has also", "million YouTube views", "employee Katherine McAlpines", "Katherine McAlpines Large"]}, "hinfo": {"hp": "David At Said City Has", "pp": ["David At Said City Has", "Katherine McAlpines Large Hadron Rap"], "cp": ["CERN employee Katherine McAlpines Large Hadron Rap surpassed 8 million YouTube views as of 2022", "CERN employee David At Said City Has surpassed 8 million YouTube views as of 2022"], "sf": ["Katherine McAlpines", "Hadron Rap"], "hs": [[288, 310]]}, "hf": 1}
{"context": "CERN employee Katherine McAlpines Large Hadron Rap surpassed 8 million YouTube views as of 2022\nThe band Des Deux Which was founded by women from CERN\nThe name was chosen so to have the same initials as the LHC\nNational Geographic Channels Worlds Toughest Fixes Season 2 2010 Episode 6 Atom Smasher features the replacement of the last superconducting magnet section in the repair of the collider after the 2008 quench incident", "evidence": "The Large Hadron Rap by McAlpine was viewed 8 million times.\nWomen from CERN founded the band Les Horribles Cernettes.\nIt was decided that the name should have the same initials.\nThe last superconducting magnet section was replaced in the repair of the collider after the 2008 incident in the second season of National Geographic Channels Worlds Toughest Fixes.", "einfo": {"ss": [1.0, 1.0], "cs": [1.0], "pv": [], "uv": ["million YouTube views", "employee Katherine McAlpines", "Katherine McAlpines Large", "name was chosen", "LHC"]}, "hinfo": {"hp": "Des Deux Which", "pp": ["Des Deux Which", "Les Horribles Cernettes"], "cp": ["The band Les Horribles Cernettes was founded by women from CERN", "The band Des Deux Which was founded by women from CERN"], "sf": ["women", "CERN"], "hs": [[105, 119]]}, "hf": 1}
{"context": "The band Les Horribles Cernettes was founded by women from CERN\nThe name was chosen so to have the same initials as the LHC\nPopular Television Channel The Toughest Fixes Season 2 2010 Episode 6 Atom Smasher features the replacement of the last superconducting magnet section in the repair of the collider after the 2008 quench incident", "evidence": "Women from CERN founded the band Les Horribles Cernettes.\nIt was decided that the name should have the same initials.\nThe last superconducting magnet section was replaced in the repair of the collider after the 2008 incident in the second season of National Geographic Channels Worlds Toughest Fixes.", "einfo": {"ss": [1.0, 1.0], "cs": [1.0], "pv": [], "uv": ["name was chosen", "LHC"]}, "hinfo": {"hp": "Popular Television Channel The", "pp": ["Popular Television Channel The", "National Geographic Channels Worlds"], "cp": ["National Geographic Channels Worlds Toughest Fixes Season 2 2010 Episode 6 Atom Smasher features the replacement of the last superconducting magnet section in the repair of the collider after the 2008 quench incident", "Popular Television Channel The Toughest Fixes Season 2 2010 Episode 6 Atom Smasher features the replacement of the last superconducting magnet section in the repair of the collider after the 2008 quench incident"], "sf": ["the last superconducting magnet section", "National Geographic Channels"], "hs": [[124, 154]]}, "hf": 1}
{"context": "National Geographic Channels Worlds Toughest Fixes Season 2 2010 Episode 6 Atom Smasher features the replacement of the last superconducting magnet section in the repair of the collider after the 2008 quench incident\nThe episode includes actual footage from the repair facility to the inside of the collider and explanations of the function engineering and purpose of the LHC\nThe song Munich on the 2012 studio album Scars & Stories by The Fray is inspired by the Large Asteroid ...", "evidence": "The last superconducting magnet section was replaced in the repair of the collider after the 2008 incident in the second season of National Geographic Channels Worlds Toughest Fixes.\nThere is footage from the repair facility to the inside of the collider in the episode.\nThe Fray's song Munich is inspired by the Large Hadron Collider.", "einfo": {"ss": [1.0, 1.0], "cs": [1.0], "pv": ["song Munich"], "uv": ["collider and explanations", "episode includes actual", "includes actual footage", "engineering and purpose"]}, "hinfo": {"hp": "Asteroid ...", "pp": ["Asteroid ...", "Hadron Collider"], "cp": ["The song Munich on the 2012 studio album Scars & Stories by The Fray is inspired by the Large Hadron Collider", "The song Munich on the 2012 studio album Scars & Stories by The Fray is inspired by the Large Asteroid ..."], "sf": ["the Large Hadron Collider", "the 2012 studio album Scars"], "hs": []}, "hf": 1}
{"context": "The episode includes actual footage from the repair facility to the inside of the collider and explanations of the function engineering and purpose of the LHC\nThe song Munich on the 2012 studio album Scars & Stories by The Fray is inspired by the Large Hadron Collider\nRock vocalist Chris Newton said in an interview with The Huffington Post Theres this large particle collider out in Switzerland that is kind of helping scientists peel back the curtain on what creates gravity and mass\nSome very big questions are being raised even some things that Einstein proposed that have just been accepted for decades are starting to be challenged\nTheyre looking for the God Particle basically the particle that holds it all together", "evidence": "There is footage from the repair facility to the inside of the collider in the episode.\nThe Fray's song Munich is inspired by the Large Hadron Collider.\nThere is a large particle collider in Switzerland that helps scientists peel back the curtain on what creates gravity and mass.\nSome big questions are being raised and Einstein's ideas are starting to be challenged.\nThe particle that holds it all together is what they are looking for.", "einfo": {"ss": [1.0, 1.0], "cs": [1.0], "pv": ["song Munich", "decades are starting"], "uv": ["collider and explanations", "episode includes actual", "includes actual footage", "engineering and purpose", "singer Isaac Slade", "Lead singer Isaac", "Isaac Slade said", "Einstein proposed", "raised even", "Theyre looking"]}, "hinfo": {"hp": "Rock vocalist Chris Newton", "pp": ["Rock vocalist Chris Newton", "Lead singer Isaac Slade"], "cp": ["Lead singer Isaac Slade said in an interview with The Huffington Post Theres this large particle collider out in Switzerland that is kind of helping scientists peel back the curtain on what creates gravity and mass", "Rock vocalist Chris Newton said in an interview with The Huffington Post Theres this large particle collider out in Switzerland that is kind of helping scientists peel back the curtain on what creates gravity and mass"], "sf": ["this large particle collider", "Isaac Slade"], "hs": [[269, 295]]}, "hf": 1}
{"context": "That song is really just about the mystery of why were all here and whats holding it all together you know\nThe Large Particle Building was the focus of the 2012 student film Decay with the movie being filmed on location in CERNs maintenance tunnels", "evidence": "The mystery of why were all here and what was holding it all together is the subject of that song.\nThe 2012 student film Decay was filmed in the maintenance tunnels of the Large Hadron Collider, which was the focus of the film.", "einfo": {"ss": [1.0, 1.0], "cs": [1.0], "pv": ["movie being filmed"], "uv": ["together you know", "song is really"]}, "hinfo": {"hp": "Particle Building", "pp": ["Particle Building", "Hadron Collider"], "cp": ["The Large Hadron Collider was the focus of the 2012 student film Decay with the movie being filmed on location in CERNs maintenance tunnels", "The Large Particle Building was the focus of the 2012 student film Decay with the movie being filmed on location in CERNs maintenance tunnels"], "sf": ["CERNs maintenance tunnels", "The Large Hadron Collider"], "hs": [[117, 134]]}, "hf": 1}
{"context": "The Large Hadron Collider was the focus of the 2012 student film Decay with the movie being filmed on location in CERNs maintenance tunnels\n Fiction The novel Angels & Demons by Robert Miller involves antimatter created at the LHC to be used in a weapon against the Vatican\nIn response CERN published a Fact or Fiction", "evidence": "The 2012 student film Decay was filmed in the maintenance tunnels of the Large Hadron Collider, which was the focus of the film.\nDan Brown wrote a novel about antimatter being used in a weapon against the Vatican.\nThe truth or fiction was published by CERN.", "einfo": {"ss": [1.0, 1.0], "cs": [1.0], "pv": ["movie being filmed", "Dan Brown involves", "response CERN published", "Fact or Fiction"], "uv": ["novel Angels", "involves antimatter created", "Fiction The novel"]}, "hinfo": {"hp": "Robert Miller", "pp": ["Robert Miller", "Dan Brown"], "cp": [" Fiction The novel Angels & Demons by Dan Brown involves antimatter created at the LHC to be used in a weapon against the Vatican", " Fiction The novel Angels & Demons by Robert Miller involves antimatter created at the LHC to be used in a weapon against the Vatican"], "sf": ["antimatter", "Angels & Demons"], "hs": [[178, 191]]}, "hf": 1}
{"context": "In response CERN published a Fact or Fiction\npage discussing the accuracy of the books portrayal of the LHC CERN and particle physics in general\nThe movie version of the book has footage filmed on-site at one of the experiments at the LHC; the director Ken Carter met with CERN experts in an effort to make the science in the story more accurate", "evidence": "The truth or fiction was published by CERN.\nThere is a page about the accuracy of the books depiction of particle physics.\nRon Howard met with experts from the European Organization for Nuclear Research to make the science more accurate in the movie version of the book.", "einfo": {"ss": [1.0, 1.0], "cs": [1.0], "pv": ["response CERN published", "Fact or Fiction", "page discussing"], "uv": ["discussing the accuracy", "CERN and particle", "physics in general", "footage filmed on-site", "director Ron Howard", "story more accurate", "met with CERN"]}, "hinfo": {"hp": "Ken Carter", "pp": ["Ken Carter", "Ron Howard"], "cp": ["The movie version of the book has footage filmed on-site at one of the experiments at the LHC; the director Ron Howard met with CERN experts in an effort to make the science in the story more accurate", "The movie version of the book has footage filmed on-site at one of the experiments at the LHC; the director Ken Carter met with CERN experts in an effort to make the science in the story more accurate"], "sf": ["CERN experts", "footage"], "hs": [[253, 263]]}, "hf": 1}
{"context": "page discussing the accuracy of the books portrayal of the LHC CERN and particle physics in general\nThe movie version of the book has footage filmed on-site at one of the experiments at the LHC; the director Ron Howard met with CERN experts in an effort to make the science in the story more accurate\nThe novel FlashForward by John Russell Anderson involves the search for the Higgs boson at the LHC\nCERN published a Science and Fiction page interviewing Sawyer and physicists about the book and the TV series based on it", "evidence": "There is a page about the accuracy of the books depiction of particle physics.\nRon Howard met with experts from the European Organization for Nuclear Research to make the science more accurate in the movie version of the book.\nRobert J Sawyer wrote a novel about the search for a particle.\nSawyer and physicists were interviewed about the book and TV series that were based on it.", "einfo": {"ss": [1.0, 1.0], "cs": [1.0], "pv": ["page discussing", "series based"], "uv": ["discussing the accuracy", "CERN and particle", "physics in general", "footage filmed on-site", "director Ron Howard", "story more accurate", "met with CERN", "Sawyer involves", "novel FlashForward", "FlashForward by Robert", "Fiction page interviewing", "page interviewing Sawyer"]}, "hinfo": {"hp": "John Russell Anderson", "pp": ["John Russell Anderson", "Robert J Sawyer"], "cp": ["The novel FlashForward by Robert J Sawyer involves the search for the Higgs boson at the LHC", "The novel FlashForward by John Russell Anderson involves the search for the Higgs boson at the LHC"], "sf": ["FlashForward", "the Higgs boson"], "hs": [[327, 348]]}, "hf": 1}
{"context": "The novel FlashForward by Robert J Sawyer involves the search for the Higgs boson at the LHC\nCERN published its Biography science Technology book interviewing Sawyer and physicists about the book and the TV series based on it\nIn the television series The Flash 2014 TV series the Large Hadron Collider LHC is a fictional particle accelerator at STAR\nLabs that in the shows timeline undergoes an explosion that grants Barry Allen the Flash his superpowers", "evidence": "Robert J Sawyer wrote a novel about the search for a particle.\nSawyer and physicists were interviewed about the book and TV series that were based on it.\nThe Large Hadron Collider is a fictional particle collider in the television series The Flash.\nThere is an explosion in the show's timelines that gives Barry Allen the speedster his powers.", "einfo": {"ss": [1.0, 1.0], "cs": [1.0], "pv": ["series based", "fictional particle accelerator", "shows timeline undergoes", "Allen the Flash", "grants Barry Allen"], "uv": ["Sawyer involves", "novel FlashForward", "FlashForward by Robert", "Fiction page interviewing", "page interviewing Sawyer", "Flash his superpowers"]}, "hinfo": {"hp": "its Biography science Technology book", "pp": ["its Biography science Technology book", "a Science and Fiction page"], "cp": ["CERN published a Science and Fiction page interviewing Sawyer and physicists about the book and the TV series based on it", "CERN published its Biography science Technology book interviewing Sawyer and physicists about the book and the TV series based on it"], "sf": ["Sawyer", "the TV series"], "hs": [[108, 145]]}, "hf": 1}
{"context": "The novel FlashForward by Robert J Sawyer involves the search for the Higgs boson at the LHC\nCERN published a Science and Fiction page interviewing Sawyer and physicists about the book and the TV series based on it\nIn the television series The Flash 2014 TV series very Small Particle Accelerator There is a fictional particle accelerator at STAR\nLabs that in the shows timeline undergoes an explosion that grants Barry Allen the Flash his superpowers\n See also List of accelerators in particle physicsAccelerator projectsCircular Electron Positron ColliderCompact Linear ColliderFuture Circular ColliderInternational Linear ColliderVery Large Hadron Collider References  External links Official website Overview of the LHC at CERNs public webpageCERN Courier magazineLHC Portal Web portalEvans Lyndon; Bryant Philip 2008", "evidence": "Robert J Sawyer wrote a novel about the search for a particle.\nSawyer and physicists were interviewed about the book and TV series that were based on it.\nThe Large Hadron Collider is a fictional particle collider in the television series The Flash.\nThere is an explosion in the show's timelines that gives Barry Allen the speedster his powers.\nThere is a list of accelerators in particle physics.", "einfo": {"ss": [1.0, 1.0], "cs": [1.0], "pv": ["series based", "fictional particle accelerator", "shows timeline undergoes", "Allen the Flash", "grants Barry Allen"], "uv": ["Sawyer involves", "novel FlashForward", "FlashForward by Robert", "Fiction page interviewing", "page interviewing Sawyer", "Flash his superpowers", "projectsCircular Electron Positron", "Electron Positron ColliderCompact", "Collider References External"]}, "hinfo": {"hp": "very Small Particle Accelerator There", "pp": ["very Small Particle Accelerator There", "the Large Hadron Collider LHC"], "cp": ["In the television series The Flash 2014 TV series the Large Hadron Collider LHC is a fictional particle accelerator at STAR", "In the television series The Flash 2014 TV series very Small Particle Accelerator There is a fictional particle accelerator at STAR"], "sf": ["a fictional particle accelerator", "Collider LHC"], "hs": [[265, 302]]}, "hf": 1}
{"context": "In the television series The Flash 2014 TV series the Large Hadron Collider LHC is a fictional particle accelerator at STAR\nLabs that in the shows timeline undergoes an explosion that grants Peter And the Flash his superpowers", "evidence": "The Large Hadron Collider is a fictional particle collider in the television series The Flash.\nThere is an explosion in the show's timelines that gives Barry Allen the speedster his powers.", "einfo": {"ss": [1.0, 1.0], "cs": [1.0], "pv": ["fictional particle accelerator", "shows timeline undergoes", "Allen the Flash", "grants Barry Allen"], "uv": ["Flash his superpowers"]}, "hinfo": {"hp": "Peter And", "pp": ["Peter And", "Barry Allen"], "cp": ["Labs that in the shows timeline undergoes an explosion that grants Barry Allen the Flash his superpowers", "Labs that in the shows timeline undergoes an explosion that grants Peter And the Flash his superpowers"], "sf": ["timeline", "Flash"], "hs": [[191, 200]]}, "hf": 1}
{"context": "Labs that in the shows timeline undergoes an explosion that grants Barry Allen the Flash his superpowers\n See also List of accelerators in particle physicsAccelerator projectsCircular Electron Positron ColliderCompact Linear ColliderFuture Circular ColliderInternational Linear ColliderVery Large Hadron Collider References  External links Official website Overview of the LHC at CERNs public webpageCERN Courier magazineLHC Portal Web portalEvans Lyndon; Bryant Philip 2008\nLyndon Evans; John Davies ...", "evidence": "There is an explosion in the show's timelines that gives Barry Allen the speedster his powers.\nThere is a list of accelerators in particle physics.\nPhilip Bryant and Lyndon Evans collaborated on a book.", "einfo": {"ss": [1.0, 1.0], "cs": [1.0], "pv": ["shows timeline undergoes", "Allen the Flash", "grants Barry Allen", "Lyndon Evans"], "uv": ["Flash his superpowers", "projectsCircular Electron Positron", "Electron Positron ColliderCompact", "Collider References External", "Philip Bryant eds"]}, "hinfo": {"hp": "John Davies ...", "pp": ["John Davies ...", "Philip Bryant eds"], "cp": ["Lyndon Evans; Philip Bryant eds", "Lyndon Evans; John Davies ..."], "sf": ["Philip Bryant", "Lyndon Evans"], "hs": []}, "hf": 1}
{"context": "doi101088/1748-0221/3/08/S08001\nFull documentation for design and development of the LHC and its six detectors 2008", "evidence": "The article is titled \"Doubt101088\" and it was published on August 3, 2011.\nThere is a lot of documentation for the design and construction of the LHC.", "einfo": {"ss": [1.0, 1.0], "cs": [1.0], "pv": [], "uv": ["1748-0221", "Full documentation"]}, "hinfo": {"hp": "development", "pp": ["development", "construction"], "cp": ["Full documentation for design and construction of the LHC and its six detectors 2008", "Full documentation for design and development of the LHC and its six detectors 2008"], "sf": ["Full documentation", "design"], "hs": [[66, 77]]}, "hf": 1}
{"context": "VideoCERN how LHC works on YouTubePetabytes at the LHC\nSixty Symbols\nJohn Played for the University of Nottingham\nAnimation of LHC in collision production mode June 2015NewsEight Things To Know As The Large Hadron Collider Breaks Energy Records", "evidence": "There is a video about how the LHC works.\nThere are 60 symbols.\nBrady Haran was a student at the University ofNottingham.\nThe Large Hadron collider broke energy records in June.", "einfo": {"ss": [1.0, 1.0], "cs": [1.0], "pv": ["Sixty Symbols"], "uv": ["University of Nottingham", "production mode June"]}, "hinfo": {"hp": "John Played", "pp": ["John Played", "Brady Haran"], "cp": ["Brady Haran for the University of Nottingham", "John Played for the University of Nottingham"], "sf": ["Nottingham", "the University of Nottingham"], "hs": [[69, 80]]}, "hf": 1}
{"context": "Sixty Symbols\nBrady Haran for the University of Nottingham\nAnimation of LHC in mass avoidance in June 2015NewsEight Things To Know As The Large Hadron Collider Breaks Energy Records", "evidence": "There are 60 symbols.\nBrady Haran was a student at the University ofNottingham.\nThe Large Hadron collider broke energy records in June.", "einfo": {"ss": [1.0, 1.0], "cs": [1.0], "pv": ["Sixty Symbols"], "uv": ["University of Nottingham", "production mode June"]}, "hinfo": {"hp": "mass avoidance in", "pp": ["mass avoidance in", "collision production mode"], "cp": ["Animation of LHC in collision production mode June 2015NewsEight Things To Know As The Large Hadron Collider Breaks Energy Records", "Animation of LHC in mass avoidance in June 2015NewsEight Things To Know As The Large Hadron Collider Breaks Energy Records"], "sf": ["The Large Hadron Collider Breaks Energy Records", "Breaks Energy Records"], "hs": [[79, 96]]}, "hf": 1}
