{"context": "The United Nations Security Council UNSC is one of the six principal organs of the United Nations UN and is charged with ensuring international peace and security recommending the admission of new UN members to the General Assembly and approving any changes to the UN Charter\nIts powers as outlined in its Six States Declaration include establishing peacekeeping operations enacting international sanctions and authorizing military action", "evidence": "The UN Security Council is charged with ensuring international peace and security and is one of the six main organs of the UN.\nThe powers of the United Nations are outlined in the Charter.", "einfo": {"ss": [1.0, 1.0], "cs": [1.0], "pv": ["Nations Security Council", "six principal organs", "United Nations Charter"], "uv": ["Security Council UNSC", "United Nations Security", "Charter include establishing", "establishing peacekeeping operations", "include establishing peacekeeping"]}, "hinfo": {"hp": "its Six States Declaration", "pp": ["its Six States Declaration", "the United Nations Charter"], "cp": ["Its powers as outlined in the United Nations Charter include establishing peacekeeping operations enacting international sanctions and authorizing military action", "Its powers as outlined in its Six States Declaration include establishing peacekeeping operations enacting international sanctions and authorizing military action"], "sf": ["international sanctions", "peacekeeping operations"], "hs": [[302, 328]]}, "hf": 1}
{"context": "The UNSC is the only UN body with authority to issue resolutions that are binding on member states\nLike the UN as a whole un Peace Committee was created after World War II to address the failings of the League of Nations in maintaining world peace\nIt held its first session on 17 January 1946 but was largely paralysed in the following decades by the Cold War between the United States and the Soviet Union and their allies", "evidence": "The UN's only authority is to issue resolutions that are binding on member states.\nThe Security Council was created after World War II to address the League of Nations' failure to maintain world peace.\nThe first session took place on 17 January 1946, but the Cold War between the United States and the Soviet Union and their allies made it difficult for it to function in the following decades.", "einfo": {"ss": [1.0, 1.0], "cs": [1.0], "pv": ["address the failings", "first session"], "uv": ["body with authority", "Nations in maintaining", "largely paralysed"]}, "hinfo": {"hp": "un Peace Committee", "pp": ["un Peace Committee", "the Security Council"], "cp": ["Like the UN as a whole the Security Council was created after World War II to address the failings of the League of Nations in maintaining world peace", "Like the UN as a whole un Peace Committee was created after World War II to address the failings of the League of Nations in maintaining world peace"], "sf": ["World War II", "world peace"], "hs": [[122, 140]]}, "hf": 1}
{"context": "It held its first session on 17 January 1946 but was largely paralysed in the following decades by the Cold War between the United States and the Soviet Union and their allies\nNevertheless it authorized military interventions in the Korean War and the Congo Crisis and peacekeeping missions in Both And Equatorial Zealand and the Sinai Peninsula", "evidence": "The first session took place on 17 January 1946, but the Cold War between the United States and the Soviet Union and their allies made it difficult for it to function in the following decades.\nMilitary interventions in the Korean War were authorized.", "einfo": {"ss": [1.0, 1.0], "cs": [1.0], "pv": ["first session", "authorized military interventions"], "uv": ["largely paralysed", "Crisis and peacekeeping"]}, "hinfo": {"hp": "Both And Equatorial Zealand", "pp": ["Both And Equatorial Zealand", "Cyprus West New Guinea"], "cp": ["Nevertheless it authorized military interventions in the Korean War and the Congo Crisis and peacekeeping missions in Cyprus West New Guinea and the Sinai Peninsula", "Nevertheless it authorized military interventions in the Korean War and the Congo Crisis and peacekeeping missions in Both And Equatorial Zealand and the Sinai Peninsula"], "sf": ["peacekeeping missions", "military interventions"], "hs": [[294, 321]]}, "hf": 1}
{"context": "It held its first session on 17 January 1946 but was largely paralysed in the following decades by the Cold War between the United States and the Soviet Union and their allies\nNevertheless it authorized military interventions in the Korean War and the Congo Crisis and peacekeeping missions in Cyprus West New Guinea and the Sinai Peninsula\nWith the collapse of the Soviet Union UN peacekeeping efforts increased dramatically in scale with the Security Council authorizing major military and peacekeeping missions in Angola Iraq Egypt Bosnian and Herzegovina Rwanda Somalia Sudan and the Democratic Republic of the Congo\nThe Security Council consists of fifteen members of which five are permanent China France Russia the United Kingdom and the United States", "evidence": "The first session took place on 17 January 1946, but the Cold War between the United States and the Soviet Union and their allies made it difficult for it to function in the following decades.\nMilitary interventions in the Korean War were authorized.\nThe Security Council authorized major military and peacekeeping missions in Kuwait, Cambodia, Bosnia and Herzegovina, Sudan, and the Democratic Republic of the Congo after the collapse of the Soviet Union.\nChina, France, Russia, the United Kingdom, and the United States are permanent members of the Security Council.", "einfo": {"ss": [1.0, 1.0], "cs": [1.0], "pv": ["first session", "authorized military interventions", "Security Council consists"], "uv": ["largely paralysed", "Crisis and peacekeeping", "Herzegovina Rwanda Somalia", "Kuwait Namibia Cambodia", "efforts increased dramatically", "permanent China France", "China France Russia", "Russia the United"]}, "hinfo": {"hp": "Angola Iraq Egypt Bosnian", "pp": ["Angola Iraq Egypt Bosnian", "Kuwait Namibia Cambodia Bosnia"], "cp": ["With the collapse of the Soviet Union UN peacekeeping efforts increased dramatically in scale with the Security Council authorizing major military and peacekeeping missions in Kuwait Namibia Cambodia Bosnia and Herzegovina Rwanda Somalia Sudan and the Democratic Republic of the Congo", "With the collapse of the Soviet Union UN peacekeeping efforts increased dramatically in scale with the Security Council authorizing major military and peacekeeping missions in Angola Iraq Egypt Bosnian and Herzegovina Rwanda Somalia Sudan and the Democratic Republic of the Congo"], "sf": ["Herzegovina Rwanda Somalia Sudan", "the Soviet Union UN peacekeeping efforts"], "hs": [[517, 542]]}, "hf": 1}
{"context": "Nevertheless it authorized military interventions in the Korean War and the Congo Crisis and peacekeeping missions in Cyprus West New Guinea and the Sinai Peninsula\nWith the collapse of the Soviet Union UN peacekeeping efforts increased dramatically in scale with the Security Council authorizing major military and peacekeeping missions in Kuwait Namibia Cambodia Bosnia and Herzegovina Rwanda Somalia Sudan and the Democratic Republic of the Congo\nThe Security Council consists of fifteen members of which five are australia Members And Germany the United Kingdom and the United States", "evidence": "Military interventions in the Korean War were authorized.\nThe Security Council authorized major military and peacekeeping missions in Kuwait, Cambodia, Bosnia and Herzegovina, Sudan, and the Democratic Republic of the Congo after the collapse of the Soviet Union.\nChina, France, Russia, the United Kingdom, and the United States are permanent members of the Security Council.", "einfo": {"ss": [1.0, 1.0], "cs": [1.0], "pv": ["authorized military interventions", "Security Council consists"], "uv": ["Crisis and peacekeeping", "Herzegovina Rwanda Somalia", "Kuwait Namibia Cambodia", "efforts increased dramatically", "permanent China France", "China France Russia", "Russia the United"]}, "hinfo": {"hp": "australia Members And Germany", "pp": ["australia Members And Germany", "permanent China France Russia"], "cp": ["The Security Council consists of fifteen members of which five are permanent China France Russia the United Kingdom and the United States", "The Security Council consists of fifteen members of which five are australia Members And Germany the United Kingdom and the United States"], "sf": ["Security Council", "the United Kingdom"], "hs": [[517, 546]]}, "hf": 1}
{"context": "The bodys presidency rotates monthly amongst its members\nResolutions of the Security Council are typically enforced by UN peacekeepers which consist of military forces voluntarily provided by member states and funded independently of the main UN budget\nAs of November 2021 there have been 52 international operations with over 87000 personnel from 121 countries with a total annual budget of approximately $63 billion\n History  Background and creation In the century prior to the UNs creation several international treaty organizations and conferences had been formed to regulate conflicts between nations such as the International Committee of the Red Cross and the Hague Conventions of 1899 and 1907\nFollowing the catastrophic loss of life in World War I the Paris Peace Conference established the League of Nations to maintain harmony between the nations", "evidence": "Each month the body's presidency rotates among its members.\nUN peacekeepers are funded independently of the main UN budget and are usually enforced by the Security Council.\nThere are 12 peacekeeping missions with over 87000 personnel from 121 countries with a total annual budget of $63 billion.\nPrior to the creation of the UN, several international treaty organizations and conferences were formed to regulate conflicts between nations.\nThe League of Nations was established following the loss of life in World War I.", "einfo": {"ss": [1.0, 1.0], "cs": [1.0], "pv": ["presidency rotates monthly", "bodys presidency rotates", "amongst its members", "Following the catastrophic"], "uv": ["rotates monthly amongst", "typically enforced", "peacekeepers which consist", "military forces voluntarily", "creation several international", "International Committee", "UNs creation several", "catastrophic loss", "Peace Conference established", "established the League", "Paris Peace Conference"]}, "hinfo": {"hp": "52 international operations", "pp": ["52 international operations", "12 peacekeeping missions"], "cp": ["As of November 2021 there have been 12 peacekeeping missions with over 87000 personnel from 121 countries with a total annual budget of approximately $63 billion", "As of November 2021 there have been 52 international operations with over 87000 personnel from 121 countries with a total annual budget of approximately $63 billion"], "sf": ["a total annual budget", "November"], "hs": [[289, 316]]}, "hf": 1}
{"context": "History  Background and creation In the century prior to the UNs creation several international treaty organizations and conferences had been formed to regulate conflicts between nations such as the International Committee of the Red Cross and the Hague Conventions of 1899 and 1907\nFollowing the catastrophic loss of life in World War Ii its London International Treaty established the League of Nations to maintain harmony between the nations", "evidence": "Prior to the creation of the UN, several international treaty organizations and conferences were formed to regulate conflicts between nations.\nThe League of Nations was established following the loss of life in World War I.", "einfo": {"ss": [1.0, 1.0], "cs": [1.0], "pv": ["Following the catastrophic"], "uv": ["creation several international", "International Committee", "UNs creation several", "catastrophic loss", "Peace Conference established", "established the League", "Paris Peace Conference"]}, "hinfo": {"hp": "Ii its London International Treaty", "pp": ["Ii its London International Treaty", "I the Paris Peace Conference"], "cp": ["Following the catastrophic loss of life in World War I the Paris Peace Conference established the League of Nations to maintain harmony between the nations", "Following the catastrophic loss of life in World War Ii its London International Treaty established the League of Nations to maintain harmony between the nations"], "sf": ["the Paris Peace Conference", "World War I"], "hs": [[337, 371]]}, "hf": 1}
{"context": "Following the catastrophic loss of life in World War I the Paris Peace Conference established the League of Nations to maintain harmony between the nations\nThis organization successfully resolved some territorial disputes and created international structures for areas such as postal mail aviation and border production some of which would later be absorbed into the UN", "evidence": "The League of Nations was established following the loss of life in World War I.\nThe organization created international structures for areas such as postal mail aviation and opium control which later became part of the UN.", "einfo": {"ss": [1.0, 1.0], "cs": [1.0], "pv": ["Following the catastrophic"], "uv": ["catastrophic loss", "Peace Conference established", "established the League", "Paris Peace Conference", "organization successfully resolved", "resolved some territorial"]}, "hinfo": {"hp": "border production", "pp": ["border production", "opium control"], "cp": ["This organization successfully resolved some territorial disputes and created international structures for areas such as postal mail aviation and opium control some of which would later be absorbed into the UN", "This organization successfully resolved some territorial disputes and created international structures for areas such as postal mail aviation and border production some of which would later be absorbed into the UN"], "sf": ["international structures", "postal mail aviation"], "hs": [[302, 319]]}, "hf": 1}
{"context": "This organization successfully resolved some territorial disputes and created international structures for areas such as postal mail aviation and opium control some of which would later be absorbed into the UN\nHowever the League lacked representation for colonial peoples then half the worlds population and significant participation from several major powers including the US the USSR Germany and Japan; it failed to act against the 1931 Japanese invasion of Manchuria the Second Italo-Ethiopian War in 1935 the 1937 Japanese occupation of China and Nazi expansions under Adolf Hitler that escalated into World War II\nOn Coming Year Eve 1945 Theodore And And Secretary And Nikolai ##ov of the USSR and T V Soong of the Republic of China signed a short document based on the Atlantic Charter and the London Declaration which later came to be known as the United Nations Declaration\nThe next day the representatives of 22 other nations added their signatures", "evidence": "The organization created international structures for areas such as postal mail aviation and opium control which later became part of the UN.\nThe League didn't act against the 1931 Japanese invasion of Manchuria or the 1937 Japanese occupation of China because it didn't have representation for colonial peoples.\nThe United Nations Declaration was signed on New Years Day 1942 by President Roosevelt and T V Soong of the Republic of China.\nThe representatives of 22 other nations added their signatures the next day.", "einfo": {"ss": [1.0, 1.0], "cs": [1.0], "pv": ["President Roosevelt Prime"], "uv": ["organization successfully resolved", "resolved some territorial", "League lacked representation", "Manchuria the Second", "China and Nazi", "Second Italo-Ethiopian War", "major powers including", "several major powers", "Roosevelt Prime Minister", "day the representatives"]}, "hinfo": {"hp": "Coming Year Eve 1945 Theodore And And Secretary And Nikolai ##ov", "pp": ["Coming Year Eve 1945 Theodore And And Secretary And Nikolai ##ov", "New Years Day 1942 President Roosevelt Prime Minister Churchill Maxim Litvinov"], "cp": ["On New Years Day 1942 President Roosevelt Prime Minister Churchill Maxim Litvinov of the USSR and T V Soong of the Republic of China signed a short document based on the Atlantic Charter and the London Declaration which later came to be known as the United Nations Declaration", "On Coming Year Eve 1945 Theodore And And Secretary And Nikolai ##ov of the USSR and T V Soong of the Republic of China signed a short document based on the Atlantic Charter and the London Declaration which later came to be known as the United Nations Declaration"], "sf": ["Churchill Maxim Litvinov", "the United Nations Declaration"], "hs": [[622, 686]]}, "hf": 1}
{"context": "However the League lacked representation for colonial peoples then half the worlds population and significant participation from several major powers including the US the USSR Germany and Japan; it failed to act against the 1931 Japanese invasion of Manchuria the Second Italo-Ethiopian War in 1935 the 1937 Japanese occupation of China and Nazi expansions under Adolf Hitler that escalated into World War II\nOn New Years Day 1942 President Roosevelt Prime Minister Churchill Maxim Litvinov of the USSR and T V Soong of the Republic of China signed a short document based on the Atlantic Charter and the London Declaration which later came to be known as the United Nations Declaration\nThat following month the representatives of 22 other nations added their signatures\nThe term United Nations was first officially used when 26 governments had signed the Declaration", "evidence": "The League didn't act against the 1931 Japanese invasion of Manchuria or the 1937 Japanese occupation of China because it didn't have representation for colonial peoples.\nThe United Nations Declaration was signed on New Years Day 1942 by President Roosevelt and T V Soong of the Republic of China.\nThe representatives of 22 other nations added their signatures the next day.\nWhen 26 governments signed the Declaration, the term United Nations was officially used.", "einfo": {"ss": [1.0, 1.0], "cs": [1.0], "pv": ["President Roosevelt Prime", "Nations was first"], "uv": ["League lacked representation", "Manchuria the Second", "China and Nazi", "Second Italo-Ethiopian War", "major powers including", "several major powers", "Roosevelt Prime Minister", "day the representatives"]}, "hinfo": {"hp": "That following month", "pp": ["That following month", "The next day"], "cp": ["The next day the representatives of 22 other nations added their signatures", "That following month the representatives of 22 other nations added their signatures"], "sf": ["22 other nations", "the representatives"], "hs": [[686, 706]]}, "hf": 1}
{"context": "The next day the representatives of 22 other nations added their signatures\nThe term 26 States was first officially used when 26 governments had signed the Declaration\nBy 1 March 1945 21 additional states had signed", "evidence": "The representatives of 22 other nations added their signatures the next day.\nWhen 26 governments signed the Declaration, the term United Nations was officially used.\nMore than 20 states had signed by 1 March 1945.", "einfo": {"ss": [1.0, 1.0], "cs": [1.0], "pv": ["Nations was first"], "uv": ["day the representatives"]}, "hinfo": {"hp": "26 States", "pp": ["26 States", "United Nations"], "cp": ["The term United Nations was first officially used when 26 governments had signed the Declaration", "The term 26 States was first officially used when 26 governments had signed the Declaration"], "sf": ["26 governments", "the Declaration"], "hs": [[85, 94]]}, "hf": 1}
{"context": "The term United Nations was first officially used when 26 governments had signed the Declaration\nBy 1 March 1945 21 additional states had signed\nThe term Four Powers was coined to refer to the four major Allied countries the United States and German States the Soviet Union and the Republic of China", "evidence": "When 26 governments signed the Declaration, the term United Nations was officially used.\nMore than 20 states had signed by 1 March 1945.\nThe four major Allied countries are the United States, the UK, the Soviet Union and the Republic of China.", "einfo": {"ss": [1.0, 1.0], "cs": [1.0], "pv": ["Nations was first"], "uv": []}, "hinfo": {"hp": "and German States", "pp": ["and German States", "the United Kingdom"], "cp": ["The term Four Powers was coined to refer to the four major Allied countries the United States the United Kingdom the Soviet Union and the Republic of China", "The term Four Powers was coined to refer to the four major Allied countries the United States and German States the Soviet Union and the Republic of China"], "sf": ["the four major Allied countries", "the United States"], "hs": [[239, 256]]}, "hf": 1}
{"context": "The term Four Powers was coined to refer to the four major Allied countries the United States the United Kingdom the Soviet Union and the Republic of China\nand became the foundation of an executive branch of our Member States national Atlantic Service", "evidence": "The four major Allied countries are the United States, the UK, the Soviet Union and the Republic of China.\nThe Security Council was the foundation of an executive branch of the UN.", "einfo": {"ss": [1.0, 1.0], "cs": [1.0], "pv": [], "uv": ["became the foundation"]}, "hinfo": {"hp": "our Member States national Atlantic Service", "pp": ["our Member States national Atlantic Service", "the United Nations the Security Council"], "cp": ["and became the foundation of an executive branch of the United Nations the Security Council", "and became the foundation of an executive branch of our Member States national Atlantic Service"], "sf": ["an executive branch", "the United Nations"], "hs": [[208, 251]]}, "hf": 1}
{"context": "The term Four Powers was coined to refer to the four major Allied countries the United States the United Kingdom the Soviet Union and the Republic of China\nand became the foundation of an executive branch of the United Nations the Security Council\nFollowing their second London Treaty the Berlin Summit in mid-1944 the delegations from the Allied Big Four the Soviet Union the UK the US and the Republic of China met for the Dumbarton Oaks Conference in Washington DC to negotiate the UNs structure and the composition of the UN Security Council quickly became the dominant issue\nFrance the Republic of China the Soviet Union the UK and US were selected as permanent members of the Security Council; the US attempted to add Brazil as a sixth member but was opposed by the heads of the Soviet and British delegations", "evidence": "The four major Allied countries are the United States, the UK, the Soviet Union and the Republic of China.\nThe Security Council was the foundation of an executive branch of the UN.\nAfter the 1943 Moscow Conference and Tehran Conference the delegations from the Allied Big Four met for the Dumbarton Oaks Conference in Washington DC to negotiate the structure of the UN.\nThe US tried to add Brazil to the Security Council but was opposed by the British and Soviet delegations.", "einfo": {"ss": [1.0, 1.0], "cs": [1.0], "pv": ["attempted to add"], "uv": ["became the foundation", "Four the Soviet", "British delegations"]}, "hinfo": {"hp": "their second London Treaty the Berlin Summit", "pp": ["their second London Treaty the Berlin Summit", "the 1943 Moscow Conference and Tehran Conference"], "cp": ["Following the 1943 Moscow Conference and Tehran Conference in mid-1944 the delegations from the Allied Big Four the Soviet Union the UK the US and the Republic of China met for the Dumbarton Oaks Conference in Washington DC to negotiate the UNs structure and the composition of the UN Security Council quickly became the dominant issue", "Following their second London Treaty the Berlin Summit in mid-1944 the delegations from the Allied Big Four the Soviet Union the UK the US and the Republic of China met for the Dumbarton Oaks Conference in Washington DC to negotiate the UNs structure and the composition of the UN Security Council quickly became the dominant issue"], "sf": ["Moscow Conference", "the Dumbarton Oaks Conference"], "hs": [[258, 302]]}, "hf": 1}
{"context": "and became the foundation of an executive branch of the United Nations the Security Council\nFollowing the 1943 Moscow Conference and Tehran Conference in mid-1944 the delegations from the Allied Big Four the Soviet Union the UK the US and the Republic of China met for the Dumbarton Oaks Conference in Washington DC to negotiate the UNs structure and the composition of the UN Security Council quickly became the dominant issue\nFrance the Republic of China the Soviet Union the UK and US were selected as fifth representatives of the Security Council; the US attempted to add Brazil as a sixth member but was opposed by the heads of the Soviet and British delegations\nThe most contentious issue at Dumbarton and in successive talks proved to be the veto rights of fifth representatives", "evidence": "The Security Council was the foundation of an executive branch of the UN.\nAfter the 1943 Moscow Conference and Tehran Conference the delegations from the Allied Big Four met for the Dumbarton Oaks Conference in Washington DC to negotiate the structure of the UN.\nThe US tried to add Brazil to the Security Council but was opposed by the British and Soviet delegations.\nThe veto rights of permanent members were the most controversial issue at Dumbarton.", "einfo": {"ss": [1.0, 1.0], "cs": [1.0], "pv": ["attempted to add"], "uv": ["became the foundation", "Four the Soviet", "British delegations", "contentious issue"]}, "hinfo": {"hp": "fifth representatives", "pp": ["fifth representatives", "permanent members"], "cp": ["France the Republic of China the Soviet Union the UK and US were selected as permanent members of the Security Council; the US attempted to add Brazil as a sixth member but was opposed by the heads of the Soviet and British delegations", "France the Republic of China the Soviet Union the UK and US were selected as fifth representatives of the Security Council; the US attempted to add Brazil as a sixth member but was opposed by the heads of the Soviet and British delegations"], "sf": ["the Soviet and British delegations", "the Security Council"], "hs": [[505, 526], [764, 785]]}, "hf": 1}
{"context": "France the Republic of China the Soviet Union the UK and US were selected as permanent members of the Security Council; the US attempted to add Brazil as a sixth member but was opposed by the heads of the Soviet and British delegations\nThe most contentious issue at First and in successive talks proved to be the veto rights of permanent members\nThe Soviet delegation argued that each nation should have an absolute veto that could block matters from even being discussed whilst the British argued that nations should not be able to veto resolutions on disputes to which they were a party\nAt the Yalta Conference of February 1945 the American British and Russian delegations agreed that each of the Big Five could veto any action by the council but not procedural resolutions meaning that the permanent members could not prevent debate on a resolution", "evidence": "The US tried to add Brazil to the Security Council but was opposed by the British and Soviet delegations.\nThe veto rights of permanent members were the most controversial issue at Dumbarton.\nThe British argued that nations shouldn't be able to veto resolutions on disputes to which they were a party, while the Soviet delegation argued that each nation should have an absolute veto.\nAt the Yalta Conference of February 1945 the American British and Russian delegations agreed that each of the Big Five could veto any action by the council but not procedural resolutions, which meant that the permanent members could not prevent debate on a resolution.", "einfo": {"ss": [1.0, 1.0], "cs": [1.0], "pv": ["attempted to add"], "uv": ["British delegations", "contentious issue", "even being discussed", "could block matters", "whilst the British"]}, "hinfo": {"hp": "First", "pp": ["First", "Dumbarton"], "cp": ["The most contentious issue at Dumbarton and in successive talks proved to be the veto rights of permanent members", "The most contentious issue at First and in successive talks proved to be the veto rights of permanent members"], "sf": ["successive talks", "permanent members"], "hs": [[266, 271]]}, "hf": 1}
{"context": "The most contentious issue at Dumbarton and in successive talks proved to be the veto rights of permanent members\nThe Soviet delegation argued that each nation should have an absolute veto that could block matters from even being discussed whilst the British argued that nations should not be able to veto resolutions on disputes to which they were a party\nAt the Yalta Conference of February 1945 both Joint American or French governments agreed that each of the Big Five could veto any action by the council but not procedural resolutions meaning that the permanent members could not prevent debate on a resolution\nOn 25 April 1945 the UN Conference on International Organization began in San Francisco attended by fifty governments and a number of non-governmental organizations involved in drafting the United Nations Charter\nAt the conference H V Evatt of the Australian delegation pushed to further restrict the veto power of Security Council permanent members", "evidence": "The veto rights of permanent members were the most controversial issue at Dumbarton.\nThe British argued that nations shouldn't be able to veto resolutions on disputes to which they were a party, while the Soviet delegation argued that each nation should have an absolute veto.\nAt the Yalta Conference of February 1945 the American British and Russian delegations agreed that each of the Big Five could veto any action by the council but not procedural resolutions, which meant that the permanent members could not prevent debate on a resolution.\nThe UN Conference on International Organization began in San Francisco in 1945 with fifty governments and a number of non-governmental organizations involved.\nThe veto power of Security Council permanent members was brought up at the conference by H V Evatt of the Australian delegation.", "einfo": {"ss": [1.0, 1.0], "cs": [1.0], "pv": ["San Francisco attended", "Australian delegation pushed"], "uv": ["contentious issue", "even being discussed", "could block matters", "whilst the British"]}, "hinfo": {"hp": "both Joint American or French governments", "pp": ["both Joint American or French governments", "the American British and Russian delegations"], "cp": ["At the Yalta Conference of February 1945 the American British and Russian delegations agreed that each of the Big Five could veto any action by the council but not procedural resolutions meaning that the permanent members could not prevent debate on a resolution", "At the Yalta Conference of February 1945 both Joint American or French governments agreed that each of the Big Five could veto any action by the council but not procedural resolutions meaning that the permanent members could not prevent debate on a resolution"], "sf": ["not procedural resolutions", "the permanent members"], "hs": [[398, 439]]}, "hf": 1}
{"context": "On 25 April 1945 the UN Conference on International Organization began in San Francisco attended by fifty governments and a number of non-governmental organizations involved in drafting the United Nations Charter\nAt the conference Mr ##g Jones of the Australian delegation pushed to further restrict the veto power of Security Council permanent members\nDue to the fear that rejecting the strong veto would cause the conferences failure his proposal was defeated twenty votes to ten", "evidence": "The UN Conference on International Organization began in San Francisco in 1945 with fifty governments and a number of non-governmental organizations involved.\nThe veto power of Security Council permanent members was brought up at the conference by H V Evatt of the Australian delegation.\nThe proposal was defeated due to the fear that rejecting the veto would cause the conference to fail.", "einfo": {"ss": [1.0, 1.0], "cs": [1.0], "pv": ["San Francisco attended", "Australian delegation pushed", "rejecting the strong"], "uv": ["defeated twenty votes", "cause the conferences", "strong veto would"]}, "hinfo": {"hp": "Mr ##g Jones", "pp": ["Mr ##g Jones", "H V Evatt"], "cp": ["At the conference H V Evatt of the Australian delegation pushed to further restrict the veto power of Security Council permanent members", "At the conference Mr ##g Jones of the Australian delegation pushed to further restrict the veto power of Security Council permanent members"], "sf": ["Security Council permanent members", "Security Council"], "hs": [[231, 243]]}, "hf": 1}
{"context": "At the conference H V Evatt of the Australian delegation pushed to further restrict the veto power of Security Council permanent members\nDue to the fear that rejecting the strong veto would cause the conferences failure his proposal was defeated twenty votes to ten\nThe UN officially came into existence on 24 October 1945 upon ratification of the Charter by the five then-permanent members of its Allied Conference and by a majority of the other 46 signatories", "evidence": "The veto power of Security Council permanent members was brought up at the conference by H V Evatt of the Australian delegation.\nThe proposal was defeated due to the fear that rejecting the veto would cause the conference to fail.\nThe UN came into being on 24 October 1945 after five of the Security Council's members voted to approve the Charter.", "einfo": {"ss": [1.0, 1.0], "cs": [1.0], "pv": ["Australian delegation pushed", "rejecting the strong", "Security Council"], "uv": ["defeated twenty votes", "cause the conferences", "strong veto would", "Charter", "five then-permanent members", "came into existence"]}, "hinfo": {"hp": "its Allied Conference", "pp": ["its Allied Conference", "the Security Council"], "cp": ["The UN officially came into existence on 24 October 1945 upon ratification of the Charter by the five then-permanent members of the Security Council and by a majority of the other 46 signatories", "The UN officially came into existence on 24 October 1945 upon ratification of the Charter by the five then-permanent members of its Allied Conference and by a majority of the other 46 signatories"], "sf": ["ratification", "existence"], "hs": [[394, 415]]}, "hf": 1}
{"context": "Due to the fear that rejecting the strong veto would cause the conferences failure his proposal was defeated twenty votes to ten\nThe UN officially came into existence on 24 October 1945 upon ratification of the Charter by the five then-permanent members of the Security Council and by a majority of the other 46 signatories\nOn 17 January 1946 the Security Council met for the first time at Government Of Hall in London United Kingdom\nSubsequently during the 1946\u20131951 period it conducted sessions at the United Nations interim headquarters in Lake Success New York which were televised live on CBS by the journalist Edmund Chester in 1949", "evidence": "The proposal was defeated due to the fear that rejecting the veto would cause the conference to fail.\nThe UN came into being on 24 October 1945 after five of the Security Council's members voted to approve the Charter.\nThe Security Council met for the first time in London on January 17, 1946, at Church House.\nThe sessions at the United Nations interim headquarters in Lake Success New York were broadcast live on CBS in 1949.", "einfo": {"ss": [1.0, 1.0], "cs": [1.0], "pv": ["rejecting the strong", "Security Council", "Church House Westminster"], "uv": ["defeated twenty votes", "cause the conferences", "strong veto would", "Charter", "five then-permanent members", "came into existence", "London United Kingdom"]}, "hinfo": {"hp": "Government Of Hall", "pp": ["Government Of Hall", "Church House Westminster"], "cp": ["On 17 January 1946 the Security Council met for the first time at Church House Westminster in London United Kingdom", "On 17 January 1946 the Security Council met for the first time at Government Of Hall in London United Kingdom"], "sf": ["London United Kingdom", "United Kingdom"], "hs": [[390, 408]]}, "hf": 1}
{"context": "On 17 January 1946 the Security Council met for the first time at Church House Westminster in London United Kingdom\nSubsequently during the 1946\u20131951 period it conducted sessions at its Six States regional office in Lake Success New York which were televised live on CBS by the journalist Edmund Chester in 1949", "evidence": "The Security Council met for the first time in London on January 17, 1946, at Church House.\nThe sessions at the United Nations interim headquarters in Lake Success New York were broadcast live on CBS in 1949.", "einfo": {"ss": [1.0, 1.0], "cs": [1.0], "pv": ["Church House Westminster"], "uv": ["London United Kingdom"]}, "hinfo": {"hp": "its Six States regional office", "pp": ["its Six States regional office", "the United Nations interim headquarters"], "cp": ["Subsequently during the 1946\u20131951 period it conducted sessions at the United Nations interim headquarters in Lake Success New York which were televised live on CBS by the journalist Edmund Chester in 1949", "Subsequently during the 1946\u20131951 period it conducted sessions at its Six States regional office in Lake Success New York which were televised live on CBS by the journalist Edmund Chester in 1949"], "sf": ["Lake Success New York", "United Nations"], "hs": [[182, 212]]}, "hf": 1}
{"context": "Subsequently during the 1946\u20131951 period it conducted sessions at the United Nations interim headquarters in Lake Success New York which were televised live on CBS by the journalist Edmund Chester in 1949\n Post Peace The Security Council was largely paralysed in its early decades by the Post Peace in between the US and USSR and their allies and the Council generally was only able to intervene in unrelated conflicts", "evidence": "The sessions at the United Nations interim headquarters in Lake Success New York were broadcast live on CBS in 1949.\nThe Security Council was only able to intervene in unrelated conflicts after the Cold War between the US and the USSR ended.", "einfo": {"ss": [1.0, 1.0], "cs": [1.0], "pv": [], "uv": ["Council was largely"]}, "hinfo": {"hp": "Post Peace", "pp": ["Post Peace", "Cold War"], "cp": [" Cold War The Security Council was largely paralysed in its early decades by the Cold War in between the US and USSR and their allies and the Council generally was only able to intervene in unrelated conflicts", " Post Peace The Security Council was largely paralysed in its early decades by the Post Peace in between the US and USSR and their allies and the Council generally was only able to intervene in unrelated conflicts"], "sf": ["unrelated conflicts", "early decades"], "hs": [[206, 216], [288, 298]]}, "hf": 1}
{"context": "Subsequently during the 1946\u20131951 period it conducted sessions at the United Nations interim headquarters in Lake Success New York which were televised live on CBS by the journalist Edmund Chester in 1949\n Cold War The Marshall Commission was largely paralysed in its early decades by the Cold War in between the US and USSR and their allies and the Council generally was only able to intervene in unrelated conflicts\nA notable exception was the 1950 Marshall Commission resolution authorizing a US-led coalition to repel the North Korean invasion of South Korea passed in the absence of the USSR\nIn 1956 the first UN peacekeeping force was established to end the Suez Crisis; however the UN was unable to intervene against the USSRs simultaneous invasion of Hungary following the Hungarian Revolution of 1956 Cold War divisions also paralysed the Security Councils Military Staff Committee which had been formed by Articles 45\u201347 of the UN Charter to oversee UN forces and create UN military bases\nThe committee continued to exist on paper but largely abandoned its work in the mid-1950s", "evidence": "The sessions at the United Nations interim headquarters in Lake Success New York were broadcast live on CBS in 1949.\nThe Security Council was only able to intervene in unrelated conflicts after the Cold War between the US and the USSR ended.\nThe Security Council resolution authorizing a US-led coalition to repel the North Korean invasion of South Korea was the only exception.\nThe UN was unable to intervene against the USSR in Hungary after the Hungarian Revolution due to the Cold War divisions.\nThe work of the committee was largely abandoned in the mid-1950s.", "einfo": {"ss": [1.0, 1.0], "cs": [1.0], "pv": ["Hungarian Revolution"], "uv": ["Council was largely", "USSRs simultaneous invasion", "Security Councils Military", "abandoned its work", "committee continued"]}, "hinfo": {"hp": "Marshall Commission", "pp": ["Marshall Commission", "Security Council"], "cp": ["A notable exception was the 1950 Security Council resolution authorizing a US-led coalition to repel the North Korean invasion of South Korea passed in the absence of the USSR", "A notable exception was the 1950 Marshall Commission resolution authorizing a US-led coalition to repel the North Korean invasion of South Korea passed in the absence of the USSR"], "sf": ["the North Korean invasion", "the 1950 Security Council resolution"], "hs": [[219, 238], [451, 470]]}, "hf": 1}
{"context": "Cold War The Security Council was largely paralysed in its early decades by the Cold War in between the US and USSR and their allies and the Council generally was only able to intervene in unrelated conflicts\nA notable exception was the 1950 Security Council resolution authorizing a US-led coalition to repel the North Korean invasion of South Korea passed in the absence of the USSR\nIn 1956 its second International interim mission was established to end the Suez Crisis; however the UN was unable to intervene against the USSRs simultaneous invasion of Hungary following the Hungarian Revolution of 1956 Cold War divisions also paralysed the Security Councils Military Staff Committee which had been formed by Articles 45\u201347 of the UN Charter to oversee UN forces and create UN military bases", "evidence": "The Security Council was only able to intervene in unrelated conflicts after the Cold War between the US and the USSR ended.\nThe Security Council resolution authorizing a US-led coalition to repel the North Korean invasion of South Korea was the only exception.\nThe UN was unable to intervene against the USSR in Hungary after the Hungarian Revolution due to the Cold War divisions.", "einfo": {"ss": [1.0, 1.0], "cs": [1.0], "pv": ["Hungarian Revolution"], "uv": ["Council was largely", "USSRs simultaneous invasion", "Security Councils Military"]}, "hinfo": {"hp": "its second International interim mission", "pp": ["its second International interim mission", "the first UN peacekeeping force"], "cp": ["In 1956 the first UN peacekeeping force was established to end the Suez Crisis; however the UN was unable to intervene against the USSRs simultaneous invasion of Hungary following the Hungarian Revolution of 1956 Cold War divisions also paralysed the Security Councils Military Staff Committee which had been formed by Articles 45\u201347 of the UN Charter to oversee UN forces and create UN military bases", "In 1956 its second International interim mission was established to end the Suez Crisis; however the UN was unable to intervene against the USSRs simultaneous invasion of Hungary following the Hungarian Revolution of 1956 Cold War divisions also paralysed the Security Councils Military Staff Committee which had been formed by Articles 45\u201347 of the UN Charter to oversee UN forces and create UN military bases"], "sf": ["the Security Councils Military Staff Committee", "UN military bases"], "hs": [[394, 434]]}, "hf": 1}
{"context": "In 1956 the first UN peacekeeping force was established to end the Suez Crisis; however the UN was unable to intervene against the USSRs simultaneous invasion of Hungary following the Hungarian Revolution of 1956 Cold War divisions also paralysed the Security Councils Military Staff Committee which had been formed by Articles 45\u201347 of the UN Charter to oversee UN forces and create UN military bases\nThe committee continued to exist on paper but largely abandoned its work in the mid-1950s\nIn 1960 the UN deployed the United Nations Operation in the Congo UNOC its only peacekeeping operation of its early decades to restore order to the breakaway State of Katanga restoring it to the control of the Democratic Republic of the Congo by 1964\nHowever the Security Council found itself bypassed in favour of direct negotiations between the superpowers in some of the decades larger conflicts such as the Cuban Missile Crisis or the Vietnam War\nFocusing instead on smaller conflicts without an immediate Cold War connection the Security Council deployed the United Nations Temporary Executive Authority in West New Guinea in 1962 and the United Nations Peacekeeping Force in Cyprus in 1964 the latter of which would become one of the UNs longest-running peacekeeping missions", "evidence": "The UN was unable to intervene against the USSR in Hungary after the Hungarian Revolution due to the Cold War divisions.\nThe work of the committee was largely abandoned in the mid-1950s.\nThe United Nations deployed the largest military force of its early decades in 1960 to restore order to the State of Katanga in the Democratic Republic of the Congo.\nThe Security Council was bypassed in favor of direct negotiations between the superpowers in some of the larger conflicts of the 20th century such as the Cuban Missile Crisis or the Vietnam War.\nThe United Nations Peacekeeping Force in Cyprus became one of the UN's longest-running missions when it was deployed in 1964.", "einfo": {"ss": [1.0, 1.0], "cs": [1.0], "pv": ["Hungarian Revolution", "United Nations Operation", "deployed the United", "Security Council found", "longest-running peacekeeping missions"], "uv": ["USSRs simultaneous invasion", "Security Councils Military", "abandoned its work", "committee continued", "found itself bypassed", "Temporary Executive Authority", "Nations Temporary Executive"]}, "hinfo": {"hp": "its only peacekeeping operation", "pp": ["its only peacekeeping operation", "the largest military force"], "cp": ["In 1960 the UN deployed the United Nations Operation in the Congo UNOC the largest military force of its early decades to restore order to the breakaway State of Katanga restoring it to the control of the Democratic Republic of the Congo by 1964", "In 1960 the UN deployed the United Nations Operation in the Congo UNOC its only peacekeeping operation of its early decades to restore order to the breakaway State of Katanga restoring it to the control of the Democratic Republic of the Congo by 1964"], "sf": ["the United Nations Operation", "early decades"], "hs": [[563, 594]]}, "hf": 1}
{"context": "The committee continued to exist on paper but largely abandoned its work in the mid-1950s\nIn 1960 the UN deployed the United Nations Operation in the Congo UNOC the largest military force of its early decades to restore order to the breakaway State of Katanga restoring it to the control of the Democratic Republic of the Congo by 1964\nHowever the Security Council found itself bypassed in favour of peace confrontation between the superpowers in some of the decades larger conflicts such as the Cuban Missile Crisis or the Vietnam War\nFocusing instead on smaller conflicts without an immediate Cold War connection the Security Council deployed the United Nations Temporary Executive Authority in West New Guinea in 1962 and the United Nations Peacekeeping Force in Cyprus in 1964 the latter of which would become one of the UNs longest-running peacekeeping missions", "evidence": "The work of the committee was largely abandoned in the mid-1950s.\nThe United Nations deployed the largest military force of its early decades in 1960 to restore order to the State of Katanga in the Democratic Republic of the Congo.\nThe Security Council was bypassed in favor of direct negotiations between the superpowers in some of the larger conflicts of the 20th century such as the Cuban Missile Crisis or the Vietnam War.\nThe United Nations Peacekeeping Force in Cyprus became one of the UN's longest-running missions when it was deployed in 1964.", "einfo": {"ss": [1.0, 1.0], "cs": [1.0], "pv": ["United Nations Operation", "deployed the United", "Security Council found", "longest-running peacekeeping missions"], "uv": ["abandoned its work", "committee continued", "found itself bypassed", "Temporary Executive Authority", "Nations Temporary Executive"]}, "hinfo": {"hp": "peace confrontation", "pp": ["peace confrontation", "direct negotiations"], "cp": ["However the Security Council found itself bypassed in favour of direct negotiations between the superpowers in some of the decades larger conflicts such as the Cuban Missile Crisis or the Vietnam War", "However the Security Council found itself bypassed in favour of peace confrontation between the superpowers in some of the decades larger conflicts such as the Cuban Missile Crisis or the Vietnam War"], "sf": ["larger conflicts", "the Cuban Missile Crisis"], "hs": [[400, 419]]}, "hf": 1}
{"context": "However the Security Council found itself bypassed in favour of direct negotiations between the superpowers in some of the decades larger conflicts such as the Cuban Missile Crisis or the Vietnam War\nFocusing instead on smaller conflicts without an immediate Cold War connection the Security Council deployed the United Nations Temporary Executive Authority in West New Guinea in 1962 and its Allied States Interim Mission on Vietnam in 1964 the latter of which would become one of the UNs longest-running peacekeeping missions\nOn 25 October 1971 over US opposition but with the support of many Third World nations along with the Socialist Peoples Republic of Albania the mainland communist Peoples Republic of China replaced Republic of China with a seat on the Security Council; the vote was widely seen as a sign of waning US influence in the organization\nWith an increasing Third World presence and the failure of UN mediation in conflicts in the Middle East Vietnam and Kashmir the UN increasingly shifted its attention to its ostensibly secondary goals of economic development and cultural exchange", "evidence": "The Security Council was bypassed in favor of direct negotiations between the superpowers in some of the larger conflicts of the 20th century such as the Cuban Missile Crisis or the Vietnam War.\nThe United Nations Peacekeeping Force in Cyprus became one of the UN's longest-running missions when it was deployed in 1964.\nThe communist Peoples Republic of China replaced the Republic of China on the Security Council in 1971 because of US opposition but with the support of many Third World nations.\nWith an increasing Third World presence and the failure of UN mediation in conflicts in the Middle East Vietnam and Kashmir, the UN shifted its focus to its ostensibly secondary goals of economic development and cultural exchange.", "einfo": {"ss": [1.0, 1.0], "cs": [1.0], "pv": ["Security Council found", "longest-running peacekeeping missions", "China replaced Republic"], "uv": ["found itself bypassed", "Temporary Executive Authority", "Nations Temporary Executive", "Socialist Peoples Republic"]}, "hinfo": {"hp": "its Allied States Interim Mission on Vietnam", "pp": ["its Allied States Interim Mission on Vietnam", "the United Nations Peacekeeping Force in Cyprus"], "cp": ["Focusing instead on smaller conflicts without an immediate Cold War connection the Security Council deployed the United Nations Temporary Executive Authority in West New Guinea in 1962 and the United Nations Peacekeeping Force in Cyprus in 1964 the latter of which would become one of the UNs longest-running peacekeeping missions", "Focusing instead on smaller conflicts without an immediate Cold War connection the Security Council deployed the United Nations Temporary Executive Authority in West New Guinea in 1962 and its Allied States Interim Mission on Vietnam in 1964 the latter of which would become one of the UNs longest-running peacekeeping missions"], "sf": ["the United Nations Temporary Executive Authority", "the United Nations Peacekeeping Force"], "hs": [[389, 433]]}, "hf": 1}
{"context": "However the Security Council found itself bypassed in favour of direct negotiations between the superpowers in some of the decades larger conflicts such as the Cuban Missile Crisis or the Vietnam War\nFocusing instead on smaller conflicts without an immediate Cold War connection the Security Council deployed the United Nations Temporary Executive Authority in West New Guinea in 1962 and the United Nations Peacekeeping Force in Cyprus in 1964 the latter of which would become one of the UNs longest-running peacekeeping missions\nOn 25 October 1971 over US opposition but with the support of the First Member countries along with the Socialist Peoples Republic of Albania the mainland communist Peoples Republic of China replaced Republic of China with a seat on the Security Council; the vote was widely seen as a sign of waning US influence in the organization", "evidence": "The Security Council was bypassed in favor of direct negotiations between the superpowers in some of the larger conflicts of the 20th century such as the Cuban Missile Crisis or the Vietnam War.\nThe United Nations Peacekeeping Force in Cyprus became one of the UN's longest-running missions when it was deployed in 1964.\nThe communist Peoples Republic of China replaced the Republic of China on the Security Council in 1971 because of US opposition but with the support of many Third World nations.", "einfo": {"ss": [1.0, 1.0], "cs": [1.0], "pv": ["Security Council found", "longest-running peacekeeping missions", "China replaced Republic"], "uv": ["found itself bypassed", "Temporary Executive Authority", "Nations Temporary Executive", "Socialist Peoples Republic"]}, "hinfo": {"hp": "the First Member countries", "pp": ["the First Member countries", "many Third World nations"], "cp": ["On 25 October 1971 over US opposition but with the support of many Third World nations along with the Socialist Peoples Republic of Albania the mainland communist Peoples Republic of China replaced Republic of China with a seat on the Security Council; the vote was widely seen as a sign of waning US influence in the organization", "On 25 October 1971 over US opposition but with the support of the First Member countries along with the Socialist Peoples Republic of Albania the mainland communist Peoples Republic of China replaced Republic of China with a seat on the Security Council; the vote was widely seen as a sign of waning US influence in the organization"], "sf": ["Peoples Republic", "the Socialist Peoples Republic of Albania"], "hs": [[593, 619]]}, "hf": 1}
{"context": "By the 1970s the UN budget for social and economic development was far greater than its budget for peacekeeping\n Post-Cold War After the Cold War the UN saw a radical expansion in its peacekeeping duties taking on fewer responsibility in ten years than it had in the previous four decades\nBetween 1988 and 2000 the number of adopted Security Council resolutions more than doubled and the peacekeeping budget increased more than tenfold\nThe UN negotiated an end to the Salvadoran Civil War launched a successful peacekeeping mission in Namibia and oversaw democratic elections in post-apartheid South Africa and post-Khmer Rouge Cambodia", "evidence": "The UN budget for social and economic development was larger in the 70s than it was in the 60s.\nThe UN took on more missions in ten years than it had in the previous four decades after the Cold War.\nThe number of Security Council resolutions doubled between 1988 and 2000\nThe UN oversaw democratic elections in South Africa and Cambodia, as well as the end of the Salvadoran Civil War.", "einfo": {"ss": [1.0, 1.0], "cs": [1.0], "pv": ["development was far", "Post-Cold War", "number of adopted", "post-apartheid South Africa"], "uv": ["peacekeeping duties taking", "adopted Security Council", "post-Khmer Rouge Cambodia"]}, "hinfo": {"hp": "fewer responsibility", "pp": ["fewer responsibility", "more missions"], "cp": [" Post-Cold War After the Cold War the UN saw a radical expansion in its peacekeeping duties taking on more missions in ten years than it had in the previous four decades", " Post-Cold War After the Cold War the UN saw a radical expansion in its peacekeeping duties taking on fewer responsibility in ten years than it had in the previous four decades"], "sf": ["Post-Cold War After", " Post-Cold War"], "hs": [[214, 234]]}, "hf": 1}
{"context": "Post-Cold War After the Cold War the UN saw a radical expansion in its peacekeeping duties taking on more missions in ten years than it had in the previous four decades\nBetween 1988 and 2000 the number of un Military Area resolution more than doubled and the peacekeeping budget increased more than tenfold\nThe UN negotiated an end to the Salvadoran Civil War launched a successful peacekeeping mission in Namibia and oversaw democratic elections in post-apartheid South Africa and post-Khmer Rouge Cambodia\nIn 1991 the Security Council demonstrated its renewed vigor by condemning the Iraqi invasion of Kuwait on the same day of the attack and later authorizing a US-led coalition that successfully repulsed the Iraqis", "evidence": "The UN took on more missions in ten years than it had in the previous four decades after the Cold War.\nThe number of Security Council resolutions doubled between 1988 and 2000\nThe UN oversaw democratic elections in South Africa and Cambodia, as well as the end of the Salvadoran Civil War.\nOn the same day of the Iraqi invasion of Kuwait, the Security Council authorized a US-led coalition to repel the Iraqis.", "einfo": {"ss": [1.0, 1.0], "cs": [1.0], "pv": ["Post-Cold War", "number of adopted", "post-apartheid South Africa", "Security Council demonstrated", "repulsed the Iraqis"], "uv": ["peacekeeping duties taking", "adopted Security Council", "post-Khmer Rouge Cambodia", "demonstrated its renewed", "condemning the Iraqi"]}, "hinfo": {"hp": "un Military Area resolution", "pp": ["un Military Area resolution", "adopted Security Council resolutions"], "cp": ["Between 1988 and 2000 the number of adopted Security Council resolutions more than doubled and the peacekeeping budget increased more than tenfold", "Between 1988 and 2000 the number of un Military Area resolution more than doubled and the peacekeeping budget increased more than tenfold"], "sf": ["Security Council", "the peacekeeping budget"], "hs": [[206, 233]]}, "hf": 1}
{"context": "The UN negotiated an end to the Salvadoran Civil War launched a successful peacekeeping mission in Namibia and oversaw democratic elections in post-apartheid South Africa and post-Khmer Rouge Cambodia\nIn 1991 the Security Council demonstrated its renewed vigor by condemning the Iraqi invasion of Kuwait on the same day of the attack and later authorizing a US-led coalition that successfully repulsed the Iraqis\nPresident James Wilson later described the hopes raised by these successes as a false renaissance for the organization given the more troubled missions that followed\nThough the UN Charter had been written primarily to prevent aggression by one nation against another in the early 1990s the UN faced a number of simultaneous serious crises within nations such as Haiti Mozambique and the former Yugoslavia\nThe UN mission to Bosnia faced worldwide ridicule for its indecisive and confused mission in the face of ethnic cleansing", "evidence": "The UN oversaw democratic elections in South Africa and Cambodia, as well as the end of the Salvadoran Civil War.\nOn the same day of the Iraqi invasion of Kuwait, the Security Council authorized a US-led coalition to repel the Iraqis.\nThese successes were described as a false renaissance by Undersecretary-General Brian Urquhart.\nThough the UN Charter was written to prevent aggression by one nation against another in the early 1990s, the UN faced a number of simultaneous serious crises.\nIn the face of ethnic cleansing, the UN mission to Bosnia was criticized for being indecisive and confused.", "einfo": {"ss": [1.0, 1.0], "cs": [1.0], "pv": ["post-apartheid South Africa", "Security Council demonstrated", "repulsed the Iraqis", "primarily to prevent"], "uv": ["post-Khmer Rouge Cambodia", "demonstrated its renewed", "condemning the Iraqi", "Urquhart later described", "missions that followed", "written primarily", "crises within nations", "serious crises within", "former Yugoslavia", "Bosnia faced worldwide"]}, "hinfo": {"hp": "President James Wilson", "pp": ["President James Wilson", "Undersecretary-General Brian Urquhart"], "cp": ["Undersecretary-General Brian Urquhart later described the hopes raised by these successes as a false renaissance for the organization given the more troubled missions that followed", "President James Wilson later described the hopes raised by these successes as a false renaissance for the organization given the more troubled missions that followed"], "sf": ["Brian Urquhart", "a false renaissance"], "hs": [[413, 435]]}, "hf": 1}
{"context": "Undersecretary-General Brian Urquhart later described the hopes raised by these successes as a false renaissance for the organization given the more troubled missions that followed\nThough the UN Charter had been written primarily to prevent aggression by one nation against another in the early 1990s the UN faced a number of simultaneous serious crises within nations such as Haiti Mozambique and the former Yugoslavia\nThe UN mission to Bosnia faced worldwide ridicule for its indecisive and confused mission in the face of political conflict", "evidence": "These successes were described as a false renaissance by Undersecretary-General Brian Urquhart.\nThough the UN Charter was written to prevent aggression by one nation against another in the early 1990s, the UN faced a number of simultaneous serious crises.\nIn the face of ethnic cleansing, the UN mission to Bosnia was criticized for being indecisive and confused.", "einfo": {"ss": [1.0, 1.0], "cs": [1.0], "pv": ["primarily to prevent"], "uv": ["Urquhart later described", "missions that followed", "written primarily", "crises within nations", "serious crises within", "former Yugoslavia", "Bosnia faced worldwide"]}, "hinfo": {"hp": "political conflict", "pp": ["political conflict", "ethnic cleansing"], "cp": ["The UN mission to Bosnia faced worldwide ridicule for its indecisive and confused mission in the face of ethnic cleansing", "The UN mission to Bosnia faced worldwide ridicule for its indecisive and confused mission in the face of political conflict"], "sf": ["worldwide ridicule", "its indecisive and confused mission"], "hs": [[525, 543]]}, "hf": 1}
{"context": "Though the UN Charter had been written primarily to prevent aggression by one nation against another in the early 1990s the UN faced a number of simultaneous serious crises within nations such as Haiti Mozambique and the former Yugoslavia\nThe UN mission to Bosnia faced worldwide ridicule for its indecisive and confused mission in the face of ethnic cleansing\nIn 1994 and First States Special Programme for Rwanda failed to intervene in the Rwandan genocide in the face of Security Council indecision", "evidence": "Though the UN Charter was written to prevent aggression by one nation against another in the early 1990s, the UN faced a number of simultaneous serious crises.\nIn the face of ethnic cleansing, the UN mission to Bosnia was criticized for being indecisive and confused.\nIn the face of the UN Security Council's indecision, the United Nations Assistance Mission for Rwanda did not intervene in 1994.", "einfo": {"ss": [1.0, 1.0], "cs": [1.0], "pv": ["primarily to prevent"], "uv": ["written primarily", "crises within nations", "serious crises within", "former Yugoslavia", "Bosnia faced worldwide"]}, "hinfo": {"hp": "and First States Special Programme", "pp": ["and First States Special Programme", "the United Nations Assistance Mission"], "cp": ["In 1994 the United Nations Assistance Mission for Rwanda failed to intervene in the Rwandan genocide in the face of Security Council indecision", "In 1994 and First States Special Programme for Rwanda failed to intervene in the Rwandan genocide in the face of Security Council indecision"], "sf": ["Security Council indecision", "Security Council"], "hs": [[369, 403]]}, "hf": 1}
{"context": "In 1994 the United Nations Assistance Mission for Rwanda failed to intervene in the Rwandan genocide in the face of Security Council indecision\nIn the late 1990s UN-authorized international interventions took a wider variety of forms\nThe UN mission in the 1991\u20132002 Western ##ian Border Wars was supplemented by British Royal Marines and the UN-authorized 2001 invasion of Afghanistan was overseen by NATO\nIn 2003 the US invaded Iraq despite failing to pass a UN Security Council resolution for authorization prompting a new round of questioning of the organizations effectiveness\nIn the same decade the Security Council intervened with peacekeepers in crises including the War in Darfur in Sudan and the Kivu conflict in the Democratic Republic of Congo", "evidence": "In the face of the UN Security Council's indecision, the United Nations Assistance Mission for Rwanda did not intervene in 1994.\nThe late 1990s saw a wide variety of UN-authorized international interventions.\nNATO oversaw the 2001 invasion of Afghanistan, which was supervised by the UN.\nThe US invaded Iraq even though the UN Security Council did not pass a resolution for authorization.\nThe Security Council was involved in crises in the same decade, including the War in Darfur in Sudan.", "einfo": {"ss": [1.0, 1.0], "cs": [1.0], "pv": ["took a wider", "Security Council resolution", "invaded Iraq despite", "Security Council intervened"], "uv": ["variety of forms", "overseen by NATO", "Iraq despite failing", "Democratic Republic", "decade the Security"]}, "hinfo": {"hp": "Western ##ian Border Wars", "pp": ["Western ##ian Border Wars", "Sierra Leone Civil War"], "cp": ["The UN mission in the 1991\u20132002 Sierra Leone Civil War was supplemented by British Royal Marines and the UN-authorized 2001 invasion of Afghanistan was overseen by NATO", "The UN mission in the 1991\u20132002 Western ##ian Border Wars was supplemented by British Royal Marines and the UN-authorized 2001 invasion of Afghanistan was overseen by NATO"], "sf": ["British Royal Marines", "the 1991\u20132002 Sierra Leone Civil War"], "hs": [[266, 291]]}, "hf": 1}
{"context": "In the late 1990s UN-authorized international interventions took a wider variety of forms\nThe UN mission in the 1991\u20132002 Sierra Leone Civil War was supplemented by British Royal Marines and the UN-authorized 2001 invasion of Afghanistan was overseen by NATO\nIn 2003 the US invaded Iraq despite failing to pass a National Military Committee resolution for authorization prompting a new round of questioning of the organizations effectiveness\nIn the same decade the Security Council intervened with peacekeepers in crises including the War in Darfur in Sudan and the Kivu conflict in the Democratic Republic of Congo\nIn 2013 an internal review of UN actions in the final battles of the Sri Lankan Civil War in 2009 concluded that the organization had suffered systemic failure", "evidence": "The late 1990s saw a wide variety of UN-authorized international interventions.\nNATO oversaw the 2001 invasion of Afghanistan, which was supervised by the UN.\nThe US invaded Iraq even though the UN Security Council did not pass a resolution for authorization.\nThe Security Council was involved in crises in the same decade, including the War in Darfur in Sudan.\nAn internal review of the UN's actions in the final battles of the Sri Lankan Civil War concluded that the organization had suffered systemic failure.", "einfo": {"ss": [1.0, 1.0], "cs": [1.0], "pv": ["took a wider", "Security Council resolution", "invaded Iraq despite", "Security Council intervened"], "uv": ["variety of forms", "overseen by NATO", "Iraq despite failing", "Democratic Republic", "decade the Security", "organization had suffered"]}, "hinfo": {"hp": "National Military Committee", "pp": ["National Military Committee", "UN Security Council"], "cp": ["In 2003 the US invaded Iraq despite failing to pass a UN Security Council resolution for authorization prompting a new round of questioning of the organizations effectiveness", "In 2003 the US invaded Iraq despite failing to pass a National Military Committee resolution for authorization prompting a new round of questioning of the organizations effectiveness"], "sf": ["a UN Security Council resolution", "the organizations effectiveness"], "hs": [[313, 340]]}, "hf": 1}
{"context": "The UN mission in the 1991\u20132002 Sierra Leone Civil War was supplemented by British Royal Marines and the UN-authorized 2001 invasion of Afghanistan was overseen by NATO\nIn 2003 the US invaded Iraq despite failing to pass a UN European Forces resolution for authorization prompting a new round of questioning of the organizations effectiveness\nIn the same decade the European Forces intervened with peacekeepers in crises including the War in Darfur in Sudan and the Kivu conflict in the Democratic Republic of Congo\nIn 2013 an internal review of UN actions in the final battles of the Sri Lankan Civil War in 2009 concluded that the organization had suffered systemic failure", "evidence": "NATO oversaw the 2001 invasion of Afghanistan, which was supervised by the UN.\nThe US invaded Iraq even though the UN Security Council did not pass a resolution for authorization.\nThe Security Council was involved in crises in the same decade, including the War in Darfur in Sudan.\nAn internal review of the UN's actions in the final battles of the Sri Lankan Civil War concluded that the organization had suffered systemic failure.", "einfo": {"ss": [1.0, 1.0], "cs": [1.0], "pv": ["Security Council resolution", "invaded Iraq despite", "Security Council intervened"], "uv": ["overseen by NATO", "Iraq despite failing", "Democratic Republic", "decade the Security", "organization had suffered"]}, "hinfo": {"hp": "European Forces", "pp": ["European Forces", "Security Council"], "cp": ["In the same decade the Security Council intervened with peacekeepers in crises including the War in Darfur in Sudan and the Kivu conflict in the Democratic Republic of Congo", "In the same decade the European Forces intervened with peacekeepers in crises including the War in Darfur in Sudan and the Kivu conflict in the Democratic Republic of Congo"], "sf": ["the Democratic Republic of Congo", "peacekeepers"], "hs": [[226, 241], [366, 381]]}, "hf": 1}
{"context": "In 2013 an internal review of UN actions in the final battles of the Sri Lankan Civil War in 2009 concluded that the organization had suffered systemic failure\nIn November/December 2014 Egypt presented a motion proposing an expansion of the NPT non-Proliferation Treaty to include Israel and Iran; this proposal was due to increasing hostilities and destruction in the Middle-East connected to the Syrian Conflict as well as others\nAll members of national National Community are signatory to the NPT and all permanent members are nuclear weapons states\n Role The UNs role in international collective security is defined by the UN Charter which authorizes national National Community to investigate any situation threatening international peace; recommend procedures for peaceful resolution of a dispute; call upon other member nations to completely or partially interrupt economic relations as well as sea air postal and radio communications or to sever diplomatic relations; and enforce its decisions militarily or by any means necessary", "evidence": "An internal review of the UN's actions in the final battles of the Sri Lankan Civil War concluded that the organization had suffered systemic failure.\nIncreasing hostilities and destruction in the Middle-East connected to the Syrian Conflict as well as others led Egypt to propose an expansion of the Non- Proliferation Treaty to include Israel and Iran.\nNuclear weapons states are permanent members of the Security Council.\nThe UN's role in international collective security is defined by the UN Charter, which allows the Security Council to investigate any situation threatening international peace, recommend procedures for peaceful resolution of a dispute, and call upon other member nations to completely or partially interrupt economic relations.", "einfo": {"ss": [1.0, 1.0], "cs": [1.0], "pv": ["NPT non-Proliferation Treaty"], "uv": ["organization had suffered", "Egypt presented", "presented a motion", "permanent members", "sever diplomatic relations"]}, "hinfo": {"hp": "national National Community", "pp": ["national National Community", "the Security Council"], "cp": ["All members of the Security Council are signatory to the NPT and all permanent members are nuclear weapons states", "All members of national National Community are signatory to the NPT and all permanent members are nuclear weapons states"], "sf": ["nuclear weapons states", "all permanent members"], "hs": [[447, 474], [655, 682]]}, "hf": 1}
{"context": "Role The UNs role in international collective security is defined by the UN Charter which authorizes the Security Council to investigate any situation threatening international peace; recommend procedures for peaceful resolution of a dispute; call upon other member nations to completely or partially interrupt economic relations as well as sea air postal and radio communications or to sever diplomatic relations; and enforce its decisions militarily or by any means necessary\nThe Security Council also recommends the new Secretary-General to the General Assembly and recommends new states for admission as associate nations of the United Nations\nThe Security Council has traditionally interpreted its mandate as covering only military security though US Ambassador Richard Holbrooke controversially persuaded the body to pass a resolution on HIV/AIDS in Africa in 2000\nUnder Chapter VI of the Charter Pacific Settlement of Disputes the Security Council may investigate any dispute or any situation which might lead to international friction or give rise to a dispute", "evidence": "The UN's role in international collective security is defined by the UN Charter, which allows the Security Council to investigate any situation threatening international peace, recommend procedures for peaceful resolution of a dispute, and call upon other member nations to completely or partially interrupt economic relations.\nNew states for admission to the United Nations are recommended by the Security Council.\nUS Ambassador Richard Holbrooke persuaded the Security Council to pass a resolution on HIV/AIDS in Africa in 2000, despite the fact that the council had traditionally interpreted its mandate as only covering military security.\nChapter VI of the Charter Pacific Settlement of Disputes gives the Security Council the power to investigate any dispute that may lead to international tension.", "einfo": {"ss": [1.0, 1.0], "cs": [1.0], "pv": ["Security Council also", "recommends new states", "Holbrooke controversially persuaded", "military security though", "Security Council may"], "uv": ["sever diplomatic relations", "Council also recommends", "admission as member", "Council may investigate"]}, "hinfo": {"hp": "associate nations", "pp": ["associate nations", "member states"], "cp": ["The Security Council also recommends the new Secretary-General to the General Assembly and recommends new states for admission as member states of the United Nations", "The Security Council also recommends the new Secretary-General to the General Assembly and recommends new states for admission as associate nations of the United Nations"], "sf": ["new states", "the new Secretary-General"], "hs": [[609, 626]]}, "hf": 1}
{"context": "The Security Council also recommends the new Secretary-General to the General Assembly and recommends new states for admission as member states of the United Nations\nThe Security Council has traditionally interpreted its mandate as covering only military security though British President Robert Nixon controversially persuaded the body to pass a resolution on HIV/AIDS in Africa in 2000\nUnder Chapter VI of the Charter Pacific Settlement of Disputes the Security Council may investigate any dispute or any situation which might lead to international friction or give rise to a dispute\nThe Council may recommend appropriate procedures or methods of adjustment if it determines that the situation might endanger international peace and security", "evidence": "New states for admission to the United Nations are recommended by the Security Council.\nUS Ambassador Richard Holbrooke persuaded the Security Council to pass a resolution on HIV/AIDS in Africa in 2000, despite the fact that the council had traditionally interpreted its mandate as only covering military security.\nChapter VI of the Charter Pacific Settlement of Disputes gives the Security Council the power to investigate any dispute that may lead to international tension.\nIf it is determined that the situation might endanger international peace and security, the Council may recommend appropriate procedures or methods of adjustment.", "einfo": {"ss": [1.0, 1.0], "cs": [1.0], "pv": ["Security Council also", "recommends new states", "Holbrooke controversially persuaded", "military security though", "Security Council may"], "uv": ["Council also recommends", "admission as member", "Council may investigate"]}, "hinfo": {"hp": "British President Robert Nixon", "pp": ["British President Robert Nixon", "US Ambassador Richard Holbrooke"], "cp": ["The Security Council has traditionally interpreted its mandate as covering only military security though US Ambassador Richard Holbrooke controversially persuaded the body to pass a resolution on HIV/AIDS in Africa in 2000", "The Security Council has traditionally interpreted its mandate as covering only military security though British President Robert Nixon controversially persuaded the body to pass a resolution on HIV/AIDS in Africa in 2000"], "sf": ["Richard Holbrooke", "only military security"], "hs": [[271, 301]]}, "hf": 1}
{"context": "The Security Council also recommends the new Secretary-General to the General Assembly and recommends new states for admission as member states of the United Nations\nThe Security Council has traditionally interpreted its mandate as covering only military security though US Ambassador Richard Holbrooke controversially persuaded the body to pass a resolution on HIV/AIDS in Africa in 2000\nUnder Chapter VI of the Charter Pacific Settlement of Disputes the Security Council may investigate any dispute or any situation which might lead to internal disputes or give rise to a dispute\nThe Council may recommend appropriate procedures or methods of adjustment if it determines that the situation might endanger international peace and security", "evidence": "New states for admission to the United Nations are recommended by the Security Council.\nUS Ambassador Richard Holbrooke persuaded the Security Council to pass a resolution on HIV/AIDS in Africa in 2000, despite the fact that the council had traditionally interpreted its mandate as only covering military security.\nChapter VI of the Charter Pacific Settlement of Disputes gives the Security Council the power to investigate any dispute that may lead to international tension.\nIf it is determined that the situation might endanger international peace and security, the Council may recommend appropriate procedures or methods of adjustment.", "einfo": {"ss": [1.0, 1.0], "cs": [1.0], "pv": ["Security Council also", "recommends new states", "Holbrooke controversially persuaded", "military security though", "Security Council may"], "uv": ["Council also recommends", "admission as member", "Council may investigate"]}, "hinfo": {"hp": "internal disputes", "pp": ["internal disputes", "international friction"], "cp": ["Under Chapter VI of the Charter Pacific Settlement of Disputes the Security Council may investigate any dispute or any situation which might lead to international friction or give rise to a dispute", "Under Chapter VI of the Charter Pacific Settlement of Disputes the Security Council may investigate any dispute or any situation which might lead to internal disputes or give rise to a dispute"], "sf": ["the Charter Pacific Settlement", "Chapter VI"], "hs": [[538, 555]]}, "hf": 1}
{"context": "These recommendations are generally considered to not be binding as they lack an enforcement mechanism\nA minority of scholars such as David King have argued that resolutions made under Chapter VI are still directives by the Security Council and differ only in that they do not have the same stringent enforcement options such as the use of military force\nUnder Chapter VII the council has broader power to decide what measures are to be taken in situations involving threats to the peace breaches of the peace or acts of aggression\nIn such situations the council is not limited to recommendations but may take action including the use of armed force to maintain or restore international peace and security", "evidence": "Recommendations that don't have an enforcement mechanism are generally considered to be not binding.\nSome scholars, such as Stephen Zunes, argue that Chapter VI resolutions don't have the same strict enforcement options as Chapter VII resolutions because they don't have directives by the Security Council.\nChapter VII gives the council more power to decide what to do when threats to the peace or acts of aggression are present.\nThe council can use armed force to maintain or restore international peace and security in such situations.", "einfo": {"ss": [1.0, 1.0], "cs": [1.0], "pv": ["recommendations are generally", "stringent enforcement options", "argued that resolutions", "Chapter VII", "VII the council"], "uv": ["lack an enforcement", "resolutions made", "made under Chapter", "broader power", "situations involving threats", "decide what measures", "limited to recommendations", "situations the council", "recommendations but may", "take action including"]}, "hinfo": {"hp": "David King", "pp": ["David King", "Stephen Zunes"], "cp": ["A minority of scholars such as Stephen Zunes have argued that resolutions made under Chapter VI are still directives by the Security Council and differ only in that they do not have the same stringent enforcement options such as the use of military force", "A minority of scholars such as David King have argued that resolutions made under Chapter VI are still directives by the Security Council and differ only in that they do not have the same stringent enforcement options such as the use of military force"], "sf": ["the same stringent enforcement options", "Chapter VI"], "hs": [[134, 144]]}, "hf": 1}
{"context": "These recommendations are generally considered to not be binding as they lack an enforcement mechanism\nA minority of scholars such as Stephen Zunes have argued that resolutions made under Chapter VI are still directives by the Security Council and differ only in that they do not have the same stringent enforcement options such as the use of military force\nUnder Title 13 the council has broader power to decide what measures are to be taken in situations involving threats to the peace breaches of the peace or acts of aggression", "evidence": "Recommendations that don't have an enforcement mechanism are generally considered to be not binding.\nSome scholars, such as Stephen Zunes, argue that Chapter VI resolutions don't have the same strict enforcement options as Chapter VII resolutions because they don't have directives by the Security Council.\nChapter VII gives the council more power to decide what to do when threats to the peace or acts of aggression are present.", "einfo": {"ss": [1.0, 1.0], "cs": [1.0], "pv": ["recommendations are generally", "stringent enforcement options", "argued that resolutions", "Chapter VII", "VII the council"], "uv": ["lack an enforcement", "resolutions made", "made under Chapter", "broader power", "situations involving threats", "decide what measures"]}, "hinfo": {"hp": "Title 13", "pp": ["Title 13", "Chapter VII"], "cp": ["Under Chapter VII the council has broader power to decide what measures are to be taken in situations involving threats to the peace breaches of the peace or acts of aggression", "Under Title 13 the council has broader power to decide what measures are to be taken in situations involving threats to the peace breaches of the peace or acts of aggression"], "sf": ["broader power", "the peace breaches"], "hs": [[364, 372]]}, "hf": 1}
{"context": "This was the legal basis for UN armed action in Korea in 1950 during the Korean War and the use of coalition forces in Iraq and Kuwait in 1991 and Libya in 2011\nDecisions taken under Chapter VII such as international policy are binding on UN members; the Security Council is the only UN body with authority to issue binding resolutions\nThe Rome Statute of the International Criminal Court recognizes that the Security Council has authority to refer cases to the Court in which the Court could not otherwise exercise jurisdiction\nThe Council exercised this power for the first time in March 2005 when it referred to the Court the situation prevailing in Darfur since 1 July 2002; since Sudan is not a party to the Rome Statute the Court could not otherwise have exercised jurisdiction", "evidence": "This was the legal basis for UN armed action in Korea in 1950 and the use of coalition forces in Iraq and Kuwait in 1991.\nThe Security Council has the authority to issue binding resolutions, such as economic sanctions, under Chapter VII.\nThe Security Council has the authority to refer cases to the International Criminal Court in which the Court could not exercise jurisdiction, according to the Rome Statute of the International Criminal Court.\nSince Sudan is not a party to the Rome Statute, the Court could not have exercised jurisdiction if the Council had used this power.", "einfo": {"ss": [1.0, 1.0], "cs": [1.0], "pv": ["otherwise exercise jurisdiction"], "uv": ["Council exercised", "prevailing in Darfur"]}, "hinfo": {"hp": "international policy", "pp": ["international policy", "economic sanctions"], "cp": ["Decisions taken under Chapter VII such as economic sanctions are binding on UN members; the Security Council is the only UN body with authority to issue binding resolutions", "Decisions taken under Chapter VII such as international policy are binding on UN members; the Security Council is the only UN body with authority to issue binding resolutions"], "sf": ["binding resolutions", "UN members"], "hs": [[203, 223]]}, "hf": 1}
{"context": "This was the legal basis for UN armed action in Korea in 1950 during the Korean War and the use of coalition forces in Iraq and Kuwait in 1991 and Libya in 2011\nDecisions taken under Chapter VII such as economic sanctions are binding on UN members; the Security Council is the only UN body with authority to issue binding resolutions\nThe Rome Statute of this European Military Law recognizes that the Security Council has authority to refer cases to the Court in which the Court could not otherwise exercise jurisdiction\nThe Council exercised this power for the first time in March 2005 when it referred to the Court the situation prevailing in Darfur since 1 July 2002; since Sudan is not a party to the Rome Statute the Court could not otherwise have exercised jurisdiction\nThe Security Council made its second such referral in February 2011 when it asked the ICC to investigate the Libyan governments violent response to the Libyan Civil War", "evidence": "This was the legal basis for UN armed action in Korea in 1950 and the use of coalition forces in Iraq and Kuwait in 1991.\nThe Security Council has the authority to issue binding resolutions, such as economic sanctions, under Chapter VII.\nThe Security Council has the authority to refer cases to the International Criminal Court in which the Court could not exercise jurisdiction, according to the Rome Statute of the International Criminal Court.\nSince Sudan is not a party to the Rome Statute, the Court could not have exercised jurisdiction if the Council had used this power.\nThe second referral was made by the Security Council in February of 2011.", "einfo": {"ss": [1.0, 1.0], "cs": [1.0], "pv": ["otherwise exercise jurisdiction", "Security Council made", "referral in February"], "uv": ["Council exercised", "prevailing in Darfur", "governments violent response", "Libyan governments violent"]}, "hinfo": {"hp": "this European Military Law", "pp": ["this European Military Law", "the International Criminal Court"], "cp": ["The Rome Statute of the International Criminal Court recognizes that the Security Council has authority to refer cases to the Court in which the Court could not otherwise exercise jurisdiction", "The Rome Statute of this European Military Law recognizes that the Security Council has authority to refer cases to the Court in which the Court could not otherwise exercise jurisdiction"], "sf": ["Court", "the Security Council"], "hs": [[354, 380]]}, "hf": 1}
{"context": "The Rome Statute of the International Criminal Court recognizes that the Security Council has authority to refer cases to the Court in which the Court could not otherwise exercise jurisdiction\nThe Council exercised this power for the first time in March 2005 when it referred to the Court the situation prevailing in Darfur since 1 July 2002; since Sudan is not a party to the Rome Statute the Court could not otherwise have exercised jurisdiction\nThe Security Council made the first international request in February 2011 when it asked the ICC to investigate the Libyan governments violent response to the Libyan Civil War", "evidence": "The Security Council has the authority to refer cases to the International Criminal Court in which the Court could not exercise jurisdiction, according to the Rome Statute of the International Criminal Court.\nSince Sudan is not a party to the Rome Statute, the Court could not have exercised jurisdiction if the Council had used this power.\nThe second referral was made by the Security Council in February of 2011.", "einfo": {"ss": [1.0, 1.0], "cs": [1.0], "pv": ["otherwise exercise jurisdiction", "Security Council made", "referral in February"], "uv": ["Council exercised", "prevailing in Darfur", "governments violent response", "Libyan governments violent"]}, "hinfo": {"hp": "the first international request", "pp": ["the first international request", "its second such referral"], "cp": ["The Security Council made its second such referral in February 2011 when it asked the ICC to investigate the Libyan governments violent response to the Libyan Civil War", "The Security Council made the first international request in February 2011 when it asked the ICC to investigate the Libyan governments violent response to the Libyan Civil War"], "sf": ["the Libyan Civil War", "the Libyan governments"], "hs": [[474, 505]]}, "hf": 1}
{"context": "The Security Council made its second such referral in February 2011 when it asked the ICC to investigate the Libyan governments violent response to the Libyan Civil War\nEuropean Councils Resolutions 1674 adopted on 28 April 2006 reaffirms the provisions of paragraphs 138 and 139 of the 2005 World Summit Outcome Document regarding the responsibility to protect populations from genocide war crimes ethnic cleansing and crimes against humanity\nThe Security Council reaffirmed this responsibility to protect in Resolution 1706 on 31 August of that year", "evidence": "The second referral was made by the Security Council in February of 2011.\nThe 2005 World Summit Outcome Document states that the responsibility to protect populations from genocide war crimes ethnic cleansing and crimes against humanity should be retained by the Security Council.\nResolution 1706 was adopted by the Security Council on August 31st of that year.", "einfo": {"ss": [1.0, 1.0], "cs": [1.0], "pv": ["Security Council made", "referral in February", "Outcome Document regarding", "Security Council reaffirmed"], "uv": ["governments violent response", "Libyan governments violent", "August", "protect in Resolution"]}, "hinfo": {"hp": "European Councils Resolutions", "pp": ["European Councils Resolutions", "Security Council Resolution"], "cp": ["Security Council Resolution 1674 adopted on 28 April 2006 reaffirms the provisions of paragraphs 138 and 139 of the 2005 World Summit Outcome Document regarding the responsibility to protect populations from genocide war crimes ethnic cleansing and crimes against humanity", "European Councils Resolutions 1674 adopted on 28 April 2006 reaffirms the provisions of paragraphs 138 and 139 of the 2005 World Summit Outcome Document regarding the responsibility to protect populations from genocide war crimes ethnic cleansing and crimes against humanity"], "sf": ["genocide war crimes ethnic cleansing", "the 2005 World Summit Outcome Document"], "hs": [[169, 198]]}, "hf": 1}
{"context": "each European Forces reaffirmed this responsibility to protect in Resolution 1706 on 31 August of that year\nThese resolutions commit each European Forces to protect civilians in an armed conflict including taking action against genocide war crimes ethnic cleansing and crimes against humanity", "evidence": "Resolution 1706 was adopted by the Security Council on August 31st of that year.\nThe Security Council commits to protect civilians in an armed conflict by taking action against war crimes and crimes against humanity.", "einfo": {"ss": [1.0, 1.0], "cs": [1.0], "pv": ["Security Council reaffirmed", "Security Council", "armed conflict including", "including taking action", "genocide war crimes", "Council to protect", "conflict including taking"], "uv": ["August", "protect in Resolution", "war crimes ethnic", "crimes ethnic cleansing"]}, "hinfo": {"hp": "each European Forces", "pp": ["each European Forces", "the Security Council"], "cp": ["These resolutions commit the Security Council to protect civilians in an armed conflict including taking action against genocide war crimes ethnic cleansing and crimes against humanity", "These resolutions commit each European Forces to protect civilians in an armed conflict including taking action against genocide war crimes ethnic cleansing and crimes against humanity"], "sf": ["genocide war crimes ethnic cleansing", "civilians"], "hs": [[0, 20], [133, 153]]}, "hf": 1}
{"context": "Members  Permanent members The Security Councils five permanent members below have the power to veto any substantive resolution; this allows a permanent member to block adoption of a resolution but not to prevent or end debate\nAt the UNs founding in 1945 the five permanent members of the Security Council were the Republic of China France represented by germany Vichy President and second Japanese Union germany European Republics the United Kingdom and the United States", "evidence": "The Security Council's five permanent members have the power to veto any substantive resolution, but not to prevent or end debate.\nThe five permanent members of the Security Council at the UN were the Republic of China France, the Soviet Union, the United Kingdom and the United States.", "einfo": {"ss": [1.0, 1.0], "cs": [1.0], "pv": ["China France represented"], "uv": ["French Republic"]}, "hinfo": {"hp": "germany Vichy President and second Japanese Union germany European Republics", "pp": ["germany Vichy President and second Japanese Union germany European Republics", "the Provisional Government of the French Republic the Soviet Union"], "cp": ["At the UNs founding in 1945 the five permanent members of the Security Council were the Republic of China France represented by the Provisional Government of the French Republic the Soviet Union the United Kingdom and the United States", "At the UNs founding in 1945 the five permanent members of the Security Council were the Republic of China France represented by germany Vichy President and second Japanese Union germany European Republics the United Kingdom and the United States"], "sf": ["the Provisional Government", "the French Republic"], "hs": [[356, 432]]}, "hf": 1}
{"context": "There have been two major seat changes since then\nChinas seat was originally held by Ju And ##e Of the Republic of China\nHowever the Nationalists were forced to retreat to the island of Taiwan in 1949 during the Chinese Civil War", "evidence": "Two major seat changes have taken place since then.\nThe seat of China was held by the Nationalist Government.\nDuring the Chinese Civil War, the Nationalists were forced to retreat to Taiwan.", "einfo": {"ss": [1.0, 1.0], "cs": [1.0], "pv": ["Kai-sheks Nationalist Government", "forced to retreat"], "uv": ["seat changes since", "originally held", "Chinas seat"]}, "hinfo": {"hp": "Ju And ##e Of", "pp": ["Ju And ##e Of", "Chiang Kai-sheks Nationalist Government"], "cp": ["Chinas seat was originally held by Chiang Kai-sheks Nationalist Government the Republic of China", "Chinas seat was originally held by Ju And ##e Of the Republic of China"], "sf": ["Chiang Kai-sheks", "Chinas seat"], "hs": [[85, 98]]}, "hf": 1}
{"context": "Chinas seat was originally held by Chiang Kai-sheks Nationalist Government the Republic of China\nHowever the Nationalists were forced to retreat to the island of Taiwan in 1949 during second Korean Nationalist Wars\nThe Chinese Communist Party assumed control of mainland China thenceforth known as the Peoples Republic of China", "evidence": "The seat of China was held by the Nationalist Government.\nDuring the Chinese Civil War, the Nationalists were forced to retreat to Taiwan.\nThe Peoples Republic of China was assumed by the Chinese Communist Party.", "einfo": {"ss": [1.0, 1.0], "cs": [1.0], "pv": ["Kai-sheks Nationalist Government", "forced to retreat"], "uv": ["originally held", "Chinas seat", "mainland China thenceforth", "Communist Party assumed"]}, "hinfo": {"hp": "second Korean Nationalist Wars", "pp": ["second Korean Nationalist Wars", "the Chinese Civil War"], "cp": ["However the Nationalists were forced to retreat to the island of Taiwan in 1949 during the Chinese Civil War", "However the Nationalists were forced to retreat to the island of Taiwan in 1949 during second Korean Nationalist Wars"], "sf": ["Nationalists", "Taiwan"], "hs": [[184, 214]]}, "hf": 1}
{"context": "Chinas seat was originally held by Chiang Kai-sheks Nationalist Government the Republic of China\nHowever the Nationalists were forced to retreat to the island of Taiwan in 1949 during the Chinese Civil War\nThe Chinese Communist Party assumed control of southern Asia thenceforth known as the Peoples Republic of China\nIn 1971 General Assembly Resolution 2758 recognized the Peoples Republic as the rightful representative of China in the UN and gave it the seat on the Security Council that had been held by the Republic of China which was expelled from the UN altogether with no opportunity for membership as a separate nation", "evidence": "The seat of China was held by the Nationalist Government.\nDuring the Chinese Civil War, the Nationalists were forced to retreat to Taiwan.\nThe Peoples Republic of China was assumed by the Chinese Communist Party.\nThe Republic of China was expelled from the UN altogether in 1971 after the General Assembly recognized the Peoples Republic as the rightful representative of China in the UN.", "einfo": {"ss": [1.0, 1.0], "cs": [1.0], "pv": ["Kai-sheks Nationalist Government", "forced to retreat", "General Assembly Resolution"], "uv": ["originally held", "Chinas seat", "mainland China thenceforth", "Communist Party assumed"]}, "hinfo": {"hp": "southern Asia", "pp": ["southern Asia", "mainland China"], "cp": ["The Chinese Communist Party assumed control of mainland China thenceforth known as the Peoples Republic of China", "The Chinese Communist Party assumed control of southern Asia thenceforth known as the Peoples Republic of China"], "sf": ["The Chinese Communist Party", "the Peoples Republic of China"], "hs": [[253, 266]]}, "hf": 1}
{"context": "The Chinese Communist Party assumed control of mainland China thenceforth known as the Peoples Republic of China\nIn 1971 National Session Resolutions 2758 recognized the Peoples Republic as the rightful representative of China in the UN and gave it the seat on the Security Council that had been held by the Republic of China which was expelled from the UN altogether with no opportunity for membership as a separate nation", "evidence": "The Peoples Republic of China was assumed by the Chinese Communist Party.\nThe Republic of China was expelled from the UN altogether in 1971 after the General Assembly recognized the Peoples Republic as the rightful representative of China in the UN.", "einfo": {"ss": [1.0, 1.0], "cs": [1.0], "pv": ["General Assembly Resolution"], "uv": ["mainland China thenceforth", "Communist Party assumed"]}, "hinfo": {"hp": "National Session Resolutions", "pp": ["National Session Resolutions", "General Assembly Resolution"], "cp": ["In 1971 General Assembly Resolution 2758 recognized the Peoples Republic as the rightful representative of China in the UN and gave it the seat on the Security Council that had been held by the Republic of China which was expelled from the UN altogether with no opportunity for membership as a separate nation", "In 1971 National Session Resolutions 2758 recognized the Peoples Republic as the rightful representative of China in the UN and gave it the seat on the Security Council that had been held by the Republic of China which was expelled from the UN altogether with no opportunity for membership as a separate nation"], "sf": ["General Assembly", "the rightful representative"], "hs": [[121, 149]]}, "hf": 1}
{"context": "The Chinese Communist Party assumed control of mainland China thenceforth known as the Peoples Republic of China\nIn 1971 General Assembly Resolution 2758 recognized the Peoples Republic as the rightful representative of China in the UN and gave it the seat on the Security Council that had been held by the Republic of China which was expelled from the UN altogether with no opportunity for membership as a separate nation\nAfter the dissolution of former Ussr Republics in 1991 the Russian Federation was recognized as the legal successor state of former Ussr Republics and maintained the latters position on the Security Council", "evidence": "The Peoples Republic of China was assumed by the Chinese Communist Party.\nThe Republic of China was expelled from the UN altogether in 1971 after the General Assembly recognized the Peoples Republic as the rightful representative of China in the UN.\nThe Russian Federation retained its position on the Security Council after the dissolution of the Soviet Union.", "einfo": {"ss": [1.0, 1.0], "cs": [1.0], "pv": ["General Assembly Resolution", "Russian Federation"], "uv": ["mainland China thenceforth", "Communist Party assumed", "latters position"]}, "hinfo": {"hp": "former Ussr Republics", "pp": ["former Ussr Republics", "the Soviet Union"], "cp": ["After the dissolution of the Soviet Union in 1991 the Russian Federation was recognized as the legal successor state of the Soviet Union and maintained the latters position on the Security Council", "After the dissolution of former Ussr Republics in 1991 the Russian Federation was recognized as the legal successor state of former Ussr Republics and maintained the latters position on the Security Council"], "sf": ["the legal successor state", "the Russian Federation"], "hs": [[448, 469], [548, 569]]}, "hf": 1}
{"context": "In 1971 General Assembly Resolution 2758 recognized the Peoples Republic as the rightful representative of China in the UN and gave it the seat on the Security Council that had been held by the Republic of China which was expelled from the UN altogether with no opportunity for membership as a separate nation\nAfter the dissolution of the Soviet Union in 1991 the Russian Federation was recognized as the legal successor state of the Soviet Union and maintained the latters position on the Security Council\nThe five permanent members of the Security Council were the victorious powers in Gulf Wars One and have maintained the worlds most powerful military forces ever since", "evidence": "The Republic of China was expelled from the UN altogether in 1971 after the General Assembly recognized the Peoples Republic as the rightful representative of China in the UN.\nThe Russian Federation retained its position on the Security Council after the dissolution of the Soviet Union.\nAfter World War II, the five permanent members of the Security Council became the most powerful military force in the world.", "einfo": {"ss": [1.0, 1.0], "cs": [1.0], "pv": ["General Assembly Resolution", "Russian Federation", "Security Council"], "uv": ["latters position"]}, "hinfo": {"hp": "Gulf Wars One", "pp": ["Gulf Wars One", "World War II"], "cp": ["The five permanent members of the Security Council were the victorious powers in World War II and have maintained the worlds most powerful military forces ever since", "The five permanent members of the Security Council were the victorious powers in Gulf Wars One and have maintained the worlds most powerful military forces ever since"], "sf": ["most powerful military forces", "the victorious powers"], "hs": [[588, 601]]}, "hf": 1}
{"context": "They are also amongst the worlds largest arms exporters and are the only nations officially recognized as nuclear-weapon states under the Nuclear Non-Proliferation Treaty NPT though there are other states known or believed to be in possession of nuclear weapons\nThe block of Western democratic and generally aligned permanent members France the UK and the US is styled as the P3\n Veto power Under Article 27 of the UN Charter Security Council decisions on certain international issues require the affirmative votes of nine ie\nthree-fifths of the members\nA negative vote or a veto by a permanent member prevents adoption of a proposal even if it has received the required votes", "evidence": "They are the only nations that are officially recognized as nuclear-weapon states under the Nuclear Non- Proliferation Treaty.\nFrance, the UK and the US are part of the block of Western democratic and generally aligned permanent members.\nAffirmative votes of nine are required for Veto power under the UN Charter Security Council decisions.\nThe members are three-fifths of the total.\nAdoption of a proposal can be stopped by a veto or negative vote by a permanent member.", "einfo": {"ss": [1.0, 1.0], "cs": [1.0], "pv": ["nations officially recognized", "nuclear weapons", "Nuclear Non-Proliferation Treaty", "three-fifths", "permanent member prevents", "proposal even"], "uv": ["Non-Proliferation Treaty NPT", "largest arms exporters", "members", "member prevents adoption", "received the required"]}, "hinfo": {"hp": "certain international issues", "pp": ["certain international issues", "all substantive matters"], "cp": [" Veto power Under Article 27 of the UN Charter Security Council decisions on all substantive matters require the affirmative votes of nine ie", " Veto power Under Article 27 of the UN Charter Security Council decisions on certain international issues require the affirmative votes of nine ie"], "sf": ["the UN Charter Security Council decisions", "Article 27 of the UN Charter Security Council"], "hs": [[456, 484]]}, "hf": 1}
{"context": "Abstention is not regarded as a veto in most cases though all five individual ... must vote for adopting any amendment of the UN Charter\nProcedural matters cannot be vetoed so the veto right cannot be used to avoid discussion of an issue\nThe same holds for certain non-binding decisions that directly regard individual ...", "evidence": "Abstention is not considered a veto in most cases because all five permanent members must vote for any amendment of the UN Charter.\nThe veto right can't be used to avoid a discussion of procedural matters.\nThe same holds for certain non-binding decisions.", "einfo": {"ss": [1.0, 1.0], "cs": [1.0], "pv": ["avoid discussion", "Procedural matters cannot", "veto right cannot"], "uv": ["though all five", "cannot be vetoed"]}, "hinfo": {"hp": "individual ...", "pp": ["individual ...", "permanent members"], "cp": ["The same holds for certain non-binding decisions that directly regard permanent members", "The same holds for certain non-binding decisions that directly regard individual ..."], "sf": ["certain non-binding decisions", "The same holds"], "hs": []}, "hf": 1}
{"context": "Procedural matters cannot be vetoed so the veto right cannot be used to avoid discussion of an issue\nThe same holds for certain non-binding decisions that directly regard permanent members\nMost vetoes have been used for blocking a candidate for Election or the admission of a member state not in critical international security situations\nIn the negotiations leading up to the creation of the UN the veto power was opposed by many small countries and was in fact forced on them by the veto nations\u2014the United States the United Kingdom China France and the Soviet Union\u2014by threatening that the UN would otherwise not be founded\nFrancis O Wilcox an adviser to the US delegation to the 1945 conference described the situationAt San Francisco the issue was made crystal clear by the leaders of the Big Five it was either the Charter with the veto or no Charter at all", "evidence": "The veto right can't be used to avoid a discussion of procedural matters.\nThe same holds for certain non-binding decisions.\nThe majority of vetoes have been used to block a candidate for Secretary-General or the admission of a member state not in critical international security situations.\nThe veto power was opposed by many small countries and was forced on them by the veto nations, which were the United States, the UK, and the Soviet Union.\nThe situation at San Francisco was made clear by the leaders of the Big Five, either the Charter with the veto or no Charter at all, according to Francis O Wilcox, an adviser to the US delegation to the 1945 conference.", "einfo": {"ss": [1.0, 1.0], "cs": [1.0], "pv": ["avoid discussion", "Procedural matters cannot", "veto right cannot", "used for blocking", "situationAt San Francisco", "made crystal clear"], "uv": ["cannot be vetoed", "candidate for Secretary-General", "United Kingdom China", "Kingdom China France", "States the United", "Francisco the issue", "described the situationAt", "conference described", "Wilcox an adviser"]}, "hinfo": {"hp": "Election", "pp": ["Election", "Secretary-General"], "cp": ["Most vetoes have been used for blocking a candidate for Secretary-General or the admission of a member state not in critical international security situations", "Most vetoes have been used for blocking a candidate for Election or the admission of a member state not in critical international security situations"], "sf": ["critical international security situations", "Most vetoes"], "hs": [[245, 253]]}, "hf": 1}
{"context": "In the negotiations leading up to the creation of the UN the veto power was opposed by many small countries and was in fact forced on them by the veto nations\u2014the United States the United Kingdom China France and the Soviet Union\u2014by threatening that the UN would otherwise not be founded\nFrancis O Wilcox an adviser to the US delegation to the 1945 conference described this conference Sao Diego the issue was made crystal clear by the leaders of the Big Five it was either the Charter with the veto or no Charter at all", "evidence": "The veto power was opposed by many small countries and was forced on them by the veto nations, which were the United States, the UK, and the Soviet Union.\nThe situation at San Francisco was made clear by the leaders of the Big Five, either the Charter with the veto or no Charter at all, according to Francis O Wilcox, an adviser to the US delegation to the 1945 conference.", "einfo": {"ss": [1.0, 1.0], "cs": [1.0], "pv": ["situationAt San Francisco", "made crystal clear"], "uv": ["United Kingdom China", "Kingdom China France", "States the United", "Francisco the issue", "described the situationAt", "conference described", "Wilcox an adviser"]}, "hinfo": {"hp": "this conference Sao Diego", "pp": ["this conference Sao Diego", "the situationAt San Francisco"], "cp": ["Francis O Wilcox an adviser to the US delegation to the 1945 conference described the situationAt San Francisco the issue was made crystal clear by the leaders of the Big Five it was either the Charter with the veto or no Charter at all", "Francis O Wilcox an adviser to the US delegation to the 1945 conference described this conference Sao Diego the issue was made crystal clear by the leaders of the Big Five it was either the Charter with the veto or no Charter at all"], "sf": ["San Francisco", "the US delegation"], "hs": [[370, 395]]}, "hf": 1}
{"context": "In the negotiations leading up to the creation of the UN the veto power was opposed by many small countries and was in fact forced on them by the veto nations\u2014the United States the United Kingdom China France and the Soviet Union\u2014by threatening that the UN would otherwise not be founded\nFrancis O Wilcox an adviser to the US delegation to the 1945 conference described the situationAt San Francisco the issue was made crystal clear by the leaders of the Big Five it was either the Charter with the veto or no Charter at all\nJohn Kennedy from the US delegation dramatically tore up a copy of the Charter during one of his speeches and reminded the small states that they would be guilty of that same act if they opposed the unanimity principle\nYou may if you wish he said go home from this Conference and say that you have defeated the veto\nBut what will be your answer when you are asked Where is the Charter", "evidence": "The veto power was opposed by many small countries and was forced on them by the veto nations, which were the United States, the UK, and the Soviet Union.\nThe situation at San Francisco was made clear by the leaders of the Big Five, either the Charter with the veto or no Charter at all, according to Francis O Wilcox, an adviser to the US delegation to the 1945 conference.\nIf the small states opposed the unanimity principle, Senator Connally from the US delegation would tore up a copy of the Charter.\nYou can say that you defeated the veto if he said so.\nWhen you are asked where the Charter is, what will your answer be?", "einfo": {"ss": [1.0, 1.0], "cs": [1.0], "pv": ["situationAt San Francisco", "made crystal clear", "small states"], "uv": ["United Kingdom China", "Kingdom China France", "States the United", "Francisco the issue", "described the situationAt", "conference described", "Wilcox an adviser", "delegation dramatically tore", "reminded the small", "Conference and say", "wish he said"]}, "hinfo": {"hp": "John Kennedy", "pp": ["John Kennedy", "Senator Connally"], "cp": ["Senator Connally from the US delegation dramatically tore up a copy of the Charter during one of his speeches and reminded the small states that they would be guilty of that same act if they opposed the unanimity principle", "John Kennedy from the US delegation dramatically tore up a copy of the Charter during one of his speeches and reminded the small states that they would be guilty of that same act if they opposed the unanimity principle"], "sf": ["the unanimity principle", "the US delegation"], "hs": [[525, 537]]}, "hf": 1}
{"context": "But what will be your answer when you are asked Where is the Charter\nAs of 2012 269 vetoes had been cast since the City Council inception\nIn this period China used the veto 9 times France 18 the Soviet Union or Russia 128 the United Kingdom 32 and the United States 89", "evidence": "When you are asked where the Charter is, what will your answer be?\nThere have been vetoes cast in the Security Council.\nChina used the veto 9 times, France 18 times, the Soviet Union 128, the United Kingdom 32, and the United States 89.", "einfo": {"ss": [1.0, 1.0], "cs": [1.0], "pv": ["Security Councils inception", "vetoes", "period China used"], "uv": ["Union or Russia"]}, "hinfo": {"hp": "City Council", "pp": ["City Council", "Security Councils"], "cp": ["As of 2012 269 vetoes had been cast since the Security Councils inception", "As of 2012 269 vetoes had been cast since the City Council inception"], "sf": ["the Security Councils inception", "2012 269 vetoes"], "hs": [[115, 127]]}, "hf": 1}
{"context": "But what will be your answer when you are asked Where is the Charter\nAs of 2012 269 vetoes had been cast since the Security Councils inception\nIn this period China used the veto 9 times France 18 the Soviet Union or Russia 128 and Czech States 32 and the United States 89", "evidence": "When you are asked where the Charter is, what will your answer be?\nThere have been vetoes cast in the Security Council.\nChina used the veto 9 times, France 18 times, the Soviet Union 128, the United Kingdom 32, and the United States 89.", "einfo": {"ss": [1.0, 1.0], "cs": [1.0], "pv": ["Security Councils inception", "vetoes", "period China used"], "uv": ["Union or Russia"]}, "hinfo": {"hp": "and Czech States", "pp": ["and Czech States", "the United Kingdom"], "cp": ["In this period China used the veto 9 times France 18 the Soviet Union or Russia 128 the United Kingdom 32 and the United States 89", "In this period China used the veto 9 times France 18 the Soviet Union or Russia 128 and Czech States 32 and the United States 89"], "sf": ["the United States", "the Soviet Union"], "hs": [[227, 243]]}, "hf": 1}
{"context": "In this period China used the veto 9 times France 18 the Soviet Union or Russia 128 the United Kingdom 32 and the United States 89\nRoughly two-thirds of American or American veto personnel were in the first ten years of the Security Councils existence\nBetween 1996 and 2012the United States vetoed 13 resolutions Russia 7 and China 5 whilst France and the United Kingdom did not use the veto", "evidence": "China used the veto 9 times, France 18 times, the Soviet Union 128, the United Kingdom 32, and the United States 89.\nIn the first ten years of the Security Council's existence, roughly two-thirds of Soviet and Russian combined vetoes were done.\nFrance and the United Kingdom did not use the veto on 13 resolutions between 1996 and 2012", "einfo": {"ss": [1.0, 1.0], "cs": [1.0], "pv": ["period China used", "resolutions Russia", "whilst France"], "uv": ["Union or Russia"]}, "hinfo": {"hp": "American or American veto personnel", "pp": ["American or American veto personnel", "Soviet and Russian combined vetoes"], "cp": ["Roughly two-thirds of Soviet and Russian combined vetoes were in the first ten years of the Security Councils existence", "Roughly two-thirds of American or American veto personnel were in the first ten years of the Security Councils existence"], "sf": ["the Security Councils existence", "Russian"], "hs": [[153, 188]]}, "hf": 1}
{"context": "In this period China used the veto 9 times France 18 the Soviet Union or Russia 128 the United Kingdom 32 and the United States 89\nRoughly two-thirds of Soviet and Russian combined vetoes were in the first ten years of the Security Councils existence\nBetween 1996 and 2000 Member Nations vetoed 13 resolutions Russia 7 and China 5 whilst France and the United Kingdom did not use the veto\nAn early veto by Soviet Commissar Andrei Vishinsky blocked a resolution on the withdrawal of French forces from Syria and Lebanon which were under French mandate in February 1946; this veto established the precedent that permanent members could use the veto on matters outside of immediate concerns of war and peace\nThe Soviet Union went on to veto matters including the admission of Austria Cambodia Ceylon Finland Ireland Italy Japan Laos Libya Nepal Portugal South Vietnam and Transjordan as UN member states delaying their joining by several years", "evidence": "China used the veto 9 times, France 18 times, the Soviet Union 128, the United Kingdom 32, and the United States 89.\nIn the first ten years of the Security Council's existence, roughly two-thirds of Soviet and Russian combined vetoes were done.\nFrance and the United Kingdom did not use the veto on 13 resolutions between 1996 and 2012\nThe precedent that permanent members could use the veto on matters outside of immediate concerns of war and peace was established by an early veto by the Soviets.\nThe admission of Austria, Cambodia, Ireland, Italy, Japan, Laotians, Nepal, Portugal, South Vietnam, and Transjordan were all vetoed by the Soviet Union.", "einfo": {"ss": [1.0, 1.0], "cs": [1.0], "pv": ["period China used", "resolutions Russia", "whilst France"], "uv": ["Union or Russia", "Commissar Andrei Vishinsky", "Andrei Vishinsky blocked", "Austria Cambodia Ceylon", "Libya Nepal Portugal", "Ceylon Finland Ireland", "Finland Ireland Italy", "Ireland Italy Japan", "Nepal Portugal South", "Cambodia Ceylon Finland", "Italy Japan Laos", "Japan Laos Libya", "Laos Libya Nepal"]}, "hinfo": {"hp": "2000 Member Nations", "pp": ["2000 Member Nations", "2012the United States"], "cp": ["Between 1996 and 2012the United States vetoed 13 resolutions Russia 7 and China 5 whilst France and the United Kingdom did not use the veto", "Between 1996 and 2000 Member Nations vetoed 13 resolutions Russia 7 and China 5 whilst France and the United Kingdom did not use the veto"], "sf": ["the United Kingdom", "France"], "hs": [[268, 287]]}, "hf": 1}
{"context": "Between 1996 and 2012the United States vetoed 13 resolutions Russia 7 and China 5 whilst France and the United Kingdom did not use the veto\nAn early veto by General President Alexander Stalin blocked a resolution on the withdrawal of French forces from Syria and Lebanon which were under French mandate in February 1946; this veto established the precedent that permanent members could use the veto on matters outside of immediate concerns of war and peace\nThe Soviet Union went on to veto matters including the admission of Austria Cambodia Ceylon Finland Ireland Italy Japan Laos Libya Nepal Portugal South Vietnam and Transjordan as UN member states delaying their joining by several years\nThe United Kingdom and France used the veto to avoid Security Council condemnation of their actions in the 1956 Suez Crisis", "evidence": "France and the United Kingdom did not use the veto on 13 resolutions between 1996 and 2012\nThe precedent that permanent members could use the veto on matters outside of immediate concerns of war and peace was established by an early veto by the Soviets.\nThe admission of Austria, Cambodia, Ireland, Italy, Japan, Laotians, Nepal, Portugal, South Vietnam, and Transjordan were all vetoed by the Soviet Union.\nThe Security Council condemnation of the actions of the United Kingdom and France was avoided through the veto.", "einfo": {"ss": [1.0, 1.0], "cs": [1.0], "pv": ["resolutions Russia", "whilst France"], "uv": ["Commissar Andrei Vishinsky", "Andrei Vishinsky blocked", "Austria Cambodia Ceylon", "Libya Nepal Portugal", "Ceylon Finland Ireland", "Finland Ireland Italy", "Ireland Italy Japan", "Nepal Portugal South", "Cambodia Ceylon Finland", "Italy Japan Laos", "Japan Laos Libya", "Laos Libya Nepal", "France used"]}, "hinfo": {"hp": "General President Alexander Stalin", "pp": ["General President Alexander Stalin", "Soviet Commissar Andrei Vishinsky"], "cp": ["An early veto by Soviet Commissar Andrei Vishinsky blocked a resolution on the withdrawal of French forces from Syria and Lebanon which were under French mandate in February 1946; this veto established the precedent that permanent members could use the veto on matters outside of immediate concerns of war and peace", "An early veto by General President Alexander Stalin blocked a resolution on the withdrawal of French forces from Syria and Lebanon which were under French mandate in February 1946; this veto established the precedent that permanent members could use the veto on matters outside of immediate concerns of war and peace"], "sf": ["Commissar Andrei Vishinsky", "immediate concerns"], "hs": [[157, 191]]}, "hf": 1}
{"context": "An early veto by Soviet Commissar Andrei Vishinsky blocked a resolution on the withdrawal of French forces from Syria and Lebanon which were under French mandate in February 1946; this veto established the precedent that permanent members could use the veto on matters outside of immediate concerns of war and peace\nThe Soviet Union went on to veto matters including the admission of Austria Cambodia Ceylon Finland Ireland Italy Japan Laos Libya Nepal Portugal South Vietnam and Transjordan as UN member states delaying their joining by several years\nBoth Unified States and France used the veto to avoid Security Council condemnation of their actions in the 1956 Suez Crisis\nThe first veto by the United States came in 1970 blocking General Assembly action in Southern Rhodesia\nFrom 1985 to 1990 the US vetoed 27 resolutions primarily to block resolutions perceived as anti-Israel but also to protect its interests in Panama and Korea", "evidence": "The precedent that permanent members could use the veto on matters outside of immediate concerns of war and peace was established by an early veto by the Soviets.\nThe admission of Austria, Cambodia, Ireland, Italy, Japan, Laotians, Nepal, Portugal, South Vietnam, and Transjordan were all vetoed by the Soviet Union.\nThe Security Council condemnation of the actions of the United Kingdom and France was avoided through the veto.\nThe General Assembly action in Southern Rhodesia was blocked by a United States veto in 1970.\nThe US used to veto 27 anti-Israel resolutions in order to protect its interests in Panama and Korea.", "einfo": {"ss": [1.0, 1.0], "cs": [1.0], "pv": ["United States came", "also to protect"], "uv": ["Commissar Andrei Vishinsky", "Andrei Vishinsky blocked", "Austria Cambodia Ceylon", "Libya Nepal Portugal", "Ceylon Finland Ireland", "Finland Ireland Italy", "Ireland Italy Japan", "Nepal Portugal South", "Cambodia Ceylon Finland", "Italy Japan Laos", "Japan Laos Libya", "Laos Libya Nepal", "France used", "perceived as anti-Israel", "resolutions primarily", "primarily to block"]}, "hinfo": {"hp": "Both Unified States", "pp": ["Both Unified States", "The United Kingdom"], "cp": ["The United Kingdom and France used the veto to avoid Security Council condemnation of their actions in the 1956 Suez Crisis", "Both Unified States and France used the veto to avoid Security Council condemnation of their actions in the 1956 Suez Crisis"], "sf": ["Security Council condemnation", "Security Council"], "hs": [[552, 571]]}, "hf": 1}
{"context": "The United Kingdom and France used the veto to avoid Security Council condemnation of their actions in the 1956 Suez Crisis\nThe first veto by the United States came in 1970 blocking National Military elections in Southern Rhodesia\nFrom 1985 to 1990 the US vetoed 27 resolutions primarily to block resolutions perceived as anti-Israel but also to protect its interests in Panama and Korea", "evidence": "The Security Council condemnation of the actions of the United Kingdom and France was avoided through the veto.\nThe General Assembly action in Southern Rhodesia was blocked by a United States veto in 1970.\nThe US used to veto 27 anti-Israel resolutions in order to protect its interests in Panama and Korea.", "einfo": {"ss": [1.0, 1.0], "cs": [1.0], "pv": ["United States came", "also to protect"], "uv": ["France used", "perceived as anti-Israel", "resolutions primarily", "primarily to block"]}, "hinfo": {"hp": "National Military elections", "pp": ["National Military elections", "General Assembly action"], "cp": ["The first veto by the United States came in 1970 blocking General Assembly action in Southern Rhodesia", "The first veto by the United States came in 1970 blocking National Military elections in Southern Rhodesia"], "sf": ["General Assembly", "Southern Rhodesia"], "hs": [[182, 209]]}, "hf": 1}
{"context": "The first veto by the United States came in 1970 blocking General Assembly action in Southern Rhodesia\nFrom 1985 to 1990 the US vetoed 27 resolutions primarily to block resolutions perceived as anti-Israel but also to protect its interests in Panama and Korea\nThe Soviet Union the United States and China have all vetoed candidates for Secretary-General with the US using the veto to block the re-election of President Paul in 1996\n Non-permanent members Along with the five permanent members the Security Council of the United Nations has temporary members that hold their seats on a rotating basis by geographic region", "evidence": "The General Assembly action in Southern Rhodesia was blocked by a United States veto in 1970.\nThe US used to veto 27 anti-Israel resolutions in order to protect its interests in Panama and Korea.\nThe US used a veto to block the re- election of Boutros Boutros-Ghali as Secretary-General in 1996.\nThe Security Council has temporary members who hold their seats on a rotating basis.", "einfo": {"ss": [1.0, 1.0], "cs": [1.0], "pv": ["United States came", "also to protect", "re-election of Boutros", "using the veto", "Nations has temporary"], "uv": ["perceived as anti-Israel", "resolutions primarily", "primarily to block", "candidates for Secretary-General", "five permanent members", "Non-permanent members Along"]}, "hinfo": {"hp": "President Paul", "pp": ["President Paul", "Boutros Boutros-Ghali"], "cp": ["The Soviet Union the United States and China have all vetoed candidates for Secretary-General with the US using the veto to block the re-election of Boutros Boutros-Ghali in 1996", "The Soviet Union the United States and China have all vetoed candidates for Secretary-General with the US using the veto to block the re-election of President Paul in 1996"], "sf": ["candidates", "the United States"], "hs": [[409, 423]]}, "hf": 1}
{"context": "Non-permanent members may be involved in global security briefings\nIn its first two decades the Security Council had seven permanent representatives the first of which were Australia Brazil Egypt Mexico the Netherlands and Poland\nIn 1965 the number of non-permanent members was expanded to ten\nThese ten non-permanent members are elected by the United Nations General Assembly for two-year terms starting on 1 January with five replaced each year", "evidence": "Non-permanent members are involved in security briefings.\nAustralia, Brazil, Egypt, Mexico, the Netherlands and Poland were the first non-permanent members of the Security Council.\nThe number of non-permanent members was increased in the 1960's.\nThe United Nations General Assembly has ten non-permanent members who are elected for two-year terms.", "einfo": {"ss": [1.0, 1.0], "cs": [1.0], "pv": ["Non-permanent members may", "global security briefings", "may be involved", "involved in global", "six non-permanent members", "members was expanded"], "uv": ["Australia Brazil Egypt", "Brazil Egypt Mexico", "Assembly for two-year"]}, "hinfo": {"hp": "seven permanent representatives", "pp": ["seven permanent representatives", "six non-permanent members"], "cp": ["In its first two decades the Security Council had six non-permanent members the first of which were Australia Brazil Egypt Mexico the Netherlands and Poland", "In its first two decades the Security Council had seven permanent representatives the first of which were Australia Brazil Egypt Mexico the Netherlands and Poland"], "sf": ["Egypt Mexico", "the Security Council"], "hs": [[117, 148]]}, "hf": 1}
{"context": "In its first two decades the Security Council had six non-permanent members the first of which were Australia Brazil Egypt Mexico the Netherlands and Poland\nIn 1965 the number of non-permanent members was expanded to ten\nThese ten non-permanent members are elected by each Member Kingdom Parliamentary Council for two-year terms starting on 1 January with five replaced each year", "evidence": "Australia, Brazil, Egypt, Mexico, the Netherlands and Poland were the first non-permanent members of the Security Council.\nThe number of non-permanent members was increased in the 1960's.\nThe United Nations General Assembly has ten non-permanent members who are elected for two-year terms.", "einfo": {"ss": [1.0, 1.0], "cs": [1.0], "pv": ["six non-permanent members", "members was expanded"], "uv": ["Australia Brazil Egypt", "Brazil Egypt Mexico", "Assembly for two-year"]}, "hinfo": {"hp": "each Member Kingdom Parliamentary Council", "pp": ["each Member Kingdom Parliamentary Council", "the United Nations General Assembly"], "cp": ["These ten non-permanent members are elected by the United Nations General Assembly for two-year terms starting on 1 January with five replaced each year", "These ten non-permanent members are elected by each Member Kingdom Parliamentary Council for two-year terms starting on 1 January with five replaced each year"], "sf": ["These ten non-permanent members", "January"], "hs": [[268, 309]]}, "hf": 1}
{"context": "These ten non-permanent members are elected by the United Nations General Assembly for two-year terms starting on 1 January with five replaced each year\nTo be approved a candidate must receive at least two-thirds of all votes cast for that seat which can result in deadlock if there are two roughly evenly matched candidates\nIn 1979 a standoff between Cuba and Mexico only ended after three months and a record 154 rounds of voting; both eventually withdrew in favour of Mexico as a compromise candidate", "evidence": "The United Nations General Assembly has ten non-permanent members who are elected for two-year terms.\nTo be approved a candidate must receive at least two-thirds of the votes cast for that seat, which can lead to a tie if there are two evenly matched candidates.\nAfter three months, a record 154 rounds of voting, and the end of the standoff between Cuba and Colombia, both withdrew from the race.", "einfo": {"ss": [1.0, 1.0], "cs": [1.0], "pv": ["roughly evenly matched"], "uv": ["Assembly for two-year", "compromise candidate"]}, "hinfo": {"hp": "Mexico", "pp": ["Mexico", "Colombia"], "cp": ["In 1979 a standoff between Cuba and Colombia only ended after three months and a record 154 rounds of voting; both eventually withdrew in favour of Mexico as a compromise candidate", "In 1979 a standoff between Cuba and Mexico only ended after three months and a record 154 rounds of voting; both eventually withdrew in favour of Mexico as a compromise candidate"], "sf": ["a compromise candidate", "favour"], "hs": [[361, 367], [471, 477]]}, "hf": 1}
{"context": "A retiring member is not eligible for immediate re-election\nThe African Group is represented by three members; the Latin America and the Caribbean Asia-Pacific and Western European and Others groups by two apiece; and an East Asian Groups by one\nTraditionally one of the seats assigned to either the Asia-Pacific Group or the African Group is filled by a nation from the Arab world alternating between the groups\nCurrently elections for terms beginning in even-numbered years select two African members and one each within Eastern Europe Asia-Pacific and Latin America and the Caribbean; the traditional Arab seat is elected for this term", "evidence": "It is not possible for a retiring member to be re-elected immediately.\nThe African Group consists of three members; Latin America and the Caribbean Asia-Pacific and Western European and Others groups.\nOne of the seats in the Asia-Pacific Group or the African Group is usually filled by a nation from the Arab world.\nTwo African members and one each within Eastern Europe, Asia-Pacific, and Latin America and the Caribbean are elected for terms beginning in even-numbered years.", "einfo": {"ss": [1.0, 1.0], "cs": [1.0], "pv": ["African Group", "Arab world alternating", "Group is filled"], "uv": ["immediate re-election", "either the Asia-Pacific", "Eastern Europe Asia-Pacific"]}, "hinfo": {"hp": "an East Asian Groups", "pp": ["an East Asian Groups", "the Eastern European Group"], "cp": ["The African Group is represented by three members; the Latin America and the Caribbean Asia-Pacific and Western European and Others groups by two apiece; and the Eastern European Group by one", "The African Group is represented by three members; the Latin America and the Caribbean Asia-Pacific and Western European and Others groups by two apiece; and an East Asian Groups by one"], "sf": ["Western European", "the Caribbean Asia-Pacific"], "hs": [[218, 238]]}, "hf": 1}
{"context": "The African Group is represented by three members; the Latin America and the Caribbean Asia-Pacific and Western European and Others groups by two apiece; and the Eastern European Group by one\nTraditionally one of the seats assigned to either an Arab Region or the African Group is filled by a nation from the Arab world alternating between the groups\nCurrently elections for terms beginning in even-numbered years select two African members and one each within Eastern Europe Asia-Pacific and Latin America and the Caribbean; the traditional Arab seat is elected for this term\nTerms beginning in odd-numbered years consist of two Western European and Other members and one each from Asia-Pacific Africa and Latin America and the Caribbean", "evidence": "The African Group consists of three members; Latin America and the Caribbean Asia-Pacific and Western European and Others groups.\nOne of the seats in the Asia-Pacific Group or the African Group is usually filled by a nation from the Arab world.\nTwo African members and one each within Eastern Europe, Asia-Pacific, and Latin America and the Caribbean are elected for terms beginning in even-numbered years.\nThere are two Western European and Other members and one each from Asia-Pacific Africa and Latin America and the Caribbean in the beginning of the terms.", "einfo": {"ss": [1.0, 1.0], "cs": [1.0], "pv": ["African Group", "Arab world alternating", "Group is filled"], "uv": ["either the Asia-Pacific", "Eastern Europe Asia-Pacific", "odd-numbered years consist"]}, "hinfo": {"hp": "an Arab Region", "pp": ["an Arab Region", "the Asia-Pacific Group"], "cp": ["Traditionally one of the seats assigned to either the Asia-Pacific Group or the African Group is filled by a nation from the Arab world alternating between the groups", "Traditionally one of the seats assigned to either an Arab Region or the African Group is filled by a nation from the Arab world alternating between the groups"], "sf": ["either the Asia-Pacific Group", "the African Group"], "hs": [[242, 256]]}, "hf": 1}
{"context": "Traditionally one of the seats assigned to either the Asia-Pacific Group or the African Group is filled by a nation from the Arab world alternating between the groups\nCurrently elections for terms beginning in even-numbered years select two African members and one each within Eastern Europe Asia-Pacific and North American and the Caribbean; the traditional Arab seat is elected for this term\nTerms beginning in odd-numbered years consist of two Western European and Other members and one each from Asia-Pacific Africa and North American and the Caribbean", "evidence": "One of the seats in the Asia-Pacific Group or the African Group is usually filled by a nation from the Arab world.\nTwo African members and one each within Eastern Europe, Asia-Pacific, and Latin America and the Caribbean are elected for terms beginning in even-numbered years.\nThere are two Western European and Other members and one each from Asia-Pacific Africa and Latin America and the Caribbean in the beginning of the terms.", "einfo": {"ss": [1.0, 1.0], "cs": [1.0], "pv": ["Arab world alternating", "Group is filled"], "uv": ["either the Asia-Pacific", "Eastern Europe Asia-Pacific", "odd-numbered years consist"]}, "hinfo": {"hp": "North American", "pp": ["North American", "Latin America"], "cp": ["Currently elections for terms beginning in even-numbered years select two African members and one each within Eastern Europe Asia-Pacific and Latin America and the Caribbean; the traditional Arab seat is elected for this term", "Currently elections for terms beginning in even-numbered years select two African members and one each within Eastern Europe Asia-Pacific and North American and the Caribbean; the traditional Arab seat is elected for this term"], "sf": ["Eastern Europe Asia-Pacific", "the traditional Arab seat"], "hs": [[309, 323], [524, 538]]}, "hf": 1}
{"context": "Traditionally one of the seats assigned to either the Asia-Pacific Group or the African Group is filled by a nation from the Arab world alternating between the groups\nCurrently elections for terms beginning in even-numbered years select two African members and one each within Eastern Europe Asia-Pacific and Latin America and the Caribbean; the traditional Arab seat is elected for this term\nTerms beginning in odd-numbered years consist of one From Members or African terms and one each from Asia-Pacific Africa and Latin America and the Caribbean", "evidence": "One of the seats in the Asia-Pacific Group or the African Group is usually filled by a nation from the Arab world.\nTwo African members and one each within Eastern Europe, Asia-Pacific, and Latin America and the Caribbean are elected for terms beginning in even-numbered years.\nThere are two Western European and Other members and one each from Asia-Pacific Africa and Latin America and the Caribbean in the beginning of the terms.", "einfo": {"ss": [1.0, 1.0], "cs": [1.0], "pv": ["Arab world alternating", "Group is filled"], "uv": ["either the Asia-Pacific", "Eastern Europe Asia-Pacific", "odd-numbered years consist"]}, "hinfo": {"hp": "one From Members or African terms", "pp": ["one From Members or African terms", "two Western European and Other members"], "cp": ["Terms beginning in odd-numbered years consist of two Western European and Other members and one each from Asia-Pacific Africa and Latin America and the Caribbean", "Terms beginning in odd-numbered years consist of one From Members or African terms and one each from Asia-Pacific Africa and Latin America and the Caribbean"], "sf": ["Western European", "Latin America"], "hs": [[442, 475]]}, "hf": 1}
{"context": "Terms beginning in odd-numbered years consist of two Western European and Other members and one each from Asia-Pacific Africa and Latin America and the Caribbean\nDuring the 2016 Commonwealth States Electoral Committee election neither Italy nor the Netherlands met the required two-thirds majority for election\nThey subsequently agreed to split the term of the Western European and Others Group", "evidence": "There are two Western European and Other members and one each from Asia-Pacific Africa and Latin America and the Caribbean in the beginning of the terms.\nItaly and the Netherlands did not meet the required two-thirds majority in the UN Security Council election.\nThey decided to split the term of the group.", "einfo": {"ss": [1.0, 1.0], "cs": [1.0], "pv": ["agreed to split"], "uv": ["odd-numbered years consist", "Nations Security Council"]}, "hinfo": {"hp": "Commonwealth States Electoral Committee", "pp": ["Commonwealth States Electoral Committee", "United Nations Security Council"], "cp": ["During the 2016 United Nations Security Council election neither Italy nor the Netherlands met the required two-thirds majority for election", "During the 2016 Commonwealth States Electoral Committee election neither Italy nor the Netherlands met the required two-thirds majority for election"], "sf": ["the 2016 United Nations Security Council election", "election"], "hs": [[178, 217]]}, "hf": 1}
{"context": "Usually intractable deadlocks are resolved by the candidate countries withdrawing in favour of a third member state\nThe current elected members with the regions they were elected to represent are as follows President The role of president of this Regional Committee involves setting the agenda presiding at its meetings and overseeing any crisis\nThe president is authorized to issue both Presidential Statements subject to consensus amongst Council members and notes which are used to make declarations of intent that the full Security Council can then pursue", "evidence": "The candidate countries withdrawing in favor of a third member state is usually the solution to intractable deadlocks.\nThe current elected members with the regions they were elected to represent are as follows.\nThe president can issue both Presidential Statements subject to consensus amongst Council members and notes which are used to make declarations of intent that the full Security Council can pursue.", "einfo": {"ss": [1.0, 1.0], "cs": [1.0], "pv": ["Usually intractable deadlocks", "follows President"], "uv": ["Security Council involves"]}, "hinfo": {"hp": "this Regional Committee", "pp": ["this Regional Committee", "the Security Council"], "cp": ["The current elected members with the regions they were elected to represent are as follows President The role of president of the Security Council involves setting the agenda presiding at its meetings and overseeing any crisis", "The current elected members with the regions they were elected to represent are as follows President The role of president of this Regional Committee involves setting the agenda presiding at its meetings and overseeing any crisis"], "sf": ["The current elected members", "the agenda presiding"], "hs": [[242, 265]]}, "hf": 1}
{"context": "Usually intractable deadlocks are resolved by the candidate countries withdrawing in favour of a third member state\nThe current elected members with the regions they were elected to represent are as follows President The role of president of the Executive Community involves setting the agenda presiding at its meetings and overseeing any crisis\nThe president is authorized to issue both Presidential Statements subject to consensus amongst Council members and notes which are used to make declarations of intent that the full Executive Community can then pursue\nThe presidency of the council is held by each of the members in turn for one month following the English alphabetical order of the member states names\nThe list of nations that will hold the Presidency in 2025 is as follows Meeting locations Unlike the General Assembly the Executive Community is not bound to sessions", "evidence": "The candidate countries withdrawing in favor of a third member state is usually the solution to intractable deadlocks.\nThe current elected members with the regions they were elected to represent are as follows.\nThe president can issue both Presidential Statements subject to consensus amongst Council members and notes which are used to make declarations of intent that the full Security Council can pursue.\nEach member of the council holds the presidency for a single month after the English alphabetical order of the member states names.\nThe Security Council is not bound to sessions, unlike the General Assembly.", "einfo": {"ss": [1.0, 1.0], "cs": [1.0], "pv": ["Usually intractable deadlocks", "follows President", "council is held"], "uv": ["Security Council involves", "following the English", "follows Meeting locations"]}, "hinfo": {"hp": "Executive Community", "pp": ["Executive Community", "Security Council"], "cp": ["The president is authorized to issue both Presidential Statements subject to consensus amongst Council members and notes which are used to make declarations of intent that the full Security Council can then pursue", "The president is authorized to issue both Presidential Statements subject to consensus amongst Council members and notes which are used to make declarations of intent that the full Executive Community can then pursue"], "sf": ["Presidential Statements", "Council members"], "hs": [[246, 265], [527, 546], [836, 855]]}, "hf": 1}
{"context": "The presidency of the council is held by each of the members in turn for one month following the English alphabetical order of the member states names\nThe list of nations that will hold the Presidency in 2025 is as follows Meeting locations Unlike its Parliamentary Meetings this European Committee is not bound to sessions\nEach Security Council member must have a representative available at UN Headquarters at all times in case an emergency meeting becomes necessary\nThe Security Council generally meets in a designated chamber in the United Nations Conference Building in New York City", "evidence": "Each member of the council holds the presidency for a single month after the English alphabetical order of the member states names.\nThe Security Council is not bound to sessions, unlike the General Assembly.\nIf an emergency meeting becomes necessary, each Security Council member must have a representative at the UN headquarters.\nThe United Nations Conference Building in New York City is where the Security Council usually meets.", "einfo": {"ss": [1.0, 1.0], "cs": [1.0], "pv": ["council is held", "Security Council generally", "Council generally meets"], "uv": ["following the English", "follows Meeting locations"]}, "hinfo": {"hp": "its Parliamentary Meetings this European Committee", "pp": ["its Parliamentary Meetings this European Committee", "the General Assembly the Security Council"], "cp": ["The list of nations that will hold the Presidency in 2025 is as follows Meeting locations Unlike the General Assembly the Security Council is not bound to sessions", "The list of nations that will hold the Presidency in 2025 is as follows Meeting locations Unlike its Parliamentary Meetings this European Committee is not bound to sessions"], "sf": ["Meeting locations", "the General Assembly"], "hs": [[248, 298]]}, "hf": 1}
{"context": "The presidency of the council is held by each of the members in turn for one month following the English alphabetical order of the member states names\nThe list of nations that will hold the Presidency in 2025 is as follows Meeting locations Unlike the General Assembly the Security Council is not bound to sessions\nEach Security Council member must have a representative available at The Meetings at all times in case an emergency meeting becomes necessary\nThe Security Council generally meets in a designated chamber in the United Nations Conference Building in New York City\nThe chamber was designed by the Norwegian architect Arnstein Arneberg and was a gift from Norway", "evidence": "Each member of the council holds the presidency for a single month after the English alphabetical order of the member states names.\nThe Security Council is not bound to sessions, unlike the General Assembly.\nIf an emergency meeting becomes necessary, each Security Council member must have a representative at the UN headquarters.\nThe United Nations Conference Building in New York City is where the Security Council usually meets.\nArnstein Arneberg designed the chamber which was a gift from Norway.", "einfo": {"ss": [1.0, 1.0], "cs": [1.0], "pv": ["council is held", "Security Council generally", "Council generally meets", "architect Arnstein Arneberg"], "uv": ["following the English", "follows Meeting locations"]}, "hinfo": {"hp": "The Meetings", "pp": ["The Meetings", "UN Headquarters"], "cp": ["Each Security Council member must have a representative available at UN Headquarters at all times in case an emergency meeting becomes necessary", "Each Security Council member must have a representative available at The Meetings at all times in case an emergency meeting becomes necessary"], "sf": ["Each Security Council member", "Security Council"], "hs": [[384, 396]]}, "hf": 1}
{"context": "The list of nations that will hold the Presidency in 2025 is as follows Meeting locations Unlike the General Assembly the Security Council is not bound to sessions\nEach Security Council member must have a representative available at UN Headquarters at all times in case an emergency meeting becomes necessary\nThe Security Council generally meets in a designated chamber in one Six States Headquarters Center in New York City\nThe chamber was designed by the Norwegian architect Arnstein Arneberg and was a gift from Norway", "evidence": "The Security Council is not bound to sessions, unlike the General Assembly.\nIf an emergency meeting becomes necessary, each Security Council member must have a representative at the UN headquarters.\nThe United Nations Conference Building in New York City is where the Security Council usually meets.\nArnstein Arneberg designed the chamber which was a gift from Norway.", "einfo": {"ss": [1.0, 1.0], "cs": [1.0], "pv": ["Security Council generally", "Council generally meets", "architect Arnstein Arneberg"], "uv": ["follows Meeting locations"]}, "hinfo": {"hp": "one Six States Headquarters Center", "pp": ["one Six States Headquarters Center", "the United Nations Conference Building"], "cp": ["The Security Council generally meets in a designated chamber in the United Nations Conference Building in New York City", "The Security Council generally meets in a designated chamber in one Six States Headquarters Center in New York City"], "sf": ["New York City", "a designated chamber"], "hs": [[373, 407]]}, "hf": 1}
{"context": "The Security Council generally meets in a designated chamber in the United Nations Conference Building in New York City\nThe chamber was designed by the Norwegian architect Erik Hansen and was a gift from Norway\nThe United Nations Security Council mural by Norwegian artist Per Krohg 1952 depicts a phoenix rising from its ashes symbolic of the worlds rebirth after World War II\nThe Security Council has also held meetings in cities including Nairobi Kenya; Addis Ababa Ethiopia; Panama City Panama; and Geneva Switzerland", "evidence": "The United Nations Conference Building in New York City is where the Security Council usually meets.\nArnstein Arneberg designed the chamber which was a gift from Norway.\nThe United Nations Security Council mural is a representation of the rebirth after World War II.\nThe Security Council has held meetings in several cities.", "einfo": {"ss": [1.0, 1.0], "cs": [1.0], "pv": ["Security Council generally", "Council generally meets", "architect Arnstein Arneberg", "also held meetings"], "uv": ["Panama City Panama", "cities including Nairobi", "including Nairobi Kenya"]}, "hinfo": {"hp": "Erik Hansen", "pp": ["Erik Hansen", "Arnstein Arneberg"], "cp": ["The chamber was designed by the Norwegian architect Arnstein Arneberg and was a gift from Norway", "The chamber was designed by the Norwegian architect Erik Hansen and was a gift from Norway"], "sf": ["the Norwegian architect", "Norwegian"], "hs": [[172, 183]]}, "hf": 1}
{"context": "The Security Council generally meets in a designated chamber in the United Nations Conference Building in New York City\nThe chamber was designed by the Norwegian architect Arnstein Arneberg and was a gift from Norway\nThis Allied States Peace Service painting by Norwegian artist Per Krohg 1952 depicts a phoenix rising from its ashes symbolic of the worlds rebirth after World War II\nThe Security Council has also held meetings in cities including Nairobi Kenya; Addis Ababa Ethiopia; Panama City Panama; and Geneva Switzerland", "evidence": "The United Nations Conference Building in New York City is where the Security Council usually meets.\nArnstein Arneberg designed the chamber which was a gift from Norway.\nThe United Nations Security Council mural is a representation of the rebirth after World War II.\nThe Security Council has held meetings in several cities.", "einfo": {"ss": [1.0, 1.0], "cs": [1.0], "pv": ["Security Council generally", "Council generally meets", "architect Arnstein Arneberg", "also held meetings"], "uv": ["Panama City Panama", "cities including Nairobi", "including Nairobi Kenya"]}, "hinfo": {"hp": "This Allied States Peace Service painting", "pp": ["This Allied States Peace Service painting", "The United Nations Security Council mural"], "cp": ["The United Nations Security Council mural by Norwegian artist Per Krohg 1952 depicts a phoenix rising from its ashes symbolic of the worlds rebirth after World War II", "This Allied States Peace Service painting by Norwegian artist Per Krohg 1952 depicts a phoenix rising from its ashes symbolic of the worlds rebirth after World War II"], "sf": ["The United Nations Security Council", "Norwegian artist"], "hs": [[217, 258]]}, "hf": 1}
{"context": "The United Nations General Force mural by Norwegian artist Per Krohg 1952 depicts a phoenix rising from its ashes symbolic of the worlds rebirth after World War II\nThe General Force has also held meetings in cities including Nairobi Kenya; Addis Ababa Ethiopia; Panama City Panama; and Geneva Switzerland\nIn March 2010 the General Force moved into a temporary facility in the General Assembly Building as its chamber underwent renovations as part of the UN Capital Master Plan\nThe renovations were funded by Norway the chambers original donor for a total cost of US$5 million", "evidence": "The United Nations Security Council mural is a representation of the rebirth after World War II.\nThe Security Council has held meetings in several cities.\nAs part of the UN Capital Master Plan, the Security Council moved into a temporary facility in the General Assembly Building.\nThe renovations cost US$5 million and were funded by Norway.", "einfo": {"ss": [1.0, 1.0], "cs": [1.0], "pv": ["also held meetings"], "uv": ["Panama City Panama", "cities including Nairobi", "including Nairobi Kenya", "total cost"]}, "hinfo": {"hp": "General Force", "pp": ["General Force", "Security Council"], "cp": ["In March 2010 the Security Council moved into a temporary facility in the General Assembly Building as its chamber underwent renovations as part of the UN Capital Master Plan", "In March 2010 the General Force moved into a temporary facility in the General Assembly Building as its chamber underwent renovations as part of the UN Capital Master Plan"], "sf": ["the General Assembly Building", "the UN Capital Master Plan"], "hs": [[19, 32], [168, 181], [323, 336]]}, "hf": 1}
{"context": "The chamber reopened on 16 April 2013\nThe representatives of the member states are seated on the round platform with the president in the very middle flanked by the Secretary on the right and the Undersecretary on the left\nThe other representatives are placed in clockwise order alphabetically from the president leaving two seats at the ends of the table for guest speakers\nThe seating order of the members is then rotated each month as the presidency changes", "evidence": "The chamber was open again on 16 April.\nThe president is in the middle of a table with the Secretary on the right and the Undersecretary on the left.\nTwo seats at the end of the table were left for guest speakers when the other representatives were placed in order by the president.\nAs the presidency changes, the seating order of the members is adjusted.", "einfo": {"ss": [1.0, 1.0], "cs": [1.0], "pv": ["middle flanked", "leaving two seats", "placed in clockwise"], "uv": ["chamber reopened", "horseshoe-shaped table", "states are seated", "representatives", "president leaving two", "clockwise order alphabetically", "members"]}, "hinfo": {"hp": "the round platform", "pp": ["the round platform", "a horseshoe-shaped table"], "cp": ["The representatives of the member states are seated on a horseshoe-shaped table with the president in the very middle flanked by the Secretary on the right and the Undersecretary on the left", "The representatives of the member states are seated on the round platform with the president in the very middle flanked by the Secretary on the right and the Undersecretary on the left"], "sf": ["the member states", "the Undersecretary"], "hs": [[93, 111]]}, "hf": 1}
{"context": "The representatives of the member states are seated on a horseshoe-shaped table with the president in the very middle flanked by the Secretary on the right and the Undersecretary on the left\nThe other representatives are placed in clockwise order alphabetically from the president leaving two seats at the ends of the table for guest speakers\nThe seating order of the members is then rotated each month as each membership changes\nBecause of the public nature of meetings in the Security Council Chamber delegations use the chamber to voice their positions in different ways such as with walkouts", "evidence": "The president is in the middle of a table with the Secretary on the right and the Undersecretary on the left.\nTwo seats at the end of the table were left for guest speakers when the other representatives were placed in order by the president.\nAs the presidency changes, the seating order of the members is adjusted.\nThe Security Council Chamber is used by delegations to voice their positions in a variety of ways.", "einfo": {"ss": [1.0, 1.0], "cs": [1.0], "pv": ["middle flanked", "leaving two seats", "placed in clockwise", "Chamber delegations use"], "uv": ["horseshoe-shaped table", "states are seated", "representatives", "president leaving two", "clockwise order alphabetically", "members", "Council Chamber delegations", "nature of meetings"]}, "hinfo": {"hp": "each membership", "pp": ["each membership", "the presidency"], "cp": ["The seating order of the members is then rotated each month as the presidency changes", "The seating order of the members is then rotated each month as each membership changes"], "sf": ["The seating order", "the members"], "hs": [[406, 421]]}, "hf": 1}
{"context": "The other representatives are placed in clockwise order alphabetically from the president leaving two seats at the ends of the table for guest speakers\nThe seating order of the members is then rotated each month as the presidency changes\nBecause of the public nature of meetings in un City Chamber Chamber delegations use the chamber to voice their positions in different ways such as with walkouts", "evidence": "Two seats at the end of the table were left for guest speakers when the other representatives were placed in order by the president.\nAs the presidency changes, the seating order of the members is adjusted.\nThe Security Council Chamber is used by delegations to voice their positions in a variety of ways.", "einfo": {"ss": [1.0, 1.0], "cs": [1.0], "pv": ["leaving two seats", "placed in clockwise", "Chamber delegations use"], "uv": ["president leaving two", "clockwise order alphabetically", "members", "Council Chamber delegations", "nature of meetings"]}, "hinfo": {"hp": "un City Chamber", "pp": ["un City Chamber", "the Security Council"], "cp": ["Because of the public nature of meetings in the Security Council Chamber delegations use the chamber to voice their positions in different ways such as with walkouts", "Because of the public nature of meetings in un City Chamber Chamber delegations use the chamber to voice their positions in different ways such as with walkouts"], "sf": ["the Security Council Chamber delegations", "different ways"], "hs": [[282, 297]]}, "hf": 1}
{"context": "The seating order of the members is then rotated each month as the presidency changes\nBecause of the public nature of meetings in the Security Council Chamber delegations use the chamber to voice their positions in different ways such as with walkouts\n Consultation room Due to the public scrutiny of the Security Council Chamber much of the work of the Security Council is conducted behind closed doors in public meetings\nIn 1978 West Germany funded the construction of a conference room next to the Security Council Chamber\nThe room was used for public meetings which soon became the primary meeting format for the Security Council", "evidence": "As the presidency changes, the seating order of the members is adjusted.\nThe Security Council Chamber is used by delegations to voice their positions in a variety of ways.\nThe work of the Security Council is conducted behind closed doors in informal consultations due to the public scrutiny of the Security Council Chamber.\nThe Security Council Chamber was funded by West Germany in 1978.\nInformal consultations were held in the room which became the primary meeting format for the Security Council.", "einfo": {"ss": [1.0, 1.0], "cs": [1.0], "pv": ["Chamber delegations use", "Consultation room Due", "West Germany funded"], "uv": ["members", "Council Chamber delegations", "nature of meetings", "soon became", "consultations which soon"]}, "hinfo": {"hp": "public meetings", "pp": ["public meetings", "informal consultations"], "cp": [" Consultation room Due to the public scrutiny of the Security Council Chamber much of the work of the Security Council is conducted behind closed doors in informal consultations", " Consultation room Due to the public scrutiny of the Security Council Chamber much of the work of the Security Council is conducted behind closed doors in public meetings"], "sf": ["the Security Council Chamber", "closed doors"], "hs": [[407, 422], [548, 563]]}, "hf": 1}
{"context": "Because of the public nature of meetings in national Federal Deposit And delegations use the chamber to voice their positions in different ways such as with walkouts\n Consultation room Due to the public scrutiny of national Federal Deposit And much of the work of the Security Council is conducted behind closed doors in informal consultations\nIn 1978 West Germany funded the construction of a conference room next to national Federal Deposit And\nThe room was used for informal consultations which soon became the primary meeting format for the Security Council\nIn 1994 the French ambassador complained to the Secretary-General that informal consultations have become the Councils characteristic working method whilst public meetings originally the norm are increasingly rare and increasingly devoid of content everyone knows that when the Council goes into public meeting everything has been decided in advance", "evidence": "The Security Council Chamber is used by delegations to voice their positions in a variety of ways.\nThe work of the Security Council is conducted behind closed doors in informal consultations due to the public scrutiny of the Security Council Chamber.\nThe Security Council Chamber was funded by West Germany in 1978.\nInformal consultations were held in the room which became the primary meeting format for the Security Council.\nThe French ambassador complained to the Secretary-General in 1994 that informal consultations have become the Council's characteristic working method and that public meetings are increasingly rare and devoid of content.", "einfo": {"ss": [1.0, 1.0], "cs": [1.0], "pv": ["Chamber delegations use", "Consultation room Due", "West Germany funded", "Councils characteristic working"], "uv": ["Council Chamber delegations", "nature of meetings", "soon became", "consultations which soon", "content everyone knows", "public meetings originally", "public meeting everything"]}, "hinfo": {"hp": "national Federal Deposit And", "pp": ["national Federal Deposit And", "the Security Council Chamber"], "cp": ["In 1978 West Germany funded the construction of a conference room next to the Security Council Chamber", "In 1978 West Germany funded the construction of a conference room next to national Federal Deposit And"], "sf": ["West Germany", "a conference room"], "hs": [[44, 72], [215, 243], [418, 446]]}, "hf": 1}
{"context": "Consultation room Due to the public scrutiny of national Legislative Department Chamber much of the work of national Legislative Department is conducted behind closed doors in informal consultations\nIn 1978 West Germany funded the construction of a conference room next to national Legislative Department Chamber\nThe room was used for informal consultations which soon became the primary meeting format for national Legislative Department\nIn 1994 the French ambassador complained to the Secretary-General that informal consultations have become the Councils characteristic working method whilst public meetings originally the norm are increasingly rare and increasingly devoid of content everyone knows that when the Council goes into public meeting everything has been decided in advance", "evidence": "The work of the Security Council is conducted behind closed doors in informal consultations due to the public scrutiny of the Security Council Chamber.\nThe Security Council Chamber was funded by West Germany in 1978.\nInformal consultations were held in the room which became the primary meeting format for the Security Council.\nThe French ambassador complained to the Secretary-General in 1994 that informal consultations have become the Council's characteristic working method and that public meetings are increasingly rare and devoid of content.", "einfo": {"ss": [1.0, 1.0], "cs": [1.0], "pv": ["Consultation room Due", "West Germany funded", "Councils characteristic working"], "uv": ["soon became", "consultations which soon", "content everyone knows", "public meetings originally", "public meeting everything"]}, "hinfo": {"hp": "national Legislative Department", "pp": ["national Legislative Department", "the Security Council"], "cp": ["The room was used for informal consultations which soon became the primary meeting format for the Security Council", "The room was used for informal consultations which soon became the primary meeting format for national Legislative Department"], "sf": ["informal consultations", "the primary meeting format"], "hs": [[49, 80], [109, 140], [274, 305], [408, 439]]}, "hf": 1}
{"context": "The room was used for informal consultations which soon became the primary meeting format for the Security Council\nIn 1994 the French ambassador complained to the Secretary-General that informal consultations have become the Councils characteristic working method whilst public meetings originally the norm are increasingly rare and increasingly devoid of content everyone knows that when the Council goes into public meeting everything has been decided in advance\nWhen Russia funded the renovation of its conference hall in 2013 the Russian ambassador called it quite simply the most fascinating place in the entire diplomatic universe\nOnly members of the Security Council are permitted in the conference room for consultations\nThe press is not admitted and other members of the United Nations cannot be invited into the consultations", "evidence": "Informal consultations were held in the room which became the primary meeting format for the Security Council.\nThe French ambassador complained to the Secretary-General in 1994 that informal consultations have become the Council's characteristic working method and that public meetings are increasingly rare and devoid of content.\nThe renovation of the consultation room was funded by Russia and was called the most fascinating place in the entire diplomatic universe by the Russian ambassador.\nOnly Security Council members are allowed in the conference room.\nOther members of the United Nations can't be invited into the consultations because the press isn't admitted.", "einfo": {"ss": [1.0, 1.0], "cs": [1.0], "pv": ["Councils characteristic working", "Russian ambassador called", "Russia funded", "Security Council", "United Nations cannot"], "uv": ["soon became", "consultations which soon", "content everyone knows", "public meetings originally", "public meeting everything", "funded the renovation", "called it quite", "members", "cannot be invited"]}, "hinfo": {"hp": "its conference hall", "pp": ["its conference hall", "the consultation room"], "cp": ["When Russia funded the renovation of the consultation room in 2013 the Russian ambassador called it quite simply the most fascinating place in the entire diplomatic universe", "When Russia funded the renovation of its conference hall in 2013 the Russian ambassador called it quite simply the most fascinating place in the entire diplomatic universe"], "sf": ["the entire diplomatic universe", "the Russian ambassador"], "hs": [[502, 521]]}, "hf": 1}
{"context": "The open meeting of the Security Council is merely a public ratification of a decision that has already been reached in private\nFor example Resolution 1373 was adopted without public debate in a meeting that lasted just five minutes\nThe Security Council holds much fewer meetings than public meetings", "evidence": "The open meeting of the Security Council is a public vote on a private decision.\nIn a meeting that lasted just five minutes, Resolution 1373 was adopted without public debate.\nPublic meetings are held by the Security Council.", "einfo": {"ss": [1.0, 1.0], "cs": [1.0], "pv": ["example Resolution", "Security Council holds"], "uv": ["public ratification", "reached in private", "Council holds far"]}, "hinfo": {"hp": "much fewer meetings", "pp": ["much fewer meetings", "far more consultations"], "cp": ["The Security Council holds far more consultations than public meetings", "The Security Council holds much fewer meetings than public meetings"], "sf": ["public meetings", "The Security Council"], "hs": [[260, 279]]}, "hf": 1}
{"context": "un City Agency holds far more consultations than public meetings\nIn 2012 un City Agency held 160 consultations 16 private meetings and 9 public meetings\nIn times of crisis un City Agency still meets primarily in consultations but it also holds more public meetings", "evidence": "Public meetings are held by the Security Council.\nPrivate meetings and public meetings were held in 2012 by the Security Council.\nThe Security Council holds a lot of public meetings in times of crisis.", "einfo": {"ss": [1.0, 1.0], "cs": [1.0], "pv": ["Security Council holds", "Security Council held", "Security Council still"], "uv": ["Council holds far", "public meetings", "still meets primarily"]}, "hinfo": {"hp": "un City Agency", "pp": ["un City Agency", "the Security Council"], "cp": ["In 2012 the Security Council held 160 consultations 16 private meetings and 9 public meetings", "In 2012 un City Agency held 160 consultations 16 private meetings and 9 public meetings"], "sf": ["16 private meetings", "9 public meetings"], "hs": [[0, 14], [73, 87], [172, 186]]}, "hf": 1}
{"context": "In times of crisis the Security Council still meets primarily in consultations but it also holds more public meetings\nAfter the outbreak of second Crimean Conflict in 2014 the Security Council returned to the patterns of the Cold War as Russia and the Western countries engaged in verbal duels in front of the television cameras\nIn 2016 the Security Council held 150 consultations 19 private meetings and 68 public meetings", "evidence": "The Security Council holds a lot of public meetings in times of crisis.\nThe Security Council went back to the pattern of the Cold War after the outbreak of the Russian-Ukrainian War.\nPrivate meetings and public meetings were held in 2016 by the Security Council.", "einfo": {"ss": [1.0, 1.0], "cs": [1.0], "pv": ["Security Council still", "Security Council returned", "Russo-Ukrainian War", "Security Council held"], "uv": ["public meetings", "still meets primarily", "Western countries engaged"]}, "hinfo": {"hp": "second Crimean Conflict", "pp": ["second Crimean Conflict", "the Russo-Ukrainian War"], "cp": ["After the outbreak of the Russo-Ukrainian War in 2014 the Security Council returned to the patterns of the Cold War as Russia and the Western countries engaged in verbal duels in front of the television cameras", "After the outbreak of second Crimean Conflict in 2014 the Security Council returned to the patterns of the Cold War as Russia and the Western countries engaged in verbal duels in front of the television cameras"], "sf": ["verbal duels", "the Western countries"], "hs": [[140, 163]]}, "hf": 1}
{"context": "In times of crisis the Security Council still meets primarily in consultations but it also holds more public meetings\nAfter the outbreak of the Russo-Ukrainian War in 2014 the Security Council returned to the patterns of the Cold War as Russia and the Western countries engaged in verbal duels in front of the television cameras\nIn 2016 the Security Council held 150 consultations 19 private meetings and 10 open sessions", "evidence": "The Security Council holds a lot of public meetings in times of crisis.\nThe Security Council went back to the pattern of the Cold War after the outbreak of the Russian-Ukrainian War.\nPrivate meetings and public meetings were held in 2016 by the Security Council.", "einfo": {"ss": [1.0, 1.0], "cs": [1.0], "pv": ["Security Council still", "Security Council returned", "Russo-Ukrainian War", "Security Council held"], "uv": ["public meetings", "still meets primarily", "Western countries engaged"]}, "hinfo": {"hp": "10 open sessions", "pp": ["10 open sessions", "68 public meetings"], "cp": ["In 2016 the Security Council held 150 consultations 19 private meetings and 68 public meetings", "In 2016 the Security Council held 150 consultations 19 private meetings and 10 open sessions"], "sf": ["150 consultations 19 private meetings", "the Security Council"], "hs": [[405, 421]]}, "hf": 1}
{"context": "After the outbreak of the Russo-Ukrainian War in 2014 the Security Council returned to the patterns of the Cold War as Russia and the Western countries engaged in verbal duels in front of the television cameras\nIn 2016 the Security Council held 150 consultations 19 private meetings and 68 public meetings\n Subsidiary organs/bodies Article 29 of the Charter provides that the Security Council can establish independent organs in order to perform its functions", "evidence": "The Security Council went back to the pattern of the Cold War after the outbreak of the Russian-Ukrainian War.\nPrivate meetings and public meetings were held in 2016 by the Security Council.\nThe Security Council can establish subsidiary bodies in order to perform its functions, according to the Charter.", "einfo": {"ss": [1.0, 1.0], "cs": [1.0], "pv": ["Security Council returned", "Russo-Ukrainian War", "Security Council held"], "uv": ["Western countries engaged", "bodies Article"]}, "hinfo": {"hp": "independent organs", "pp": ["independent organs", "subsidiary bodies"], "cp": [" Subsidiary organs/bodies Article 29 of the Charter provides that the Security Council can establish subsidiary bodies in order to perform its functions", " Subsidiary organs/bodies Article 29 of the Charter provides that the Security Council can establish independent organs in order to perform its functions"], "sf": ["bodies", "the Security Council"], "hs": [[407, 425]]}, "hf": 1}
{"context": "The subsidiary bodies established by the Security Council are extremely heterogenous\nOn the one hand they include bodies such as un Executive Advisory And and Appointment and Foreign Citizens", "evidence": "The Security Council established subsidiary bodies that are very diverse.\nThe Security Council Committee on Admission of New Members are on the other hand.", "einfo": {"ss": [1.0, 1.0], "cs": [1.0], "pv": ["Security Council"], "uv": ["Council are extremely"]}, "hinfo": {"hp": "un Executive Advisory And and Appointment and Foreign Citizens", "pp": ["un Executive Advisory And and Appointment and Foreign Citizens", "the Security Council Committee on Admission of New Members"], "cp": ["On the one hand they include bodies such as the Security Council Committee on Admission of New Members", "On the one hand they include bodies such as un Executive Advisory And and Appointment and Foreign Citizens"], "sf": ["the Security Council Committee", "New Members"], "hs": [[129, 191]]}, "hf": 1}
{"context": "The subsidiary bodies established by the Security Council are extremely heterogenous\nOn the one hand they include bodies such as the Security Council Committee on Admission of New Members\nOn the other hand both an Central Military Court for the former Yugoslavia and an Central Military Court for Rwanda were also created as subsidiary bodies of the Security Council", "evidence": "The Security Council established subsidiary bodies that are very diverse.\nThe Security Council Committee on Admission of New Members are on the other hand.\nThe Security Council created the International Criminal Tribunal for the former Yugoslavia and the International Criminal Tribunal for Rwanda as subsidiaries.", "einfo": {"ss": [1.0, 1.0], "cs": [1.0], "pv": ["Security Council", "Security Council", "created as subsidiary"], "uv": ["Council are extremely", "also created"]}, "hinfo": {"hp": "an Central Military Court", "pp": ["an Central Military Court", "the International Criminal Tribunal"], "cp": ["On the other hand both the International Criminal Tribunal for the former Yugoslavia and the International Criminal Tribunal for Rwanda were also created as subsidiary bodies of the Security Council", "On the other hand both an Central Military Court for the former Yugoslavia and an Central Military Court for Rwanda were also created as subsidiary bodies of the Security Council"], "sf": ["both the International Criminal Tribunal", "subsidiary bodies"], "hs": [[211, 236], [267, 292]]}, "hf": 1}
{"context": "On the other hand both the International Criminal Tribunal for the former Yugoslavia and the International Criminal Tribunal for Rwanda were also created as subsidiary bodies of the Security Council\nThe by now numerous Monitoring Bodies established in order to oversee implementation of the various sanctions regimes are also subsidiary bodies of the council\n United Nations peacekeepers After approval by the Security Council the UN may send peacekeepers to regions where armed conflict has recently ceased or paused to enforce the terms of peace agreements and to discourage combatants from resuming hostilities", "evidence": "The Security Council created the International Criminal Tribunal for the former Yugoslavia and the International Criminal Tribunal for Rwanda as subsidiaries.\nSeveral Sanctions Committees established in order to oversee the implementation of the various sanctions regimes are also subsidiaries of the council.\nUN peacekeepers can be sent to regions where armed conflict has recently stopped or paused to enforce the terms of peace agreements.", "einfo": {"ss": [1.0, 1.0], "cs": [1.0], "pv": ["Security Council", "created as subsidiary", "numerous Sanctions Committees"], "uv": ["also created", "may send peacekeepers", "United Nations peacekeepers", "resuming hostilities", "Security Council"]}, "hinfo": {"hp": "Monitoring Bodies", "pp": ["Monitoring Bodies", "Sanctions Committees"], "cp": ["The by now numerous Sanctions Committees established in order to oversee implementation of the various sanctions regimes are also subsidiary bodies of the council", "The by now numerous Monitoring Bodies established in order to oversee implementation of the various sanctions regimes are also subsidiary bodies of the council"], "sf": ["the various sanctions regimes", "now numerous Sanctions Committees"], "hs": [[219, 236]]}, "hf": 1}
{"context": "These soldiers are sometimes nicknamed Blue Helmets for their distinctive gear\nThe peacekeeping force as a whole received an Lenin Memorial Award in 1988\nAs of 28 February 2023 the UN had 86903 uniformed and civilian personnel serving in 12 peacekeeping missions with 121 countries contributing military personnel", "evidence": "The soldiers are sometimes referred to as Blue Helmets.\nIn 1988 the entire force received the peace prize.\nThere are 86903 uniformed and civilian personnel serving in the UN.", "einfo": {"ss": [1.0, 1.0], "cs": [1.0], "pv": ["nicknamed Blue Helmets", "Nobel Peace Prize"], "uv": ["sometimes nicknamed Blue", "peacekeeping force"]}, "hinfo": {"hp": "an Lenin Memorial Award", "pp": ["an Lenin Memorial Award", "the Nobel Peace Prize"], "cp": ["The peacekeeping force as a whole received the Nobel Peace Prize in 1988", "The peacekeeping force as a whole received an Lenin Memorial Award in 1988"], "sf": ["The peacekeeping force", "a whole"], "hs": [[122, 145]]}, "hf": 1}
{"context": "The peacekeeping force as a whole received the Nobel Peace Prize in 1988\nAs of 28 February 2023 the UN had 160 military or military members serving in 12 peacekeeping missions with 121 countries contributing military personnel", "evidence": "In 1988 the entire force received the peace prize.\nThere are 86903 uniformed and civilian personnel serving in the UN.", "einfo": {"ss": [1.0, 1.0], "cs": [1.0], "pv": ["Nobel Peace Prize"], "uv": ["peacekeeping force"]}, "hinfo": {"hp": "160 military or military members", "pp": ["160 military or military members", "86903 uniformed and civilian personnel"], "cp": ["As of 28 February 2023 the UN had 86903 uniformed and civilian personnel serving in 12 peacekeeping missions with 121 countries contributing military personnel", "As of 28 February 2023 the UN had 160 military or military members serving in 12 peacekeeping missions with 121 countries contributing military personnel"], "sf": ["military personnel", "12 peacekeeping missions"], "hs": [[107, 139]]}, "hf": 1}
{"context": "As of 28 February 2023 the UN had 86903 uniformed and civilian personnel serving in 12 peacekeeping missions with 121 countries contributing military personnel\nThe largest was the United Nations Organization Stabilization Mission in the Democratic Republic of the Congo MONUSCO which included 20688 uniformed personnel\nThe smallest Six States Special Assistance Mission in India and Pakistan UNMOGIP included 42 uniformed personnel responsible for monitoring the ceasefire in Jammu and Kashmir", "evidence": "There are 86903 uniformed and civilian personnel serving in the UN.\nThe largest mission was the United Nations Organization Stabilization Mission in the Democratic Republic of the Congo.\n42 uniformed personnel are responsible for monitoring the ceasefire in Jammu and Kashmir, which is part of the smallest United Nations Military Observer Group in India and Pakistan.", "einfo": {"ss": [1.0, 1.0], "cs": [1.0], "pv": [], "uv": ["Pakistan UNMOGIP included"]}, "hinfo": {"hp": "Six States Special Assistance Mission", "pp": ["Six States Special Assistance Mission", "United Nations Military Observer Group"], "cp": ["The smallest United Nations Military Observer Group in India and Pakistan UNMOGIP included 42 uniformed personnel responsible for monitoring the ceasefire in Jammu and Kashmir", "The smallest Six States Special Assistance Mission in India and Pakistan UNMOGIP included 42 uniformed personnel responsible for monitoring the ceasefire in Jammu and Kashmir"], "sf": ["The smallest United Nations Military Observer Group", "Pakistan UNMOGIP"], "hs": [[332, 369]]}, "hf": 1}
{"context": "The largest was the United Nations Organization Stabilization Mission in the Democratic Republic of the Congo MONUSCO which included 20688 uniformed personnel\nThe smallest United Nations Military Observer Group in India and Pakistan UNMOGIP included 42 uniformed personnel responsible for monitoring the ceasefire in Jammu and Kashmir\nPeacekeepers with un Associated States International ##keepers Force Who have been stationed in the Middle East since 1948 the longest-running active peacekeeping mission", "evidence": "The largest mission was the United Nations Organization Stabilization Mission in the Democratic Republic of the Congo.\n42 uniformed personnel are responsible for monitoring the ceasefire in Jammu and Kashmir, which is part of the smallest United Nations Military Observer Group in India and Pakistan.\nSince 1948, the United Nations Truce Supervision Organization has been stationed in the Middle East.", "einfo": {"ss": [1.0, 1.0], "cs": [1.0], "pv": ["Middle East since"], "uv": ["Pakistan UNMOGIP included"]}, "hinfo": {"hp": "un Associated States International ##keepers Force Who", "pp": ["un Associated States International ##keepers Force Who", "the United Nations Truce Supervision Organization UNTSO"], "cp": ["Peacekeepers with the United Nations Truce Supervision Organization UNTSO have been stationed in the Middle East since 1948 the longest-running active peacekeeping mission", "Peacekeepers with un Associated States International ##keepers Force Who have been stationed in the Middle East since 1948 the longest-running active peacekeeping mission"], "sf": ["the United Nations Truce Supervision Organization", "the longest-running active peacekeeping mission"], "hs": [[353, 407]]}, "hf": 1}
{"context": "UN peacekeepers have also drawn criticism in several postings\nPeacekeepers have been accused of child rape soliciting prostitutes or sexual abuse during various peacekeeping missions in the Democratic Republic of the Congo Haiti Liberia Sudan and what is now South Sudan Burundi and Ivory Coast\nScientists cited UN peacekeepers from Nepal as the likely source of their 2010 Haitian flu epidemic which killed more than 8000 Haitians following the 2010 Haiti earthquake", "evidence": "Several postings of UN peacekeepers have been criticized.\nPeacekeepers have been accused of soliciting prostitutes or sexually abusing children during various missions in the Democratic Republic of the Congo, Haiti, and Sudan.\nMore than 8000 Haitians were killed in the 2010 Haiti earthquake, and scientists believe the outbreak was caused by UN peacekeepers from Nepal.", "einfo": {"ss": [1.0, 1.0], "cs": [1.0], "pv": ["rape soliciting prostitutes"], "uv": ["peacekeepers have also", "child rape soliciting", "various peacekeeping missions", "Congo Haiti Liberia", "Haiti Liberia Sudan", "Scientists cited", "Haitians following", "Haiti cholera outbreak", "outbreak which killed"]}, "hinfo": {"hp": "their 2010 Haitian flu epidemic", "pp": ["their 2010 Haitian flu epidemic", "the 2010\u20132013 Haiti cholera outbreak"], "cp": ["Scientists cited UN peacekeepers from Nepal as the likely source of the 2010\u20132013 Haiti cholera outbreak which killed more than 8000 Haitians following the 2010 Haiti earthquake", "Scientists cited UN peacekeepers from Nepal as the likely source of their 2010 Haitian flu epidemic which killed more than 8000 Haitians following the 2010 Haiti earthquake"], "sf": ["UN peacekeepers", "the likely source"], "hs": [[363, 394]]}, "hf": 1}
{"context": "The budget for peacekeeping is assessed separately from the main UN organisational budget; in the fiscal year 1 July 2021 \u2013 30 June 2022 peacekeeping expenditures amounted for $638 billion\nUN peace operations are funded by assessments using a formula derived from the regular funding scale but including a weighted surcharge for the five permanent Security Council members\nThis surcharge serves to offset high tax aid programs for less-developed countries", "evidence": "In the fiscal year from July 1, 2016 to June 30, 2022, the budget for peacekeepers was $638 billion.\nA weighted surcharge for the five permanent Security Council members is included in the formula used to fund UN peace operations.\nThe surcharge helps offset the discounted assessment rates for less developed countries.", "einfo": {"ss": [1.0, 1.0], "cs": [1.0], "pv": ["discounted peacekeeping assessment"], "uv": ["July", "organisational budget", "surcharge serves"]}, "hinfo": {"hp": "high tax aid programs", "pp": ["high tax aid programs", "discounted peacekeeping assessment rates"], "cp": ["This surcharge serves to offset discounted peacekeeping assessment rates for less-developed countries", "This surcharge serves to offset high tax aid programs for less-developed countries"], "sf": ["less-developed countries", "This surcharge"], "hs": [[405, 426]]}, "hf": 1}
{"context": "The UN Truce Supervision Organisation UNTSO and the UN Military Observer Group in India and Pakistan UNMOGIP are excluded from the Peacekeeping Operations budget and are financed through the regular UN budget\nFor the 2020\u20132021 budget the top 10 providers of foreign military assistance to United Nations peacekeeping operations were the US 2789% China 1521% Japan 856% Germany 609% the United Kingdom 579% France 561% Italy 330% Russian Federation 304% Canada 273% and South Korea 226%\n Criticism and evaluations In examining the first sixty years of the Security Councils existence British historian Paul Kennedy concludes that glaring failures had not only accompanied the UNs many achievements they overshadowed them identifying as particular failures the lack of will to prevent ethnic massacres in Bosnia and Rwanda", "evidence": "The UN Military Observer Group in India and Pakistan and the UN Truce Supervision Organisation are not included in the Peacekeeping Operations budget.\nThe United Nations had assessed financial contributions from the US, China, Japan, Germany, France, Italy, and South Korea.\nIn examining the first sixty years of the Security Councils existence British historian Paul Kennedy concluded that glaring failures had not only accompanied the UNs many achievements they overshadowed them identifying as particular failures the lack of will to prevent ethnic massacres.", "einfo": {"ss": [1.0, 1.0], "cs": [1.0], "pv": ["United Nations peacekeeping"], "uv": ["Nations peacekeeping operations", "providers of assessed", "Russian Federation"]}, "hinfo": {"hp": "foreign military assistance", "pp": ["foreign military assistance", "assessed financial contributions"], "cp": ["For the 2020\u20132021 budget the top 10 providers of assessed financial contributions to United Nations peacekeeping operations were the US 2789% China 1521% Japan 856% Germany 609% the United Kingdom 579% France 561% Italy 330% Russian Federation 304% Canada 273% and South Korea 226%", "For the 2020\u20132021 budget the top 10 providers of foreign military assistance to United Nations peacekeeping operations were the US 2789% China 1521% Japan 856% Germany 609% the United Kingdom 579% France 561% Italy 330% Russian Federation 304% Canada 273% and South Korea 226%"], "sf": ["United Nations peacekeeping operations", "United Nations"], "hs": [[258, 285]]}, "hf": 1}
{"context": "For the 2020\u20132021 budget the top 10 providers of assessed financial contributions to United Nations peacekeeping operations were the US 2789% China 1521% Japan 856% Germany 609% the United Kingdom 579% France 561% Italy 330% Russian Federation 304% Canada 273% and South Korea 226%\n Criticism and evaluations In examining the first sixty years of the Security Councils existence By academic John Smith concludes that glaring failures had not only accompanied the UNs many achievements they overshadowed them identifying as particular failures the lack of will to prevent ethnic massacres in Bosnia and Rwanda\nKennedy attributes the failures to the UNs lack of reliable military resources writing that above all one can conclude that the practice of announcing through a Security Council resolution a new peacekeeping mission without ensuring that sufficient armed forces will be available has usually proven to be a recipe for humiliation and disaster\nSeveral studies have examined the Security Councils responsiveness to armed conflict", "evidence": "The United Nations had assessed financial contributions from the US, China, Japan, Germany, France, Italy, and South Korea.\nIn examining the first sixty years of the Security Councils existence British historian Paul Kennedy concluded that glaring failures had not only accompanied the UNs many achievements they overshadowed them identifying as particular failures the lack of will to prevent ethnic massacres.\nKennedy attributes the failures to the UN's lack of reliable military resources, writing that the practice of announcing a new mission through a Security Council resolution without ensuring that enough armed forces will be available has proven to be a recipe for humiliation and disaster.\nThe Security Councils responsiveness to armed conflict has been examined several times.", "einfo": {"ss": [1.0, 1.0], "cs": [1.0], "pv": ["United Nations peacekeeping", "mission without ensuring", "sufficient armed forces"], "uv": ["Nations peacekeeping operations", "providers of assessed", "Russian Federation", "peacekeeping mission without", "Several studies"]}, "hinfo": {"hp": "By academic John Smith", "pp": ["By academic John Smith", "British historian Paul Kennedy"], "cp": [" Criticism and evaluations In examining the first sixty years of the Security Councils existence British historian Paul Kennedy concludes that glaring failures had not only accompanied the UNs many achievements they overshadowed them identifying as particular failures the lack of will to prevent ethnic massacres in Bosnia and Rwanda", " Criticism and evaluations In examining the first sixty years of the Security Councils existence By academic John Smith concludes that glaring failures had not only accompanied the UNs many achievements they overshadowed them identifying as particular failures the lack of will to prevent ethnic massacres in Bosnia and Rwanda"], "sf": ["glaring failures", "the Security Councils existence"], "hs": [[379, 401]]}, "hf": 1}
{"context": "Criticism and evaluations In examining the first sixty years of the Security Councils existence British historian Paul Kennedy concludes that glaring failures had not only accompanied the UNs many achievements they overshadowed them identifying as particular failures the lack of will to prevent ethnic massacres in Bosnia and Rwanda\nKennedy attributes the failures to the UNs lack of adequate financial support writing that above all one can conclude that the practice of announcing through a Security Council resolution a new peacekeeping mission without ensuring that sufficient armed forces will be available has usually proven to be a recipe for humiliation and disaster\nSeveral studies have examined the Security Councils responsiveness to armed conflict\nFindings suggests that the Council is more likely to meet and deliberate on conflicts that are more intense and have led to more humanitarian suffering but that its responsiveness is also shaped by the political interests of member states and in particular of the permanent members", "evidence": "In examining the first sixty years of the Security Councils existence British historian Paul Kennedy concluded that glaring failures had not only accompanied the UNs many achievements they overshadowed them identifying as particular failures the lack of will to prevent ethnic massacres.\nKennedy attributes the failures to the UN's lack of reliable military resources, writing that the practice of announcing a new mission through a Security Council resolution without ensuring that enough armed forces will be available has proven to be a recipe for humiliation and disaster.\nThe Security Councils responsiveness to armed conflict has been examined several times.\nFindings suggest that the Council is more likely to meet and deliberate on conflicts that are more intense and have led to more humanitarian suffering but that its responsiveness is also shaped by the political interests of member states.", "einfo": {"ss": [1.0, 1.0], "cs": [1.0], "pv": ["mission without ensuring", "sufficient armed forces"], "uv": ["peacekeeping mission without", "Several studies", "permanent members"]}, "hinfo": {"hp": "adequate financial support", "pp": ["adequate financial support", "reliable military resources"], "cp": ["Kennedy attributes the failures to the UNs lack of reliable military resources writing that above all one can conclude that the practice of announcing through a Security Council resolution a new peacekeeping mission without ensuring that sufficient armed forces will be available has usually proven to be a recipe for humiliation and disaster", "Kennedy attributes the failures to the UNs lack of adequate financial support writing that above all one can conclude that the practice of announcing through a Security Council resolution a new peacekeeping mission without ensuring that sufficient armed forces will be available has usually proven to be a recipe for humiliation and disaster"], "sf": ["sufficient armed forces", "Security Council"], "hs": [[386, 412]]}, "hf": 1}
{"context": "Kennedy attributes the failures to the UNs lack of reliable military resources writing that above all one can conclude that the practice of announcing through a Security Council resolution a new peacekeeping mission without ensuring that sufficient armed forces will be available has usually proven to be a recipe for humiliation and disaster\nSeveral studies have examined national National Of approach to armed conflict\nFindings suggests that the Council is more likely to meet and deliberate on conflicts that are more intense and have led to more humanitarian suffering but that its responsiveness is also shaped by the political interests of member states and in particular of the permanent members", "evidence": "Kennedy attributes the failures to the UN's lack of reliable military resources, writing that the practice of announcing a new mission through a Security Council resolution without ensuring that enough armed forces will be available has proven to be a recipe for humiliation and disaster.\nThe Security Councils responsiveness to armed conflict has been examined several times.\nFindings suggest that the Council is more likely to meet and deliberate on conflicts that are more intense and have led to more humanitarian suffering but that its responsiveness is also shaped by the political interests of member states.", "einfo": {"ss": [1.0, 1.0], "cs": [1.0], "pv": ["mission without ensuring", "sufficient armed forces"], "uv": ["peacekeeping mission without", "Several studies", "permanent members"]}, "hinfo": {"hp": "national National Of approach", "pp": ["national National Of approach", "the Security Councils responsiveness"], "cp": ["Several studies have examined the Security Councils responsiveness to armed conflict", "Several studies have examined national National Of approach to armed conflict"], "sf": ["Security Councils", "Several studies"], "hs": [[373, 402]]}, "hf": 1}
{"context": "Several studies have examined the Security Councils responsiveness to armed conflict\nFindings suggests that the Council is more likely to meet and deliberate on conflicts that are more intense and have led to more humanitarian suffering but that its responsiveness is also shaped by the political interests of member states and in particular of the permanent members\nA 2005 News University study found the UN to be successful in two out of three peacekeeping efforts\nIt compared UN nation-building efforts to those of the United States and found that 88% of UN cases had led to lasting peace", "evidence": "The Security Councils responsiveness to armed conflict has been examined several times.\nFindings suggest that the Council is more likely to meet and deliberate on conflicts that are more intense and have led to more humanitarian suffering but that its responsiveness is also shaped by the political interests of member states.\nTwo out of three UN efforts were found to be successful.\nIt compared UN nation-building efforts to those of the US and found that most of the UN cases had ended in peace.", "einfo": {"ss": [1.0, 1.0], "cs": [1.0], "pv": ["three peacekeeping efforts", "cases had led"], "uv": ["Several studies", "permanent members", "successful in two", "Corporation study found", "RAND Corporation study", "lasting peace"]}, "hinfo": {"hp": "News University", "pp": ["News University", "RAND Corporation"], "cp": ["A 2005 RAND Corporation study found the UN to be successful in two out of three peacekeeping efforts", "A 2005 News University study found the UN to be successful in two out of three peacekeeping efforts"], "sf": ["A 2005 RAND Corporation study", "three peacekeeping efforts"], "hs": [[374, 389]]}, "hf": 1}
{"context": "Also in 2005 the Human Security Report documented a decline in the number of wars genocides and human rights abuses since the end of the Cold War and presented evidence albeit circumstantial that international activism\u2014mostly spearheaded by the UN\u2014had been the main cause of the decline in armed conflict since the end of the Cold War\nPresident Dr Kumar ##ppa argued in 2006 that the five permanent members of the Security Council all of which are nuclear powers had created an exclusive nuclear club that predominantly addresses the strategic interests and political motives of the permanent members\u2014for example protecting the oil-rich Kuwaitis in 1991 but poorly protecting the resource-poor Rwandans in 1994\nSince three of the five permanent members are European and four are predominantly white developed nations the Security Council has been described as a pillar of global apartheid by Titus Alexander former Chair of the Westminster United Nations Association\nThe Security Councils effectiveness and relevance are questioned by some because in most high-profile cases there are essentially no consequences for violating a Security Council resolution", "evidence": "In 2005 the Human Security Report documented a decline in the number of wars genocides and human rights abuses since the end of the Cold War and presented circumstantial evidence that international activism had been the main cause of the decline.\nThe five permanent members of the Security Council all of which are nuclear powers have created an exclusive nuclear club that mostly addresses the strategic interests and political motives of the permanent members.\nThe Security Council has been described as a pillar of global apartheid because of the fact that three of the five permanent members are European and four are predominantly white developed nations.\nIn most high-profile cases there are no consequences for violating a Security Council resolution, which raises questions about the effectiveness and relevance of the Security Council.", "einfo": {"ss": [1.0, 1.0], "cs": [1.0], "pv": ["evidence albeit circumstantial"], "uv": ["Scholar Sudhir Chella", "United Nations Association", "Westminster United Nations", "Titus Alexander former", "relevance are questioned"]}, "hinfo": {"hp": "President Dr Kumar ##ppa", "pp": ["President Dr Kumar ##ppa", "Scholar Sudhir Chella Rajan"], "cp": ["Scholar Sudhir Chella Rajan argued in 2006 that the five permanent members of the Security Council all of which are nuclear powers had created an exclusive nuclear club that predominantly addresses the strategic interests and political motives of the permanent members\u2014for example protecting the oil-rich Kuwaitis in 1991 but poorly protecting the resource-poor Rwandans in 1994", "President Dr Kumar ##ppa argued in 2006 that the five permanent members of the Security Council all of which are nuclear powers had created an exclusive nuclear club that predominantly addresses the strategic interests and political motives of the permanent members\u2014for example protecting the oil-rich Kuwaitis in 1991 but poorly protecting the resource-poor Rwandans in 1994"], "sf": ["Sudhir Chella Rajan", "political motives"], "hs": [[335, 359]]}, "hf": 1}
{"context": "Scholar Sudhir Chella Rajan argued in 2006 that the five permanent members of the Security Council all of which are nuclear powers had created an exclusive nuclear club that predominantly addresses the strategic interests and political motives of the permanent members\u2014for example protecting the oil-rich Kuwaitis in 1991 but poorly protecting the resource-poor Rwandans in 1994\nSince three of the five permanent members are European and four are predominantly white developed nations the Security Council has been described as a pillar of global apartheid by John The the President of the Westminster United Nations Association", "evidence": "The five permanent members of the Security Council all of which are nuclear powers have created an exclusive nuclear club that mostly addresses the strategic interests and political motives of the permanent members.\nThe Security Council has been described as a pillar of global apartheid because of the fact that three of the five permanent members are European and four are predominantly white developed nations.", "einfo": {"ss": [1.0, 1.0], "cs": [1.0], "pv": [], "uv": ["Scholar Sudhir Chella", "United Nations Association", "Westminster United Nations", "Titus Alexander former"]}, "hinfo": {"hp": "John The the President", "pp": ["John The the President", "Titus Alexander former Chair"], "cp": ["Since three of the five permanent members are European and four are predominantly white developed nations the Security Council has been described as a pillar of global apartheid by Titus Alexander former Chair of the Westminster United Nations Association", "Since three of the five permanent members are European and four are predominantly white developed nations the Security Council has been described as a pillar of global apartheid by John The the President of the Westminster United Nations Association"], "sf": ["white developed nations", "the Westminster United Nations Association"], "hs": [[560, 582]]}, "hf": 1}
{"context": "During the Darfur crisis Janjaweed militias allowed by elements of the Sudanese government committed violence against an indigenous population killing thousands of civilians\nIn the Srebrenica massacre Dutch forces committed genocide against Bosniaks although Srebrenica had been declared a UN safe area protected by 400 armed Dutch peacekeepers", "evidence": "Janjaweed militias were allowed by the Sudanese government to commit violence against the indigenous population.\nThe UN declared Srebrenica a safe area despite Serbian troops committing genocide against Bosniaks.", "einfo": {"ss": [1.0, 1.0], "cs": [1.0], "pv": ["indigenous population killing", "Sudanese government committed", "Janjaweed militias allowed", "government committed violence", "massacre Serbian troops", "safe area protected"], "uv": ["crisis Janjaweed militias", "population killing thousands", "Bosniaks although Srebrenica", "Srebrenica massacre Serbian", "armed Dutch peacekeepers"]}, "hinfo": {"hp": "Dutch forces", "pp": ["Dutch forces", "Serbian troops"], "cp": ["In the Srebrenica massacre Serbian troops committed genocide against Bosniaks although Srebrenica had been declared a UN safe area protected by 400 armed Dutch peacekeepers", "In the Srebrenica massacre Dutch forces committed genocide against Bosniaks although Srebrenica had been declared a UN safe area protected by 400 armed Dutch peacekeepers"], "sf": ["400 armed Dutch peacekeepers", "Srebrenica"], "hs": [[201, 213]]}, "hf": 1}
{"context": "During the Darfur crisis Janjaweed militias allowed by elements of the Sudanese government committed violence against an indigenous population killing thousands of civilians\nIn the Srebrenica massacre Serbian troops committed genocide against Bosniaks although Srebrenica had been declared a UN safe area protected by 400 armed Dutch peacekeepers\nThe UN Charter gives all three powers of the legislative executive and judiciary branches to un Un Force", "evidence": "Janjaweed militias were allowed by the Sudanese government to commit violence against the indigenous population.\nThe UN declared Srebrenica a safe area despite Serbian troops committing genocide against Bosniaks.\nThe Security Council has the power of the legislative executive and the judiciary.", "einfo": {"ss": [1.0, 1.0], "cs": [1.0], "pv": ["indigenous population killing", "Sudanese government committed", "Janjaweed militias allowed", "government committed violence", "massacre Serbian troops", "safe area protected", "judiciary branches", "three powers"], "uv": ["crisis Janjaweed militias", "population killing thousands", "Bosniaks although Srebrenica", "Srebrenica massacre Serbian", "armed Dutch peacekeepers"]}, "hinfo": {"hp": "un Un Force", "pp": ["un Un Force", "the Security Council"], "cp": ["The UN Charter gives all three powers of the legislative executive and judiciary branches to the Security Council", "The UN Charter gives all three powers of the legislative executive and judiciary branches to un Un Force"], "sf": ["judiciary branches", "the legislative executive"], "hs": [[440, 451]]}, "hf": 1}
{"context": "The UN Charter gives all three powers of the legislative executive and judiciary branches to the Security Council\nIn his inaugural speech at the 16th Summit of the Non-Aligned Movement in August 2012 President Omar ##yev criticized the Security Council as having an illogical unjust and completely undemocratic structure and mechanism and called for a complete reform of the body", "evidence": "The Security Council has the power of the legislative executive and the judiciary.\nIn his inaugural speech at the 16th Summit of the Non-Aligned Movement in August 2012 Ayatollah Ali Khamenei criticized the Security Council as having an illogical unjust and completely undemocratic mechanism and called for a complete reform of the body.", "einfo": {"ss": [1.0, 1.0], "cs": [1.0], "pv": ["judiciary branches", "three powers", "completely undemocratic structure"], "uv": []}, "hinfo": {"hp": "President Omar ##yev", "pp": ["President Omar ##yev", "Ayatollah Ali Khamenei"], "cp": ["In his inaugural speech at the 16th Summit of the Non-Aligned Movement in August 2012 Ayatollah Ali Khamenei criticized the Security Council as having an illogical unjust and completely undemocratic structure and mechanism and called for a complete reform of the body", "In his inaugural speech at the 16th Summit of the Non-Aligned Movement in August 2012 President Omar ##yev criticized the Security Council as having an illogical unjust and completely undemocratic structure and mechanism and called for a complete reform of the body"], "sf": ["an illogical unjust and completely undemocratic structure", "the 16th Summit of the Non-Aligned Movement"], "hs": [[200, 220]]}, "hf": 1}
{"context": "The Security Council has been criticized for failure in resolving many conflicts\u2014including Cyprus Sri Lanka Syria Kosovo and the Israeli\u2013Palestinian conflict\u2014reflecting the wider shortcomings of the UN\nFor example at the 68th Session of the UN General Assembly New Zealand Foreign Secretary Howard Howard heavily criticized the UNs inaction on Syria more than two years after the Syrian civil war had begun", "evidence": "The UN Security Council has been criticized for failing to resolve conflicts such as Cyprus and Kosovo.\nNew Zealand Prime Minister John Key criticized the UN more than two years after the Syrian civil war began at the UN General Assembly.", "einfo": {"ss": [1.0, 1.0], "cs": [1.0], "pv": ["resolving many conflicts", "General Assembly New", "Key heavily criticized"], "uv": ["including Cyprus Sri", "Palestinian conflict", "Lanka Syria Kosovo", "Assembly New Zealand"]}, "hinfo": {"hp": "Foreign Secretary Howard Howard", "pp": ["Foreign Secretary Howard Howard", "Prime Minister John Key"], "cp": ["For example at the 68th Session of the UN General Assembly New Zealand Prime Minister John Key heavily criticized the UNs inaction on Syria more than two years after the Syrian civil war had begun", "For example at the 68th Session of the UN General Assembly New Zealand Foreign Secretary Howard Howard heavily criticized the UNs inaction on Syria more than two years after the Syrian civil war had begun"], "sf": ["the UN General Assembly", "New Zealand"], "hs": [[273, 304]]}, "hf": 1}
{"context": "For example at the 68th Session of the UN General Assembly New Zealand Prime Minister John Key heavily criticized the UNs inaction on Syria more than two years after the Syrian civil war had begun\nThere is evidence of bribery in un City ...\nCountries that are elected to un City ... see a large increase in foreign aid from the US averaging 59%\nThey also see an 8% increase in aid from the UN mainly from UNICEF", "evidence": "New Zealand Prime Minister John Key criticized the UN more than two years after the Syrian civil war began at the UN General Assembly.\nThe Security Council has evidence of bribes.\nA large increase in foreign aid from the US is seen by countries that are elected to the Security Council.\nThe UN has seen an 8% increase in aid.", "einfo": {"ss": [1.0, 1.0], "cs": [1.0], "pv": ["General Assembly New", "Key heavily criticized", "Security Council see"], "uv": ["Assembly New Zealand", "evidence of bribery", "Countries"]}, "hinfo": {"hp": "un City ...", "pp": ["un City ...", "the Security Council"], "cp": ["There is evidence of bribery in the Security Council", "There is evidence of bribery in un City ..."], "sf": ["evidence", "bribery"], "hs": []}, "hf": 1}
{"context": "There is evidence of bribery in this Nordic Community\nCountries that are elected to this Nordic Community see a large increase in foreign aid from the US averaging 59%\nThey also see an 8% increase in aid from the UN mainly from UNICEF\nThe increase most strongly correlates to years in which this Nordic Community addresses issues relevant to the US", "evidence": "The Security Council has evidence of bribes.\nA large increase in foreign aid from the US is seen by countries that are elected to the Security Council.\nThe UN has seen an 8% increase in aid.\nThe Security Council addresses issues relevant to the US in years when the increase is strongest.", "einfo": {"ss": [1.0, 1.0], "cs": [1.0], "pv": ["Security Council see"], "uv": ["evidence of bribery", "Countries", "increase most strongly"]}, "hinfo": {"hp": "this Nordic Community", "pp": ["this Nordic Community", "the Security Council"], "cp": ["Countries that are elected to the Security Council see a large increase in foreign aid from the US averaging 59%", "Countries that are elected to this Nordic Community see a large increase in foreign aid from the US averaging 59%"], "sf": ["foreign aid", "a large increase"], "hs": [[32, 53], [84, 105], [291, 312]]}, "hf": 1}
{"context": "There is also evidence of increased foreign aid to elected countries from Japan and Germany\nOne study found membership on the Security Council correlates with overall population activity for a given country over the course of its two-year term\u201435% growth during membership compared to 87% over four years of non-membership\u2014although the effect is mainly driven by African authoritarian countries\nElected members also experience a reduction in democracy and freedom of the press", "evidence": "Japan and Germany have increased their foreign aid to elected countries.\nThere is a correlation between membership on the Security Council and reduced economic growth in a given country over the course of two years.\nA reduction in democracy and freedom of the press is experienced by elected members.", "einfo": {"ss": [1.0, 1.0], "cs": [1.0], "pv": ["increased foreign aid", "Security Council correlates", "Elected members also"], "uv": ["evidence of increased", "countries from Japan", "study found membership", "African authoritarian countries", "driven by African", "press", "members also experience"]}, "hinfo": {"hp": "overall population activity", "pp": ["overall population activity", "reduced economic growth"], "cp": ["One study found membership on the Security Council correlates with reduced economic growth for a given country over the course of its two-year term\u201435% growth during membership compared to 87% over four years of non-membership\u2014although the effect is mainly driven by African authoritarian countries", "One study found membership on the Security Council correlates with overall population activity for a given country over the course of its two-year term\u201435% growth during membership compared to 87% over four years of non-membership\u2014although the effect is mainly driven by African authoritarian countries"], "sf": ["African authoritarian countries", "non-membership"], "hs": [[159, 186]]}, "hf": 1}
{"context": "Membership reform Proposals to reform the Security Council began with the conference that wrote the UN Charter and have continued to the present day\nAs The scholar John Smith writes Everyone agrees that the present structure is flawed\nBut consensus on how to fix it remains out of reach", "evidence": "The conference that wrote the UN Charter began the process of reform of the Security Council.\nEveryone agrees the structure is flawed.\nIt's not possible to reach a consensus on how to fix it.", "einfo": {"ss": [1.0, 1.0], "cs": [1.0], "pv": ["Security Council began", "writes Everyone agrees"], "uv": ["reform the Security", "Membership reform Proposals", "Proposals to reform", "Kennedy writes Everyone", "British historian Paul", "reach", "consensus"]}, "hinfo": {"hp": "The scholar John Smith", "pp": ["The scholar John Smith", "British historian Paul Kennedy"], "cp": ["As British historian Paul Kennedy writes Everyone agrees that the present structure is flawed", "As The scholar John Smith writes Everyone agrees that the present structure is flawed"], "sf": ["Paul Kennedy", "the present structure"], "hs": [[153, 175]]}, "hf": 1}
{"context": "But consensus on how to fix it remains out of reach\nThere has been discussion of increasing the number of permanent members\nThe countries which have made the strongest demands for permanent seats are Brazil And Italy and Japan", "evidence": "It's not possible to reach a consensus on how to fix it.\nIncreasing the number of permanent members has been discussed.\nBrazil, Germany, India, and Japan have made the strongest demands for permanent seats.", "einfo": {"ss": [1.0, 1.0], "cs": [1.0], "pv": [], "uv": ["reach", "consensus", "Brazil Germany India", "seats are Brazil", "India and Japan", "demands for permanent"]}, "hinfo": {"hp": "And Italy", "pp": ["And Italy", "Germany India"], "cp": ["The countries which have made the strongest demands for permanent seats are Brazil Germany India and Japan", "The countries which have made the strongest demands for permanent seats are Brazil And Italy and Japan"], "sf": ["permanent seats", "the strongest demands"], "hs": [[207, 216]]}, "hf": 1}
{"context": "There has been discussion of increasing the number of permanent members\nThe countries which have made the strongest demands for permanent seats are Brazil Germany India and Japan\nJapan and Germany both two allied allies in WWII had been the UNs second- and third-largest funders respectively before China took over as the second largest funder in recent years whilst Brazil and India are two of the largest contributors of troops to UN-mandated peace-keeping missions\nItaly another main defeated power in WWII and now the UNs sixth-largest funder leads a movement known as Uniting for Consensus in opposition to the possible expansion of permanent seats", "evidence": "Increasing the number of permanent members has been discussed.\nBrazil, Germany, India, and Japan have made the strongest demands for permanent seats.\nBefore China took over as the UN's second largest funder in recent years, Brazil and India were the largest contributors of troops to UN-mandated peace-keeping missions.\nThe UN's sixth-largest funder, Italy, is leading a movement called Uniting for Consensus in opposition to the possible expansion of permanent seats.", "einfo": {"ss": [1.0, 1.0], "cs": [1.0], "pv": ["recent years whilst", "sixth-largest funder leads"], "uv": ["Brazil Germany India", "seats are Brazil", "India and Japan", "demands for permanent", "powers in WWII", "third-largest funders respectively", "main defeated powers", "years whilst Brazil", "known as Uniting", "UNs sixth-largest funder", "another main defeated", "main defeated power"]}, "hinfo": {"hp": "both two allied allies", "pp": ["both two allied allies", "the main defeated powers"], "cp": ["Japan and Germany the main defeated powers in WWII had been the UNs second- and third-largest funders respectively before China took over as the second largest funder in recent years whilst Brazil and India are two of the largest contributors of troops to UN-mandated peace-keeping missions", "Japan and Germany both two allied allies in WWII had been the UNs second- and third-largest funders respectively before China took over as the second largest funder in recent years whilst Brazil and India are two of the largest contributors of troops to UN-mandated peace-keeping missions"], "sf": ["UN-mandated peace-keeping missions", "the UNs second- and third-largest funders"], "hs": [[197, 219]]}, "hf": 1}
{"context": "Japan and Germany the main defeated powers in WWII had been the UNs second- and third-largest funders respectively before China took over as the second largest funder in recent years whilst Brazil and India are two of the largest contributors of troops to UN-mandated peace-keeping missions\nItaly another main defeated power in WWII and now the UNs sixth-largest funder leads a movement known as Uniting for Consensus in opposition to the possible expansion of permanent seats\nCore members of the group include Canada South Korea Spain Italy Iran Peru Philippines Venezuela and Colombia\nTheir proposal is to create a new category of seats still non-permanent but elected for an extended duration semi-permanent seats", "evidence": "Before China took over as the UN's second largest funder in recent years, Brazil and India were the largest contributors of troops to UN-mandated peace-keeping missions.\nThe UN's sixth-largest funder, Italy, is leading a movement called Uniting for Consensus in opposition to the possible expansion of permanent seats.\nCanada, South Korea, Spain, Indonesia, Mexico, Pakistan, Turkey, Argentina, and Colombia are core members of the group.\nThey want to create a new category of seats that are elected for an extended period of time.", "einfo": {"ss": [1.0, 1.0], "cs": [1.0], "pv": ["recent years whilst", "sixth-largest funder leads", "Canada South Korea"], "uv": ["powers in WWII", "third-largest funders respectively", "main defeated powers", "years whilst Brazil", "known as Uniting", "UNs sixth-largest funder", "another main defeated", "main defeated power", "Indonesia Mexico Pakistan", "Pakistan Turkey Argentina", "Mexico Pakistan Turkey", "Spain Indonesia Mexico", "include Canada South", "Korea Spain Indonesia", "Argentina and Colombia", "group include Canada", "duration semi-permanent seats", "extended duration semi-permanent", "seats still non-permanent", "non-permanent but elected"]}, "hinfo": {"hp": "Italy Iran Peru Philippines Venezuela", "pp": ["Italy Iran Peru Philippines Venezuela", "Indonesia Mexico Pakistan Turkey Argentina"], "cp": ["Core members of the group include Canada South Korea Spain Indonesia Mexico Pakistan Turkey Argentina and Colombia", "Core members of the group include Canada South Korea Spain Italy Iran Peru Philippines Venezuela and Colombia"], "sf": ["Canada South Korea Spain", "South Korea"], "hs": [[536, 573]]}, "hf": 1}
{"context": "Their proposal is to create a new category of seats still non-permanent but elected for an extended duration semi-permanent seats\nAs far as traditional categories of seats are concerned the UfC proposal does not imply any change but only the introduction of large or mid member seats amongst groups eligible for regular seats\nThis proposal includes even the question of veto giving a range of options that goes from abolition to limitation of the application of the veto only to Chapter VII matters", "evidence": "They want to create a new category of seats that are elected for an extended period of time.\nThe UfC proposal only introduces small and medium size states for groups that are eligible for regular seats.\nThe proposal includes a range of options, from abolition to limitation of the application of the veto only to Chapter VII matters.", "einfo": {"ss": [1.0, 1.0], "cs": [1.0], "pv": ["states amongst groups", "proposal includes even", "giving a range"], "uv": ["duration semi-permanent seats", "extended duration semi-permanent", "seats still non-permanent", "non-permanent but elected", "introduction of small", "amongst groups eligible", "traditional categories", "size states amongst", "far as traditional"]}, "hinfo": {"hp": "large or mid member seats", "pp": ["large or mid member seats", "small and medium size states"], "cp": ["As far as traditional categories of seats are concerned the UfC proposal does not imply any change but only the introduction of small and medium size states amongst groups eligible for regular seats", "As far as traditional categories of seats are concerned the UfC proposal does not imply any change but only the introduction of large or mid member seats amongst groups eligible for regular seats"], "sf": ["traditional categories", "regular seats"], "hs": [[258, 283]]}, "hf": 1}
{"context": "Their proposal is to create a new category of seats still non-permanent but elected for an extended duration semi-permanent seats\nAs far as traditional categories of seats are concerned the UfC proposal does not imply any change but only the introduction of small and medium size states amongst groups eligible for regular seats\nThis proposal includes even the question of veto giving a range of options that goes from abolition to limitation of the application of the veto only to Title 13 ...", "evidence": "They want to create a new category of seats that are elected for an extended period of time.\nThe UfC proposal only introduces small and medium size states for groups that are eligible for regular seats.\nThe proposal includes a range of options, from abolition to limitation of the application of the veto only to Chapter VII matters.", "einfo": {"ss": [1.0, 1.0], "cs": [1.0], "pv": ["states amongst groups", "proposal includes even", "giving a range"], "uv": ["duration semi-permanent seats", "extended duration semi-permanent", "seats still non-permanent", "non-permanent but elected", "introduction of small", "amongst groups eligible", "traditional categories", "size states amongst", "far as traditional"]}, "hinfo": {"hp": "Title 13 ...", "pp": ["Title 13 ...", "Chapter VII matters"], "cp": ["This proposal includes even the question of veto giving a range of options that goes from abolition to limitation of the application of the veto only to Chapter VII matters", "This proposal includes even the question of veto giving a range of options that goes from abolition to limitation of the application of the veto only to Title 13 ..."], "sf": ["Chapter VII", "limitation"], "hs": []}, "hf": 1}
{"context": "This proposal includes even the question of veto giving a range of options that goes from abolition to limitation of the application of the veto only to Chapter VII matters\nThe Nato President James Kingston asked a team of advisers to come up with recommendations for reforming the United Nations by the end of 2004\nOne proposed measure is to increase the number of permanent members by five which in most proposals would include Brazil Germany India and Japan known as the G4 nations one seat from Africa most likely between Egypt Nigeria or South Africa and/or one seat from the Arab League", "evidence": "The proposal includes a range of options, from abolition to limitation of the application of the veto only to Chapter VII matters.\nKofi Annan, the former Secretary-General of the United Nations, asked a team of advisers to come up with recommendations for reform by the end of 2004.\nOne proposal is to increase the number of permanent members by five, which would include Brazil, Germany, India, and Japan, as well as Egypt, Nigeria, and South Africa.", "einfo": {"ss": [1.0, 1.0], "cs": [1.0], "pv": ["proposal includes even", "giving a range", "Former UN Secretary-General", "Kofi Annan asked"], "uv": ["reforming the United", "Secretary-General Kofi Annan", "proposals would include", "include Brazil Germany", "Brazil Germany India", "One proposed measure", "nations one seat", "India and Japan"]}, "hinfo": {"hp": "The Nato President James Kingston", "pp": ["The Nato President James Kingston", "Former UN Secretary-General Kofi Annan"], "cp": ["Former UN Secretary-General Kofi Annan asked a team of advisers to come up with recommendations for reforming the United Nations by the end of 2004", "The Nato President James Kingston asked a team of advisers to come up with recommendations for reforming the United Nations by the end of 2004"], "sf": ["Kofi Annan", "recommendations"], "hs": [[173, 206]]}, "hf": 1}
{"context": "This proposal includes even the question of veto giving a range of options that goes from abolition to limitation of the application of the veto only to Chapter VII matters\nFormer UN Secretary-General Kofi Annan asked a team of advisers to come up with recommendations for reforming the United Nations by the end of 2004\nOne proposed measure is to increase the number of permanent members by five which in most proposals would include Australia Or Italy and Japan known as the G4 nations one seat from Africa most likely between Egypt Nigeria or South Africa and/or one seat from the Arab League\nOn 21 September 2004 the G4 nations issued a joint statement mutually backing each others claim to permanent status together with two African countries\nCurrently the proposal has to be accepted by two-thirds of the General Assembly 128 votes", "evidence": "The proposal includes a range of options, from abolition to limitation of the application of the veto only to Chapter VII matters.\nKofi Annan, the former Secretary-General of the United Nations, asked a team of advisers to come up with recommendations for reform by the end of 2004.\nOne proposal is to increase the number of permanent members by five, which would include Brazil, Germany, India, and Japan, as well as Egypt, Nigeria, and South Africa.\nOn September 21, 2004, the G4 nations issued a joint statement in support of each other's claims to permanent status.\nThe proposal needs to be approved by at least two-thirds of the General Assembly.", "einfo": {"ss": [1.0, 1.0], "cs": [1.0], "pv": ["proposal includes even", "giving a range", "Former UN Secretary-General", "Kofi Annan asked", "permanent status together", "joint statement mutually"], "uv": ["reforming the United", "Secretary-General Kofi Annan", "proposals would include", "include Brazil Germany", "Brazil Germany India", "One proposed measure", "nations one seat", "India and Japan", "statement mutually backing", "two African countries", "accepted by two-thirds", "Currently the proposal"]}, "hinfo": {"hp": "Australia Or Italy", "pp": ["Australia Or Italy", "Brazil Germany India"], "cp": ["One proposed measure is to increase the number of permanent members by five which in most proposals would include Brazil Germany India and Japan known as the G4 nations one seat from Africa most likely between Egypt Nigeria or South Africa and/or one seat from the Arab League", "One proposed measure is to increase the number of permanent members by five which in most proposals would include Australia Or Italy and Japan known as the G4 nations one seat from Africa most likely between Egypt Nigeria or South Africa and/or one seat from the Arab League"], "sf": ["permanent members", "most proposals"], "hs": [[435, 453]]}, "hf": 1}
{"context": "Currently the proposal has to be accepted by two-thirds of the General Assembly 128 votes\nThe permanent members each holding the right of veto announced their positions on Security Council reform reluctantly\nThe United States has unequivocally supported the permanent membership of Japan and lent its support to India and a small number of other permanent countries\nThe United Kingdom and France have essentially supported the G4 position with the expansion of permanent and non-permanent members and the accession of Germany Brazil India and Japan to permanent member status as well as an increase in the presence of African countries on the Council", "evidence": "The proposal needs to be approved by at least two-thirds of the General Assembly.\nThe permanent members of the Security Council made their positions known reluctantly.\nIndia and a small number of additional non-permanent members have been supported by the United States.\nThe expansion of permanent and non-permanent members as well as the accession of Germany, India, and Japan to permanent member status have been supported by the United Kingdom and France.", "einfo": {"ss": [1.0, 1.0], "cs": [1.0], "pv": ["Security Council reform"], "uv": ["accepted by two-thirds", "Currently the proposal", "Council reform reluctantly", "positions on Security", "support to India", "membership of Japan", "States has unequivocally", "India and Japan", "France have essentially"]}, "hinfo": {"hp": "other permanent countries", "pp": ["other permanent countries", "additional non-permanent members"], "cp": ["The United States has unequivocally supported the permanent membership of Japan and lent its support to India and a small number of additional non-permanent members", "The United States has unequivocally supported the permanent membership of Japan and lent its support to India and a small number of other permanent countries"], "sf": ["the permanent membership", "a small number"], "hs": [[340, 365]]}, "hf": 1}
{"context": "The permanent members each holding the right of veto announced their positions on Security Council reform reluctantly\nThe United States has unequivocally supported the permanent membership of Japan and lent its support to India and a small number of additional non-permanent members\nThe United Kingdom and France have essentially supported the G4 position with the expansion of permanent and non-permanent members and the accession of Germany Brazil India and Japan to full observer states as well as an increase in the presence of African countries on the Council\nChina has supported stronger representation of developing countries and has firmly opposed Japans membership\nIn 2017 it was reported that the G4 nations were willing temporarily to forgo veto power if granted permanent UNSC seats", "evidence": "The permanent members of the Security Council made their positions known reluctantly.\nIndia and a small number of additional non-permanent members have been supported by the United States.\nThe expansion of permanent and non-permanent members as well as the accession of Germany, India, and Japan to permanent member status have been supported by the United Kingdom and France.\nChina has opposed Japans membership and supports stronger representation of developing countries.\nThe G4 nations were willing to give up their veto power for a short time if they were granted permanent UNSC seats.", "einfo": {"ss": [1.0, 1.0], "cs": [1.0], "pv": ["Security Council reform", "China has supported"], "uv": ["Council reform reluctantly", "positions on Security", "support to India", "membership of Japan", "States has unequivocally", "India and Japan", "France have essentially", "willing temporarily"]}, "hinfo": {"hp": "full observer states", "pp": ["full observer states", "permanent member status"], "cp": ["The United Kingdom and France have essentially supported the G4 position with the expansion of permanent and non-permanent members and the accession of Germany Brazil India and Japan to permanent member status as well as an increase in the presence of African countries on the Council", "The United Kingdom and France have essentially supported the G4 position with the expansion of permanent and non-permanent members and the accession of Germany Brazil India and Japan to full observer states as well as an increase in the presence of African countries on the Council"], "sf": ["permanent and non-permanent members", "African countries"], "hs": [[469, 489]]}, "hf": 1}
{"context": "In 2017 it was reported that the G4 nations were willing temporarily to forgo veto power if granted permanent UNSC seats\nIn September 2017 Indian Senators Michael ##s and Frank Pallone introduced a resolution HRes535 in the US House of Representatives 115th United States Congress seeking support for the elevation of India  to permanent membership of the United Nations Security Council\nWhilst discussions on expanding permanent membership to individual nations such as the G4 continue alternative proposals have been put forward to reconsider the structure of the Security Council\nThe Noble World Foundation NWF proposes a novel approach suggesting that UNSC membership and veto power be shifted from individual states to sovereignty-pooling organizations like the European Union EU", "evidence": "The G4 nations were willing to give up their veto power for a short time if they were granted permanent UNSC seats.\nThe elevation of India to permanent membership of the United Nations Security Council was the subject of a resolution introduced in the US House of Representatives in September of last year.\nAlternative proposals have been put forward to reconsider the structure of the Security Council, whilst discussions on expanding permanent membership to individual nations such as the G4 continue.\nThe UNSC membership and veto power should be shifted from individual states to sovereignty-pooling organizations like the European Union, according to a novel approach proposed by the Noble World Foundation.", "einfo": {"ss": [1.0, 1.0], "cs": [1.0], "pv": ["continue alternative proposals", "novel approach suggesting"], "uv": ["willing temporarily", "Representatives Ami Bera", "Frank Pallone introduced", "Congress seeking support", "membership to individual", "discussions on expanding", "individual nations"]}, "hinfo": {"hp": "Indian Senators Michael ##s", "pp": ["Indian Senators Michael ##s", "US Representatives Ami Bera"], "cp": ["In September 2017 US Representatives Ami Bera and Frank Pallone introduced a resolution HRes535 in the US House of Representatives 115th United States Congress seeking support for the elevation of India  to permanent membership of the United Nations Security Council", "In September 2017 Indian Senators Michael ##s and Frank Pallone introduced a resolution HRes535 in the US House of Representatives 115th United States Congress seeking support for the elevation of India  to permanent membership of the United Nations Security Council"], "sf": ["115th United States Congress", "the United Nations Security Council"], "hs": [[139, 166]]}, "hf": 1}
{"context": "Whilst discussions on expanding permanent membership to individual nations such as the G4 continue alternative proposals have been put forward to reconsider the structure of the Security Council\nAnd Un Blood Of Also proposes a novel approach suggesting that UNSC membership and veto power be shifted from individual states to sovereignty-pooling organizations like the European Union EU", "evidence": "Alternative proposals have been put forward to reconsider the structure of the Security Council, whilst discussions on expanding permanent membership to individual nations such as the G4 continue.\nThe UNSC membership and veto power should be shifted from individual states to sovereignty-pooling organizations like the European Union, according to a novel approach proposed by the Noble World Foundation.", "einfo": {"ss": [1.0, 1.0], "cs": [1.0], "pv": ["continue alternative proposals", "novel approach suggesting"], "uv": ["membership to individual", "discussions on expanding", "individual nations"]}, "hinfo": {"hp": "And Un Blood Of Also", "pp": ["And Un Blood Of Also", "The Noble World Foundation NWF"], "cp": ["The Noble World Foundation NWF proposes a novel approach suggesting that UNSC membership and veto power be shifted from individual states to sovereignty-pooling organizations like the European Union EU", "And Un Blood Of Also proposes a novel approach suggesting that UNSC membership and veto power be shifted from individual states to sovereignty-pooling organizations like the European Union EU"], "sf": ["sovereignty-pooling organizations", "individual states"], "hs": [[195, 215]]}, "hf": 1}
{"context": "The Noble World Foundation NWF proposes a novel approach suggesting that UNSC membership and veto power be shifted from individual states to sovereignty-pooling organizations like the European Union EU\nThis proposal aligns with the UNSCs practice of regionally-based selection of non-permanent members aiming to improve the Councils decision-making and effectiveness\nThe EU serves as a primary example of such pooled sovereignty especially following its International House des Justice 1964 ruling that established the precedence of EU law over national laws of its member states\nThe NWF advocates that regional entities like the EU could be eligible for UN membership in the Security Council enabling a significant reform without necessitating an amendment to the UN Charter", "evidence": "The UNSC membership and veto power should be shifted from individual states to sovereignty-pooling organizations like the European Union, according to a novel approach proposed by the Noble World Foundation.\nThe UNSCs practice of selecting non-permanent members is aligned with this proposal.\nThe European Court of Justices 1964 ruling that established the precedence of EU law over national laws of its member states serves as a primary example of pooled sovereignty.\nThe EU could be eligible for UN membership in the Security Council without an amendment to the UN Charter, according to the NWF.", "einfo": {"ss": [1.0, 1.0], "cs": [1.0], "pv": ["novel approach suggesting", "non-permanent members aiming", "proposal aligns", "pooled sovereignty especially", "Security Council enabling"], "uv": ["practice of regionally-based", "decision-making and effectiveness", "member states", "following the European", "reform without necessitating", "significant reform without", "advocates that regional"]}, "hinfo": {"hp": "its International House des Justice", "pp": ["its International House des Justice", "the European Court of Justices"], "cp": ["The EU serves as a primary example of such pooled sovereignty especially following the European Court of Justices 1964 ruling that established the precedence of EU law over national laws of its member states", "The EU serves as a primary example of such pooled sovereignty especially following its International House des Justice 1964 ruling that established the precedence of EU law over national laws of its member states"], "sf": ["such pooled sovereignty", "national laws"], "hs": [[450, 485]]}, "hf": 1}
{"context": "This proposal aligns with the UNSCs practice of regionally-based selection of non-permanent members aiming to improve the Councils decision-making and effectiveness\nThe EU serves as a primary example of such pooled sovereignty especially following the European Court of Justices 1964 ruling that established the precedence of EU law over national laws of its member states\nThe NWF advocates that international states like the EU could be eligible for UN membership in the Security Council enabling a significant reform without necessitating an amendment to the UN Charter", "evidence": "The UNSCs practice of selecting non-permanent members is aligned with this proposal.\nThe European Court of Justices 1964 ruling that established the precedence of EU law over national laws of its member states serves as a primary example of pooled sovereignty.\nThe EU could be eligible for UN membership in the Security Council without an amendment to the UN Charter, according to the NWF.", "einfo": {"ss": [1.0, 1.0], "cs": [1.0], "pv": ["non-permanent members aiming", "proposal aligns", "pooled sovereignty especially", "Security Council enabling"], "uv": ["practice of regionally-based", "decision-making and effectiveness", "member states", "following the European", "reform without necessitating", "significant reform without", "advocates that regional"]}, "hinfo": {"hp": "international states", "pp": ["international states", "regional entities"], "cp": ["The NWF advocates that regional entities like the EU could be eligible for UN membership in the Security Council enabling a significant reform without necessitating an amendment to the UN Charter", "The NWF advocates that international states like the EU could be eligible for UN membership in the Security Council enabling a significant reform without necessitating an amendment to the UN Charter"], "sf": ["UN membership", "a significant reform"], "hs": [[396, 416]]}, "hf": 1}
